Fuel Type Code,Station Name,Street Address,Intersection Directions,City,State,ZIP,Station Phone,Status Code,Groups With Access Code,Access Days Time,Cards Accepted,EV Level1 EVSE Num,EV Level2 EVSE Num,EV DC Fast Count,Latitude,Longitude,Date Last Confirmed,ID,Updated At,Open Date,EV Connector Types,Facility Type
ELEC,City of Raleigh - Municipal Building,285 W Hargett St,Street pay parking at the curb,Raleigh,NC,27601,919-996-3030,E,Public,24 hours daily; metered parking,,,2,0,35.778416,-78.64347,10/01/2023,39016,2023-01-10 16:44:47 UTC,15/10/2010,J1772,STREET_PARKING
ELEC,City of Raleigh - Downtown,215 W Cabarrus St,Street parking at the curb,Raleigh,NC,27601,919-996-3030,E,Public,24 hours daily,,,1,0,35.77435,-78.642287,10/01/2023,39017,2023-01-10 16:44:47 UTC,15/02/2011,J1772,STREET_PARKING
ELEC,Oak Ridge Nissan,101 S Illinois Ave,,Oak Ridge,TN,37830,865-482-5489,E,Public - Call ahead,Dealership business hours,,,1,0,36.010279,-84.268049,09/06/2020,39705,2021-03-11 23:22:17 UTC,15/03/2011,J1772,CAR_DEALER
ELEC,Newton Nissan South,2801 Highway 231 N,,Shelbyville,TN,37160,931-684-6811,E,Public - Call ahead,Dealership business hours,,,1,0,35.558371,-86.448276,09/06/2020,39707,2021-03-11 23:22:17 UTC,15/03/2011,J1772,CAR_DEALER
ELEC,Mountain View Nissan,2100 S Market St,,Chattanooga,TN,37408,423-756-1500,E,Public - Call ahead,Dealership business hours,,,1,1,35.030251,-85.308376,09/06/2020,39802,2021-03-11 23:22:17 UTC,15/03/2011,CHADEMO J1772,CAR_DEALER
ELEC,Harold Mathews Nissan,185 Highway 76,,Clarksville,TN,37043,931-552-7555,E,Public - Call ahead,Dealership business hours,,,1,1,36.513006,-87.268667,10/02/2022,39803,2022-02-10 19:42:29 UTC,15/03/2011,CHADEMO J1772,CAR_DEALER
ELEC,Cookeville Nissan,501 Neal St,,Cookeville,TN,38501,931-528-7715,E,Public - Call ahead,Dealership business hours,,,1,0,36.137109,-85.496453,09/06/2020,39805,2021-03-11 23:22:17 UTC,15/03/2011,J1772,CAR_DEALER
ELEC,Victory Nissan West,2219 Highway 46 S,,Dickson,TN,37055,615-446-7070,E,Public - Call ahead,Dealership business hours,,,1,0,36.023934,-87.340223,09/06/2020,39806,2021-03-11 23:22:17 UTC,15/03/2011,J1772,CAR_DEALER
ELEC,Rick Hill Nissan,2700 Parr Ave,,Dyersburg,TN,38024,731-285-6294,E,Public - Call ahead,Dealership business hours,,,1,0,36.063277,-89.379485,09/06/2020,39807,2021-03-11 23:22:17 UTC,15/03/2011,J1772,CAR_DEALER
ELEC,Nissan of Cool Springs,212 Comtide Ct,,Franklin,TN,37067,615-790-2500,E,Public - Call ahead,Dealership business hours,,,1,1,35.957857,-86.80853,10/02/2022,39808,2022-02-10 19:42:29 UTC,15/03/2011,CHADEMO J1772 J1772COMBO,CAR_DEALER
ELEC,Newton Nissan of Gallatin,1461 Nashville Pike,,Gallatin,TN,37066,615-451-6827,E,Public - Call ahead,Dealership business hours,,,1,1,36.361376,-86.494932,10/02/2022,39809,2022-02-10 19:42:29 UTC,15/03/2011,CHADEMO J1772 J1772COMBO,CAR_DEALER
ELEC,Tri-Cities Nissan,3602 Bristol Hwy,,Johnson City,TN,37601,423-282-4731,E,Public - Call ahead,Dealership business hours,,,1,0,36.374198,-82.372119,09/06/2020,39811,2021-03-11 23:22:17 UTC,15/03/2011,J1772,CAR_DEALER
ELEC,Wallace Nissan Oldsmobile,2733 E Stone Dr,,Kingsport,TN,37660,423-288-5500,E,Public - Call ahead,Dealership business hours,,,3,0,36.551978,-82.487762,05/08/2020,39812,2021-03-11 23:22:17 UTC,15/03/2011,J1772,CAR_DEALER
ELEC,Ted Russell Nissan,8565 Kingston Pike,,Knoxville,TN,37919,865-693-2856,E,Public - Call ahead,Dealership business hours,,,1,0,35.920587,-84.067881,09/06/2020,39813,2021-03-11 23:22:17 UTC,15/03/2011,J1772,CAR_DEALER
ELEC,Rusty Wallace Nissan,4515 Clinton Hwy,,Knoxville,TN,37912,865-687-6111,E,Public - Call ahead,Dealership business hours,,,1,0,35.999617,-83.969451,09/06/2020,39814,2021-03-11 23:22:17 UTC,15/03/2011,J1772,CAR_DEALER
ELEC,Nissan of Rivergate,1550 Gallatin Pike N,,Madison,TN,37115,615-865-7220,E,Public - Call ahead,Dealership business hours,,,1,1,36.29062,-86.7051,10/02/2022,39815,2022-02-10 19:42:29 UTC,01/05/2019,CHADEMO J1772 J1772COMBO,CAR_DEALER
ELEC,Roberts Nissan,2747 Hillsboro Hwy,,Manchester,TN,37355,931-728-2212,E,Public - Call ahead,Dealership business hours,,,1,0,35.454702,-86.041805,09/06/2020,39816,2021-03-11 23:22:17 UTC,01/05/2019,J1772,CAR_DEALER
ELEC,Weakley County Motors,841 N Lindell St,,Martin,TN,38237,731-587-3141,E,Public - Call ahead,Dealership business hours,,,1,0,36.369277,-88.849653,09/06/2020,39817,2021-03-11 23:22:17 UTC,15/03/2011,J1772,CAR_DEALER
ELEC,AutoNation Nissan - Memphis,4140 Hacks Cross Rd,,Memphis,TN,38125,901-759-6100,E,Public - Call ahead,Dealership business hours,,,1,0,35.0353,-89.795859,09/06/2020,39818,2021-03-11 23:22:17 UTC,15/03/2011,J1772,CAR_DEALER
ELEC,Jim Keras Nissan,2080 Covington Pike,,Memphis,TN,38128,901-373-2800,E,Public - Call ahead,Dealership business hours,,,1,1,35.181031,-89.895533,07/03/2022,39819,2022-03-07 19:49:53 UTC,01/05/2019,CHADEMO J1772 J1772COMBO,CAR_DEALER
ELEC,East Tennessee Nissan,5496 W Andrew Johnson Hwy,,Morristown,TN,37814,423-587-2506,E,Public - Call ahead,Dealership business hours,,,1,0,36.18226,-83.382387,09/06/2020,39820,2021-03-11 23:22:17 UTC,15/03/2011,J1772,CAR_DEALER
ELEC,Nissan of Murfreesboro,814 Memorial Blvd,,Murfreesboro,TN,37129,615-893-0252,E,Public - Call ahead,Dealership business hours,,,1,2,35.854156,-86.394979,10/02/2022,39821,2022-02-10 19:42:29 UTC,15/03/2011,CHADEMO J1772 J1772COMBO,CAR_DEALER
ELEC,Action Nissan,307 Thompson Ln,,Nashville,TN,37211,615-834-8244,E,Public - Call ahead,Dealership business hours,,,2,1,36.110606,-86.743585,10/02/2022,39822,2022-02-10 19:42:29 UTC,15/03/2011,CHADEMO J1772 J1772COMBO,CAR_DEALER
ELEC,Downtown Nashville Nissan,25 Vantage Way,,Nashville,TN,37228,615-248-5100,E,Public - Call ahead,Dealership business hours,,,2,1,36.191053,-86.793132,10/02/2022,39823,2022-02-10 19:42:29 UTC,15/03/2011,CHADEMO J1772,CAR_DEALER
ELEC,Twin City Nissan,3247 Airport Hwy,,Alcoa,TN,37701,865-970-4132,E,Public - Call ahead,Dealership business hours,,,2,0,35.830725,-83.974822,05/08/2020,39845,2021-03-11 23:22:17 UTC,15/03/2011,J1772,CAR_DEALER
ELEC,Wolfchase Nissan,2956 N Germantown Rd,,Bartlett,TN,38133,901-255-3800,E,Public - Call ahead,Dealership business hours,,,2,1,35.205818,-89.791337,07/03/2022,39846,2022-03-07 19:49:53 UTC,15/03/2011,CHADEMO J1772,CAR_DEALER
ELEC,Dutch Miller Nissan,235 Century Blvd,,Bristol,TN,37620,423-989-6700,E,Public - Call ahead,Dealership business hours,,,1,0,36.54282,-82.2354,06/04/2022,39847,2022-04-06 14:08:04 UTC,15/03/2011,J1772,CAR_DEALER
ELEC,Nissan of Chattanooga East,2121 Chapman Rd,,Chattanooga,TN,37421,423-381-6435,E,Public - Call ahead,Dealership business hours,,,1,0,35.056433,-85.190515,09/06/2020,39848,2021-03-11 23:22:17 UTC,01/03/2017,J1772,CAR_DEALER
ELEC,Sutherlin Nissan - Mall of Georgia,3520 Highway 20,,Buford,GA,30519,678-714-1885,E,Public - Call ahead,Dealership business hours,,,2,1,34.075281,-83.98366,07/03/2022,39983,2022-03-07 19:49:53 UTC,15/03/2011,CHADEMO J1772,CAR_DEALER
ELEC,Nalley Nissan of Atlanta,2551 The Nalley Way,,Atlanta,GA,30360,855-416-9828,E,Public - Call ahead,"9am-8pm M-Sat, 12pm-5pm Sun",,,1,2,33.907866,-84.283186,09/06/2020,39985,2021-03-11 23:22:17 UTC,15/03/2011,CHADEMO J1772,CAR_DEALER
ELEC,Gwinnett Place Nissan,2555 Pleasant Hill Rd,,Duluth,GA,30096,770-476-7771,E,Public - Call ahead,Dealership business hours,,,1,1,33.967935,-84.146036,07/03/2022,39986,2022-03-07 19:49:53 UTC,15/03/2011,CHADEMO J1772 J1772COMBO,CAR_DEALER
ELEC,Stone Mountain Nissan,4275 Highway 78,,Lilburn,GA,30047,678-252-3100,E,Public - Call ahead,Dealership business hours,,,1,1,33.841932,-83.905677,07/03/2022,39988,2022-03-07 19:49:53 UTC,15/03/2011,CHADEMO J1772,CAR_DEALER
ELEC,AutoNation Nissan - Thornton Road,811 Thornton Rd,,Lithia Springs,GA,30122,770-674-6080,E,Public - Call ahead,Dealership business hours,,,1,1,33.784015,-84.612737,09/06/2020,39989,2021-03-11 23:22:17 UTC,15/03/2011,CHADEMO J1772,CAR_DEALER
ELEC,AutoNation Nissan - Marietta,925 Cobb Pkwy SE,,Marietta,GA,30060,770-674-6081,E,Public - Call ahead,Dealership business hours,,,1,1,33.92909,-84.50889,07/03/2022,39990,2022-03-07 19:49:53 UTC,15/03/2011,CHADEMO J1772 J1772COMBO,CAR_DEALER
ELEC,Nissan South,6889 Jonesboro Rd,,Morrow,GA,30260,770-968-1360,E,Public - Call ahead,Dealership business hours,,,1,0,33.566938,-84.344405,09/06/2020,39991,2021-03-11 23:22:17 UTC,15/03/2011,J1772,CAR_DEALER
ELEC,Regal Nissan,1090 Holcomb Bridge Rd,,Roswell,GA,30076,770-998-8686,E,Public - Call ahead,Dealership business hours,,,2,1,34.022437,-84.327529,07/03/2022,39992,2022-03-07 19:49:53 UTC,15/03/2011,CHADEMO J1772 J1772COMBO,CAR_DEALER
ELEC,Nissan South Union City,4080 Jonesboro Rd,,Union City,GA,30291,,E,Public - Call ahead,Dealership business hours; contact 770-964-4900 for more information,,,1,1,33.565412,-84.521117,07/03/2022,39993,2022-03-07 19:49:53 UTC,15/03/2011,CHADEMO J1772,CAR_DEALER
ELEC,Five Star Nissan,839 Warren Dr,,Warner Robins,GA,31088,478-987-5030,E,Public - Call ahead,Dealership business hours,,,1,0,32.555572,-83.66552,09/06/2020,39994,2021-03-11 23:22:17 UTC,15/03/2011,J1772,CAR_DEALER
ELEC,Modern Nissan - Concord,967 Concord Pkwy S,,Concord,NC,28027,704-788-2110,E,Public - Call ahead,Dealership business hours,,,1,1,35.392063,-80.622777,07/03/2022,40066,2022-03-07 19:49:53 UTC,15/03/2011,CHADEMO J1772 J1772COMBO,CAR_DEALER
ELEC,Fred Anderson Nissan,4559 Raeford Rd,,Fayetteville,NC,28304,910-758-2338,E,Public - Call ahead,Dealership business hours,,,1,1,35.042419,-78.956747,09/06/2020,40067,2021-03-11 23:22:17 UTC,15/03/2011,CHADEMO J1772,CAR_DEALER
ELEC,Vann Yorks High Point Nissan,1810 S Main St,,High Point,NC,27260,336-884-4122,E,Public - Call ahead,Dealership business hours,,,1,0,35.937981,-79.996012,09/06/2020,40068,2021-03-11 23:22:17 UTC,15/03/2011,J1772,CAR_DEALER
ELEC,Nissan of Lumberton,1949 Roberts Ave,,Lumberton,NC,28358,910-739-8371,E,Public - Call ahead,Dealership business hours,,,1,0,34.634487,-78.997134,09/06/2020,40069,2021-03-11 23:22:17 UTC,15/03/2011,J1772,CAR_DEALER
ELEC,Marriott Hotel - Underground Deck,1 E Lenoir St,P3 Level of Parking Deck,Raleigh,NC,27601,919-833-7522,E,Public,24 hours daily; pay garage,,,2,0,35.772881,-78.638502,10/01/2023,40745,2023-01-10 16:44:47 UTC,17/07/2011,J1772,HOTEL
ELEC,City of Raleigh - Performing Arts Center Deck,128 W South St,P2 Level of Parking Deck,Raleigh,NC,27601,919-996-3030,E,Public,24 hours daily; pay garage,,,1,0,35.772619,-78.641492,10/01/2023,40747,2023-01-10 16:44:47 UTC,17/07/2011,J1772,PAY_GARAGE
ELEC,City of Raleigh - Wilmington Station Deck,117 S Wilmington St,1st floor of parking deck,Raleigh,NC,27601,919-996-3030,E,Public,24 hours daily; pay garage,,1,1,0,35.77937,-78.638203,10/01/2023,40751,2023-01-10 16:44:47 UTC,17/07/2011,J1772 NEMA520,PAY_GARAGE
ELEC,Jim Ellis Chevrolet,5900 Peachtree Industrial Blvd,"South of I-285 on west side of Peachtree Industrial Blvd, located near the sales department",Atlanta,GA,30341,,E,Public - Call ahead,9am-8pm M-Sat; for Volt use only,,,6,1,33.90999,-84.2914,10/08/2022,40790,2022-08-10 13:32:10 UTC,27/07/2011,J1772 J1772COMBO,CAR_DEALER
ELEC,Neal's Garage,1907 W Markham Ave,At Ninth and Markham,Durham,NC,27705,919-286-1167,E,Public,24 hours daily,,,2,0,36.009999,-78.921405,10/01/2022,40854,2022-02-10 19:42:29 UTC,15/08/2011,J1772,GAS_STATION
ELEC,City of Kingsport - Parking Garage,215 W Center St,,Kingsport,TN,37660,423-229-9309,E,Public - Call ahead,24 hours daily,,,8,0,36.547921,-82.56179,14/09/2022,41483,2022-09-14 15:49:44 UTC,01/07/2011,J1772,PARKING_GARAGE
ELEC,Wilkerson Nature Preserve Park,11408 Raven Ridge Rd,,Raleigh,NC,27614,919-996-3030,E,Public,24 hours daily,,,2,0,35.92353,-78.599883,10/01/2023,41553,2023-01-10 16:44:47 UTC,25/05/2011,J1772,PARK
ELEC,Net Zero USA,7565 Industrial Ct,McFarland & Atlanta Highway,Alpharetta,GA,30004,770-754-0200,E,Public - Call ahead,8:30am-5:30pm M-Sat,,,1,0,34.138312,-84.251109,12/10/2021,42032,2022-02-10 19:42:29 UTC,05/12/2011,J1772,PARKING_LOT
ELEC,Raleigh Municipal Building Deck,201 W Morgan St,P3 Level of Parking Deck,Raleigh,NC,27601,919-996-3030,E,Public,24 hours daily; pay garage,,,2,0,35.779082,-78.641779,10/01/2023,42396,2023-01-10 16:44:47 UTC,14/11/2011,J1772,MUNI_GOV
ELEC,City of Raleigh,231 Fayetteville St,Curbside pay parking,Raleigh,NC,27601,919-996-3030,T,TEMPORARILY UNAVAILABLE (Public),24 hours daily; metered parking,,,1,0,35.777283,-78.639281,10/01/2023,42397,2023-01-10 16:44:47 UTC,01/01/2013,J1772,STREET_PARKING
ELEC,City of Raleigh - Walnut Creek Wetland Center,950 Peterson St,,Raleigh,NC,27610,919-996-3030,E,Public,24 hours daily,,,2,0,35.760503,-78.625345,10/01/2023,42398,2023-01-10 16:44:47 UTC,14/11/2011,J1772,PARK
ELEC,City of Raleigh - Optimist Park and Community Center,5910 Whittier Dr,,Raleigh,NC,27609,919-996-3030,E,Public,24 hours daily,,,2,0,35.862603,-78.643641,10/01/2023,42399,2023-01-10 16:44:47 UTC,14/11/2011,J1772,REC_SPORTS_FACILITY
ELEC,City of Raleigh - Jaycee Park and Community Center,2401 Wade Ave,,Raleigh,NC,27607,919-996-3030,E,Public,24 hours daily,,,1,0,35.800443,-78.663445,10/01/2023,42400,2023-01-10 16:44:47 UTC,14/11/2011,J1772,REC_SPORTS_FACILITY
ELEC,City of Raleigh - Wilders Grove,630 Beacon Lake Dr,,Raleigh,NC,27610,919-996-3030,E,Public,24 hours daily,,,2,0,35.788789,-78.573106,10/01/2023,42401,2023-01-10 16:44:47 UTC,14/11/2011,J1772,MUNI_GOV
ELEC,City of Raleigh - Transit Center,808 Bus Way,,Raleigh,NC,27610,919-996-3030,E,Private,Drivers must bring their own J1772 cordset for Level 1 charging,,2,2,0,35.767483,-78.563464,10/01/2023,42402,2023-01-10 16:44:47 UTC,14/11/2011,J1772 NEMA520,MUNI_GOV
ELEC,City of Raleigh - Transit Center,808 Bus Way,,Raleigh,NC,27610,919-996-3030,E,Public,24 hours daily; Drivers must bring their own J1772 cordset for Level 1 charging,,1,1,0,35.767483,-78.563464,10/01/2023,42403,2023-01-10 16:44:47 UTC,14/11/2011,J1772 NEMA520,MUNI_GOV
ELEC,Alexander's Storage,101 W 8th St,Located behind the building,Columbia,TN,38401,931-381-0954,E,Public,24 hours daily,,,1,0,35.61323,-87.034614,10/09/2021,42872,2022-02-10 19:42:29 UTC,31/12/2011,J1772,STORAGE
ELEC,The Green Parking Garage,435 S Tryon St,At S Tryon St and Levine Avenue of the Arts,Charlotte,NC,28202,604-338-3232,E,Public,Garage business hours; pay lot,Cash M V,,6,0,35.223874,-80.846273,10/01/2023,42927,2023-01-10 16:44:47 UTC,08/08/2011,J1772,PAY_GARAGE
ELEC,Middle Tennessee Electric Membership Corp - Corporate Headquarters,555 New Salem Rd,,Murfreesboro,TN,37129,,E,Private,,,,1,0,35.837613,-86.407098,10/11/2022,42939,2022-11-10 16:40:31 UTC,30/04/2011,J1772,OFFICE_BLDG
ELEC,North Carolina State University - McKimmon Center and Solar House,1201 Gorman Ave,Gorman Ave between Varsity and Western,Raleigh,NC,27606,919-515-0314,E,Public,24 hours daily,,,2,0,35.78214,-78.6864,09/12/2021,43324,2022-02-10 19:42:29 UTC,20/02/2012,J1772,COLLEGE_CAMPUS
ELEC,Taylor Automotive,1007 Hawkins Ave,Located on the right of the building,Sanford,NC,27330,919-774-4037,E,Public,24 hours daily,,,1,0,35.49416,-79.180591,09/12/2021,43363,2022-02-10 19:42:29 UTC,03/02/2012,J1772,CAR_DEALER
ELEC,Middle Tennessee Electric Membership Corp - District Office,2156 Edward Curd Ln,,Franklin,TN,37067,,E,Private,,,,1,0,35.922223,-86.821182,10/11/2022,43761,2022-11-10 16:40:31 UTC,31/08/2011,J1772,OFFICE_BLDG
ELEC,Nissan North America,1 Nissan Way,,Franklin,TN,37067,615-725-1000,E,Public,24 hours daily,,,4,3,35.940203,-86.813764,09/06/2020,43762,2021-03-11 23:22:17 UTC,01/01/2016,CHADEMO J1772,OFFICE_BLDG
ELEC,Middle Tennessee Electric Membership Corp - District Office,201 Maddox-Simpson Pkwy,,Lebanon,TN,37090,,E,Private,,,,1,0,36.174597,-86.298021,10/11/2022,43763,2022-11-10 16:40:31 UTC,31/08/2011,J1772,OFFICE_BLDG
ELEC,Middle Tennessee Electric Membership Corp - District Office,326 Saint Andrews Dr,,Murfreesboro,TN,37128,,E,Private,,,,1,0,35.843311,-86.446636,10/11/2022,43764,2022-11-10 16:40:31 UTC,31/08/2011,J1772,OFFICE_BLDG
ELEC,Carriage Nissan,2400 Browns Bridge Rd,,Gainesville,GA,30504,770-532-6335,E,Public - Call ahead,Dealership business hours,,,1,1,34.275207,-83.85946,07/03/2022,43839,2022-03-07 19:49:53 UTC,01/03/2011,CHADEMO J1772,CAR_DEALER
ELEC,Town Center Nissan,2310 Barrett Lakes Blvd N,,Kennesaw,GA,30144,770-423-9691,E,Public - Call ahead,Dealership business hours,,,2,1,34.010005,-84.577162,07/03/2022,43840,2022-03-07 19:49:53 UTC,01/03/2011,CHADEMO J1772 J1772COMBO,CAR_DEALER
ELEC,Carolina Nissan,1329 Huffman Mill Rd,,Burlington,NC,27215,336-584-0201,E,Public - Call ahead,Dealership business hours,,,2,1,36.063557,-79.503697,07/03/2022,43876,2022-03-07 19:49:53 UTC,01/04/2011,CHADEMO J1772,CAR_DEALER
ELEC,Carolina Nissan,1329 Huffman Mill Rd,,Burlington,NC,27215,336-584-0201,E,Private,Dealership use only,,,2,0,36.063557,-79.503697,07/03/2022,43877,2022-03-07 19:49:53 UTC,01/04/2011,J1772,CAR_DEALER
ELEC,North Carolina State University - Joyner Visitor Center,1210 Varsity Dr,,Raleigh,NC,27606,919-513-1200,E,Public,24 hours daily,,,2,0,35.784037,-78.684667,09/12/2021,43880,2022-02-10 19:42:29 UTC,01/02/2012,J1772,COLLEGE_CAMPUS
ELEC,Northern Wake Tech Community College,6600 Louisburg Rd,"Parking Lot A, at intersection of Success Way and Excellence Drive",Raleigh,NC,27616,919-532-5502,E,Public,24 hours daily; staff and visitor use only,,,2,0,35.867552,-78.543695,04/11/2021,44301,2022-04-28 20:01:31 UTC,29/02/2012,J1772,COLLEGE_CAMPUS
ELEC,Whole Foods Market,8710 Six Forks Rd,East side parking lot,Raleigh,NC,27615,919-354-0350,E,Public - Credit card at all times,Market business hours,CREDIT Debit,,2,0,35.898899,-78.650239,09/12/2021,44302,2022-02-10 19:42:29 UTC,01/01/2012,J1772,GROCERY
ELEC,Asheville Chamber of Commerce & Visitors Center,36 Montford Ave,,Asheville,NC,28801,828-258-6101  828-258-6129,E,Public,9am-5pm daily,,,2,0,35.597527,-82.560582,09/12/2021,44376,2022-02-10 19:42:29 UTC,29/02/2012,J1772,MUNI_GOV
ELEC,College Street Parking Deck,164 College St,Center of ground level,Asheville,NC,28801,828-259-5792,E,Public - Call ahead,24 hours daily,,,6,0,35.597377,-82.549206,04/11/2021,44377,2022-02-10 19:42:29 UTC,29/02/2012,J1772,PAY_GARAGE
ELEC,Ingles Markets - Skyland Plaza,1865 Hendersonville Rd,Close to gas station and car wash in front of Ingles,Asheville,NC,28803,828-274-0804,E,Public,24 hours daily,,,6,0,35.499836,-82.522586,10/01/2023,44378,2023-01-10 16:44:47 UTC,29/02/2012,J1772,GROCERY
ELEC,FAYETTEVILLE NC FRANKLIN 2,208 Franklin St,,Fayetteville,NC,28301,888-758-4389,E,Public,24 hours daily,,,2,0,35.052556,-78.880206,12/01/2023,44944,2023-01-12 23:20:59 UTC,15/03/2012,J1772,
ELEC,"CHARLOTTE, NC CMGC STATION 4",232 S Davidson St,,Charlotte,NC,28202,888-758-4389,E,Public,24 hours daily,,,2,0,35.221981,-80.839984,12/01/2023,45854,2023-01-12 23:12:29 UTC,31/05/2012,J1772,
ELEC,"CHARLOTTE, NC MALLARD CK 02",1712 J N Pease Pl,,Charlotte,NC,28262,888-758-4389,T,TEMPORARILY UNAVAILABLE (Public),24 hours daily,,,2,0,35.323848,-80.773027,23/01/2023,45858,2023-01-23 23:04:52 UTC,01/04/2012,J1772,
ELEC,PMC Enterprises,240 Industrial Park Dr,Exit 185 off Interstate 75. Less than 3/4 mile off interstate,Forsyth,GA,31029,478-994-2848,E,Public,During business hours,,,1,0,33.020179,-83.912616,11/10/2022,46291,2022-10-11 18:56:12 UTC,05/01/2021,J1772,OFFICE_BLDG
ELEC,Michael Jordan Nissan,3930 Chapel Hill Blvd,,Durham,NC,27707,919-489-3800,E,Public - Call ahead,Dealership business hours,,,2,2,35.97051751,-78.95684759,07/03/2022,46407,2022-03-07 19:49:53 UTC,01/08/2011,CHADEMO J1772 J1772COMBO,CAR_DEALER
ELEC,HCA Corporate Headquarters - Building 1,One Park Plaza,,Nashville,TN,37203,,E,Private,Employee use only,,,4,0,36.15403028,-86.81379927,14/09/2022,46470,2022-09-14 15:49:44 UTC,15/07/2011,J1772,OFFICE_BLDG
ELEC,Vaden Nissan,10421 Abercorn St,,Savannah,GA,31419,912-920-5480,E,Public - Call ahead,Dealership business hours,,,3,1,31.986772,-81.13254,09/06/2020,46483,2021-03-11 23:22:17 UTC,31/01/2012,CHADEMO J1772,CAR_DEALER
ELEC,Vaden Nissan,10421 Abercorn St,,Savannah,GA,31419,912-920-5480,E,Private,,,,1,0,31.986772,-81.13254,09/06/2020,46484,2021-03-11 23:22:17 UTC,31/01/2012,J1772,CAR_DEALER
ELEC,Vaden Nissan of Statesboro,686 Brannen St,,Statesboro,GA,30458,912-681-4700,E,Public - Call ahead,Dealership business hours,,,1,0,32.423702,-81.791801,09/06/2020,46486,2021-03-11 23:22:17 UTC,31/01/2012,J1772,CAR_DEALER
ELEC,Flowers Nissan,1630 E Jackson St,,Thomasville,GA,31792,229-226-1106,E,Public - Call ahead,Dealership business hours,,,1,0,30.857666,-83.950487,09/06/2020,46488,2021-03-11 23:22:17 UTC,31/01/2012,J1772,CAR_DEALER
ELEC,Flowers Nissan,1630 E Jackson St,,Thomasville,GA,31792,229-226-1106,E,Private,,,,1,0,30.857666,-83.950487,09/06/2020,46489,2021-03-11 23:22:17 UTC,31/01/2012,J1772,CAR_DEALER
ELEC,Tenneson Nissan,535 Old Omega Rd,,Tifton,GA,31794,229-382-7777,E,Public - Call ahead,Dealership business hours,,,1,0,31.441223,-83.524911,09/06/2020,46490,2021-03-11 23:22:17 UTC,31/01/2012,J1772,CAR_DEALER
ELEC,Tenneson Nissan,535 Old Omega Rd,,Tifton,GA,31794,229-382-7777,E,Private,,,,1,0,31.441223,-83.524911,09/06/2020,46491,2021-03-11 23:22:17 UTC,31/01/2012,J1772,CAR_DEALER
ELEC,Valdosta Nissan,3715 Inner Perimeter Rd,,Valdosta,GA,31602,229-242-7325,E,Public - Call ahead,Dealership business hours,,,1,0,30.883336,-83.269586,09/06/2020,46492,2021-03-11 23:22:17 UTC,31/01/2012,J1772,CAR_DEALER
ELEC,Valdosta Nissan,3715 Inner Perimeter Rd,,Valdosta,GA,31602,229-242-7325,E,Private,,,,1,0,30.883336,-83.269586,09/06/2020,46493,2021-03-11 23:22:17 UTC,31/01/2012,J1772,CAR_DEALER
ELEC,Woody Folsom Nissan,1609 E 1st St,,Vidalia,GA,30474,912-537-9079,E,Public - Call ahead,Dealership business hours,,,1,0,32.210564,-82.391607,09/06/2020,46494,2021-03-11 23:22:17 UTC,29/05/2018,J1772,CAR_DEALER
ELEC,Five Star Nissan - Albany,1100 E Oglethorpe Blvd,,Albany,GA,31705,229-436-8807,E,Public - Call ahead,Dealership business hours,,,1,0,31.57122,-84.125568,09/06/2020,46640,2021-03-11 23:22:17 UTC,31/01/2012,J1772,CAR_DEALER
ELEC,Five Star Nissan - Albany,1100 E Oglethorpe Blvd,,Albany,GA,31705,229-436-8807,E,Private,,,,1,0,31.57122,-84.125568,09/06/2020,46641,2021-03-11 23:22:17 UTC,31/01/2012,J1772,CAR_DEALER
ELEC,Hilton Garden Inn - Marietta,3045 Windy Hill Rd,,Atlanta,GA,30339,770-953-8850,E,Public,24 hours daily; for guest use only,,,4,0,33.9064807,-84.4639319,10/08/2022,46642,2022-08-10 13:32:10 UTC,15/02/2012,J1772,HOTEL
ELEC,Nissan of Augusta,3300 Washington Rd,,Augusta,GA,30907,706-854-1000,E,Public - Call ahead,Dealership business hours,,,1,0,33.515068,-82.067573,09/06/2020,46643,2021-03-11 23:22:17 UTC,31/01/2012,J1772,CAR_DEALER
ELEC,Nissan of Augusta,3300 Washington Rd,,Augusta,GA,30907,706-854-1000,E,Private,,,,1,0,33.515068,-82.067573,09/06/2020,46644,2021-03-11 23:22:17 UTC,31/01/2012,J1772,CAR_DEALER
ELEC,Nissan of Athens,4735 Atlanta Hwy,,Athens,GA,30606,706-549-6600,E,Public - Call ahead,Dealership business hours,,,1,1,33.940287,-83.49648,07/03/2022,46645,2022-03-07 19:49:53 UTC,31/01/2012,CHADEMO J1772,CAR_DEALER
ELEC,Nissan of Athens,4735 Atlanta Hwy,,Athens,GA,30606,706-549-6600,E,Private,,,,1,0,33.940287,-83.49648,07/03/2022,46646,2022-03-07 19:49:53 UTC,31/01/2012,J1772,CAR_DEALER
ELEC,Scott Evans Nissan,725 Bankhead Hwy,,Carrollton,GA,30117,770-832-8222,E,Public - Call ahead,Dealership business hours,,,1,1,33.587958,-85.053239,07/03/2022,46647,2022-03-07 19:49:53 UTC,31/01/2012,CHADEMO J1772,CAR_DEALER
ELEC,Scott Evans Nissan,725 Bankhead Hwy,,Carrollton,GA,30117,770-832-8222,E,Private,,,,1,0,33.587958,-85.053239,07/03/2022,46648,2022-03-07 19:49:53 UTC,31/01/2012,J1772,CAR_DEALER
ELEC,Nissan Headquarters - Columbus,1725 Whittlesey Rd,,Columbus,GA,31904,,E,Public - Call ahead,Dealership business hours,,,1,1,32.539843,-84.965676,13/07/2020,46649,2021-03-11 23:22:17 UTC,31/01/2012,CHADEMO J1772,CAR_DEALER
ELEC,Nissan Headquarters - Columbus,1725 Whittlesey Rd,,Columbus,GA,31904,,E,Private,,,,1,0,32.539843,-84.965676,13/07/2020,46650,2021-03-11 23:22:17 UTC,31/01/2012,J1772,CAR_DEALER
ELEC,Conyers Nissan,1420 Iris Dr,,Conyers,GA,30094,,E,Public - Call ahead,Dealership business hours; contact 770-922-7600 for more information,,,1,0,33.66597615,-84.03435213,09/06/2020,46651,2021-03-11 23:22:17 UTC,31/01/2012,J1772,CAR_DEALER
ELEC,Conyers Nissan,1420 Iris Dr,,Conyers,GA,30094,,E,Private,,,,1,0,33.66597615,-84.03435213,09/06/2020,46652,2021-03-11 23:22:17 UTC,31/01/2012,J1772,CAR_DEALER
ELEC,Butler Nissan,4500 Riverside Dr,,Macon,GA,31206,478-781-8440,E,Public - Call ahead,Dealership business hours,,,1,0,32.915302,-83.70634,09/06/2020,46658,2021-03-11 23:22:17 UTC,01/05/2012,J1772,CAR_DEALER
ELEC,Butler Nissan,4500 Riverside Dr,,Macon,GA,31206,478-781-8440,E,Private,,,,1,0,32.915302,-83.70634,09/06/2020,46659,2021-03-11 23:22:17 UTC,31/01/2012,J1772,CAR_DEALER
ELEC,Childre Nissan,126 Roberson Mill Rd,,Milledgeville,GA,31061,478-452-5535,E,Public - Call ahead,Dealership business hours,,,1,1,33.106139,-83.257757,07/03/2022,46662,2022-03-07 19:49:53 UTC,31/01/2012,CHADEMO J1772,CAR_DEALER
ELEC,Childre Nissan,126 Roberson Mill Rd,,Milledgeville,GA,31061,478-452-5535,E,Private,,,,1,0,33.106139,-83.257757,07/03/2022,46663,2022-03-07 19:49:53 UTC,31/01/2012,J1772,CAR_DEALER
ELEC,One Atlantic Center,1201 W Peachtree St,Stations are located on the W Peachtree Rd side of the parking deck near the exit on level B2,Atlanta,GA,30309,,E,Private,Tenant and guest use only,,,19,0,33.787208,-84.387453,04/08/2021,46991,2023-01-05 02:01:24 UTC,15/05/2012,J1772,PARKING_GARAGE
ELEC,Friendship Nissan,156 Oak St Extension,,Forest City,NC,28043,888-667-0284,E,Public - Call ahead,Dealership business hours,,,1,0,35.334675,-81.892822,09/06/2020,46996,2021-03-11 23:22:17 UTC,31/01/2012,J1772,CAR_DEALER
ELEC,Friendship Nissan,156 Oak St Extension,,Forest City,NC,28043,888-667-0284,E,Private,,,,1,0,35.334675,-81.892822,09/06/2020,46997,2021-03-11 23:22:17 UTC,31/01/2012,J1772,CAR_DEALER
ELEC,Gastonia Nissan,2755 E Franklin Blvd,,Gastonia,NC,28054,704-867-0000,E,Public - Call ahead,Dealership business hours,,,1,2,35.261109,-81.139708,07/03/2022,46998,2022-03-07 19:49:53 UTC,31/01/2012,CHADEMO J1772 J1772COMBO,CAR_DEALER
ELEC,Gastonia Nissan,2755 E Franklin Blvd,,Gastonia,NC,28054,704-867-0000,E,Private,,,,1,0,35.261109,-81.139708,07/03/2022,46999,2022-03-07 19:49:53 UTC,31/01/2012,J1772,CAR_DEALER
ELEC,Deacon Jones Nissan,1220 W Grantham St,,Goldsboro,NC,27530,919-734-2411,E,Public - Call ahead,Dealership business hours,,,2,0,35.400146,-78.014743,09/06/2020,47000,2021-03-11 23:22:17 UTC,31/01/2012,J1772,CAR_DEALER
ELEC,Crown Nissan,3900 W Wendover Ave,,Greensboro,NC,27407,,E,Public - Call ahead,Dealership business hours; contact 336-292-9191 for more information,,,1,1,36.060613,-79.876505,07/03/2022,47003,2022-03-07 19:49:53 UTC,31/01/2012,CHADEMO J1772,CAR_DEALER
ELEC,Crown Nissan,3900 W Wendover Ave,,Greensboro,NC,27407,,E,Private,,,,1,0,36.060613,-79.876505,07/03/2022,47004,2022-03-07 19:49:53 UTC,31/01/2012,J1772,CAR_DEALER
ELEC,Greenville Nissan,991 Greenville Blvd SW,,Greenville,NC,27834,252-756-1738,E,Public - Call ahead,Dealership business hours,,,1,1,35.571982,-77.408327,09/06/2020,47005,2021-03-11 23:22:17 UTC,31/01/2012,CHADEMO J1772,CAR_DEALER
ELEC,Greenville Nissan,991 Greenville Blvd SW,,Greenville,NC,27834,252-756-1738,E,Private,,,,1,0,35.571982,-77.408327,09/06/2020,47006,2021-03-11 23:22:17 UTC,31/01/2012,J1772,CAR_DEALER
ELEC,City of Hendersonville - Dogwood Parking Lot,411 N Church St,N Church & 4th Ave W.,Hendersonville,NC,28792,828-697-3000,E,Public,24 hours daily; pay lot,,,2,0,35.316931,-82.461565,13/12/2022,47007,2022-12-13 14:36:26 UTC,01/12/2011,J1772,PAY_LOT
ELEC,Hunter Nissan,1340 Spartanburg Hwy,,Hendersonville,NC,28792,828-697-2222,E,Public - Call ahead,Dealership business hours,,,1,0,35.301937,-82.440374,09/06/2020,47008,2021-03-11 23:22:17 UTC,31/01/2012,J1772,CAR_DEALER
ELEC,Hunter Nissan,1340 Spartanburg Hwy,,Hendersonville,NC,28792,828-697-2222,E,Private,,,,1,0,35.301937,-82.440374,09/06/2020,47009,2021-03-11 23:22:17 UTC,31/01/2012,J1772,CAR_DEALER
ELEC,Modern Nissan - Hickory,840 US Highway 70 SE,,Hickory,NC,28602,828-324-5040,E,Public - Call ahead,Dealership business hours,,,2,1,35.710136,-81.321182,07/03/2022,47010,2022-03-07 19:49:53 UTC,31/01/2012,CHADEMO J1772 J1772COMBO,CAR_DEALER
ELEC,Modern Nissan - Hickory,840 US Highway 70 SE,,Hickory,NC,28602,828-324-5040,E,Private,,,,1,0,35.710136,-81.321182,07/03/2022,47011,2022-03-07 19:49:53 UTC,31/01/2012,J1772,CAR_DEALER
ELEC,Vann Yorks High Point Nissan,1810 S Main St,,High Point,NC,27260,336-884-4122,E,Private,,,,1,0,35.937981,-79.996012,09/06/2020,47012,2021-03-11 23:22:17 UTC,15/03/2011,J1772,CAR_DEALER
ELEC,Don Williamson Nissan,310 Western Blvd,,Jacksonville,NC,28546,910-353-7700,E,Public - Call ahead,Dealership business hours,,,1,0,34.761337,-77.381386,09/06/2020,47013,2021-03-11 23:22:17 UTC,31/01/2012,J1772,CAR_DEALER
ELEC,Don Williamson Nissan,310 Western Blvd,,Jacksonville,NC,28546,910-353-7700,E,Private,,,,1,0,34.761337,-77.381386,09/06/2020,47014,2021-03-11 23:22:17 UTC,31/01/2012,J1772,CAR_DEALER
ELEC,Montreat College,310 Appalachian Way,Located in L Nelson Bell Library & Belk Student Center parking lot. Lookout Road & Appalachian Way,Montreat,NC,28757,828-669-8012,E,Public,24 hours daily,,,1,0,35.64569,-82.296916,13/12/2022,47017,2022-12-13 14:36:26 UTC,06/07/2017,J1772,COLLEGE_CAMPUS
ELEC,Eastern Carolina Nissan,3315 Highway 70 E,,New Bern,NC,28560,252-636-1000,E,Public - Call ahead,Dealership business hours,,,1,0,35.048239,-77.014397,09/06/2020,47018,2021-03-11 23:22:17 UTC,31/01/2012,J1772,CAR_DEALER
ELEC,Eastern Carolina Nissan,3315 Highway 70 E,,New Bern,NC,28560,252-636-1000,E,Private,,,,1,0,35.048239,-77.014397,09/06/2020,47019,2021-03-11 23:22:17 UTC,31/01/2012,J1772,CAR_DEALER
ELEC,Reidsville Nissan,1123 Freeway Dr,,Reidsville,NC,27320,336-342-5741,E,Public - Call ahead,Dealership business hours,,,1,0,36.323241,-79.686657,09/06/2020,47024,2021-03-11 23:22:17 UTC,31/01/2012,J1772,CAR_DEALER
ELEC,Reidsville Nissan,1123 Freeway Dr,,Reidsville,NC,27320,336-342-5741,E,Private,,,,1,0,36.323241,-79.686657,09/06/2020,47025,2021-03-11 23:22:17 UTC,31/01/2012,J1772,CAR_DEALER
ELEC,Nissan of Roanoke Rapids,407 Premier Blvd,,Roanoke Rapids,NC,27870,252-537-1041,E,Public - Call ahead,Dealership business hours,,,1,0,36.42331,-77.635287,09/06/2020,47026,2021-03-11 23:22:17 UTC,31/01/2012,J1772,CAR_DEALER
ELEC,Griffin Nissan,1780 E Broad Ave,,Rockingham,NC,28379,910-997-5516,E,Public - Call ahead,Dealership business hours,,,1,0,34.918104,-79.744733,09/06/2020,47028,2021-03-11 23:22:17 UTC,31/01/2012,J1772,CAR_DEALER
ELEC,Simmons Nissan,1994 Rockford St,,Mt. Airy,NC,27030,336-786-8371,E,Public - Call ahead,Dealership business hours,,,1,0,36.480616,-80.616003,09/06/2020,47029,2021-03-11 23:22:17 UTC,31/01/2012,J1772,CAR_DEALER
ELEC,Simmons Nissan,1994 Rockford St,,Mt. Airy,NC,27030,336-786-8371,E,Private,,,,1,0,36.480616,-80.616003,09/06/2020,47030,2021-03-11 23:22:17 UTC,31/01/2012,J1772,CAR_DEALER
ELEC,Griffin Nissan,1780 E Broad Ave,,Rockingham,NC,28379,910-997-5516,E,Private,,,,1,0,34.918104,-79.744733,09/06/2020,47031,2021-03-11 23:22:17 UTC,31/01/2012,J1772,CAR_DEALER
ELEC,Ben Mynatt Nissan,629 Jake Alexander Blvd S,,Salisbury,NC,28147,704-633-7270,E,Public - Call ahead,Dealership business hours,,,1,1,35.644549,-80.488272,07/03/2022,47032,2022-03-07 19:49:53 UTC,31/01/2012,CHADEMO J1772 J1772COMBO,CAR_DEALER
ELEC,Ben Mynatt Nissan,629 Jake Alexander Blvd S,,Salisbury,NC,28147,704-633-7270,E,Private,,,,1,0,35.644549,-80.488272,07/03/2022,47033,2022-03-07 19:49:53 UTC,31/01/2012,J1772,CAR_DEALER
ELEC,Classic Nissan - Sanford,3305 NC Highway 87 S,,Sanford,NC,27332,919-775-2351,E,Public - Call ahead,Dealership business hours,,,1,1,35.44411,-79.1282,07/03/2022,47034,2022-03-07 19:49:53 UTC,31/01/2012,CHADEMO J1772 J1772COMBO,CAR_DEALER
ELEC,Classic Nissan - Sanford,3305 NC Highway 87 S,,Sanford,NC,27332,919-775-2351,E,Private,,,,1,0,35.44411,-79.1282,07/03/2022,47035,2022-03-07 19:49:53 UTC,31/01/2012,J1772,CAR_DEALER
ELEC,Pinehurst Nissan,10910 S US Highway 15-501,,Southern Pines,NC,28387,910-684-1010,E,Public - Call ahead,Dealership business hours,,,1,0,35.161067,-79.421191,09/06/2020,47036,2021-03-11 23:22:17 UTC,31/01/2012,J1772,CAR_DEALER
ELEC,Pinehurst Nissan,10910 S US Highway 15-501,,Southern Pines,NC,28387,910-684-1010,E,Private,,,,1,0,35.161067,-79.421191,09/06/2020,47037,2021-03-11 23:22:17 UTC,31/01/2012,J1772,CAR_DEALER
ELEC,Classic Nissan - Statesville,1244 E Garner Bagnal Blvd,,Statesville,NC,28677,704-872-8500,E,Public - Call ahead,Dealership business hours,,,1,0,35.770417,-80.858363,09/06/2020,47038,2021-03-11 23:22:17 UTC,31/01/2012,J1772,CAR_DEALER
ELEC,Crossroads Nissan - Wake Forest,11120 Capital Blvd,,Wake Forest,NC,27587,919-435-5700,E,Public - Call ahead,Dealership business hours,,,1,1,35.948971,-78.539171,07/03/2022,47040,2022-03-07 19:49:53 UTC,31/01/2012,CHADEMO J1772 J1772COMBO,CAR_DEALER
ELEC,Crossroads Nissan - Wake Forest,11120 Capital Blvd,,Wake Forest,NC,27587,919-435-5700,E,Private,,,,1,0,35.948971,-78.539171,07/03/2022,47041,2022-03-07 19:49:53 UTC,31/01/2012,J1772,CAR_DEALER
ELEC,Wilkes Nissan,1933 US Highway 421B,,Wilkesboro,NC,28697,336-838-3167,E,Public - Call ahead,Dealership business hours,,,1,0,36.149969,-81.202184,09/06/2020,47042,2021-03-11 23:22:17 UTC,31/01/2012,J1772,CAR_DEALER
ELEC,Wilkes Nissan,1933 US Highway 421B,,Wilkesboro,NC,28697,336-838-3167,E,Private,,,,1,0,36.149969,-81.202184,09/06/2020,47043,2021-03-11 23:22:17 UTC,31/01/2012,J1772,CAR_DEALER
ELEC,Capital Nissan - Wilmington,5501 Market St,,Wilmington,NC,28405,877-606-5859,E,Public - Call ahead,Dealership business hours,,,1,0,34.24769,-77.865815,09/06/2020,47044,2021-03-11 23:22:17 UTC,31/01/2012,J1772,CAR_DEALER
ELEC,Capital Nissan - Wilmington,5501 Market St,,Wilmington,NC,28405,877-606-5859,E,Private,,,,1,0,34.24769,-77.865815,09/06/2020,47045,2021-03-11 23:22:17 UTC,31/01/2012,J1772,CAR_DEALER
ELEC,Lee Nissan,4170 Raleigh Rd Pkwy,,Wilson,NC,27896,252-237-4400,E,Public - Call ahead,Dealership business hours,,,1,2,35.756003,-77.9753,07/03/2022,47046,2022-03-07 19:49:53 UTC,31/01/2012,CHADEMO J1772 J1772COMBO,CAR_DEALER
ELEC,Lee Nissan,4170 Raleigh Rd Pkwy,,Wilson,NC,27896,252-237-4400,E,Private,,,,1,0,35.756003,-77.9753,07/03/2022,47047,2022-03-07 19:49:53 UTC,31/01/2012,J1772,CAR_DEALER
ELEC,Modern Nissan,5795 University Pkwy,,Winston-Salem,NC,27105,336-767-8260,E,Public - Call ahead,Dealership business hours,,,1,1,36.179741,-80.275364,07/03/2022,47048,2022-03-07 19:49:53 UTC,31/01/2012,CHADEMO J1772,CAR_DEALER
ELEC,Modern Nissan,5795 University Pkwy,,Winston-Salem,NC,27105,336-767-8260,E,Private,,,,1,0,36.179741,-80.275364,07/03/2022,47049,2022-03-07 19:49:53 UTC,31/01/2012,J1772,CAR_DEALER
ELEC,East Charlotte Nissan,6901 E Independence Blvd,,Charlotte,NC,28227,704-535-4012,E,Public - Call ahead,Dealership business hours,,,1,0,35.167774,-80.742259,09/06/2020,47117,2021-03-11 23:22:17 UTC,31/01/2012,J1772,CAR_DEALER
ELEC,East Charlotte Nissan,6901 E Independence Blvd,,Charlotte,NC,28227,704-535-4012,E,Private,,,,1,0,35.167774,-80.742259,09/06/2020,47118,2021-03-11 23:22:17 UTC,31/01/2012,J1772,CAR_DEALER
ELEC,Scott Clark Nissan,9215 S Blvd,,Charlotte,NC,28273,704-552-9191,E,Public - Call ahead,Dealership business hours,,,1,0,35.111292,-80.881867,09/06/2020,47119,2021-03-11 23:22:17 UTC,31/01/2012,J1772,CAR_DEALER
ELEC,Scott Clark Nissan,9215 S Blvd,,Charlotte,NC,28273,704-552-9191,E,Private,,,,1,0,35.111292,-80.881867,09/06/2020,47120,2021-03-11 23:22:17 UTC,31/01/2012,J1772,CAR_DEALER
ELEC,Haywood Community College,185 Freedlander Dr,1500 Building. Jones Cove Rd and Hospital Rd (near Hwy 74 and I-40 Junction),Clyde,NC,28721,828-627-2821,E,Public,Campus operating hours,,,1,0,35.525966,-82.927696,04/11/2021,47121,2022-02-10 19:42:29 UTC,03/01/2012,J1772,COLLEGE_CAMPUS
ELEC,Modern Nissan - Concord,967 Concord Pkwy S,,Concord,NC,28027,704-788-2110,E,Private,,,,1,0,35.392063,-80.622777,07/03/2022,47122,2022-03-07 19:49:53 UTC,15/03/2011,J1772,CAR_DEALER
ELEC,Modern Nissan - Lake Norman,18615 Statesville Rd,,Cornelius,NC,28031,704-237-5100,E,Public - Call ahead,Dealership business hours,,,1,1,35.467117,-80.872205,07/03/2022,47123,2022-03-07 19:49:53 UTC,31/01/2012,CHADEMO J1772,CAR_DEALER
ELEC,Modern Nissan - Lake Norman,18615 Statesville Rd,,Cornelius,NC,28031,704-237-5100,E,Private,,,,1,0,35.467117,-80.872205,07/03/2022,47124,2022-03-07 19:49:53 UTC,31/01/2012,J1772,CAR_DEALER
ELEC,Durham County - Justice Center Parking Deck,510 S Dillard St,,Durham,NC,27701,919-560-7999,E,Public,24 hours daily,,,4,0,35.99289,-78.9014,10/01/2022,47126,2022-02-10 19:42:29 UTC,01/03/2012,J1772,MUNI_GOV
ELEC,Nissan of Elizabeth City,1712 N Rd St,,Elizabeth City,NC,27909,252-338-5161,E,Public - Call ahead,Dealership business hours,,,1,0,36.339936,-76.244936,09/06/2020,47130,2021-03-11 23:22:17 UTC,31/01/2012,J1772,CAR_DEALER
ELEC,Nissan of Elizabeth City,1712 N Rd St,,Elizabeth City,NC,27909,252-338-5161,E,Private,,,,1,0,36.339936,-76.244936,09/06/2020,47131,2021-03-11 23:22:17 UTC,31/01/2012,J1772,CAR_DEALER
ELEC,Fred Anderson Nissan,4559 Raeford Rd,,Fayetteville,NC,28304,910-758-2338,E,Private,,,,1,0,35.042419,-78.956747,09/06/2020,47132,2021-03-11 23:22:17 UTC,01/02/2012,J1772,CAR_DEALER
ELEC,Asheboro Nissan,1635 E Dixie Dr,,Asheboro,NC,27203,,E,Public - Call ahead,Dealership business hours; contact 336-625-2500 for more information,,,2,0,35.70458,-79.781748,09/06/2020,47184,2021-03-11 23:22:17 UTC,31/01/2012,J1772,CAR_DEALER
ELEC,Asheboro Nissan,1635 E Dixie Dr,,Asheboro,NC,27203,,E,Private,,,,1,0,35.70458,-79.781748,09/06/2020,47185,2021-03-11 23:22:17 UTC,31/01/2012,J1772,CAR_DEALER
ELEC,Anderson Nissan,629 Brevard Rd,,Asheville,NC,28806,828-252-0000,E,Public - Call ahead,Dealership business hours,,,1,0,35.547866,-82.599474,09/06/2020,47186,2021-03-11 23:22:17 UTC,31/01/2012,J1772,CAR_DEALER
ELEC,Anderson Nissan,629 Brevard Rd,,Asheville,NC,28806,828-252-0000,E,Private,,,,1,0,35.547866,-82.599474,09/06/2020,47187,2021-03-11 23:22:17 UTC,31/01/2012,J1772,CAR_DEALER
ELEC,Black Mountain Public Safety Building,102 Montreat Rd,Midland Ave and West Street,Black Mountain,NC,28711,828-419-9350,E,Public,24 hours daily,,,1,0,35.619218,-82.320192,13/12/2022,47189,2022-12-13 14:36:26 UTC,15/12/2011,J1772,MUNI_GOV
ELEC,AutoStar Nissan - Boone,135 Innovation Dr,,Boone,NC,28607,828-264-7726,E,Public - Call ahead,Dealership business hours,,,1,0,36.222859,-81.63402,05/08/2020,47190,2021-03-11 23:22:17 UTC,31/01/2012,J1772,CAR_DEALER
ELEC,AutoStar Nissan - Boone,135 Innovation Dr,,Boone,NC,28607,828-264-7726,E,Private,,,,1,0,36.222859,-81.63402,05/08/2020,47191,2021-03-11 23:22:17 UTC,31/01/2012,J1772,CAR_DEALER
ELEC,Leith Nissan,2100 Auto Park Blvd,,Cary,NC,27511,919-589-0029,E,Public - Call ahead,Dealership business hours,,,1,1,35.7390019,-78.8138134,07/03/2022,47192,2022-03-07 19:49:53 UTC,31/01/2012,CHADEMO J1772 J1772COMBO,CAR_DEALER
ELEC,Leith Nissan,2100 Auto Park Blvd,,Cary,NC,27511,919-589-0029,E,Private,,,,1,0,35.7390019,-78.8138134,07/03/2022,47193,2022-03-07 19:49:53 UTC,31/01/2012,J1772,CAR_DEALER
ELEC,1180 Peachtree Building,1180 Peachtree St NE,NW corner of Peachtree and 14th St. 14th floor of Peachtree building parking garage,Atlanta,GA,30309,,E,Private,Tenant and guest use only; pay lot,,,4,0,33.787,-84.383549,10/08/2022,47246,2022-08-10 13:32:10 UTC,06/06/2012,J1772,PAY_GARAGE
ELEC,Orange County - Robert and Pearl Seymour Center,2551 Homestead Rd,,Chapel Hill,NC,27516,919-245-2625,E,Public,24 hours daily,,,2,0,35.950629,-79.063354,04/11/2021,47332,2022-02-10 19:42:29 UTC,25/05/2012,J1772,MUNI_GOV
ELEC,Orange County - Skills Development Center,503 W Franklin St,,Chapel Hill,NC,27516,919-245-2625,E,Public,24 hours daily,,,4,0,35.909907,-79.06344,10/01/2022,47333,2022-02-10 19:42:29 UTC,25/05/2012,J1772,MUNI_GOV
ELEC,Orange County - Durham Technical Community College Park & Ride Lot,525 College Park Dr,,Hillsborough,NC,27278,919-245-2625,E,Public,24 hours daily,,,6,0,36.04236,-79.09323,14/06/2022,47334,2022-06-15 20:47:14 UTC,25/05/2012,J1772,PARKING_LOT
ELEC,Orange County - West Campus Office Building,131 W Margaret Ln,"In parking deck, one floor up from ground level",Hillsborough,NC,27278,919-245-2625,E,Public,24 hours daily,,,6,0,36.073889,-79.100586,12/07/2022,47335,2022-07-12 20:31:42 UTC,01/01/2015,J1772,MUNI_GOV
ELEC,Umstead Hotel and Spa,100 Woodland Pond Dr,N Harrison Ave and SAS Campus Drive,Cary,NC,27513,919-447-4000,E,Public,24 hours daily; for guest use only,,,1,0,35.82973,-78.7646,09/12/2021,47718,2022-04-28 20:01:31 UTC,01/02/2012,J1772,HOTEL
ELEC,Mayfair Town Center,900 Town Center Dr,Parking lot behind Pottery Barn,Wilmington,NC,28405,910-256-5131,T,TEMPORARILY UNAVAILABLE (Public),Shopping center hours,,,2,0,34.242673,-77.83313,10/01/2022,47720,2022-02-10 19:42:29 UTC,12/04/2012,J1772,SHOPPING_CENTER
ELEC,Twin City Nissan,3247 Airport Hwy,,Alcoa,TN,37701,865-970-4132,E,Private,,,,1,0,35.830725,-83.974822,05/08/2020,47807,2021-03-11 23:22:17 UTC,15/03/2011,J1772,CAR_DEALER
ELEC,Wolfchase Nissan,2956 N Germantown Rd,,Bartlett,TN,38133,901-255-3800,E,Private,,,,1,0,35.205818,-89.791337,07/03/2022,47808,2022-03-07 19:49:53 UTC,15/03/2011,J1772,CAR_DEALER
ELEC,Dutch Miller Nissan,235 Century Blvd,,Bristol,TN,37620,423-989-6700,E,Private,,,,1,0,36.54282,-82.2354,06/04/2022,47810,2022-04-06 14:08:04 UTC,15/03/2011,J1772,CAR_DEALER
ELEC,Mountain View Nissan,2100 S Market St,,Chattanooga,TN,37408,423-756-1500,E,Private,,,,1,0,35.030251,-85.308376,09/06/2020,47813,2021-03-11 23:22:17 UTC,15/03/2011,J1772,CAR_DEALER
ELEC,Harold Mathews Nissan,185 Highway 76,,Clarksville,TN,37043,931-552-7555,E,Private,,,,1,0,36.513006,-87.268667,10/02/2022,47814,2022-02-10 19:42:29 UTC,15/03/2011,J1772,CAR_DEALER
ELEC,Cookeville Nissan,501 Neal St,,Cookeville,TN,38501,931-528-7715,E,Private,,,,1,0,36.137109,-85.496453,09/06/2020,47816,2021-03-11 23:22:17 UTC,15/03/2011,J1772,CAR_DEALER
ELEC,Victory Nissan West,2219 Highway 46 S,,Dickson,TN,37055,615-446-7070,E,Private,,,,1,0,36.023934,-87.340223,09/06/2020,47817,2021-03-11 23:22:17 UTC,15/03/2011,J1772,CAR_DEALER
ELEC,Nissan of Cool Springs,212 Comtide Ct,,Franklin,TN,37067,615-790-2500,E,Private,,,,1,0,35.957857,-86.80853,10/02/2022,47819,2022-02-10 19:42:29 UTC,15/03/2011,J1772,CAR_DEALER
ELEC,Newton Nissan of Gallatin,1461 Nashville Pike,,Gallatin,TN,37066,615-451-6827,E,Private,,,,1,0,36.361376,-86.494932,10/02/2022,47823,2022-02-10 19:42:29 UTC,15/03/2011,J1772,CAR_DEALER
ELEC,Carlock Nissan - Jackson,495 Vann Dr,,Jackson,TN,38305,,E,Private,,,,1,0,35.668125,-88.84297,07/03/2022,47824,2022-03-07 19:49:53 UTC,15/03/2011,J1772,CAR_DEALER
ELEC,Tri-Cities Nissan,3602 Bristol Hwy,,Johnson City,TN,37601,423-282-4731,E,Private,,,,1,0,36.374198,-82.372119,09/06/2020,47826,2021-03-11 23:22:17 UTC,15/03/2011,J1772,CAR_DEALER
ELEC,Wallace Nissan Oldsmobile,2733 E Stone Dr,,Kingsport,TN,37660,423-288-5500,E,Private,,,,1,0,36.551978,-82.487762,05/08/2020,47827,2021-03-11 23:22:17 UTC,15/03/2011,J1772,CAR_DEALER
ELEC,Ted Russell Nissan,8565 Kingston Pike,,Knoxville,TN,37919,865-693-2856,E,Private,,,,1,0,35.920587,-84.067881,09/06/2020,47829,2021-03-11 23:22:17 UTC,15/03/2011,J1772,CAR_DEALER
ELEC,Rusty Wallace Nissan,4515 Clinton Hwy,,Knoxville,TN,37912,865-687-6111,E,Private,,,,1,0,35.999617,-83.969451,09/06/2020,47830,2021-03-11 23:22:17 UTC,15/03/2011,J1772,CAR_DEALER
ELEC,Nissan of Rivergate,1550 Gallatin Pike N,,Madison,TN,37115,615-865-7220,E,Private,,,,1,0,36.29062,-86.7051,10/02/2022,47831,2022-02-10 19:42:29 UTC,01/05/2019,J1772,CAR_DEALER
ELEC,Roberts Nissan,2747 Hillsboro Hwy,,Manchester,TN,37355,931-728-2212,E,Private,,,,1,0,35.454702,-86.041805,09/06/2020,47832,2021-03-11 23:22:17 UTC,01/05/2019,J1772,CAR_DEALER
ELEC,AutoNation Nissan - Memphis,4140 Hacks Cross Rd,,Memphis,TN,38125,901-759-6100,E,Private,,,,1,0,35.0353,-89.795859,09/06/2020,47837,2021-03-11 23:22:17 UTC,15/03/2011,J1772,CAR_DEALER
ELEC,Jim Keras Nissan,2080 Covington Pike,,Memphis,TN,38128,901-373-2800,E,Private,,,,1,0,35.181031,-89.895533,07/03/2022,47838,2022-03-07 19:49:53 UTC,01/05/2019,J1772,CAR_DEALER
ELEC,East Tennessee Nissan,5496 W Andrew Johnson Hwy,,Morristown,TN,37814,423-587-2506,E,Private,,,,1,0,36.18226,-83.382387,09/06/2020,47839,2021-03-11 23:22:17 UTC,15/03/2011,J1772,CAR_DEALER
ELEC,Nissan of Murfreesboro,814 Memorial Blvd,,Murfreesboro,TN,37129,615-893-0252,E,Private,,,,1,0,35.854156,-86.394979,10/02/2022,47841,2022-02-10 19:42:29 UTC,15/03/2011,J1772,CAR_DEALER
ELEC,Action Nissan,307 Thompson Ln,,Nashville,TN,37211,615-834-8244,E,Private,,,,1,0,36.110606,-86.743585,10/02/2022,47842,2022-02-10 19:42:29 UTC,15/03/2011,J1772,CAR_DEALER
ELEC,Downtown Nashville Nissan,25 Vantage Way,,Nashville,TN,37228,615-248-5100,E,Private,,,,1,0,36.191053,-86.793132,10/02/2022,47843,2022-02-10 19:42:29 UTC,15/03/2011,J1772,CAR_DEALER
ELEC,Oak Ridge Nissan,101 S Illinois Ave,,Oak Ridge,TN,37830,865-482-5489,E,Private,,,,1,0,36.010279,-84.268049,09/06/2020,47850,2021-03-11 23:22:17 UTC,15/03/2011,J1772,CAR_DEALER
ELEC,Jones Motor Co,1260 Wayne Rd,,Savannah,TN,38372,731-925-0367,E,Public - Call ahead,Dealership business hours,,,1,0,35.226101,-88.224729,09/06/2020,47853,2021-03-11 23:22:17 UTC,31/01/2012,J1772,CAR_DEALER
ELEC,Fields Auto Group,255 Smokey Park Hwy,,Asheville,NC,28806,828-667-5213,E,Public - Call ahead,Dealership business hours,,,1,0,35.562735,-82.63133,10/01/2022,48042,2022-02-10 19:42:29 UTC,06/11/2019,J1772,CAR_DEALER
ELEC,Cherokee Welcome Center,498 Tsali Blvd,BIA Hwy 316,Cherokee,NC,28719,800-438-1601,E,Public,24 hours daily,,,2,0,35.483554,-83.31624,10/11/2022,48044,2022-11-10 16:40:31 UTC,05/07/2012,J1772,TRAVEL_CENTER
ELEC,Boyd Automotive,1875 Spartanburg Hwy,,Hendersonville,NC,28792,828-693-3461,E,Public - Call ahead,Dealership business hours,,,1,0,35.294913,-82.432913,04/11/2021,48045,2022-02-10 19:42:29 UTC,31/08/2011,J1772,CAR_DEALER
ELEC,Panel Built,302 Beasley St,Located at the far end of the parking lot under the solar canopy,Blairsville,GA,30512,800-636-3873,E,Public,9am-4pm M-F,,,1,0,34.874075,-83.940478,11/10/2022,48373,2022-10-11 18:56:12 UTC,01/07/2012,J1772,PARKING_LOT
ELEC,Jenkins Nissan - Brunswick,231 Chapel Crossing Rd,,Brunswick,GA,31525,912-264-3825,E,Public - Call ahead,Dealership business hours,,,1,1,31.226652,-81.495562,09/06/2020,48374,2021-03-11 23:22:17 UTC,31/01/2012,CHADEMO J1772,CAR_DEALER
ELEC,Sutherlin Nissan - Mall of Georgia,3520 Highway 20,,Buford,GA,30519,678-714-1885,E,Private,,,,1,0,34.075281,-83.98366,07/03/2022,48376,2022-03-07 19:49:53 UTC,15/03/2011,J1772,CAR_DEALER
ELEC,Gwinnett Place Nissan,2555 Pleasant Hill Rd,,Duluth,GA,30096,770-476-7771,E,Private,,,,1,0,33.967935,-84.146036,07/03/2022,48380,2022-03-07 19:49:53 UTC,15/03/2011,J1772,CAR_DEALER
ELEC,Carriage Nissan,2400 Browns Bridge Rd,,Gainesville,GA,30504,770-532-6335,E,Private,,,,1,0,34.275207,-83.85946,07/03/2022,48381,2022-03-07 19:49:53 UTC,01/03/2011,J1772,CAR_DEALER
ELEC,Stone Mountain Nissan,4275 Highway 78,,Lilburn,GA,30047,678-252-3100,E,Private,,,,1,0,33.841932,-83.905677,07/03/2022,48384,2022-03-07 19:49:53 UTC,15/03/2011,J1772,CAR_DEALER
ELEC,AutoNation Nissan - Thornton Road,811 Thornton Rd,,Lithia Springs,GA,30122,770-674-6080,E,Private,,,,1,0,33.784015,-84.612737,09/06/2020,48385,2021-03-11 23:22:17 UTC,15/03/2011,J1772,CAR_DEALER
ELEC,AutoNation Nissan - Marietta,925 Cobb Pkwy SE,,Marietta,GA,30060,770-674-6081,E,Private,,,,1,0,33.92909,-84.50889,07/03/2022,48386,2022-03-07 19:49:53 UTC,15/03/2011,J1772,CAR_DEALER
ELEC,Nissan South,6889 Jonesboro Rd,,Morrow,GA,30260,770-968-1360,E,Private,,,,1,0,33.566938,-84.344405,09/06/2020,48387,2021-03-11 23:22:17 UTC,15/03/2011,J1772,CAR_DEALER
ELEC,Nissan South Union City,4080 Jonesboro Rd,,Union City,GA,30291,,E,Private,,,,1,0,33.565412,-84.521117,07/03/2022,48389,2022-03-07 19:49:53 UTC,15/03/2011,J1772,CAR_DEALER
ELEC,Five Star Nissan,839 Warren Dr,,Warner Robins,GA,31088,478-987-5030,E,Private,,,,1,0,32.555572,-83.66552,09/06/2020,48390,2021-03-11 23:22:17 UTC,15/03/2011,J1772,CAR_DEALER
ELEC,Asheville Chevrolet,205 Smoky Park Hwy,,Asheville,NC,28806,866-688-1210,E,Public - Credit card at all times,Dealership business hours; for Chevy use and customers only,,,1,0,35.563115,-82.630535,09/12/2021,48678,2022-04-28 20:01:31 UTC,15/06/2012,J1772,CAR_DEALER
ELEC,Blue Ridge Community College - Spearman Building,2 E Campus Dr,Spearman Bldg Main Entrance,Flat Rock,NC,28731,828-694-1700,E,Public,24 hours daily,,,1,0,35.306506,-82.421425,10/11/2022,48682,2022-11-10 16:40:31 UTC,15/06/2012,J1772,COLLEGE_CAMPUS
ELEC,Bibb County Courthouse,275 2nd St,On 2nd street in front of the courthouse,Macon,GA,31201,478-621-6400,T,TEMPORARILY UNAVAILABLE (Public),24 hours daily,,,1,0,32.83827,-83.6276,10/01/2023,48846,2023-01-10 16:44:47 UTC,01/08/2012,J1772,STREET_PARKING
ELEC,Electric Power Research Institute (EPRI) - Knoxville,942 Corridor Park Blvd,Located in the lab garage area and front parking,Knoxville,TN,37932,,E,Private,Employee and guest use only,,,7,0,35.922002,-84.142112,10/01/2023,49206,2023-01-10 16:44:47 UTC,20/01/2010,J1772,RESEARCH_FACILITY
ELEC,McMinnville Electric System,300 W Main St,,McMinnville,TN,37110,931-473-3144,E,Public,24 hours daily,,,1,0,35.682046,-85.776576,14/01/2021,49211,2023-01-05 00:44:48 UTC,10/07/2014,J1772,UTILITY
ELEC,Murfreesboro Electric,205 N Walnut St,,Murfreesboro,TN,37130,,E,Private,,,,1,0,35.847864,-86.394251,11/10/2022,49469,2022-10-11 18:56:12 UTC,30/09/2012,J1772,UTILITY
ELEC,Nissan of Clinton,412 Southeast Blvd,,Clinton,NC,28328,910-590-2005,E,Public - Call ahead,Dealership business hours,,,1,0,34.999456,-78.309597,09/06/2020,49874,2021-03-11 23:22:17 UTC,25/10/2012,J1772,CAR_DEALER
ELEC,Nissan of Clinton,412 Southeast Blvd,,Clinton,NC,28328,910-590-2005,E,Private,,,,1,0,34.999456,-78.309597,09/06/2020,49875,2021-03-11 23:22:17 UTC,25/10/2012,J1772,CAR_DEALER
ELEC,Wake Technical Community College,9101 Fayetteville Rd,Located in the parking deck,Raleigh,NC,27603,919-866-5000,E,Public,24 hours daily,,,2,0,35.651689,-78.706233,10/01/2022,49881,2022-02-10 19:42:29 UTC,27/08/2012,J1772,COLLEGE_CAMPUS
ELEC,Town of Southern Pines - Library,170 W Connecticut Ave,Located off of Bennet,Southern Pines,NC,28387,910-692-8235,E,Public,24 hours daily,,,3,0,35.176173,-79.390553,13/12/2022,49882,2022-12-13 14:36:26 UTC,09/10/2012,J1772,LIBRARY
ELEC,City of Wilmington - Market Street Parking Deck,115 Market St,Intersection of Market and 2nd St. Located on the first floor.,Wilmington,NC,28401,910-762-5678,E,Public,24 hours daily,,,2,0,34.235678,-77.948353,10/01/2022,49883,2022-02-10 19:42:29 UTC,31/05/2012,J1772,PAY_GARAGE
ELEC,Dublin Nissan,2046 Veterans Blvd,,Dublin,GA,31021,478-275-2660,E,Public - Call ahead,Dealership business hours,,,3,1,32.54118,-82.953347,07/03/2022,49960,2022-03-07 19:49:53 UTC,25/10/2012,CHADEMO J1772,CAR_DEALER
ELEC,Dublin Nissan,2046 Veterans Blvd,,Dublin,GA,31021,478-275-2660,E,Private,,,,1,0,32.54118,-82.953347,07/03/2022,49961,2022-03-07 19:49:53 UTC,25/10/2012,J1772,CAR_DEALER
ELEC,Grainger Nissan,1550 Chatham Pkwy,,Garden City,GA,31408,912-358-5858,E,Public - Call ahead,Dealership business hours,,,1,1,32.075164,-81.158721,07/03/2022,49962,2022-03-07 19:49:53 UTC,25/10/2012,CHADEMO J1772,CAR_DEALER
ELEC,Grainger Nissan,1550 Chatham Pkwy,,Garden City,GA,31408,912-358-5858,E,Private,,,,1,0,32.075164,-81.158721,07/03/2022,49963,2022-03-07 19:49:53 UTC,25/10/2012,J1772,CAR_DEALER
ELEC,Buncombe County - Health and Human Services,40 Coxe Ave,Access is off Coxe Ave. on Sears Alley on the north side of building,Asheville,NC,28801,828-250-4976,E,Public,24 hours daily; pay lot; maximum session time of 4 hours,,,4,0,35.593656,-82.555258,13/12/2022,50172,2022-12-13 14:36:26 UTC,01/02/2018,J1772,PAY_GARAGE
ELEC,Buncombe County Interchange Building,59 Woodfin Pl,,Asheville,NC,28801,,E,Private - Government only,,,,2,0,35.599429,-82.546527,10/01/2023,50392,2023-01-10 16:44:47 UTC,01/10/2012,J1772,MUNI_GOV
ELEC,Orange County - West Campus Office Building,131 W Margaret Ln,"In parking deck, one floor up from ground level",Hillsborough,NC,27278,919-245-2625,E,Public,24 hours daily,,,2,0,36.073889,-79.100586,12/07/2022,50393,2022-07-12 20:31:42 UTC,01/07/2012,J1772,MUNI_GOV
ELEC,SAS Institute Inc - T,701 SAS Campus Dr,Located at Building T,Cary,NC,27513,,E,Private,Employee and guest use only,,,8,0,35.823796,-78.752235,10/01/2023,50688,2023-01-10 16:44:47 UTC,30/11/2011,J1772,OFFICE_BLDG
ELEC,SAS Institute Inc - C,820 SAS Campus Dr,Located at Building C,Cary,NC,27513,,E,Private,Employee and guest use only,,,6,0,35.817516,-78.751668,10/01/2023,50689,2023-01-10 16:44:47 UTC,30/05/2012,J1772,OFFICE_BLDG
ELEC,Levine Properties,325 E 9th St,,Charlotte,NC,28202,704-688-3333,E,Public,24 hours daily,,,2,0,35.228706,-80.834507,10/11/2022,50691,2022-11-10 16:40:31 UTC,30/11/2012,J1772,PAY_LOT
ELEC,McCurry Deck Chevrolet,178 Watkins Dr,,Forest City,NC,28043,,E,Private,Service center use only,,,2,0,35.312853,-81.878889,13/12/2022,50697,2022-12-13 14:36:26 UTC,30/06/2012,J1772,CAR_DEALER
ELEC,Gastonia Conference Center,145 Dr MLK Jr Way,Ground level,Gastonia,NC,28052,704-869-1948,E,Public,24 hours daily,,,1,0,35.262936,-81.182459,04/11/2021,50698,2022-02-10 19:42:29 UTC,01/08/2013,J1772,CONVENTION_CENTER
ELEC,Southface,241 Pine St NE,Located on the right side of the complex at the end of the driveway.,Atlanta,GA,30308,,E,Private,Member and staff use only,,,1,0,33.767508,-84.38028,10/01/2022,51522,2022-02-10 19:42:29 UTC,01/04/2013,J1772,PARKING_LOT
ELEC,Ford of Murfreesboro,1550 NW Broad St,,Murfreesboro,TN,37129,,E,Private,Service center use only,,,1,0,35.868733,-86.412702,10/01/2023,51701,2023-01-10 16:44:47 UTC,01/04/2013,J1772,CAR_DEALER
ELEC,West Regional Library,4000 Louis Stephens Dr,Parking lot to the left,Cary,NC,27519,919-463-8500,E,Public,24 hours daily,,,2,0,35.815061,-78.864062,10/01/2022,52057,2022-02-10 19:42:29 UTC,30/06/2013,J1772,LIBRARY
ELEC,East Regional Library,946 Steeple Square Rd,,Knightdale,NC,27545,919-217-5300,E,Public,24 hours daily,,,2,0,35.802473,-78.487298,10/01/2022,52058,2022-02-10 19:42:29 UTC,30/06/2013,J1772,LIBRARY
ELEC,Peachy Airport Parking,3100 Sylvan Rd,,Atlanta,GA,30354,404-767-7275,E,Public,24 hours daily; pay lot; reservations accepted; Drivers must bring their own J1772 cordset for Level 1 charging,,60,,0,33.669868,-84.418478,12/10/2021,52108,2022-02-10 21:00:18 UTC,01/05/2013,NEMA515,PAY_GARAGE
ELEC,PreFlight Airport Parking,4000 Global Gateway Connector,Located in rows R and S under covered parking,College Park,GA,30337,404-767-8000,E,Public,24 hours daily; pay lot,,,1,0,33.645031,-84.465875,04/08/2021,52110,2022-02-10 19:42:29 UTC,01/05/2013,J1772,PAY_GARAGE
ELEC,Woodlawn Funeral Home,375 Woodlawn Ave,Located at N Hawthorne and Woodlawn Ave,Mt. Holly,NC,28120,704-820-0608,E,Public - Call ahead,24 hours daily,,,1,0,35.3041747,-81.0210277,04/11/2021,52376,2022-02-10 19:42:29 UTC,01/07/2013,J1772,STANDALONE_STATION
ELEC,Kidd Ford,5917 Manchester Hwy,,Morrison,TN,37357,931-668-2177,E,Public - Call ahead,Dealership business hours; customer use only,,,1,0,35.632542,-85.852605,12/10/2021,52600,2022-04-28 20:01:31 UTC,01/06/2013,J1772,CAR_DEALER
ELEC,Shelby Farms Park Conservancy,518 Pine Lake Dr,,Memphis,TN,38134,901-767-7275,E,Public,Dawn to dusk daily,,,10,0,35.140771,-89.834205,10/09/2021,52834,2022-02-10 19:42:29 UTC,01/09/2016,J1772,PARK
ELEC,Vanderbilt University - Surface Lot,124 21st Ave S,,Nashville,TN,37212,615-322-2554,E,Public - Credit card at all times,24 hours daily; pay lot; Also accepts Vanderbilt ID,A D M V,,10,0,36.148816,-86.799577,10/01/2023,52836,2023-01-10 16:44:47 UTC,31/08/2012,J1772,COLLEGE_CAMPUS
ELEC,Kennesaw State University - P60 Parking Deck,N Hornet Dr,Located on the 4th floor,Marietta,GA,30060,470-578-5114,E,Public,24 hours daily; non-permit holders must move their vehicle to visitor parking after completing charge,,,1,0,33.937899,-84.522281,09/10/2020,52905,2022-09-16 22:17:09 UTC,01/09/2013,J1772,COLLEGE_CAMPUS
ELEC,CrossRoads Ford,2333 Walnut St,,Cary,NC,27511,877-830-1251,T,TEMPORARILY UNAVAILABLE (Public - Call ahead),Dealership business hours,,,2,0,35.753616,-78.739497,10/01/2022,53884,2022-02-10 19:42:29 UTC,,J1772,CAR_DEALER
ELEC,Mooresville Ford,151 E Plaza Dr,,Mooresville,NC,28115,704-664-1300,E,Public,24 hours daily,,,1,0,35.589615,-80.834215,04/11/2021,53885,2022-04-28 20:01:31 UTC,01/04/2013,J1772,CAR_DEALER
ELEC,Steak 'n Shake,11 Bett Stroud Rd,,Weaverville,NC,28787,828-645-0126,E,Public,24 hours daily,,,2,0,35.7027,-82.5758,04/11/2021,53887,2022-02-10 19:42:29 UTC,01/11/2013,J1772,RESTAURANT
ELEC,Jenkins and Wynne Ford Lincoln Honda,2655 Trenton Rd,,Clarksville,TN,37040,931-538-7000,E,Public - Call ahead,24 hours daily; Drivers must bring their own J1772 cordset for Level 1 charging,,2,2,0,36.583614,-87.314186,14/09/2022,53986,2022-09-14 15:49:44 UTC,01/04/2013,J1772 NEMA520,CAR_DEALER
ELEC,AutoNation Ford Wolfchase,7925 Stage Rd,Highway 64,Memphis,TN,38133,901-209-1257,E,Public - Call ahead,Dealership business hours,,,2,0,35.203552,-89.799194,14/01/2021,53987,2022-12-22 20:45:06 UTC,01/04/2013,J1772,CAR_DEALER
ELEC,Hotel Indigo,500 College Ave,College Ave & E Dougherty St,Athens,GA,30601,706-546-0430,E,Public,24 hours daily; for guest use only; see front desk for access,,,2,0,33.962319,-83.376296,10/01/2023,54072,2023-01-10 16:44:47 UTC,30/01/2020,J1772,HOTEL
ELEC,UNC B-SCHOOL DECK,Kenan Drive,,Chapel Hill,NC,27514,888-758-4389,E,Public,24 hours daily,,,2,0,35.900785,-79.046279,23/01/2023,58187,2023-01-23 23:00:32 UTC,20/01/2014,J1772,
ELEC,Ambiente Modern Furniture,210 Hampton Woods Ln,,Raleigh,NC,27607,919-821-7210,E,Public,Store business hours; see front desk for access,,,2,0,35.793985,-78.750329,10/01/2022,60264,2022-02-10 19:42:29 UTC,01/11/2013,J1772,SHOPPING_CENTER
ELEC,FLOW BMW STATION 01,2573-2575 NC-150,,Winston-Salem,NC,27127,888-758-4389,T,TEMPORARILY UNAVAILABLE (Public),24 hours daily,,,2,0,36.060175,-80.258174,23/01/2023,60749,2023-01-23 23:00:54 UTC,15/03/2014,J1772,
ELEC,BMW  ASHEVILLE STATION 01,649 Airport Rd,,Fletcher,NC,28732,888-758-4389,E,Public,24 hours daily,,,2,0,35.438431,-82.53562,23/01/2023,60789,2023-01-23 23:00:51 UTC,19/03/2014,J1772,
ELEC,Regal Nissan,1090 Holcomb Bridge Rd,,Roswell,GA,30076,770-998-8686,E,Private,,,,1,0,34.022437,-84.327529,07/03/2022,61347,2022-03-07 19:49:53 UTC,15/03/2011,J1772,CAR_DEALER
ELEC,Vaden Nissan of Hinesville,1009 E Oglethorpe Hwy,,Hinesville,GA,31313,912-368-1680,E,Public - Call ahead,Dealership business hours,,,1,1,31.853303,-81.577139,07/03/2022,61408,2022-03-07 19:49:53 UTC,01/02/2014,CHADEMO J1772,CAR_DEALER
ELEC,Vaden Nissan of Hinesville,1009 E Oglethorpe Hwy,,Hinesville,GA,31313,912-368-1680,E,Private,,,,1,0,31.853303,-81.577139,07/03/2022,61409,2022-03-07 19:49:53 UTC,01/02/2014,J1772,CAR_DEALER
ELEC,Fred Anderson Nissan,9225 Glenwood Ave,,Raleigh,NC,27617,919-324-3443,E,Public - Call ahead,Dealership business hours,,,1,1,35.896757,-78.760671,07/03/2022,61410,2022-03-07 19:49:53 UTC,01/02/2014,CHADEMO J1772,CAR_DEALER
ELEC,Fred Anderson Nissan,9225 Glenwood Ave,,Raleigh,NC,27617,919-324-3443,E,Private,,,,1,0,35.896757,-78.760671,07/03/2022,61411,2022-03-07 19:49:53 UTC,01/02/2014,J1772,CAR_DEALER
ELEC,Nissan of LaGrange,224 Commerce Ave,,LaGrange,GA,30241,706-884-1744,E,Public - Call ahead,Dealership business hours,,,1,1,33.048536,-85.018055,07/03/2022,61412,2022-03-07 19:49:53 UTC,01/02/2014,CHADEMO J1772,CAR_DEALER
ELEC,Nissan of LaGrange,224 Commerce Ave,,LaGrange,GA,30241,706-884-1744,E,Private,,,,1,0,33.048536,-85.018055,07/03/2022,61413,2022-03-07 19:49:53 UTC,01/02/2014,J1772,CAR_DEALER
ELEC,Cronic Nissan,2624 N Expy,,Griffin,GA,30223,678-967-2277,E,Public - Call ahead,Dealership business hours,,,2,2,33.304797,-84.290372,07/03/2022,61416,2022-03-07 19:49:53 UTC,01/02/2014,CHADEMO J1772 J1772COMBO,CAR_DEALER
ELEC,CROWN BMW STATION 01,3902 Wendover Ave W,,Greensboro,NC,27407,888-758-4389,E,Public,24 hours daily,,,2,0,36.060492,-79.877721,23/01/2023,61520,2023-01-23 23:00:53 UTC,29/04/2014,J1772,
ELEC,VALLEY BMW STATION 01,3832-3856 Sycamore Dairy Rd,,Fayetteville,NC,28303,888-758-4389,T,TEMPORARILY UNAVAILABLE (Public),24 hours daily,,,2,0,35.080009,-78.94689,23/01/2023,61619,2023-01-23 23:01:08 UTC,07/05/2014,J1772,
ELEC,GASTON COUNTY VISITOR CENTER,620 N. Main Street,,Belmont,NC,28012,888-758-4389,E,Public,24 hours daily,,,1,0,35.2566,-81.042796,23/01/2023,61737,2023-01-23 23:01:08 UTC,17/05/2014,J1772,
ELEC,GASTON COUNTY LOWELL LIBRARY,203 McAdenville Rd.,,Lowell,NC,28098,888-758-4389,E,Public,24 hours daily,,,1,0,35.267294,-81.098034,23/01/2023,61738,2023-01-23 23:01:08 UTC,17/05/2014,J1772,
ELEC,GEORGIA STATE G DECK EV2,52 Courtland St SE,,Atlanta,GA,30303,888-758-4389,E,Public,24 hours daily,,,2,0,33.751991,-84.387318,23/01/2023,62062,2023-01-23 23:04:51 UTC,07/06/2014,J1772,
ELEC,BMW NASHVILLE STATION 01,4013 Armory Oaks Dr,,Nashville,TN,37204,888-758-4389,E,Public,24 hours daily,,,2,0,36.104589,-86.761033,23/01/2023,62273,2023-01-23 23:00:52 UTC,27/06/2014,J1772,
ELEC,Echoview Fiber Mill,76 Jupiter Rd,,Weaverville,NC,28787,828-348-4864,E,Public,8am-5pm M-F,,,5,0,35.759451,-82.54994,04/11/2021,62280,2022-02-10 19:42:29 UTC,01/04/2012,J1772,OTHER
ELEC,Fields Auto Group,255 Smokey Park Hwy,,Asheville,NC,28806,828-667-5213,E,Private,Service center use only,,,1,0,35.562735,-82.63133,10/01/2022,62314,2022-02-10 19:42:29 UTC,15/05/2012,J1772,CAR_DEALER
ELEC,North Carolina Museum of Life and Science,433 W Murray Ave,,Durham,NC,27704,919-220-5429,T,TEMPORARILY UNAVAILABLE (Public - Call ahead),24 hours daily,,,2,0,36.030987,-78.898207,04/11/2021,62316,2022-02-10 19:42:29 UTC,30/06/2013,J1772,MUSEUM
ELEC,TVHS STATION2,3401 Memorial Blvd,,Murfreesboro,TN,37129,888-758-4389,T,TEMPORARILY UNAVAILABLE (Public),24 hours daily,,,1,0,35.910873,-86.384511,23/01/2023,62332,2023-01-23 23:01:06 UTC,01/07/2014,J1772,
ELEC,Sheraton Hotel,165 Courtland St NE,"Located on left side of the parking garage, see valet",Atlanta,GA,30303,404-659-6500,E,Public,Garage business hours; pay lot; see valet for access; Drivers must bring their own J1772 cordset for Level 1 charging,,1,1,0,33.75886,-84.384194,04/08/2021,62519,2022-02-10 21:00:18 UTC,12/01/2014,J1772 NEMA520,HOTEL
ELEC,Children's at Egleston Hospital,1405 Clifton Rd NE,Turn onto Uppergate Dr. off of Clifton Rd. Garage is on left.,Atlanta,GA,30329,404-785-6000,E,Public - Credit card at all times,24 hours daily,A D M V,,4,0,33.793285,-84.320996,10/08/2022,62710,2022-08-10 13:32:10 UTC,01/07/2014,J1772,HOSPITAL
ELEC,Southbound Restaurant,5394 Peachtree Rd,Located to the east of the entrance from the lot,Chamblee,GA,30341,678-580-5579,T,TEMPORARILY UNAVAILABLE (Public),24 hours daily; for customer use only,,,1,0,33.892288,-84.301018,04/08/2021,62713,2022-02-10 19:42:29 UTC,01/07/2014,J1772,RESTAURANT
ELEC,600 Galleria Parking Deck,600 Galleria Pkwy SE,Located on the ground level next to the smoking lounge,Atlanta,GA,30339,,E,Private,Building tenant use only; Drivers must bring their own J1772 cordset for Level 1 charging,,2,,2,33.8836,-84.464232,13/12/2022,62718,2022-12-13 14:36:26 UTC,01/07/2013,CHADEMO NEMA520,PARKING_GARAGE
ELEC,APSU LOT 9,311 Ford St,,Clarksville,TN,37040,888-758-4389,E,Public,24 hours daily,,,2,0,36.532847,-87.349204,23/01/2023,62789,2023-01-23 23:01:10 UTC,05/08/2014,J1772,
ELEC,METRO NASHVILLE MIDTOWN HILLS,1441 12th Ave S,,Nashville,TN,37203,888-758-4389,E,Public,24 hours daily,,,2,0,36.137258,-86.788609,23/01/2023,62807,2023-01-23 23:00:57 UTC,07/08/2014,J1772,
ELEC,Ben Mynatt Chevrolet Cadillac,281 Concord Pkwy S,,Concord,NC,28027,704-786-2151,E,Public - Call ahead,Dealership business hours,,,2,0,35.395326,-80.610927,09/12/2021,62828,2022-02-10 19:42:29 UTC,11/08/2014,J1772,CAR_DEALER
ELEC,Austin Peay State University,601 College St,Located near the intersection of Ford St and College St,Clarksville,TN,37040,931-221-7456,E,Public,24 hours daily,,,1,0,36.531568,-87.353782,12/10/2021,63033,2022-02-10 19:42:29 UTC,08/08/2014,J1772,COLLEGE_CAMPUS
ELEC,METRO NASHVILLE LENTZ 3,2500 Charlotte Ave,,Nashville,TN,37203,888-758-4389,E,Public,24 hours daily,,,2,0,36.15557,-86.813431,12/01/2023,63039,2023-01-12 23:14:14 UTC,26/08/2014,J1772,
ELEC,SAS Institute Inc - G,300 Matrix Dr,Located at Picnic Shelter,Cary,NC,27513,,E,Private,Employee and guest use only,,,2,0,35.823401,-78.76124,10/01/2023,63074,2023-01-10 16:44:47 UTC,01/04/2014,J1772,OFFICE_BLDG
ELEC,SAS Institute Inc - S,600 SAS Campus Dr,Located at Building S,Cary,NC,27607,,E,Private,Employee and guest use only,,,4,0,35.822242,-78.757042,07/06/2021,63075,2022-11-14 22:08:52 UTC,01/04/2014,J1772,OFFICE_BLDG
ELEC,SAS Institute Inc - R,500 SAS Campus Dr,Located at Building R,Cary,NC,27513,,E,Private,Employee and guest use only,,,8,0,35.824815,-78.757352,10/01/2023,63076,2023-01-10 16:44:47 UTC,01/04/2014,J1772,OFFICE_BLDG
ELEC,BSMG NORTH DECK 1,305 Jackson St,,Durham,NC,27701,888-758-4389,E,Public,24 hours daily,,,2,0,35.994829,-78.905062,23/01/2023,63239,2023-01-23 23:01:29 UTC,09/09/2014,J1772,
ELEC,Park 'N Ticket,3945 Conley St,,College Park,GA,30337,404-669-3800,E,Public - Call ahead,Garage business hours; pay lot; Drivers must bring their own J1772 cordset for Level 1 charging,,17,,0,33.647979,-84.454573,13/12/2022,63246,2022-12-13 14:36:26 UTC,02/09/2014,NEMA520,PAY_GARAGE
ELEC,BSMG EAST DECK 3,250 South Mangum Street,,Durham,NC,27701,888-758-4389,E,Public,24 hours daily,,,2,0,35.992578,-78.902123,23/01/2023,63298,2023-01-23 23:01:29 UTC,16/09/2014,J1772,
ELEC,BSMG SOUTH DECK 1,705 Willard Street,,Durham,NC,27701,888-758-4389,E,Public,24 hours daily,,,2,0,35.991785,-78.906252,23/01/2023,63299,2023-01-23 23:01:29 UTC,16/09/2014,J1772,
ELEC,UNC RAMSHEAD 1,104 Ridge Rd,,Chapel Hill,NC,27514,888-758-4389,E,Public,24 hours daily,,,2,0,35.906068,-79.045679,23/01/2023,63303,2023-01-23 23:01:30 UTC,16/09/2014,J1772,
ELEC,UNC CARDINAL DECK 1,Cardinal Deck Skywalk,,Chapel Hill,NC,27514,888-758-4389,E,Public,24 hours daily,,,2,0,35.90333,-79.052449,23/01/2023,63335,2023-01-23 23:01:30 UTC,19/09/2014,J1772,
ELEC,Appalachian State University - Rivers Street Parking Deck,461 Rivers St,Located on the 1st level,Boone,NC,28608,828-262-2878,E,Public,Garage business hours,,,1,0,36.211913,-81.680812,09/12/2021,63368,2022-02-10 19:42:29 UTC,01/06/2013,J1772,PARKING_GARAGE
ELEC,Benton Nissan - Columbia,1510 Nashville Hwy,,Columbia,TN,38401,,E,Public - Call ahead,Dealership business hours; contact 931-388-2023 for more information,,,1,1,35.649166,-87.011382,09/06/2020,63441,2021-03-11 23:22:17 UTC,05/04/2011,CHADEMO J1772,CAR_DEALER
ELEC,Publix #1154,12800 Georgia 144,Located in the parking lot in front of the store,Richmond Hill,GA,31324,912-459-1171,E,Public,Store business hours; customer use only while shopping at Publix,,,1,0,31.909521,-81.27874,06/04/2022,63520,2022-04-28 20:01:31 UTC,01/08/2014,J1772,GROCERY
ELEC,Whole Foods Market,1815 E Victory Dr,Located at the front of the store next to the handicap parking,Savannah,GA,31404,912-358-5829,E,Public,24 hours daily,,,2,0,32.044095,-81.071495,10/01/2023,63521,2023-01-10 16:44:47 UTC,01/09/2013,J1772,GROCERY
ELEC,Eagle Creek Brewing Co - Tesla,106 Savannah Ave,,Statesboro,GA,30458,912-489-2337,E,Public - Call ahead,Brewery business hours; for Tesla use only; call ahead to make appointment,,,1,0,32.448106,-81.779944,14/01/2021,63522,2022-12-12 19:17:59 UTC,01/09/2013,TESLA,RESTAURANT
ELEC,Kroger,1931 Jesse Jewell Pkwy,,Gainesville,GA,30501,470-252-3182,E,Public,24 hours daily,,,2,0,34.283903,-83.848362,10/01/2023,63524,2023-01-10 16:44:47 UTC,01/03/2014,J1772,GROCERY
ELEC,Mountain View Ford Lincoln,301 E 20th St,,Chattanooga,TN,37408,423-756-1331,E,Public - Call ahead,Dealership business hours; customer use only,,,2,0,35.03095,-85.305742,12/10/2021,63597,2022-02-10 19:42:29 UTC,01/09/2013,J1772,CAR_DEALER
ELEC,RTP EMC - RTP,62 T W Alexander Drive,,Durham,NC,27703,888-758-4389,E,Public,24 hours daily,,,2,0,35.919842,-78.87791,23/01/2023,63766,2023-01-23 23:01:32 UTC,17/10/2014,J1772,
ELEC,City of Cornelia - Train Depot,109 Grant Pl,"Located in the parking lot, just off of Clarkesville St next to the wooden fence and water splash park area",Cornelia,GA,30531,706-778-8585,E,Public,24 hours daily,,,1,0,34.512321,-83.525769,11/10/2022,64138,2022-10-11 18:56:12 UTC,21/03/2014,J1772,PARK
ELEC,City of Cornelia - North Fire Station,347 Old Historic Highway 441 N,,Cornelia,GA,30531,706-778-8585,E,Public,24 hours daily,,,1,0,34.541644,-83.543244,11/10/2022,64139,2022-10-11 18:56:12 UTC,01/11/2014,J1772,FIRE_STATION
ELEC,Gaston Courthouse Community Center,131 N Gaston St,,Dallas,NC,28034,704-922-3176,E,Public,24 hours daily,,,4,0,35.316002,-81.176575,09/12/2021,64399,2022-02-10 19:42:29 UTC,15/10/2014,J1772,MUNI_GOV
ELEC,Asheville Ford,611 Brevard Rd,,Asheville,NC,28806,828-253-2731,E,Private,Service center use only,,,1,0,35.550684,-82.601894,10/01/2022,64510,2022-02-10 19:42:29 UTC,01/12/2013,J1772,CAR_DEALER
ELEC,METRO NASHVILLE FULTON GARAGE 5,1st Ave S,,Nashville,TN,37210,888-758-4389,E,Public,24 hours daily,,,2,0,36.153934,-86.767472,23/01/2023,64552,2023-01-23 23:01:28 UTC,09/12/2014,J1772,
ELEC,North Carolina State University - Keystone Science Center,1791 Varsity Dr,,Raleigh,NC,27606,919-513-3334,E,Public,24 hours daily; see FREEDM Reception desk for parking permit,,,3,0,35.774673,-78.677792,10/11/2022,64755,2022-11-10 16:40:31 UTC,31/10/2011,J1772,COLLEGE_CAMPUS
ELEC,CLT AIRPORT LEVEL4_ST1,5501 R C Josh Birmingham Pkwy,,Charlotte,NC,28208,888-758-4389,T,TEMPORARILY UNAVAILABLE (Public),24 hours daily,,,2,0,35.221677,-80.944937,23/01/2023,65505,2023-01-23 23:02:03 UTC,04/02/2015,J1772,
ELEC,Ingles Market,2130 E Main St,,Lincolnton,NC,28092,704-735-2398,E,Public,24 hours daily,,,2,0,35.478123,-81.221638,10/01/2022,65509,2022-02-10 19:42:29 UTC,01/09/2014,J1772,GROCERY
ELEC,Sunshine Chevrolet,100 Thunderland Cir,,Arden,NC,28704,,E,Public - Call ahead,24 hours daily; call ahead during dealership hours,,,2,0,35.480846,-82.564542,10/01/2023,65512,2023-01-10 16:44:47 UTC,01/10/2014,J1772,CAR_DEALER
ELEC,Mills Rentals Office,120 Purefoy Rd,Located next to the street between 118 and 119 Purefoy Rd,Chapel Hill,NC,27514,919-967-0045,E,Public - Credit card at all times,24 hours daily; Also accepts prepaid card,M V,,1,0,35.897388,-79.052478,13/12/2022,65520,2022-12-13 14:36:26 UTC,01/01/2015,J1772,STREET_PARKING
ELEC,"Piedmont Triad Regional Council, NC",1398 Carrollton Crossing Drive,,Kernsersville,NC,27284,855-885-9571,E,Public,,,,2,0,36.079558,-80.064636,23/01/2023,65924,2023-01-23 23:34:45 UTC,01/01/2015,J1772,
ELEC,Ingles Market,915 Merrimon Ave,,Asheville,NC,28804,828-253-1326,E,Public,24 hours daily,,,2,0,35.62983,-82.552775,10/01/2023,66409,2023-01-10 16:44:47 UTC,01/11/2014,J1772,GROCERY
ELEC,NORTHWINDS NORTHWINDS 2,2500 Northwinds Pkwy,,Alpharetta,GA,30009,888-758-4389,E,Public,24 hours daily,,,2,0,34.059814,-84.285095,12/01/2023,66606,2023-01-12 23:15:52 UTC,03/04/2015,J1772,
ELEC,BSMG SOUTH DECK 2,Julian Carr St,,Durham,NC,27701,888-758-4389,E,Public,24 hours daily,,,2,0,35.992658,-78.905999,23/01/2023,66697,2023-01-23 23:01:20 UTC,12/04/2015,J1772,
ELEC,Cobb County - Powder Springs,1150 Powder Springs St,,Marietta,GA,30064,678-345-4574,T,TEMPORARILY UNAVAILABLE (Public),24 hours daily,,,,2,33.925418,-84.574845,11/10/2022,66787,2022-10-11 18:56:12 UTC,01/04/2015,CHADEMO J1772COMBO,MUNI_GOV
ELEC,Carl Miller Park,74 Sewell Rd,,Newnan,GA,30263,770-683-5516,E,Public,8am-9pm daily,,,1,0,33.359198,-84.803283,14/01/2021,66906,2023-01-04 17:12:54 UTC,01/01/2015,J1772,PARK
ELEC,DeKalb Peachtree Airport,2000 Airport Rd,,Atlanta,GA,30341,770-936-5440,E,Public - Call ahead,24 hours daily; call ahead to obtain code to use the charger,,,2,0,33.874961,-84.301305,10/01/2023,67099,2023-01-10 16:44:47 UTC,16/01/2017,J1772,AIRPORT
ELEC,City of Americus - Welcome Center,101 W Lamar St,,Americus,GA,31709,229-928-6059,E,Public,24 hours daily,,,1,0,32.072192,-84.232577,04/08/2021,67101,2022-02-10 19:42:29 UTC,01/05/2015,J1772,MUNI_GOV
ELEC,Concord Regional Airport - Hourly Parking Lot,9000 Aviation Blvd,,Concord,NC,28027,704-920-5900,E,Public,24 hours daily,,,2,0,35.385521,-80.712971,10/01/2022,67127,2022-02-10 19:42:29 UTC,01/01/2015,J1772,AIRPORT
ELEC,MEBANE TANGER EV 1,4000 Arrowhead Blvd,,Mebane,NC,27302,888-758-4389,E,Public,24 hours daily,,,2,0,36.074911,-79.26771,23/01/2023,67172,2023-01-23 23:02:55 UTC,21/05/2015,J1772,
ELEC,Newnan Utilities,315 Millard Farmer Industrial Blvd,Millard Farmer Industrial Blvd & Hillwood Cir,Newnan,GA,30263,770-683-5516,E,Public,8am-5pm M-F,,,2,0,33.40016,-84.78589,11/10/2022,68000,2022-10-11 18:56:12 UTC,01/06/2015,J1772,UTILITY
ELEC,SAS Institute Inc - U,720 SAS Campus Dr,Located at Building U,Cary,NC,27513,,E,Private,Employee and guest use only,,,4,0,35.820801,-78.753109,10/01/2023,68003,2023-01-10 16:44:47 UTC,01/09/2014,J1772,OFFICE_BLDG
ELEC,SAS Institute Inc - Q,801 SAS Campus Dr,Located at Building Q,Cary,NC,27513,,E,Private,Employee and guest use only,,,6,0,35.82111,-78.749317,10/01/2023,68004,2023-01-10 16:44:47 UTC,01/09/2014,J1772,OFFICE_BLDG
ELEC,SAS Institute Inc - H,301 SAS Campus Dr,Located at Building H,Cary,NC,27513,,E,Private,Employee and guest use only,,,6,0,35.827144,-78.76066,07/06/2021,68005,2022-11-15 20:28:21 UTC,01/09/2014,J1772,OFFICE_BLDG
ELEC,SAS Institute Inc - LW,104 SAS Campus Dr,Located at Building LW,Cary,NC,27513,,E,Private,Employee and guest use only,,,2,0,35.828483,-78.767465,07/06/2021,68006,2022-11-15 20:28:21 UTC,01/09/2014,J1772,OFFICE_BLDG
ELEC,METRO NASHVILLE DOUGLAS HS 2,621 Howerton St,,Nashville,TN,37206,888-758-4389,E,Public,24 hours daily,,,2,0,36.176117,-86.762044,12/01/2023,68034,2023-01-12 23:16:03 UTC,25/06/2015,J1772,
ELEC,GARAGE RAMP PINNACLE 1,150 3rd Ave S 150 3rd Ave South,,Nashville,TN,37201,888-758-4389,E,Public,24 hours daily,,,2,0,36.160453,-86.774698,23/01/2023,68143,2023-01-23 23:03:26 UTC,27/06/2015,J1772,
ELEC,SEVIERVILLE TANGER OUTLET 1,1641 Parkway,,Sevierville,TN,37862,888-758-4389,E,Public,24 hours daily,,,2,0,35.832754,-83.570439,23/01/2023,68198,2023-01-23 23:03:19 UTC,09/07/2015,J1772,
ELEC,Beach Ready Auto,8863 Caratoke Hwy,,Point Harbor,NC,27964,252-489-4891,E,Public,24 hours daily,,,1,0,36.093125,-75.808695,13/12/2022,68269,2022-12-13 14:36:26 UTC,29/06/2015,J1772,AUTO_REPAIR
ELEC,Publix #1211,4324 Harding Pike,Located in the bottom level of the parking garage near the elevators,Nashville,TN,37205,615-279-2038,E,Public,Store business hours; customer use only while shopping at Publix,,,1,0,36.12718,-86.84697,06/04/2022,68381,2022-04-28 20:01:31 UTC,16/03/2011,J1772,GROCERY
ELEC,Publix #1442,11222 Providence Rd W,Located in the parking lot in front of the store,Charlotte,NC,28277,704-716-2344,E,Public,Store business hours; customer use only while shopping at Publix,,,1,0,35.0435,-80.84951,06/04/2022,68383,2022-04-28 20:01:31 UTC,26/02/2014,J1772,GROCERY
ELEC,Publix #1453,2222 South Blvd,Located in the parking garage P-2 on the back left corner by stairwell.,Charlotte,NC,28203,704-373-2122,E,Public,Store business hours; customer use only while shopping at Publix,,,1,0,35.208237,-80.86254,06/04/2022,68384,2022-04-28 20:01:31 UTC,18/04/2015,J1772,GROCERY
ELEC,Carlock Nissan - Jackson,495 Vann Dr,,Jackson,TN,38305,,E,Public - Call ahead,Dealership business hours; contact 731-422-4658 for more information,,,,1,35.668125,-88.84297,07/03/2022,68421,2022-03-07 19:49:53 UTC,01/04/2015,CHADEMO,CAR_DEALER
ELEC,Marine Corps Logistic Base - Albany,814 Radford Blvd,,Albany,GA,31704,,E,Private - Government only,,,,1,0,31.551225,-84.066879,12/07/2022,68541,2022-07-12 20:31:42 UTC,15/07/2015,J1772,MIL_BASE
ELEC,Federal Law Enforcement Training Center Glynco,1131 Chapel Crossing Rd,,Glynco,GA,31524,,E,Private - Government only,DHS fleet use only; call ahead,,,1,0,31.228369,-81.462842,12/07/2022,68544,2022-07-12 20:31:42 UTC,15/07/2015,J1772,FED_GOV
ELEC,ASBURYVILLAGE ASBURY STAT 1,814 Handsworth Ln,,Raleigh,NC,27607,888-758-4389,E,Public,24 hours daily,,,2,0,35.795027,-78.738174,23/01/2023,68827,2023-01-23 23:03:26 UTC,05/08/2015,J1772,
ELEC,City of Suwanee,330 Town Center Ave,,Suwanee,GA,30024,770-945-8996,E,Public - Credit card at all times,24 hours daily; Google Pay,A APPLE_PAY M V,,2,0,34.055372,-84.06375,10/01/2023,68859,2023-01-10 16:44:47 UTC,01/07/2015,J1772,MUNI_GOV
ELEC,GA GWINNETT COL BLDG A LOT,1000 University Center Lane,,Lawrenceville,GA,30043,888-758-4389,E,Public,24 hours daily,,,2,0,33.979426,-84.000113,12/01/2023,69053,2023-01-12 23:10:44 UTC,15/08/2015,J1772,
ELEC,GEORGIA POWER L'VILLE L2,1453 HIGHWAY 120,,Lawrenceville,GA,30043,888-758-4389,E,Public,24 hours daily,,,2,0,33.972818,-84.052222,23/01/2023,69151,2023-01-23 23:03:53 UTC,21/08/2015,J1772,
ELEC,EC STATION CROATAN HWY 1,7100 S Croatan Hwy,,Nags Head,NC,27959,888-758-4389,T,TEMPORARILY UNAVAILABLE (Public),24 hours daily,,,2,0,35.913597,-75.60263,12/01/2023,69213,2023-01-12 23:13:39 UTC,27/08/2015,J1772,
ELEC,Nissan of Newnan,783 Bullsboro Dr,,Newnan,GA,30263,770-254-3800,E,Public - Call ahead,Dealership business hours,,,1,1,33.395504,-84.752641,07/03/2022,70444,2022-03-07 19:49:53 UTC,19/08/2014,CHADEMO J1772 J1772COMBO,CAR_DEALER
ELEC,Nissan of Newnan,783 Bullsboro Dr,,Newnan,GA,30263,770-254-3800,E,Private,Service center use only,,,1,0,33.395504,-84.752641,07/03/2022,70466,2022-03-07 19:49:53 UTC,19/08/2014,J1772,CAR_DEALER
ELEC,GWCC GWCC MB NGW 8,Mangum St SW,,Atlanta,GA,30303,888-758-4389,E,Public,24 hours daily,,,2,0,33.755638,-84.398674,23/01/2023,70512,2023-01-23 23:04:01 UTC,15/10/2015,J1772,
ELEC,VRF ROBINSON FARM,8430 Rea Rd,,Charlotte,NC,28277,888-758-4389,E,Public,24 hours daily,,,2,0,35.053318,-80.81217,23/01/2023,70594,2023-01-23 23:02:48 UTC,21/10/2015,J1772,
ELEC,HIGHWOODS 2800 NGW1,2800 Century Center Dr,,Atlanta,GA,30345,888-758-4389,E,Public,24 hours daily,,,2,0,33.848618,-84.304817,23/01/2023,70705,2023-01-23 23:04:03 UTC,28/10/2015,J1772,
ELEC,METRO NASHVILLE MNFD STATION 19,524b 26th Ave N,,Nashville,TN,37209,888-758-4389,E,Public,24 hours daily,,,1,0,36.156447,-86.815539,23/01/2023,70728,2023-01-23 23:02:58 UTC,29/10/2015,J1772,
ELEC,HIGHWOODS 2400 NGW,2400 Century Center Dr,,Atlanta,GA,30345,888-758-4389,E,Public,24 hours daily,,,2,0,33.846544,-84.3063,23/01/2023,71016,2023-01-23 23:04:03 UTC,07/11/2015,J1772,
ELEC,THREE ALLIANCE 3 ALLIANCE EV2,3560 Lenox Rd NE,,Atlanta,GA,30326,888-758-4389,E,Public,24 hours daily,,,2,0,33.85114,-84.366722,23/01/2023,71107,2023-01-23 23:05:21 UTC,14/11/2015,J1772,
ELEC,FPWC HONEYCUTT 1,352-498 Devers St Honeycutt Park,,Fayetteville,NC,28303,888-758-4389,E,Public,24 hours daily,,,2,0,35.069194,-78.92208,23/01/2023,71809,2023-01-23 23:03:25 UTC,12/12/2015,J1772,
ELEC,Yonah Mountain Vineyards,1717 Highway 225,,Cleveland,GA,30528,706-878-5522,E,Public,24 hours daily; for guest use only; see front desk for access,,,4,0,34.615088,-83.703135,09/10/2020,72082,2023-01-05 02:31:09 UTC,01/11/2015,J1772,BREWERY_DISTILLERY_WINERY
ELEC,MONARCH TOWER G MONARCH TOWER 2,3424 Peachtree Rd NE,,Atlanta,GA,30326,888-758-4389,E,Public,24 hours daily,,,2,0,33.85194,-84.364959,23/01/2023,72282,2023-01-23 23:04:22 UTC,31/12/2015,J1772,
ELEC,MONARCH TOWER G MONARCH PLAZA,3414 Peachtree Rd NE,,Atlanta,GA,30326,888-758-4389,E,Public,24 hours daily,,,2,0,33.851384,-84.36464,23/01/2023,72323,2023-01-23 23:04:23 UTC,05/01/2016,J1772,
ELEC,GEORGIA POWER CUMMING DC,1610 Market Pl Blvd,,Cumming,GA,30041,888-758-4389,E,Public,24 hours daily,,,,1,34.187507,-84.13101,23/01/2023,72331,2023-01-23 23:03:54 UTC,06/01/2016,CHADEMO J1772COMBO,
ELEC,FASTPARK ATLANTA 1,211 Charles W Grant Pkwy,,Atlanta,GA,30354,888-758-4389,E,Public,24 hours daily,,,2,0,33.640281,-84.398028,23/01/2023,72379,2023-01-23 23:04:06 UTC,07/01/2016,J1772,
ELEC,WOOD BRIDGE 1 WOODBRIDGE1,680 Park Bridge Pkwy,,Alpharetta,GA,30005,888-758-4389,E,Public,24 hours daily,,,2,0,34.064451,-84.240698,23/01/2023,72493,2023-01-23 23:04:08 UTC,12/01/2016,J1772,
ELEC,Savannah Harley-Davidson,1 Fort Argyle Rd,,Savannah,GA,31324,912-925-0005,E,Public - Call ahead,24 hours daily,,,1,0,32.003481,-81.286643,11/10/2022,72523,2022-10-11 18:56:12 UTC,30/10/2015,J1772,SHOPPING_CENTER
ELEC,SAT PLACE 300 BANYAN 2 NGW,3237 Satellite Blvd,,Duluth,GA,30096,888-758-4389,E,Public,24 hours daily,,,2,0,33.96366,-84.120419,23/01/2023,72592,2023-01-23 23:04:34 UTC,19/01/2016,J1772,
ELEC,GE Campus,4200 Wildwood Pkwy,,Atlanta,GA,30339,678-844-6000,E,Public,24 hours daily,,,2,0,33.913436,-84.456553,09/12/2021,72695,2022-02-10 19:42:29 UTC,25/01/2016,J1772,OFFICE_BLDG
ELEC,Roswell City Hall,38 Hill St,,Roswell,GA,30075,770-641-3727,E,Public,24 hours daily,,,2,0,34.0228,-84.3598,10/08/2022,73132,2022-08-10 13:32:10 UTC,01/01/2015,J1772,MUNI_GOV
ELEC,City of Etowah - Depot Parking,801 Tennessee Ave,Located at 9th and Tennessee Ave,Etowah,TN,37331,423-263-9441,E,Public,24 hours daily,,,1,0,35.322918,-84.52522,10/01/2023,73225,2023-01-10 16:44:47 UTC,01/11/2014,J1772,PARKING_LOT
ELEC,UNC CRAIGE DECK,290-296 Manning Dr,,Chapel Hill,NC,27514,888-758-4389,E,Public,24 hours daily,,,2,0,35.902571,-79.047712,23/01/2023,73277,2023-01-23 23:03:49 UTC,04/02/2016,J1772,
ELEC,Piedmont Triad International Airport,1000 A Ted Johnson Pkwy,,Greensboro,NC,27409,336-665-5631,E,Public,24 hours daily,,4,,0,36.105313,-79.938316,10/01/2022,73468,2022-02-10 21:00:18 UTC,01/01/2016,J1772,AIRPORT
ELEC,"CHARLOTTE, NC HUNTERSVILLE 01",10300 Compass St,,Huntersville,NC,28078,888-758-4389,E,Public,24 hours daily,,,1,0,35.41369,-80.857192,23/01/2023,73502,2023-01-23 23:03:49 UTC,12/02/2016,J1772,
ELEC,"CHARLOTTE, NC SOUTHEND 02",1428 South Blvd,,Charlotte,NC,28203,888-758-4389,E,Public,24 hours daily,,,1,0,35.215386,-80.853754,23/01/2023,73525,2023-01-23 23:04:28 UTC,13/02/2016,J1772,
ELEC,"CHARLOTTE, NC SOUTHEND 01",1424-1436 South Blvd,,Charlotte,NC,28203,888-758-4389,E,Public,24 hours daily,,,1,0,35.215337,-80.853918,23/01/2023,73527,2023-01-23 23:03:49 UTC,13/02/2016,J1772,
ELEC,KENNESAW HAWTHORNE EV1,4045 George Busbee Pkwy NW,,Kennesaw,GA,30144,888-758-4389,E,Public,24 hours daily,,,2,0,34.050753,-84.586163,23/01/2023,73609,2023-01-23 23:04:22 UTC,16/02/2016,J1772,
ELEC,METRO NASHVILLE BELLEVUE LIB,720 Baugh Rd,,Nashville,TN,37221,888-758-4389,E,Public,24 hours daily,,,1,0,36.06949,-86.936094,12/01/2023,73707,2023-01-12 23:12:07 UTC,26/02/2016,J1772,
ELEC,METRO NASHVILLE NFD 20,1630 Harding Pl,,Nashville,TN,37215,888-758-4389,E,Public,24 hours daily,,,1,0,36.091731,-86.826441,23/01/2023,74075,2023-01-23 23:02:59 UTC,08/03/2016,J1772,
ELEC,FAYETTE COUNTY STATION #2,140  Stonewall Ave W,,Fayetteville,GA,30214,888-758-4389,T,TEMPORARILY UNAVAILABLE (Public),24 hours daily,,,2,0,33.447616,-84.455718,23/01/2023,74219,2023-01-23 23:04:50 UTC,16/03/2016,J1772,
ELEC,ASSURANT - ATL STATION 2,260 Interstate N Cir SE,,Atlanta,GA,30339,888-758-4389,E,Public,24 hours daily,,,2,0,33.899408,-84.463308,23/01/2023,74319,2023-01-23 23:04:49 UTC,24/03/2016,J1772,
ELEC,HALIFAXCNTYCVB STATION 01,260 Premier Blvd,,Roanoke Rapids,NC,27870,888-758-4389,E,Public,24 hours daily,,,2,0,36.426982,-77.631357,23/01/2023,74559,2023-01-23 23:04:52 UTC,31/03/2016,J1772,
ELEC,HAVANA PHIL'S CIGAR COMPANY,1628 Battleground Ave,,Greensboro,NC,27408,888-758-4389,E,Public,24 hours daily,,,1,0,36.090729,-79.811402,23/01/2023,74910,2023-01-23 23:03:51 UTC,13/04/2016,J1772,
ELEC,754 MIDTOWN GW,759 West Peachtree St NW,,Atlanta,GA,30308,888-758-4389,E,Public,24 hours daily,,,2,0,33.775604,-84.386929,23/01/2023,75456,2023-01-23 23:04:06 UTC,29/04/2016,J1772,
ELEC,Rider Transit System,635 Alfred Brown Jr Court SW,,Concord,NC,28025,704-920-5431,E,Public,8am-5pm M-F,,,1,0,35.37637407,-80.56380056,13/12/2022,75480,2022-12-13 14:36:26 UTC,01/01/2015,J1772,MUNI_GOV
ELEC,City of Concord - Parking Deck,35 Cabarrus Ave W,,Concord,NC,28026,704-920-5431,E,Public,24 hours daily,,,2,0,35.409825,-80.582282,13/12/2022,75481,2022-12-13 14:36:26 UTC,15/01/2015,J1772,MUNI_GOV
ELEC,LAKESBELLEVUE LAKESBELLEVUE,200 Erin Ln,,Nashville,TN,37221,888-758-4389,E,Public,24 hours daily,,,2,0,36.079471,-86.908649,23/01/2023,75502,2023-01-23 23:04:57 UTC,01/05/2016,J1772,
ELEC,BEMC OIB,44 E 1st St,,Ocean Isle Beach,NC,28469,888-758-4389,E,Public,24 hours daily,,,1,0,33.888258,-78.432809,23/01/2023,75527,2023-01-23 23:02:46 UTC,04/05/2016,J1772,
ELEC,CARTA CARTA NORTH,215 Broad St,,Chattanooga,TN,37402,888-758-4389,T,TEMPORARILY UNAVAILABLE (Public),24 hours daily,,,2,0,35.05385,-85.31132,23/01/2023,75629,2023-01-23 23:04:59 UTC,14/05/2016,J1772,
ELEC,CARTA THEATRECENTRE 1,200 River St,,Chattanooga,TN,37405,888-758-4389,E,Public,24 hours daily,,,2,0,35.061201,-85.30598,23/01/2023,75630,2023-01-23 23:04:59 UTC,14/05/2016,J1772,
ELEC,CARTA N SHORE GARAGE,305 Frazier Ave,,Chattanooga,TN,37405,888-758-4389,E,Public,24 hours daily,,,2,0,35.062618,-85.305176,23/01/2023,75631,2023-01-23 23:04:59 UTC,14/05/2016,J1772,
ELEC,DEKALB COUNTY SEMINOLE,4295 Clevemont Rd,,Ellenwood,GA,30294,888-758-4389,T,TEMPORARILY UNAVAILABLE (Public),24 hours daily,,,2,0,33.653188,-84.255732,23/01/2023,75643,2023-01-23 23:04:57 UTC,17/05/2016,J1772,
ELEC,CARTA SHUTTLE PARK S,1398 Market Street,,Chattanooga,TN,37402,888-758-4389,E,Public,24 hours daily,,,2,0,35.038031,-85.307156,23/01/2023,75671,2023-01-23 23:04:59 UTC,19/05/2016,J1772,
ELEC,CARTA INCLINE RAILWAY,3917 St Elmo Ave,,Chattanooga,TN,37409,888-758-4389,E,Public,24 hours daily,,,2,0,35.009534,-85.328442,23/01/2023,75696,2023-01-23 23:04:58 UTC,21/05/2016,J1772,
ELEC,OVERLOOK II SURFACE PARK 1,2839 Paces Ferry Rd SE,,Atlanta,GA,30339,888-758-4389,E,Public,24 hours daily,,,2,0,33.866937,-84.47224,23/01/2023,75697,2023-01-23 23:04:58 UTC,21/05/2016,J1772,
ELEC,WINDWARD PLACE WINDWARD 01,6230-7498 Jefferson Ct,,Alpharetta,GA,30005,888-758-4389,E,Public,24 hours daily,,,2,0,34.089086,-84.239913,23/01/2023,75700,2023-01-23 23:04:29 UTC,21/05/2016,J1772,
ELEC,DUN EV CHARGE BROOK RUN EV,4770 N Peachtree Rd,,Dunwoody,GA,30338,888-758-4389,T,TEMPORARILY UNAVAILABLE (Public),24 hours daily,,,2,0,33.934798,-84.295756,23/01/2023,76149,2023-01-23 23:04:19 UTC,04/06/2016,J1772,
ELEC,GERMANTOWN1 IMT GERMANTOWN2,1100 3rd Ave N,,Nashville,TN,37208,888-758-4389,T,TEMPORARILY UNAVAILABLE (Public),24 hours daily,,,1,0,36.17576,-86.784768,23/01/2023,76199,2023-01-23 23:05:27 UTC,08/06/2016,J1772,
ELEC,HALIFAXCNTYCVB HGI STATION 01,111 Carolina Crossroads Pkwy,,Roanoke Rapids,NC,27870,888-758-4389,E,Public,24 hours daily,,,2,0,36.398861,-77.640846,23/01/2023,76532,2023-01-23 23:05:09 UTC,25/06/2016,J1772,
ELEC,HALIFAXCNTYCVB HAMPTON INN 01,85 Hampton Blvd,,Roanoke Rapids,NC,27870,888-758-4389,E,Public,24 hours daily,,,2,0,36.432713,-77.630786,23/01/2023,76533,2023-01-23 23:05:08 UTC,25/06/2016,J1772,
ELEC,GEORGIA POWER BEST WESTERN DC,301 N Central Ave,,Hapeville,GA,30354,888-758-4389,E,Public,24 hours daily,,,,1,33.653984,-84.397653,12/01/2023,76862,2023-01-12 23:16:04 UTC,02/07/2016,CHADEMO J1772COMBO,
ELEC,Caromont Regional Medical Center,2525 Court Dr,Located in P1,Gastonia,NC,28054,704-834-2000,E,Public,24 hours daily,,,1,1,35.27153,-81.141587,10/01/2022,76881,2022-02-10 19:42:29 UTC,01/08/2014,CHADEMO J1772,HOSPITAL
ELEC,Southern Alliance for Clean Energy,46 Orchard St,,Asheville,NC,28801,,E,Private,24 hours daily; maximum session time of 4 hours from 8am-4pm daily; for SACE members only,,,4,0,35.601009,-82.548012,10/01/2023,76914,2023-01-10 16:44:47 UTC,01/03/2015,J1772,OFFICE_BLDG
ELEC,GEORGIA POWER EPICENTER DC,135 Riverside Pkwy,,Austell,GA,30168,888-758-4389,E,Public,24 hours daily,,,,1,33.771288,-84.558434,23/01/2023,76998,2023-01-23 23:03:55 UTC,16/07/2016,CHADEMO J1772COMBO,
ELEC,Acuity Brands Lighting,1400 Lester Rd,,Conyers,GA,30012,,E,Private,,,,2,0,33.6809967,-84.04174,10/01/2023,77013,2023-01-10 16:44:47 UTC,16/07/2016,J1772,OFFICE_BLDG
ELEC,GEORGIA POWER LIBERTY VILL DC,1075 Hwy 155 S,,McDonough,GA,30253,888-758-4389,E,Public,24 hours daily,,,,1,33.40723,-84.167619,23/01/2023,77127,2023-01-23 23:03:55 UTC,26/07/2016,CHADEMO J1772COMBO,
ELEC,BROOKLEIGH FLAT PARKING GARAGE,3450 Blair Cir NE,,Atlanta,GA,30319,888-758-4389,E,Public,24 hours daily,,,2,0,33.891577,-84.323784,23/01/2023,77145,2023-01-23 23:05:21 UTC,27/07/2016,J1772,
ELEC,DUN EV CHARGE NATURE CTR EV,5343 Roberts Dr,,Dunwoody,GA,30338,888-758-4389,T,TEMPORARILY UNAVAILABLE (Public),24 hours daily,,,2,0,33.956685,-84.333046,23/01/2023,77148,2023-01-23 23:04:18 UTC,27/07/2016,J1772,
ELEC,CARTA ERLANGER E HOSP,1751 Gunbarrel Road,,Chattanooga,TN,37421,888-758-4389,E,Public,24 hours daily,,,2,0,35.023738,-85.160777,23/01/2023,77360,2023-01-23 23:05:28 UTC,06/08/2016,J1772,
ELEC,CARTA NORTHGATE MALL,271 Northgate Mall Dr,,Chattanooga,TN,37343,888-758-4389,E,Public,24 hours daily,,,2,0,35.130823,-85.238173,23/01/2023,77361,2023-01-23 23:05:28 UTC,06/08/2016,J1772,
ELEC,CARTA FLYING SQUIRREL,55 Johnson Street,,Chattanooga,TN,37408,888-758-4389,E,Public,24 hours daily,,,2,0,35.035854,-85.305218,23/01/2023,77363,2023-01-23 23:05:06 UTC,06/08/2016,J1772,
ELEC,CARTA MEMORIAL HOSP,2525 Desales Ave.,,Chattanooga,TN,37406,888-758-4389,E,Public,24 hours daily,,,2,0,35.043855,-85.260525,23/01/2023,77364,2023-01-23 23:04:59 UTC,06/08/2016,J1772,
ELEC,CARTA CHATTANOOGA ZOO,301 North Holtzclaw,,Chattanooga,TN,37404,888-758-4389,E,Public,24 hours daily,,,2,0,35.043794,-85.280574,23/01/2023,77365,2023-01-23 23:04:59 UTC,06/08/2016,J1772,
ELEC,CARTA HAMILTON MALL,2120 Hamilton Pl Blvd,,Chattanooga,TN,37421,888-758-4389,E,Public,24 hours daily,,,2,0,35.035694,-85.15777,23/01/2023,77366,2023-01-23 23:04:57 UTC,06/08/2016,J1772,
ELEC,CARTA BETHLEHEM CNTR,200 West 38th Street,,Chattanooga,TN,37410,888-758-4389,E,Public,24 hours daily,,,2,0,35.005733,-85.311911,23/01/2023,77367,2023-01-23 23:04:56 UTC,06/08/2016,J1772,
ELEC,Dental TLC,290 Hilderbrand Dr,Located at the corner of Boylston and Mt Vernon in the Balconies parking lot,Sandy Springs,GA,30328,404-255-2273,E,Public,24 hours daily,,,2,0,33.9234603,-84.3798675,12/10/2021,77394,2022-02-10 19:42:29 UTC,25/07/2016,J1772,OFFICE_BLDG
ELEC,Appalachian State University - Legends Parking Lot,190 Hardin St,Between the Hardin St/Howard St intersection and the Hardin St/Locust St intersection,Boone,NC,28608,,T,TEMPORARILY UNAVAILABLE (Private),24 hours daily,,,4,0,36.214982,-81.675345,10/11/2022,77396,2022-11-10 16:40:31 UTC,01/07/2015,J1772,COLLEGE_CAMPUS
ELEC,GEORGIA POWER KROGER COMM L2,720 Commerce Dr,,Decatur,GA,30030,888-758-4389,E,Public,24 hours daily,,,2,0,33.778262,-84.292625,23/01/2023,77433,2023-01-23 23:04:09 UTC,10/08/2016,J1772,
ELEC,Big South Fork National River and Recreation Area,4564 Leatherwood Rd,,Oneida,TN,37841,,E,Private,,,,1,0,36.470898,-84.651393,22/02/2021,77668,2021-03-11 23:22:17 UTC,15/08/2016,J1772,NATL_PARK
ELEC,GA. AQUARIUM SEA LION,225 Baker St NW,,Atlanta,GA,30313,888-758-4389,T,TEMPORARILY UNAVAILABLE (Public),24 hours daily,,,2,0,33.763493,-84.395365,12/01/2023,78219,2023-01-12 23:17:07 UTC,31/08/2016,J1772,
ELEC,University of Tennessee - 11th Street Parking Garage,1101 Cumberland Ave,Top level,Knoxville,TN,37916,865-974-6031,E,Public,24 hours daily; parking permit required,,,2,1,35.95953,-83.924911,12/10/2021,78292,2022-02-10 19:42:29 UTC,01/10/2015,CHADEMO J1772,COLLEGE_CAMPUS
ELEC,University of Tennessee - Staff Area 23,1350 Pat Head Summitt St,,Knoxville,TN,37916,865-974-6031,E,Public,24 hours daily; parking permit required,,,6,0,35.951858,-83.9316,12/10/2021,78293,2022-02-10 19:42:29 UTC,01/10/2015,J1772,COLLEGE_CAMPUS
ELEC,University of Tennessee - Agriculture Campus,2402 Chapman Dr,,Knoxville,TN,37916,865-974-6031,E,Public,24 hours daily; parking permit required,,,6,0,35.946202,-83.93878,12/10/2021,78294,2022-02-10 19:42:29 UTC,01/10/2015,J1772,COLLEGE_CAMPUS
ELEC,"CHARLOTTE, NC S TRYON ST 1",501 S Tryon St,,Charlotte,NC,28202,888-758-4389,T,TEMPORARILY UNAVAILABLE (Public),24 hours daily,,,1,0,35.224011,-80.847647,23/01/2023,78303,2023-01-23 23:05:40 UTC,07/09/2016,J1772,
ELEC,"CHARLOTTE, NC CATS I-485 4",9512 South Blvd,,Charlotte,NC,28273,888-758-4389,E,Public,24 hours daily,,,1,0,35.106994,-80.883287,23/01/2023,78305,2023-01-23 23:05:43 UTC,07/09/2016,J1772,
ELEC,CARTA AIRPORT LOT2 #3,1001 Airport Rd,,Chattanooga,TN,37421,888-758-4389,E,Public,24 hours daily,,,2,0,35.038042,-85.195795,23/01/2023,78354,2023-01-23 23:05:28 UTC,08/09/2016,J1772,
ELEC,"CHARLOTTE, NC CMPD LEC 1",601 E. Trade St.,,Charlotte,NC,28202,888-758-4389,E,Public,24 hours daily,,,2,0,35.223157,-80.836819,23/01/2023,78355,2023-01-23 23:05:23 UTC,08/09/2016,J1772,
ELEC,CARTA SAU 4,Hickman Drive,,Collegedale,TN,37363,888-758-4389,T,TEMPORARILY UNAVAILABLE (Public),24 hours daily,,,2,0,35.050309,-85.050405,23/01/2023,78399,2023-01-23 23:08:44 UTC,10/09/2016,J1772,
ELEC,GEORGIA POWER GPC CORP HQ2 L2,241 Ralph McGill Blvd NE,,Atlanta,GA,30308,888-758-4389,E,Public,24 hours daily,,,2,0,33.763981,-84.380076,12/01/2023,78489,2023-01-12 23:16:54 UTC,15/09/2016,J1772,
ELEC,GSU HOUSING EVS UNIV COMMONS 2,141 Piedmont Ave NE,,Atlanta,GA,30303,888-758-4389,T,TEMPORARILY UNAVAILABLE (Public),24 hours daily,,,1,0,33.757551,-84.381217,23/01/2023,78599,2023-01-23 23:05:27 UTC,23/09/2016,J1772,
ELEC,GSU HOUSING EVS PIEDMONT NORTH,175 Piedmont Ave.,,Atlanta,GA,30303,888-758-4389,T,TEMPORARILY UNAVAILABLE (Public),24 hours daily,,,2,0,33.759038,-84.380579,23/01/2023,78606,2023-01-23 23:04:18 UTC,23/09/2016,J1772,
ELEC,GSU HOUSING EVS UNIV COMMONS 1,Piedmont Ave NE,,Atlanta,GA,30303,888-758-4389,T,TEMPORARILY UNAVAILABLE (Public),24 hours daily,,,2,0,33.757569,-84.381199,23/01/2023,78607,2023-01-23 23:04:18 UTC,23/09/2016,J1772,
ELEC,GEORGIA POWER CAPTAIN D'S DC,1910 Eatonton Rd,,Madison,GA,30650,888-758-4389,T,TEMPORARILY UNAVAILABLE (Public),24 hours daily,,,,1,33.561063,-83.476565,23/01/2023,78609,2023-01-23 23:03:54 UTC,23/09/2016,CHADEMO J1772COMBO,
ELEC,BERNCHARGE BERNHARDT EVSE,1839 Morganton Blvd SW,,Lenoir,NC,28645,888-758-4389,E,Public,24 hours daily,,,2,0,35.896887,-81.558321,23/01/2023,78873,2023-01-23 23:05:35 UTC,07/10/2016,J1772,
ELEC,GEORGIA POWER STAYBRIDGE DC,3420 Norman Berry Dr,,Hapeville,GA,30354,888-758-4389,E,Public,24 hours daily,,,,1,33.662898,-84.428118,12/01/2023,78878,2023-01-12 23:16:09 UTC,07/10/2016,CHADEMO J1772COMBO,
ELEC,SEVENSPRINGS 7SPRINGS_3,320 Seven Springs Way,,Brentwood,TN,37027,888-758-4389,E,Public,24 hours daily,,,2,0,36.041618,-86.770424,23/01/2023,78943,2023-01-23 23:05:23 UTC,12/10/2016,J1772,
ELEC,GEORGIA POWER CLAYTON L2,19 Duncan St,,Clayton,GA,30525,888-758-4389,E,Public,24 hours daily,,,2,0,34.87995,-83.401835,23/01/2023,78973,2023-01-23 23:04:10 UTC,13/10/2016,J1772,
ELEC,DELTA AIR LINES GO CHARGER 13,Hartsfield Dr SW,,Atlanta,GA,30354,888-758-4389,E,Public,24 hours daily,,,2,0,33.653832,-84.423689,12/01/2023,78998,2023-01-12 23:10:42 UTC,14/10/2016,J1772,
ELEC,GEORGIA POWER MOROSGO L2,2452 Morosgo Way NE,,Atlanta,GA,30324,888-758-4389,E,Public,24 hours daily,,,2,0,33.821482,-84.365231,23/01/2023,79237,2023-01-23 23:04:08 UTC,22/10/2016,J1772,
ELEC,BNA EXPRESS STATION 01,115 Knapp Blvd,,Nashville,TN,37217,888-758-4389,E,Public,24 hours daily,,,2,0,36.110741,-86.672007,23/01/2023,79332,2023-01-23 23:04:56 UTC,29/10/2016,J1772,
ELEC,GEORGIA POWER E ELLIJAY L2,696 1st Ave,,East Ellijay,GA,30539,888-758-4389,E,Public,24 hours daily,,,2,0,34.67794,-84.477315,23/01/2023,79364,2023-01-23 23:04:09 UTC,02/11/2016,J1772,
ELEC,AVL TECH PARK EV CHARGER 01,15 N Merrimon Ave,,Asheville,NC,28801,888-758-4389,E,Public,24 hours daily,,,2,0,35.639777,-82.575849,23/01/2023,79380,2023-01-23 23:05:42 UTC,03/11/2016,J1772,
ELEC,FFIS FFIS 1,5803 Abercorn St,,Savannah,GA,31405,888-758-4389,E,Public,24 hours daily,,,2,0,32.022136,-81.11114,23/01/2023,79402,2023-01-23 23:04:18 UTC,04/11/2016,J1772,
ELEC,GEORGIA POWER LAVISTA L2,3959 Lavista Rd,,Tucker,GA,30084,888-758-4389,E,Public,24 hours daily,,,2,0,33.844021,-84.256647,23/01/2023,79447,2023-01-23 23:04:09 UTC,08/11/2016,J1772,
ELEC,University of North Georgia - Dahlonega Campus,82 College Cir,,Dahlonega,GA,30597,404-736-9173,T,TEMPORARILY UNAVAILABLE (Public),24 hours daily,,,2,0,34.53018,-83.984692,11/10/2022,79453,2022-10-11 18:56:12 UTC,01/06/2015,J1772,COLLEGE_CAMPUS
ELEC,University of North Georgia - Gainesville Campus,3820 Mundy Mill Rd,,Oakwood,GA,30566,404-736-9173,T,TEMPORARILY UNAVAILABLE (Public),24 hours daily,,,2,0,34.23783972,-83.86689129,11/10/2022,79454,2022-10-11 18:56:12 UTC,01/06/2015,J1772,COLLEGE_CAMPUS
ELEC,TAPESTRY EV 1,300 Centerview Dr,,Brentwood,TN,37027,888-758-4389,T,TEMPORARILY UNAVAILABLE (Public),24 hours daily,,,1,0,36.026078,-86.789115,23/01/2023,79958,2023-01-23 23:05:59 UTC,23/11/2016,J1772,
ELEC,DEVON FOUR25 DEVON FOUR25,425 N Boylan Ave,,Raleigh,NC,27603,888-758-4389,E,Public,24 hours daily,,,2,0,35.786358,-78.649851,23/01/2023,80023,2023-01-23 23:04:21 UTC,01/12/2016,J1772,
ELEC,HARRIS TEETER HT 003,4821 Berwick Town Center Dr,,Charlotte,NC,28278,888-758-4389,E,Public,24 hours daily,,,2,0,35.160957,-80.973479,23/01/2023,80109,2023-01-23 23:05:49 UTC,08/12/2016,J1772,
ELEC,DUKEPTS SDG 2,302 Science Drive Science Drive Garage,,Durham,NC,27708,888-758-4389,E,Public,24 hours daily,,,2,0,35.99613,-78.947421,23/01/2023,80187,2023-01-23 23:05:21 UTC,16/12/2016,J1772,
ELEC,DUKEPTS SDG VISITOR JB,Thomas Center Dr Science Drive Garage,,Durham,NC,27708,888-758-4389,E,Public,24 hours daily,,,2,0,35.996268,-78.947219,23/01/2023,80188,2023-01-23 23:04:58 UTC,16/12/2016,J1772,
ELEC,AT&T,333 Commerce St,,Nashville,TN,37201,,E,Private,AT&T fleet vehicle use only,,,1,0,36.162131,-86.777114,10/01/2023,80223,2023-01-10 16:44:47 UTC,01/06/2014,J1772,OFFICE_BLDG
ELEC,LANTOWER WAVERL SW EV2,11809 Providence Rd,,Charlotte,NC,28277,888-758-4389,E,Public,24 hours daily,,,2,0,35.050642,-80.766069,23/01/2023,80325,2023-01-23 23:04:57 UTC,21/12/2016,J1772,
ELEC,New Belgium Brewery,21 Craven St,"Two chargers located by the Tasting Room, four chargers located by the employee parking lot",Asheville,NC,28806,828-333-6900,E,Public,24 hours daily; employee chargers available to public after 5pm or by appointment,,,6,0,35.586702,-82.570643,04/11/2021,80421,2022-04-28 20:01:31 UTC,15/12/2016,J1772,BREWERY_DISTILLERY_WINERY
ELEC,CARTA ST ELMO #1,3001-3099 St Elmo Ave,,Chattanooga,TN,37408,888-758-4389,E,Public,24 hours daily,,,2,0,35.021658,-85.321318,23/01/2023,80496,2023-01-23 23:06:33 UTC,05/01/2017,J1772,
ELEC,CARTA 548 VINE ST #2,548 Vine St,,Chattanooga,TN,37403,888-758-4389,E,Public,24 hours daily,,,2,0,35.048058,-85.300749,23/01/2023,80499,2023-01-23 23:06:16 UTC,05/01/2017,J1772,
ELEC,CARTA MLK,527 E M L King Blvd,,Chattanooga,TN,37403,888-758-4389,E,Public,24 hours daily,,,2,0,35.043428,-85.301786,23/01/2023,80500,2023-01-23 23:06:06 UTC,05/01/2017,J1772,
ELEC,CARTA W11TH ST @BROAD,1-99 W 11th St,,Chattanooga,TN,37402,888-758-4389,E,Public,24 hours daily,,,2,0,35.04403,-85.310026,23/01/2023,80504,2023-01-23 23:06:33 UTC,05/01/2017,J1772,
ELEC,Mike Murphy Kia,6150 Altama Ave,,Brunswick,GA,31525,912-342-4190,E,Public - Call ahead,Dealership business hours,,,2,0,31.224991,-81.47703,10/01/2023,80760,2023-01-10 16:44:47 UTC,30/08/2019,J1772,CAR_DEALER
ELEC,Mall of Georgia Ford,4525 Nelson Brogdon Blvd,,Buford,GA,30518,,E,Private,For service center use only; very limited public use,,,1,0,34.099866,-84.016663,10/01/2023,80762,2023-01-10 16:44:47 UTC,01/11/2016,J1772,CAR_DEALER
ELEC,Kritters Country Club,7377 W Strickland St,,Douglasville,GA,30134,770-489-7500,E,Public,24 hours daily,,,1,0,33.74498,-84.768817,10/08/2022,80764,2022-08-10 13:32:10 UTC,01/06/2015,J1772,STANDALONE_STATION
ELEC,Elbert County Government Complex,45 Forest Ave,,Elberton,GA,30635,706-283-2000,E,Public,24 hours daily,,,1,0,34.111009,-82.870808,10/08/2022,80765,2022-08-10 13:32:10 UTC,01/10/2015,J1772,MUNI_GOV
ELEC,Dyer Kia,4580 Washington Rd,,Evans,GA,30809,877-751-4001,E,Public - Call ahead,Dealership business hours,,,2,0,33.549342,-82.153002,04/08/2021,80766,2022-02-10 19:42:29 UTC,01/11/2016,J1772,CAR_DEALER
ELEC,Kennesaw State University - East Parking Deck,1000 Chastain Rd,,Kennesaw,GA,30144,,E,Private,For student and staff use only,,,1,0,34.032637,-84.580372,10/08/2022,80771,2022-08-10 13:32:10 UTC,01/11/2016,J1772,COLLEGE_CAMPUS
ELEC,John Thornton Chevrolet,1971 Thornton Rd,,Lithia Springs,GA,30122,770-941-8550,E,Public - Call ahead,Dealership business hours; for Chevrolet vehicle use only,,,1,0,33.784,-84.610397,14/01/2021,80772,2023-01-04 20:22:20 UTC,01/11/2016,J1772,CAR_DEALER
ELEC,Lithia Springs Ford,870 Thornton Rd,Located on the left hand side of the building,Lithia Springs,GA,30122,770-941-9000,E,Public,Business hours; for Ford vehicles only,,,1,0,33.781867,-84.606639,04/08/2021,80773,2022-04-28 20:01:31 UTC,01/11/2016,J1772,CAR_DEALER
ELEC,O'Kelly Memorial Library,363 Conyers Rd,,Loganville,GA,30052,770-466-2895,E,Public,24 hours daily,,,1,0,33.838123,-83.903053,13/12/2022,80774,2022-12-13 14:36:26 UTC,15/12/2015,J1772,LIBRARY
ELEC,Navicent Health - Green Deck,777 Hemlock St,Located on first level,Macon,GA,31201,478-633-1000,E,Public,Garage business hours,,,2,0,32.833526,-83.636078,12/10/2021,80775,2022-02-10 19:42:29 UTC,01/11/2016,J1772,HOSPITAL
ELEC,McDonough Nissan,1775 Avalon Pkwy,,McDonough,GA,30253,888-532-3789,E,Public,24 hours daily,,,1,0,33.422762,-84.177682,09/06/2020,80779,2021-03-11 23:22:17 UTC,01/11/2016,J1772,CAR_DEALER
ELEC,Heritage Mitsubishi,7134 Jonesboro Rd,,Morrow,GA,30260,770-282-5019,E,Public - Call ahead,Dealership business hours; for customer use only,,,2,0,33.561906,-84.344267,12/10/2021,80780,2022-02-10 19:42:29 UTC,01/11/2016,J1772,CAR_DEALER
ELEC,SouthTowne Chevrolet,695 Bullsboro Dr,"One located in service, one located in sales",Newnan,GA,30265,770-913-6417,E,Public - Call ahead,Dealership business hours,,,2,0,33.39644,-84.755016,12/10/2021,80781,2022-02-10 19:42:29 UTC,01/11/2016,J1772,CAR_DEALER
ELEC,City of Norcross - City Hall,65 Lawrenceville St,,Norcross,GA,30071,770-448-2122,E,Public,24 hours daily,,,1,0,33.942436,-84.210831,04/08/2021,80782,2022-02-10 19:42:29 UTC,01/03/2015,J1772,MUNI_GOV
ELEC,Roswell Mitsubishi,11170 Alpharetta Hwy,,Roswell,GA,30076,888-962-5534,E,Public,24 hours daily,,,1,0,34.052142,-84.335161,10/01/2022,80784,2022-02-10 19:42:29 UTC,02/11/2016,J1772,CAR_DEALER
ELEC,Rick Hendrick Chevrolet,3277 Satellite Blvd NW,,Duluth,GA,30096,678-381-8941,E,Public - Call ahead,Dealership business hours; for customer use only,,,1,0,33.964498,-84.12267,04/08/2021,80791,2022-02-10 19:42:29 UTC,01/11/2016,J1772,CAR_DEALER
ELEC,Boehringer Ingelheim,3239 Satellite Blvd,,Duluth,GA,30096,,E,Private,,,,4,0,33.964724,-84.118944,10/01/2023,80794,2023-01-10 16:44:47 UTC,01/11/2016,J1772,OFFICE_BLDG
ELEC,Fairway Ford,4333 Washington Rd,,Evans,GA,30809,706-854-9200,E,Public - Call ahead,Dealership business hours,,,1,0,33.540097,-82.130384,04/08/2021,80795,2022-02-10 19:42:29 UTC,01/11/2016,J1772,CAR_DEALER
ELEC,City of Newnan - City Hall,25 LaGrange St,,Newnan,GA,30263,770-253-2682,E,Public,Employee use only 8am-5pm; Public use after 5pm,,,1,0,33.37307,-84.801024,04/08/2021,80797,2022-02-10 19:42:29 UTC,01/11/2016,J1772,MUNI_GOV
ELEC,The General Store at Serenbe,10642 Serenbe Ln,,Palmetto,GA,30268,770-463-2222,T,TEMPORARILY UNAVAILABLE (Public),24 hours daily,,,1,0,33.517197,-84.733838,04/08/2021,80798,2022-02-10 19:42:29 UTC,01/11/2016,J1772,SHOPPING_CENTER
ELEC,Columbus State University,4025 University Ave,Located in parking lot of Schuster Student Success Center,Columbus,GA,31907,706-507-8222,E,Public,24 hours daily; valid parking permit required,,,3,0,32.503115,-84.938555,10/08/2022,80800,2022-08-10 13:32:10 UTC,01/11/2016,J1772,COLLEGE_CAMPUS
ELEC,State Farm,5755 Lawrenceville Hwy,,Tucker,GA,30084,770-564-0994,E,Public - Card key at all times,24 hours daily; ask for office key at the front desk,,,2,0,33.877815,-84.168919,10/01/2023,80801,2023-01-10 16:44:47 UTC,01/11/2016,J1772,OFFICE_BLDG
ELEC,GEORGIA POWER GAINESVILLE L2,450 Jesse Jewell Pkwy,,Gainesville,GA,30501,888-758-4389,E,Public,24 hours daily,,,2,0,34.295923,-83.829389,23/01/2023,80860,2023-01-23 23:04:09 UTC,12/01/2017,J1772,
ELEC,GEORGIA POWER GLENWOOD DC,800 Glenwood Ave SE,,Atlanta,GA,30316,888-758-4389,E,Public,24 hours daily,,,,1,33.74186,-84.3595,12/01/2023,80931,2023-01-12 23:16:25 UTC,19/01/2017,CHADEMO J1772COMBO,
ELEC,Ingles Market,867 Brevard Rd,,Asheville,NC,28806,828-665-0787,E,Public,24 hours daily,,,4,0,35.530128,-82.606464,13/12/2022,81000,2022-12-13 14:36:26 UTC,01/01/2017,J1772,GROCERY
ELEC,Ingles Market,201 Barber Blvd,,Waynesville,NC,28786,828-456-7599,E,Public,6am to 12am daily,,,4,0,35.504331,-82.987681,13/12/2022,81001,2022-12-13 14:36:26 UTC,01/01/2017,J1772,GROCERY
ELEC,Publix #1475,34 Miller St,Located in the back right hand corner in parking garage,Winston-Salem,NC,27104,336-724-3707,E,Public,Store business hours; customer use only while shopping at Publix,,,1,0,36.094603,-80.275497,06/04/2022,81084,2022-04-28 20:01:31 UTC,11/05/2016,J1772,GROCERY
ELEC,Hartsfield-Jackson Atlanta International Airport - Domestic Terminal South Hourly,6000 N Terminal Pkwy,Located on the ground floor,Atlanta,GA,30320,404-530-7300,E,Public,24 hours daily,,10,,0,33.638488,-84.444031,13/12/2022,81089,2022-12-13 14:36:26 UTC,12/01/2017,J1772,AIRPORT
ELEC,Hartsfield-Jackson Atlanta International Airport - Domestic Terminal North Hourly,6000 N Terminal Pkwy,Located on the ground floor,Atlanta,GA,30320,404-530-7300,E,Public,24 hours daily,,,10,0,33.643088,-84.443467,13/12/2022,81090,2022-12-13 14:36:26 UTC,12/01/2017,J1772,AIRPORT
ELEC,Hartsfield-Jackson Atlanta International Airport - International Terminal Hourly,6000 N Terminal Pkwy,Located on the second floor,Atlanta,GA,30320,404-530-7300,E,Public,24 hours daily,,10,6,0,33.64137,-84.419237,13/12/2022,81091,2022-12-13 14:36:26 UTC,12/01/2017,J1772,AIRPORT
ELEC,Hartsfield-Jackson Atlanta International Airport - International Terminal Park and Ride,6000 N Terminal Pkwy,,Atlanta,GA,30320,404-530-7300,E,Public,24 hours daily,,28,,0,33.642508,-84.404983,13/12/2022,81092,2022-12-13 14:36:26 UTC,12/01/2017,J1772,AIRPORT
ELEC,Hartsfield-Jackson Atlanta International Airport - South Department of Aviation Employee Lot,6000 N Terminal Pkwy,,Atlanta,GA,30320,,E,Private,Employee use only,,,2,0,33.64182,-84.44262,13/12/2022,81093,2022-12-13 14:36:26 UTC,12/01/2017,J1772,AIRPORT
ELEC,Hartsfield-Jackson Atlanta International Airport - Technical Support Campus,6000 N Terminal Pkwy,,Atlanta,GA,30320,,E,Private,Employee use only,,2,2,0,33.624612,-84.427512,13/12/2022,81094,2022-12-13 14:36:26 UTC,12/01/2017,J1772,AIRPORT
ELEC,Hartsfield-Jackson Atlanta International Airport - Airport Maintenance,6000 N Terminal Pkwy,Located at Building 1,Atlanta,GA,30320,,E,Private,Employee use only,,2,2,0,33.625719,-84.431299,13/12/2022,81095,2022-12-13 14:36:26 UTC,12/01/2017,J1772,AIRPORT
ELEC,PEACHTREE EV 2500 PTREE EV,2500 Peachtree Road Northwest,,Atlanta,GA,30305,888-758-4389,E,Public,24 hours daily,,,2,0,33.82329,-84.388172,23/01/2023,81671,2023-01-23 23:06:27 UTC,07/03/2017,J1772,
ELEC,THREE ALLIANCE 3 ALLIANCE EV1,Alliance Center Dr NE,,Atlanta,GA,30326,888-758-4389,E,Public,24 hours daily,,,2,0,33.851471,-84.366375,23/01/2023,81676,2023-01-23 23:05:37 UTC,08/03/2017,J1772,
ELEC,THREE ALLIANCE 3 ALLIANCE EV4,3500 Lenox Rd NE,,Atlanta,GA,30326,888-758-4389,E,Public,24 hours daily,,,2,0,33.852015,-84.366524,23/01/2023,81677,2023-01-23 23:05:21 UTC,08/03/2017,J1772,
ELEC,CITY OF WILSON AMTRAK,113 Lodge St E,,Wilson,NC,27893,888-758-4389,T,TEMPORARILY UNAVAILABLE (Public),24 hours daily,,,1,0,35.723772,-77.907757,23/01/2023,81755,2023-01-23 23:06:06 UTC,16/03/2017,J1772,
ELEC,CITY OF WILSON POLICE LOT,212 Green St E,,Wilson,NC,27893,888-758-4389,E,Public,24 hours daily,,,1,0,35.724962,-77.908933,23/01/2023,81756,2023-01-23 23:06:06 UTC,16/03/2017,J1772,
ELEC,DUKEPTS RDG1,304 Research Dr,,Durham,NC,27710,888-758-4389,E,Public,24 hours daily,,,2,0,36.00702,-78.941262,23/01/2023,81839,2023-01-23 23:05:48 UTC,22/03/2017,J1772,
ELEC,INTOWN SUITES CONCORD,7870 Commons Park Cir NW,,Concord,NC,28027,888-758-4389,T,TEMPORARILY UNAVAILABLE (Public),24 hours daily,,,2,0,35.371974,-80.709108,23/01/2023,82104,2023-01-23 23:06:28 UTC,29/03/2017,J1772,
ELEC,GO BRAVES EAST EV LEVEL 1,75 Circle Pkwy,,Atlanta,GA,30339,888-758-4389,T,TEMPORARILY UNAVAILABLE (Public),24 hours daily,,,2,0,33.891366,-84.466019,23/01/2023,82106,2023-01-23 23:06:22 UTC,29/03/2017,J1772,
ELEC,GEORGIA POWER SUNTRUST L2 8,655 Battery Ave SE Delta Deck Surface Lot,,Atlanta,GA,30339,888-758-4389,E,Public,24 hours daily,,,2,0,33.892135,-84.466187,23/01/2023,82154,2023-01-23 23:06:32 UTC,01/04/2017,J1772,
ELEC,GASTONIA 1555 E GARRISON,1555 E Garrison Blvd,,Gastonia,NC,28054,888-758-4389,E,Public,24 hours daily,,,2,0,35.252107,-81.157763,23/01/2023,82191,2023-01-23 23:06:27 UTC,05/04/2017,J1772,
ELEC,Maggie Valley - Town Hall,3987 Soco Rd,,Maggie Valley,NC,28751,828-926-0866,E,Public,24 hours daily,,,2,0,35.517156,-83.09442,13/12/2022,82222,2022-12-13 14:36:26 UTC,01/04/2017,J1772,MUNI_GOV
ELEC,CHARGER 1 LVR LIFE LVR 2,1270 Lifes Way,,Marietta,GA,30062,888-758-4389,E,Public,24 hours daily,,,2,0,33.934997,-84.515678,23/01/2023,82239,2023-01-23 23:06:37 UTC,08/04/2017,J1772,
ELEC,ATLANTA FALCONS ATL UNITED EV1,861 Franklin Gateway SE,,Marietta,GA,30067,888-758-4389,E,Public,24 hours daily,,,2,0,33.934376,-84.498496,23/01/2023,82270,2023-01-23 23:06:22 UTC,12/04/2017,J1772,
ELEC,MARIETTA ROOT ST,Dobbs Street Northwest,,Marietta,GA,30060,888-758-4389,E,Public,24 hours daily,,,2,0,33.95454,-84.552158,23/01/2023,82372,2023-01-23 23:06:35 UTC,22/04/2017,J1772,
ELEC,AVALON CHARGE 7000 WEST,5185 1st St,,Alpharetta,GA,30009,888-758-4389,T,TEMPORARILY UNAVAILABLE (Public),24 hours daily,,,2,0,34.071339,-84.274664,23/01/2023,82444,2023-01-23 23:06:35 UTC,28/04/2017,J1772,
ELEC,GEORGIA POWER GPC METTER L2,1118  S Lewis St,,Metter,GA,30439,888-758-4389,E,Public,24 hours daily,,,2,0,32.378924,-82.062491,23/01/2023,82485,2023-01-23 23:04:10 UTC,02/05/2017,J1772,
ELEC,WESTOVER WESTOVER EV1,34-38 Middle Plantation Rd NW,,Atlanta,GA,30318,888-758-4389,E,Public,24 hours daily,,,2,0,33.822875,-84.44123,23/01/2023,82489,2023-01-23 23:06:09 UTC,03/05/2017,J1772,
ELEC,WESTOVER WESTOVER EV2,2475 Westover Plantation Rd NW,,Atlanta,GA,30318,888-758-4389,E,Public,24 hours daily,,,2,0,33.822996,-84.437821,23/01/2023,82490,2023-01-23 23:06:08 UTC,03/05/2017,J1772,
ELEC,SANFORDEVHORNER 151 S HORNER 01,151 S Horner Blvd,,Sanford,NC,27330,888-758-4389,E,Public,24 hours daily,,,2,0,35.479392,-79.179842,23/01/2023,82513,2023-01-23 23:06:38 UTC,06/05/2017,J1772,
ELEC,COBB COUNTY 100 CHEROKEE 02,100 Cherokee St NE,,Marietta,GA,30060,888-758-4389,E,Public,24 hours daily,,,2,0,33.954226,-84.548401,23/01/2023,82534,2023-01-23 23:04:19 UTC,10/05/2017,J1772,
ELEC,COBB COUNTY 191 LAWRENCE 02,191 Lawrence St NE,,Marietta,GA,30060,888-758-4389,E,Public,24 hours daily,,,2,0,33.953554,-84.547441,23/01/2023,82535,2023-01-23 23:04:19 UTC,10/05/2017,J1772,
ELEC,SEC EVC COLISEUM 1,1921 W Gate City Blvd,,Greensboro,NC,27403,888-758-4389,T,TEMPORARILY UNAVAILABLE (Public),24 hours daily,,,2,0,36.05778,-79.826559,23/01/2023,82568,2023-01-23 23:06:34 UTC,12/05/2017,J1772,
ELEC,TRACE TRACE 3 PG LVL2,782 Peachtree St NW,,Atlanta,GA,30308,888-758-4389,E,Public,24 hours daily,,,1,0,33.775451,-84.387328,23/01/2023,82586,2023-01-23 23:05:49 UTC,13/05/2017,J1772,
ELEC,PIEDMONT EMC PEMC,2500 NC-86 PEMC Visitor Lot,,Hillsborough,NC,27278,888-758-4389,E,Public,24 hours daily,,,2,0,36.045546,-79.080706,23/01/2023,82601,2023-01-23 23:06:38 UTC,16/05/2017,J1772,
ELEC,MUNICIPAL LOT GRANITE FALLS,17 State Rd 1107,,Granite Falls,NC,28630,888-758-4389,E,Public,24 hours daily,,,2,0,35.797815,-81.430339,23/01/2023,82603,2023-01-23 23:06:32 UTC,16/05/2017,J1772,
ELEC,715 715 STATION 2,715 peachtree street,,Atlanta,GA,30308,888-758-4389,T,TEMPORARILY UNAVAILABLE (Public),24 hours daily,,,2,0,33.775993,-84.387614,23/01/2023,82628,2023-01-23 23:06:50 UTC,17/05/2017,J1772,
ELEC,VENUE BROOKWOOD VENUE EV1,2140 Peachtree Rd NW,,Atlanta,GA,30309,888-758-4389,E,Public,24 hours daily,,,2,0,33.813539,-84.393912,23/01/2023,82695,2023-01-23 23:06:41 UTC,24/05/2017,J1772,
ELEC,NORTHSIDE EV NORTHSIDE EV2,450 Northside Cherokee Blvd,,Canton,GA,30114,888-758-4389,E,Public,24 hours daily,,,2,0,34.230074,-84.466138,23/01/2023,82759,2023-01-23 23:06:45 UTC,27/05/2017,J1772,
ELEC,NORTHSIDE EV NORTHSIDE EV4,460 Northside Cherokee Blvd.,,Canton,GA,30115,888-758-4389,E,Public,24 hours daily,,,2,0,34.228041,-84.464699,23/01/2023,82781,2023-01-23 23:06:52 UTC,31/05/2017,J1772,
ELEC,INTOWN SUITES SMYRNA,10700-10798 Cedar Grove Rd,,Smyrna,TN,37167,888-758-4389,E,Public,24 hours daily,,,2,0,35.97745,-86.560795,23/01/2023,85392,2023-01-23 23:06:28 UTC,02/06/2017,J1772,
ELEC,NORTHWINDS NORTHWINDS 7,2550 Northwinds Pkwy,,Alpharetta,GA,30004,888-758-4389,E,Public,24 hours daily,,,2,0,34.059834,-84.282836,23/01/2023,85461,2023-01-23 23:07:00 UTC,07/06/2017,J1772,
ELEC,PONCE CITY MKT GARAGE LEVEL 4A,675 Ponce De Leon Ave NE,,Atlanta,GA,30308,888-758-4389,E,Public,24 hours daily,,,2,0,33.772522,-84.365925,23/01/2023,85622,2023-01-23 23:04:06 UTC,21/06/2017,J1772,
ELEC,SAS Institute Inc - 940,940 NW Cary Pkwy,,Cary,NC,27513,,T,TEMPORARILY UNAVAILABLE (Private),Employee and guest use only,,,2,0,35.820148,-78.798696,10/01/2023,85655,2023-01-10 16:44:47 UTC,01/07/2017,J1772,OFFICE_BLDG
ELEC,Hot Springs Resort & Spa - Campground,247 Bridge St,,Hot Springs,NC,28743,828-622-7676,E,Public,24 hours daily,,,2,0,35.893472,-82.824906,13/12/2022,85685,2022-12-13 14:36:26 UTC,01/06/2017,J1772,CAMPGROUND
ELEC,GASTON COUNTY PUBLIC HLTH DIV,500-598 Henderson St Public Health Division,,Gastonia,NC,28052,888-758-4389,T,TEMPORARILY UNAVAILABLE (Public),24 hours daily,,,2,0,35.234026,-81.204497,23/01/2023,85767,2023-01-23 23:07:58 UTC,30/06/2017,J1772,
ELEC,PIEDMONT TRIAD COBLE TRANS CTR,8310 W. Market Street,,Greensboro,NC,27409,888-758-4389,E,Public,24 hours daily,,,2,0,36.093768,-79.95943,23/01/2023,85770,2023-01-23 23:07:00 UTC,30/06/2017,J1772,
ELEC,WEST JEFFERSON WEST JEFFERSON,414 School Ave,,West Jefferson,NC,28694,888-758-4389,E,Public,24 hours daily,,,2,0,36.402542,-81.489421,23/01/2023,85773,2023-01-23 23:06:27 UTC,30/06/2017,J1772,
ELEC,Western Carolina University,320 Memorial Dr,,Cullowhee,NC,28723,828-227-7442,E,Public,24 hours daily; pay lot from 7am-11pm daily,A Cash D Debit M V,,2,0,35.311874,-83.183414,10/01/2023,85786,2023-01-10 16:44:47 UTC,28/06/2017,J1772,COLLEGE_CAMPUS
ELEC,ELM-MARSHALL ST GRAHAM,200-206 E Elm St,,Graham,NC,27253,888-758-4389,E,Public,24 hours daily,,,2,0,36.069424,-79.398463,23/01/2023,85790,2023-01-23 23:07:05 UTC,01/07/2017,J1772,
ELEC,CARTA MAI BELL APT,601-699 S Hawthorne St,,Chattanooga,TN,37404,888-758-4389,T,TEMPORARILY UNAVAILABLE (Public),24 hours daily,,,2,0,35.033667,-85.277644,23/01/2023,85877,2023-01-23 23:05:02 UTC,12/07/2017,J1772,
ELEC,SALESFORCE TOWE STATION 2,950 East Paces Ferry Rd.,,Atlanta,GA,30326,888-758-4389,E,Public,24 hours daily,,,2,0,33.847675,-84.357445,23/01/2023,85905,2023-01-23 23:06:52 UTC,14/07/2017,J1772,
ELEC,DELTA AIR LINES CAMP CREEK 5,3939 North West Drive,,College Park,GA,30337,888-758-4389,T,TEMPORARILY UNAVAILABLE (Public),24 hours daily,,,2,0,33.645968,-84.461371,23/01/2023,85933,2023-01-23 23:06:02 UTC,18/07/2017,J1772,
ELEC,RIVERWOOD 200 STATION 5,3300 Riverwood Parkway,,Atlanta,GA,30339,888-758-4389,T,TEMPORARILY UNAVAILABLE (Public),24 hours daily,,,2,0,33.876905,-84.45924,23/01/2023,85941,2023-01-23 23:06:07 UTC,19/07/2017,J1772,
ELEC,Ingles Market,625 Spartanburg Hwy,,Hendersonville,NC,28739,828-692-1368,E,Public,6am-11pm daily,,,2,0,35.306469,-82.456078,13/12/2022,85948,2022-12-13 14:36:26 UTC,01/07/2017,J1772,GROCERY
ELEC,Holiday Inn Express,107 Upward Crossing Dr,1-26 & Exit 53,Flat Rock,NC,28731,828-698-8899,E,Public,24 hours daily; free for guests,,,1,0,35.29856,-82.409937,10/01/2023,85954,2023-01-10 16:44:47 UTC,04/05/2017,J1772,HOTEL
ELEC,Mountain View Nissan,1706 E Walnut Ave,,Dalton,GA,30721,706-459-3600,E,Public - Call ahead,Dealership business hours,,,2,0,34.761066,-84.93958,09/06/2020,85959,2021-03-11 23:22:17 UTC,01/03/2017,J1772,CAR_DEALER
ELEC,Monroe Nissan,5510 W Highway 74,,Indian Trail,NC,28110,704-288-3654,E,Public - Call ahead,Dealership business hours,,,1,0,35.060577,-80.631499,09/06/2020,85968,2021-03-11 23:22:17 UTC,01/03/2017,J1772,CAR_DEALER
ELEC,SPECTRUM BLDG B2 1,300 S Tryon St,,Charlotte,NC,28202,888-758-4389,E,Public,24 hours daily,,,2,0,35.225662,-80.845776,23/01/2023,85987,2023-01-23 23:06:14 UTC,20/07/2017,J1772,
ELEC,Albemarle Corp,4350 Congress St,,Charlotte,NC,28209,,E,Public,24 hours daily,,,10,0,35.154231,-80.837508,13/12/2022,86027,2022-12-13 14:36:26 UTC,01/07/2016,J1772,OFFICE_BLDG
ELEC,Duke Energy,526 S Church St,,Charlotte,NC,28202,,E,Private,Employee and fleet use only,,,4,0,35.225061,-80.849351,10/01/2023,86063,2023-01-10 16:44:47 UTC,06/01/2020,J1772,UTILITY
ELEC,Duke Energy,1040 Beason Creek Rd,,Kings Mountain,NC,28086,,E,Private,Employee use only,,,4,0,35.236976,-81.414012,10/01/2023,86064,2023-01-10 16:44:47 UTC,31/08/2020,J1772,UTILITY
ELEC,Duke Energy,4412 Hillsborough Rd,,Durham,NC,27705,,E,Private,Employee and fleet vehicle use only; Drivers must bring their own J1772 cordset for Level 1 charging,,1,4,0,36.035299,-78.973331,10/01/2023,86066,2023-01-10 16:44:47 UTC,15/01/2014,J1772 NEMA515,UTILITY
ELEC,Duke Energy,250 9th St Ln SE,,Hickory,NC,28602,,E,Private,Employee and fleet vehicle use only,,,2,0,35.73312,-81.319387,10/01/2023,86067,2023-01-10 16:44:47 UTC,31/08/2020,J1772,UTILITY
ELEC,Duke Energy,410 S Mint St,,Charlotte,NC,28202,,E,Private,Employee and fleet vehicle use only,,,21,0,35.227182,-80.850301,10/01/2023,86068,2023-01-10 16:44:47 UTC,02/01/2019,J1772,UTILITY
ELEC,Duke Energy,610 Toddville Rd,,Charlotte,NC,28214,,E,Private,Employee and fleet vehicle use only,,,10,0,35.276037,-80.915771,10/01/2023,86079,2023-01-10 16:44:47 UTC,31/08/2020,J1772,UTILITY
ELEC,Duke Energy,431 S Salisbury St,,Raleigh,NC,27601,,E,Private,Fleet vehicles only,,,2,0,35.774724,-78.640402,10/01/2023,86120,2023-01-10 16:44:47 UTC,20/09/2011,J1772,UTILITY
ELEC,Duke Energy,602 Raleigh Rd,,Henderson,NC,27536,,E,Private,Employee and fleet vehicle use only,,,2,0,36.309215,-78.409358,10/01/2023,86121,2023-01-10 16:44:47 UTC,28/10/2011,J1772,UTILITY
ELEC,Duke Energy,2637 Gum Branch Rd,,Jacksonville,NC,28540,,E,Private,Fleet vehicles only,,,1,0,34.803916,-77.4468,10/01/2023,86122,2023-01-10 16:44:47 UTC,17/11/2011,J1772,UTILITY
ELEC,Duke Energy,1020 W Chatham St,,Cary,NC,27511,,E,Private,Employee use only,,,3,0,35.773958,-78.803281,10/01/2023,86123,2023-01-10 16:44:47 UTC,03/11/2011,J1772,UTILITY
ELEC,Duke Energy,1422 Mechanical Blvd,,Garner,NC,27529,,E,Private,Employee and fleet vehicle use only,,,2,0,35.71922,-78.629588,10/01/2023,86124,2023-01-10 16:44:47 UTC,29/09/2011,J1772,UTILITY
ELEC,Duke Energy,160 Rush St,,Raleigh,NC,27603,,E,Private,Employee use only,,,2,0,35.7417,-78.642369,10/01/2023,86125,2023-01-10 16:44:47 UTC,06/12/2012,J1772,UTILITY
ELEC,Duke Energy,4690 Simms Creek Rd,,Raleigh,NC,27616,,E,Private,Employee use only,,,2,0,35.884757,-78.564544,10/01/2023,86126,2023-01-10 16:44:47 UTC,16/11/2011,J1772,UTILITY
ELEC,Duke Energy,25 Burlington Rd,,Roxboro,NC,27573,,E,Private,Fleet vehicles only,,,1,0,36.390045,-79.000328,10/01/2023,86127,2023-01-10 16:44:47 UTC,25/10/2011,J1772,UTILITY
ELEC,Duke Energy,555 Brevard Rd,,Asheville,NC,28806,,E,Private,Employee and fleet vehicle use only,,,2,0,35.511376,-82.600756,10/01/2023,86129,2023-01-10 16:44:47 UTC,20/10/2011,J1772,UTILITY
ELEC,Duke Energy,700 E Ritchie Rd,,Salisbury,NC,28146,,E,Private,Fleet vehicles only,,,6,0,35.624893,-80.492531,10/01/2023,86156,2023-01-10 16:44:47 UTC,31/07/2017,J1772,UTILITY
ELEC,Duke Energy,410 S Wilmington St,,Raleigh,NC,27601,,E,Private,Employee use only,,,2,0,35.774838,-78.63743,10/01/2023,86166,2023-01-10 16:44:47 UTC,23/12/2014,J1772,UTILITY
ELEC,Duke Energy,1451 Military Cutoff Rd,,Wilmington,NC,28403,,E,Private,Employee and fleet vehicle use only,,,2,0,34.224815,-77.829645,10/01/2023,86174,2023-01-10 16:44:47 UTC,31/08/2020,J1772,UTILITY
ELEC,City of Hendersonville - Azalea Parking Lot,301 N King St,N King & 3rd Ave E,Hendersonville,NC,28792,828-697-3000,E,Public,24 hours daily; pay lot,,,1,0,35.316047,-82.458795,10/01/2023,86263,2023-01-10 16:44:47 UTC,01/10/2017,J1772,PAY_LOT
ELEC,Fairfield Inn & Suites,1494 E Oglethorpe Hwy,,Hinesville,GA,31313,912-876-2003,E,Public,24 hours daily,A Cash D M V,,2,0,31.857062,-81.570245,10/08/2022,86865,2022-08-10 13:32:10 UTC,29/08/2017,J1772,HOTEL
ELEC,A&ET CAPE FEAR CC,4500 Blue Clay Rd Behind NB Building,,Castle Hayne,NC,28429,888-758-4389,E,Public,24 hours daily,,,2,0,34.324938,-77.879843,23/01/2023,86919,2023-01-23 23:06:24 UTC,26/08/2017,J1772,
ELEC,STARWORKS STARWORKS,100 Russell Dr,,Star,NC,27356,888-758-4389,E,Public,24 hours daily,,,2,0,35.406401,-79.785713,23/01/2023,86942,2023-01-23 23:07:34 UTC,29/08/2017,J1772,
ELEC,TOC EV STATIONS TOWNHALL,301 W Main St,,Carrboro,NC,27510,888-758-4389,E,Public,24 hours daily,,,2,0,35.91116,-79.077496,23/01/2023,86956,2023-01-23 23:07:51 UTC,30/08/2017,J1772,
ELEC,FLAT ROCK NC VILLAGE OFFICE,110 Village Center Dr,,Flat Rock,NC,28731,888-758-4389,E,Public,24 hours daily,,,2,0,35.272712,-82.441517,23/01/2023,86959,2023-01-23 23:07:34 UTC,30/08/2017,J1772,
ELEC,Blue Ridge Community College - Brevard Campus,45 Oak Park Dr,Lower parking lot,Brevard,NC,28712,828-694-1700,E,Public,24 hours daily,,,2,0,35.250058,-82.720567,10/11/2022,86965,2022-11-10 16:40:31 UTC,31/01/2018,J1772,COLLEGE_CAMPUS
ELEC,PIEDMONT TRIAD MEBANE SOUTH,3940 Arrowhead Blvd,,Mebane,NC,27302,888-758-4389,E,Public,24 hours daily,,,2,0,36.074761,-79.270004,23/01/2023,87572,2023-01-23 23:07:05 UTC,12/09/2017,J1772,
ELEC,DUKEPTS PG2 LEVEL 7,2300-2314 Erwin Rd,,Durham,NC,27705,888-758-4389,E,Public,24 hours daily,,,2,0,36.008327,-78.937789,23/01/2023,87609,2023-01-23 23:07:47 UTC,14/09/2017,J1772,
ELEC,TOWN OF CARY BOND PARK BH,801 High House Road Bond Park Boathouse,,Cary,NC,27513,888-758-4389,T,TEMPORARILY UNAVAILABLE (Public),24 hours daily,,,2,0,35.781304,-78.825552,23/01/2023,87656,2023-01-23 23:07:51 UTC,15/09/2017,J1772,
ELEC,BMW NASHVILLE STATION 5,1568 Mallory Ln,,Brentwood,TN,37027,888-758-4389,E,Public,24 hours daily,,,2,0,35.979926,-86.804875,23/01/2023,87676,2023-01-23 23:07:58 UTC,16/09/2017,J1772,
ELEC,Kennesaw State University - West Parking Deck,1000 Chastain Rd,,Kennesaw,GA,30144,,E,Private,For student and staff use only,,,1,0,34.035555,-84.585989,10/08/2022,87747,2022-08-10 13:32:10 UTC,01/08/2017,J1772,COLLEGE_CAMPUS
ELEC,Kennesaw State University - Central Parking Deck,1000 Chastain Rd,,Kennesaw,GA,30144,,E,Private,For student and staff use only,,,2,0,34.042012,-84.581724,10/08/2022,87748,2022-08-10 13:32:10 UTC,01/08/2017,J1772,COLLEGE_CAMPUS
ELEC,Kennesaw State University - North Parking Deck,1000 Chastain Rd,,Kennesaw,GA,30144,,E,Private,24 hours daily; for student and staff use only,,,1,0,34.043732,-84.584733,10/08/2022,87749,2022-08-10 13:32:10 UTC,01/08/2017,J1772,COLLEGE_CAMPUS
ELEC,PURITAN MILL PURITAN MILL EV,916 Joseph E Lowery Blvd NW,,Atlanta,GA,30318,888-758-4389,E,Public,24 hours daily,,,2,0,33.780224,-84.418301,23/01/2023,87767,2023-01-23 23:07:32 UTC,26/09/2017,J1772,
ELEC,City of Archdale - Creekside Park,214 Park Dr,Located within the tennis court parking lot off of Park Dr,Archdale,NC,27263,336-431-9141,E,Public,6am-11pm daily,,,1,0,35.893721,-79.935725,13/12/2022,87805,2022-12-13 14:36:26 UTC,27/09/2017,J1772,PARK
ELEC,City of Archdale - City Hall,307 Balfour Dr,Located on the eastern side of Archdale City Hall between the City Hall building and the Archdale Police Department.,Archdale,NC,27263,336-431-9141,E,Public,6am-11pm daily,,,1,0,35.89954,-79.961673,10/01/2023,87806,2023-01-10 16:44:47 UTC,27/09/2017,J1772,MUNI_GOV
ELEC,Town of Sylva - Bridge Park,76 Railroad Ave,Located in the parking lot adjacent to Railroad Ave and Bridge Park,Sylva,NC,28779,828-586-2719,E,Public,24 hours daily,,,4,0,35.374319,-83.224975,13/12/2022,87963,2022-12-13 14:36:26 UTC,01/10/2017,J1772,PARK
ELEC,DILLSBORO NC TOWN HALL PARK,Depot St Town Hall Park,,Dillsboro,NC,28275,888-758-4389,E,Public,24 hours daily,,,1,0,35.369982,-83.249138,23/01/2023,88015,2023-01-23 23:06:06 UTC,14/10/2017,J1772,
ELEC,HARRIS TEETER MORCROFT,3908 Colony Rd,,Charlotte,NC,28211,888-758-4389,E,Public,24 hours daily,,,2,0,35.153275,-80.825473,23/01/2023,88081,2023-01-23 23:08:15 UTC,20/10/2017,J1772,
ELEC,RSP GARAGE RSP EV1,6621-6665 S Park Dr,,Charlotte,NC,28211,888-758-4389,T,TEMPORARILY UNAVAILABLE (Public),24 hours daily,,,2,0,35.152842,-80.828638,23/01/2023,88291,2023-01-23 23:07:35 UTC,03/11/2017,J1772,
ELEC,N DRUID HILLS STATION 1,7 Executive Park Dr NE,,Atlanta,GA,30329,888-758-4389,E,Public,24 hours daily,,,2,0,33.829968,-84.338503,23/01/2023,88371,2023-01-23 23:07:49 UTC,08/11/2017,J1772,
ELEC,KINSTON WOODMEN,2602 W Vernon Ave,,Kinston,NC,28504,888-758-4389,E,Public,24 hours daily,,,1,0,35.267617,-77.619577,23/01/2023,88391,2023-01-23 23:08:28 UTC,10/11/2017,J1772,
ELEC,KINSTON GRAINGER STADIU,421 E Grainger Ave,,Kinston,NC,28501,888-758-4389,E,Public,24 hours daily,,,1,0,35.269397,-77.574478,23/01/2023,88393,2023-01-23 23:08:27 UTC,10/11/2017,J1772,
ELEC,KINSTON HERITAGE,101 N. Herritage St,,Kinston,NC,28501,888-758-4389,E,Public,24 hours daily,,,1,0,35.260523,-77.58274,23/01/2023,88430,2023-01-23 23:08:27 UTC,14/11/2017,J1772,
ELEC,ORIENTAL S1 ORIENTAL MARINA,303 South Ave,,Oriental,NC,28571,888-758-4389,E,Public,24 hours daily,,,1,0,35.02412,-76.695302,23/01/2023,88518,2023-01-23 23:06:54 UTC,18/11/2017,J1772,
ELEC,ORIENTAL S1 TOWN HALL,507 Church St,,Oriental,NC,28571,888-758-4389,T,TEMPORARILY UNAVAILABLE (Public),24 hours daily,,,1,0,35.028864,-76.694792,23/01/2023,88519,2023-01-23 23:06:44 UTC,18/11/2017,J1772,
ELEC,KINSTON LENOIR CC,231 North Carolina Hwy 58,,Kinston,NC,28504,888-758-4389,E,Public,24 hours daily,,,1,0,35.233117,-77.570911,23/01/2023,88592,2023-01-23 23:08:27 UTC,29/11/2017,J1772,
ELEC,Asheville Regional Airport - Hourly Parking Lot,61 Terminal Dr,Exit 40 off Interstate 26,Fletcher,NC,28732,828-684-2226,E,Public,24 hours daily; pay lot,,,2,0,35.434874,-82.537656,13/12/2022,88616,2022-12-13 14:36:26 UTC,23/11/2017,J1772,AIRPORT
ELEC,POINT ON SCOTT SCOTT EV2,2532-2552 N Decatur Rd,,Decatur,GA,30033,888-758-4389,T,TEMPORARILY UNAVAILABLE (Public),24 hours daily,,,2,0,33.793277,-84.288539,23/01/2023,88695,2023-01-23 23:06:08 UTC,05/12/2017,J1772,
ELEC,POINT ON SCOTT SCOTT EV1,2554-2566 N Decatur Rd,,Decatur,GA,30033,888-758-4389,E,Public,24 hours daily,,,2,0,33.793286,-84.288512,23/01/2023,88697,2023-01-23 23:05:56 UTC,05/12/2017,J1772,
ELEC,COH POLICE DEPT,172 Wyche St,,Henderson,NC,27536,888-758-4389,T,TEMPORARILY UNAVAILABLE (Public),24 hours daily,,,2,0,36.327352,-78.403989,23/01/2023,88714,2023-01-23 23:07:33 UTC,07/12/2017,J1772,
ELEC,COH OPS CTR,900 S Beckford Dr,,Henderson,NC,27536,888-758-4389,T,TEMPORARILY UNAVAILABLE (Public),24 hours daily,,,2,0,36.335487,-78.431279,23/01/2023,88715,2023-01-23 23:07:31 UTC,07/12/2017,J1772,
ELEC,SKYNET RANKIN PARKING,2-24 Rankin Ave,,Asheville,NC,28801,888-758-4389,E,Public,24 hours daily,,,2,0,35.595922,-82.553836,23/01/2023,88725,2023-01-23 23:08:22 UTC,08/12/2017,J1772,
ELEC,M3 CT4K 1,1715 N Brown Rd,,Lawrenceville,GA,30043,888-758-4389,E,Public,24 hours daily,,,2,0,33.995431,-84.074338,23/01/2023,89729,2023-01-23 23:08:08 UTC,19/12/2017,J1772,
ELEC,Greystone at Maple Ridge,7777 Schomburg Rd,Phase I,Columbus,GA,31909,706-221-7778,E,Public,24 hours daily,,,2,0,32.560205,-84.907262,11/10/2022,89766,2022-10-11 18:56:12 UTC,12/12/2017,J1772,PARKING_LOT
ELEC,CARTA 8007 VOLKSWAGEN,8007 Volkswagen Dr,,Chattanooga,TN,37421,888-758-4389,E,Public,24 hours daily,,,2,0,35.072113,-85.131349,23/01/2023,89771,2023-01-23 23:07:11 UTC,21/12/2017,J1772,
ELEC,CARTA 7380 TN 317,7380 TN-317,,Chattanooga,TN,37421,888-758-4389,E,Public,24 hours daily,,,2,0,35.070661,-85.133595,23/01/2023,89772,2023-01-23 23:07:11 UTC,21/12/2017,J1772,
ELEC,Ingles Market,1670 Brown Ave,,Waynesville,NC,28786,828-456-8776,E,Public,24 hours daily,,,2,0,35.470142,-83.004869,13/12/2022,91903,2022-12-13 14:36:26 UTC,01/01/2018,J1772,GROCERY
ELEC,Blue Ridge Community College - Patton Hall,43-65 W Campus Dr,,Flat Rock,NC,28731,828-694-1700,E,Public,24 hours daily,,,2,0,35.307808,-82.426922,10/11/2022,91905,2022-11-10 16:40:31 UTC,01/01/2018,J1772,COLLEGE_CAMPUS
ELEC,NCR HQ  MIDTOW NCR EV 13,864 Spring St NW,,Atlanta,GA,30309,888-758-4389,E,Public,24 hours daily,,,2,0,33.778604,-84.389433,12/01/2023,92375,2023-01-12 23:11:02 UTC,07/03/2018,J1772,
ELEC,PTREE MARKETPLC PCM STATION 2,6141 Peachtree Pkwy,,Norcross,GA,30092,888-758-4389,E,Public,24 hours daily,,,2,0,33.951573,-84.235219,23/01/2023,92389,2023-01-23 23:07:57 UTC,07/03/2018,J1772,
ELEC,WF EV STATIONS S WHITE EV,150 S White St,,Wake Forest,NC,27587,888-758-4389,E,Public,24 hours daily,,,1,0,35.978194,-78.510054,23/01/2023,92409,2023-01-23 23:07:37 UTC,07/03/2018,J1772,
ELEC,SHUTE PARKING MONROE 1,214 NC-207,,Monroe,NC,28112,888-758-4389,E,Public,24 hours daily,,,2,0,34.980492,-80.549375,23/01/2023,92411,2023-01-23 23:07:34 UTC,07/03/2018,J1772,
ELEC,NOVEL NODA EV CHARGER 01,424 E 36th St,,Charlotte,NC,28205,888-758-4389,E,Public,24 hours daily,,,2,0,35.248562,-80.806547,23/01/2023,92421,2023-01-23 23:07:19 UTC,07/03/2018,J1772,
ELEC,RCC COLLEGE SOUTH 2000 LOT,1531 Trinity Church Rd,,Concord,NC,28027,888-758-4389,E,Public,24 hours daily,,,2,0,35.437046,-80.659445,23/01/2023,92435,2023-01-23 23:06:55 UTC,07/03/2018,J1772,
ELEC,RCC COLLEGE NORTH 600 LOT,1333 Jake Alexander Blvd. S,,Salisbury,NC,28146,888-758-4389,E,Public,24 hours daily,,,2,0,35.639123,-80.483178,23/01/2023,92444,2023-01-23 23:06:42 UTC,07/03/2018,J1772,
ELEC,PEMBROKE CHARGE STATION CT4000,202 Main St,,Pembroke,NC,28372,888-758-4389,E,Public,24 hours daily,,,2,0,34.680435,-79.193414,23/01/2023,92445,2023-01-23 23:06:39 UTC,07/03/2018,J1772,
ELEC,ECU AUSTIN BUILDING,Dixon Dr,,Greenville,NC,27858,888-758-4389,E,Public,24 hours daily,,,2,0,35.605769,-77.362353,23/01/2023,92451,2023-01-23 23:06:28 UTC,07/03/2018,J1772,
ELEC,GASTONIA SOCIAL SERVICES,330 Dr M.L.K. Jr. Way,,Gastonia,NC,28052,888-758-4389,E,Public,24 hours daily,,,2,0,35.265924,-81.180696,23/01/2023,92452,2023-01-23 23:06:26 UTC,07/03/2018,J1772,
ELEC,University of North Carolina - Parking Deck,5-11 University Heights,Located in the lower level of Parking Deck P 12 adjacent to University Heights,Asheville,NC,28804,828-251-6691,E,Public,24 hours daily,,,2,0,35.6188,-82.566569,10/01/2023,94357,2023-01-10 16:44:47 UTC,01/03/2018,J1772,COLLEGE_CAMPUS
ELEC,Town of Lake Lure,2932 Memorial Hwy,Located in the Welcome Center parking lot,Lake Lure,NC,28746,828-625-9983,E,Public,24 hours daily; maximum session time of 2 hours,,,2,0,35.435111,-82.231733,10/11/2022,94358,2022-11-10 16:40:31 UTC,01/03/2018,J1772,MUNI_GOV
ELEC,BEMC CALABASH,1045 River Rd,,Calabash,NC,28467,888-758-4389,E,Public,24 hours daily,,,1,0,33.889609,-78.566864,23/01/2023,94377,2023-01-23 23:05:50 UTC,21/03/2018,J1772,
ELEC,HUNTCRESTII NORTHBROWNRD1,1745 N Brown Rd,,Lawrenceville,GA,30043,888-758-4389,E,Public,24 hours daily,,,2,0,33.992621,-84.078221,23/01/2023,95010,2023-01-23 23:09:26 UTC,17/04/2018,J1772,
ELEC,EPROPERTY FIRST FLOOR GW,9101-9199 Sessions St,,Charlotte,NC,28273,888-758-4389,E,Public,24 hours daily,,,2,0,35.137368,-80.929169,23/01/2023,95012,2023-01-23 23:09:19 UTC,17/04/2018,J1772,
ELEC,EPROPERTY FIRST FLOOR GW2,2401-2621 Silver Cres Dr,,Charlotte,NC,28273,888-758-4389,E,Public,24 hours daily,,,2,0,35.137204,-80.929129,23/01/2023,95013,2023-01-23 23:09:19 UTC,17/04/2018,J1772,
ELEC,Druid Pointe Parking Lot,2751 Buford Hwy,,Atlanta,GA,30324,888-998-2546,E,Public,MON: 24 hours | TUE: 24 hours | WED: 24 hours | THU: 24 hours | FRI: 24 hours | SAT: 24 hours | SUN: 24 hours,,,2,0,33.829001,-84.344342,23/01/2023,95104,2023-01-23 22:57:47 UTC,07/03/2018,J1772,
ELEC,Brookview Promenade,265 Brookview Centre Way,,Knoxville,TN,37919,888-998-2546,E,Public,MON: 24 hours | TUE: 24 hours | WED: 24 hours | THU: 24 hours | FRI: 24 hours | SAT: 24 hours | SUN: 24 hours,,,4,0,35.935669,-84.005456,23/01/2023,95183,2023-01-23 22:57:19 UTC,01/03/2012,J1772,
ELEC,Henderson Hutcherson and McCullough,1200 Market St,,Chattanooga,TN,37402,888-998-2546,E,Public,MON: 24 hours | TUE: 24 hours | WED: 24 hours | THU: 24 hours | FRI: 24 hours | SAT: 24 hours | SUN: 24 hours,,,1,0,35.0421861,-85.308904,23/01/2023,95190,2023-01-23 22:57:19 UTC,15/01/2012,J1772,
ELEC,Titanic Pigeon Forge,2134 Parkway,,Pigeon Forge,TN,37863,888-998-2546,E,Public,MON: 24 hours | TUE: 24 hours | WED: 24 hours | THU: 24 hours | FRI: 24 hours | SAT: 24 hours | SUN: 24 hours,,,2,0,35.821406,-83.578337,23/01/2023,95203,2023-01-23 22:57:19 UTC,15/01/2012,J1772,
ELEC,Loews Vanderbilt Hotel,2100 West End Avenue,Paid Parking Garage||,Nashville,TN,37203,888-998-2546,E,Public,MON: 24 hours | TUE: 24 hours | WED: 24 hours | THU: 24 hours | FRI: 24 hours | SAT: 24 hours | SUN: 24 hours,,,4,0,36.150544,-86.802403,23/01/2023,95221,2023-01-23 22:57:14 UTC,31/12/2011,J1772,
ELEC,City of Franklin - 2nd Ave,109 2nd Ave South,,Franklin,TN,37064,888-998-2546,E,Public,MON: 24 hours | TUE: 24 hours | WED: 24 hours | THU: 24 hours | FRI: 24 hours | SAT: 24 hours | SUN: 24 hours,,,1,0,35.9256575,-86.8674099,23/01/2023,95453,2023-01-23 22:57:25 UTC,01/03/2012,J1772,
ELEC,City of Franklin - 4th Ave,115 4th Avenue South,,Franklin,TN,37064,888-998-2546,E,Public,MON: 24 hours | TUE: 24 hours | WED: 24 hours | THU: 24 hours | FRI: 24 hours | SAT: 24 hours | SUN: 24 hours,,,2,0,35.9241797,-86.8699657,23/01/2023,95454,2023-01-23 22:57:25 UTC,01/03/2012,J1772,
ELEC,Midtown Cafe,102 19th Avenue S,,Nashville,TN,37203,888-998-2546,E,Public,MON: 24 hours | TUE: 24 hours | WED: 24 hours | THU: 24 hours | FRI: 24 hours | SAT: 24 hours | SUN: 24 hours,,,1,0,36.151923,-86.79686,23/01/2023,95484,2023-01-23 22:57:34 UTC,22/02/2014,J1772,
ELEC,Integra Hills Preserve,9100 Integra Preserve Court,,Ooltewah,TN,37363,888-998-2546,E,Public,MON: 24 hours | TUE: 24 hours | WED: 24 hours | THU: 24 hours | FRI: 24 hours | SAT: 24 hours | SUN: 24 hours,,,2,0,35.0663,-85.0745,23/01/2023,95497,2023-01-23 22:57:38 UTC,08/03/2016,J1772,
ELEC,Emory Johns Creek Hospital,6325 Hospital Pkwy,,Johns Creek,GA,30097,888-998-2546,E,Public,MON: 24 hours | TUE: 24 hours | WED: 24 hours | THU: 24 hours | FRI: 24 hours | SAT: 24 hours | SUN: 24 hours,,,6,0,34.067523,-84.175344,23/01/2023,95619,2023-01-23 22:57:32 UTC,15/08/2013,J1772,
ELEC,Commodore Hotel Linden,114 E. Main Street,,Linden,TN,37096,888-998-2546,E,Public,MON: 24 hours | TUE: 24 hours | WED: 24 hours | THU: 24 hours | FRI: 24 hours | SAT: 24 hours | SUN: 24 hours,,,2,0,35.616609,-87.838277,23/01/2023,95649,2023-01-23 22:57:16 UTC,01/03/2012,J1772,
ELEC,Pellissippi State (Magnolia Ave),1610 E Magnolia Ave,,Knoxville,TN,37917,888-998-2546,E,Public,MON: 24 hours | TUE: 24 hours | WED: 24 hours | THU: 24 hours | FRI: 24 hours | SAT: 24 hours | SUN: 24 hours,,,2,0,35.977993,-83.907603,23/01/2023,95772,2023-01-23 22:57:15 UTC,01/09/2011,J1772,
ELEC,Pellissippi State,10915 Hardin Valley Road,,Knoxville,TN,37932,888-998-2546,E,Public,MON: 24 hours | TUE: 24 hours | WED: 24 hours | THU: 24 hours | FRI: 24 hours | SAT: 24 hours | SUN: 24 hours,,,3,0,35.94657,-84.164617,23/01/2023,95978,2023-01-23 22:57:32 UTC,10/08/2011,J1772,
ELEC,Pellissippi State (Blount County Campus),2731 W. Lamar Alexander Hwy,Charger #147 under repair.||,Friendsville,TN,37737,888-998-2546,E,Public,MON: 24 hours | TUE: 24 hours | WED: 24 hours | THU: 24 hours | FRI: 24 hours | SAT: 24 hours | SUN: 24 hours,,,2,0,35.755076,-84.072247,23/01/2023,96093,2023-01-23 22:57:17 UTC,31/05/2012,J1772,
ELEC,Fairfield Inn & Suites Kodak,3620 Outdoor Sportsman Place,,Kodak,TN,37764,888-998-2546,E,Public,MON: 24 hours | TUE: 24 hours | WED: 24 hours | THU: 24 hours | FRI: 24 hours | SAT: 24 hours | SUN: 24 hours,,,1,0,35.985804,-83.610977,23/01/2023,96156,2023-01-23 22:57:41 UTC,13/11/2015,J1772,
ELEC,Kroger Store #480 - Grayson - Grayson Hwy,1911 Grayson Hwy,,Grayson,GA,30017,888-998-2546,E,Public,MON: 24 hours | TUE: 24 hours | WED: 24 hours | THU: 24 hours | FRI: 24 hours | SAT: 24 hours | SUN: 24 hours,,,1,0,33.897361,-83.961528,23/01/2023,96246,2023-01-23 22:57:33 UTC,26/09/2016,J1772,
ELEC,Cross Park Realty Partners LLC,9111 Cross Park Dr,.||,Knoxville,TN,37923,888-998-2546,E,Public,MON: 24 hours | TUE: 24 hours | WED: 24 hours | THU: 24 hours | FRI: 24 hours | SAT: 24 hours | SUN: 24 hours,,,4,0,35.92301,-84.08731,23/01/2023,96322,2023-01-23 22:57:30 UTC,01/03/2012,J1772,
ELEC,Riverfront Garage,35 Monroe Ave,Paid Public Parking. Enter via. S Front ||Street. Ground Level Charging.||,Memphis,TN,38103,888-998-2546,E,Public,MON: 24 hours | TUE: 24 hours | WED: 24 hours | THU: 24 hours | FRI: 24 hours | SAT: 24 hours | SUN: 24 hours,,,2,0,35.144379,-90.054791,23/01/2023,96342,2023-01-23 22:57:23 UTC,26/09/2016,J1772,
ELEC,Criminal Justice Center,245 Washington Ave,"Paid Parking - Garage for Jury Duty and ||Court visits, located on the first ||floor, midway on the left.||",Memphis,TN,38103,888-998-2546,E,Public,MON: 24 hours | TUE: 24 hours | WED: 24 hours | THU: 24 hours | FRI: 24 hours | SAT: 24 hours | SUN: 24 hours,,,2,0,35.147539,-90.046249,23/01/2023,96344,2023-01-23 22:57:24 UTC,26/09/2016,J1772,
ELEC,Hilton Garden Inn Chattanooga,2343 Shallowford Village Dr.,,Chattanooga,TN,37421,888-998-2546,E,Public,MON: 24 hours | TUE: 24 hours | WED: 24 hours | THU: 24 hours | FRI: 24 hours | SAT: 24 hours | SUN: 24 hours,,,1,0,35.045076,-85.156036,23/01/2023,96356,2023-01-23 22:57:17 UTC,26/07/2011,J1772,
ELEC,Maury Regional Medical Center,1224 Trotwood Ave,,Columbia,TN,38401,888-998-2546,E,Public,MON: 24 hours | TUE: 24 hours | WED: 24 hours | THU: 24 hours | FRI: 24 hours | SAT: 24 hours | SUN: 24 hours,,,2,0,35.606597,-87.067605,23/01/2023,96368,2023-01-23 22:57:18 UTC,15/01/2012,J1772,
ELEC,Three Rivers Market,1100 N Central Street,,Knoxville,TN,37917,888-998-2546,E,Public,MON: 24 hours | TUE: 24 hours | WED: 24 hours | THU: 24 hours | FRI: 24 hours | SAT: 24 hours | SUN: 24 hours,,,2,0,35.981352,-83.928208,23/01/2023,96371,2023-01-23 22:57:18 UTC,01/03/2012,J1772,
ELEC,Shoppers Garage,85 N Front St,Chargers under repair.||,Memphis,TN,38103,888-998-2546,E,Public,MON: 24 hours | TUE: 24 hours | WED: 24 hours | THU: 24 hours | FRI: 24 hours | SAT: 24 hours | SUN: 24 hours,,,2,0,35.147834,-90.0532075,23/01/2023,96459,2023-01-23 22:57:24 UTC,30/09/2012,J1772,
ELEC,Springhill Suites Pigeon Forge,120 Christmas Tree Lane,,Pigeon Forge,TN,37863,888-998-2546,E,Public,MON: 24 hours | TUE: 24 hours | WED: 24 hours | THU: 24 hours | FRI: 24 hours | SAT: 24 hours | SUN: 24 hours,,,1,0,35.808857,-83.575849,23/01/2023,96527,2023-01-23 22:57:36 UTC,06/11/2014,J1772,
ELEC,Holiday Inn Express Alcoa,130 Associates Blvd,,Alcoa,TN,37701,888-998-2546,E,Public,MON: 24 hours | TUE: 24 hours | WED: 24 hours | THU: 24 hours | FRI: 24 hours | SAT: 24 hours | SUN: 24 hours,,,1,0,35.783947,-83.988546,23/01/2023,96528,2023-01-23 22:57:36 UTC,13/12/2014,J1772,
ELEC,La Quinta Alcoa,126 Cusick Rd,,Alcoa,TN,37701,888-998-2546,E,Public,MON: 24 hours | TUE: 24 hours | WED: 24 hours | THU: 24 hours | FRI: 24 hours | SAT: 24 hours | SUN: 24 hours,,,1,0,35.811537,-83.982389,23/01/2023,96531,2023-01-23 22:57:36 UTC,13/12/2014,J1772,
ELEC,Holiday Inn Cedar Bluff,9134 Executive Park Drive,,Knoxville,TN,37923,888-998-2546,E,Public,MON: 24 hours | TUE: 24 hours | WED: 24 hours | THU: 24 hours | FRI: 24 hours | SAT: 24 hours | SUN: 24 hours,,,1,0,35.919789,-84.088552,23/01/2023,96532,2023-01-23 22:57:36 UTC,20/11/2014,J1772,
ELEC,Holiday Inn Express Kodak,3526 Outdoor World Drive,,Kodak,TN,37764,888-998-2546,E,Public,MON: 24 hours | TUE: 24 hours | WED: 24 hours | THU: 24 hours | FRI: 24 hours | SAT: 24 hours | SUN: 24 hours,,,1,0,35.984378,-83.613235,23/01/2023,96533,2023-01-23 22:57:36 UTC,07/11/2014,J1772,
ELEC,ING - Atlanta,5780 Powers Ferry Road NW,Charger #2 under repair.||,Atlanta,GA,30327,888-998-2546,E,Public,MON: 24 hours | TUE: 24 hours | WED: 24 hours | THU: 24 hours | FRI: 24 hours | SAT: 24 hours | SUN: 24 hours,,,2,0,33.9134,-84.4182,23/01/2023,96547,2023-01-23 22:57:37 UTC,07/11/2014,J1772,
ELEC,GEORGIA POWER SAVANNAH L2,1601 Dean Forest Rd,,Savannah,GA,31408,888-758-4389,E,Public,24 hours daily,,,2,0,32.0743,-81.199094,23/01/2023,96710,2023-01-23 23:03:55 UTC,20/04/2018,J1772,
ELEC,REVUP1 NC ZOO2,Zoo Pkwy,,Asheboro,NC,27205,888-758-4389,E,Public,24 hours daily,,,2,0,35.630452,-79.765581,23/01/2023,96720,2023-01-23 23:09:20 UTC,21/04/2018,J1772,
ELEC,REVUP1 SOLAR POINT 1,4401 Zoo Parkway,,Asheboro,NC,27205,888-758-4389,E,Public,24 hours daily,,,2,0,35.627228,-79.766688,23/01/2023,96725,2023-01-23 23:09:10 UTC,21/04/2018,J1772,
ELEC,Elbert County Courthouse,12 S Oliver St,,Elberton,GA,30635,706-988-0963,E,Public,24 hours daily,,,2,0,34.109726,-82.868747,10/08/2022,96780,2022-08-10 13:32:10 UTC,16/04/2018,J1772,MUNI_GOV
ELEC,BSMG ATC EVSE GW,324 Blackwell St,,Durham,NC,27701,888-758-4389,T,TEMPORARILY UNAVAILABLE (Public),24 hours daily,,,2,0,35.993329,-78.905625,12/01/2023,96976,2023-01-12 23:10:28 UTC,10/05/2018,J1772,
ELEC,WHOLE FOODS MKT FRANKLIN 01,4089 Mallory Ln,,Franklin,TN,37067,888-758-4389,T,TEMPORARILY UNAVAILABLE (Public),24 hours daily,,,2,0,35.934861,-86.824692,23/01/2023,97067,2023-01-23 23:09:33 UTC,16/05/2018,J1772,
ELEC,INN INN 2,597 Barnsley Gardens Rd NW,,Adairsville,GA,30103,888-758-4389,E,Public,24 hours daily,,,1,0,34.302263,-84.983802,23/01/2023,97072,2023-01-23 23:08:59 UTC,16/05/2018,J1772,
ELEC,WHOLE FOODS MKT CHARLOTTE STA 1,400 E Stonewall St,,Charlotte,NC,28202,888-758-4389,E,Public,24 hours daily,,,2,0,35.221064,-80.84649,12/01/2023,98566,2023-01-12 23:10:11 UTC,26/05/2018,J1772,
ELEC,BEMC SHALLOTTE,299-355 Mulberry St,,Shallotte,NC,28470,888-758-4389,E,Public,24 hours daily,,,2,0,33.974158,-78.386606,23/01/2023,98568,2023-01-23 23:09:32 UTC,26/05/2018,J1772,
ELEC,Sutherlin Nissan - Cherokee,101 Harbor Creek Pkwy,,Holly Spring,GA,30115,678-730-9900,E,Public - Call ahead,Dealership business hours,,,1,1,34.183359,-84.502677,07/03/2022,98584,2022-03-07 19:49:53 UTC,29/05/2018,CHADEMO J1772 J1772COMBO,CAR_DEALER
ELEC,Sutherlin Nissan - Cherokee,101 Harbor Creek Pkwy,,Holly Spring,GA,30115,678-730-9900,E,Private,,,,1,0,34.183359,-84.502677,07/03/2022,98585,2022-03-07 19:49:53 UTC,29/05/2018,J1772,CAR_DEALER
ELEC,RIVERWOOD 200 STATION 3,3300 Riverwood Pkwy,,Atlanta,GA,30339,888-758-4389,T,TEMPORARILY UNAVAILABLE (Public),24 hours daily,,,2,0,33.877674,-84.459523,23/01/2023,98599,2023-01-23 23:06:00 UTC,30/05/2018,J1772,
ELEC,Environmental Protection Agency,61 Forsyth St NW,,Atlanta,GA,30303,,E,Private,Fleet use only,,,1,0,33.753606,-84.394258,22/02/2021,98671,2021-03-11 23:22:17 UTC,01/04/2018,J1772,FED_GOV
ELEC,Social Security Administration,1 Innovation Dr,,Research Triangle Park,NC,27709,,E,Private,Fleet use only,,,2,0,35.877576,-78.88564,22/02/2021,98678,2021-03-11 23:22:17 UTC,01/04/2018,J1772,FED_GOV
ELEC,SAVANNAH 1 SAVANNAH 1,5 E Hall St,,Savannah,GA,31401,888-758-4389,E,Public,24 hours daily,,,1,0,32.067848,-81.095089,12/01/2023,98724,2023-01-12 23:10:20 UTC,02/06/2018,J1772,
ELEC,DELTA AIR LINES RESERVATIONS #1,700 south central ave,,Atlanta,GA,30354,888-758-4389,E,Public,24 hours daily,,,2,0,33.65972,-84.413647,23/01/2023,98882,2023-01-23 23:09:14 UTC,14/06/2018,J1772,
ELEC,Oconaluftee Visitor Center L2,1194 Newfound Gap Rd,,"Cherokee,",NC,28719,855-900-7584,T,TEMPORARILY UNAVAILABLE (Public),24 hours daily,,,1,0,35.514404,-83.3066,23/01/2023,99084,2023-01-23 23:12:24 UTC,02/10/2015,J1772,
ELEC,DECATUR DOWN TOWN,509 N McDonough St,,Decatur,GA,30030,888-758-4389,E,Public,24 hours daily,,,2,0,33.77428,-84.296526,12/01/2023,99517,2023-01-12 23:10:28 UTC,29/06/2018,J1772,
ELEC,DECATUR OAKHURST,499 Mead Rd,,Decatur,GA,30030,888-758-4389,E,Public,24 hours daily,,,2,0,33.760116,-84.303466,12/01/2023,99518,2023-01-12 23:10:28 UTC,29/06/2018,J1772,
ELEC,MIDTOWN PLAZA MIDTOWN 163-164,1360 W Peachtree St NE,,Atlanta,GA,30309,888-758-4389,T,TEMPORARILY UNAVAILABLE (Public),24 hours daily,,,2,0,33.79175,-84.386337,23/01/2023,99644,2023-01-23 23:09:39 UTC,10/07/2018,J1772,
ELEC,MIDTOWN PLAZA MIDTOWN117-118,1349 W Peachtree St NE,,Atlanta,GA,30309,888-758-4389,E,Public,24 hours daily,,,2,0,33.791365,-84.386874,23/01/2023,99645,2023-01-23 23:09:39 UTC,10/07/2018,J1772,
ELEC,PPS PREFERRED PKNG,1916 Doggett St,,Charlotte,NC,28203,888-758-4389,E,Public,24 hours daily,,,2,0,35.211793,-80.861685,23/01/2023,99678,2023-01-23 23:06:05 UTC,11/07/2018,J1772,
ELEC,Jet Food Stores of Georgia #92,4765 Riverside Dr,,Macon,GA,31210,478-216-5271,E,Public,24 hours daily,A Cash D Debit FleetOne FuelMan M V Voyager Wright_Exp,,2,0,32.920767,-83.708842,10/08/2022,99712,2022-08-10 13:32:10 UTC,29/06/2018,J1772,GAS_STATION
ELEC,DILLON STATION STATION1,223 S West St,,Raleigh,NC,27603,888-758-4389,E,Public,24 hours daily,,,2,0,35.777973,-78.645687,23/01/2023,99756,2023-01-23 23:09:02 UTC,14/07/2018,J1772,
ELEC,WEINSTEIN CARPENTER1,2074 Geddy House Ln,,Cary,NC,27519,888-758-4389,E,Public,24 hours daily,,,2,0,35.82114,-78.859447,12/01/2023,99819,2023-01-12 23:10:42 UTC,20/07/2018,J1772,
ELEC,PROSCENIUM STATION 1,1170 Crescent Ave NE,,Atlanta,GA,30309,888-758-4389,E,Public,24 hours daily,,,2,0,33.786336,-84.38443,23/01/2023,99825,2023-01-23 23:08:57 UTC,20/07/2018,J1772,
ELEC,WEINSTEIN TRIANGLE1,1200 Pickett Branch Rd,,Cary,NC,27519,888-758-4389,E,Public,24 hours daily,,,2,0,35.857658,-78.89673,12/01/2023,99843,2023-01-12 23:10:43 UTC,21/07/2018,J1772,
ELEC,ASHFORD GREEN ASHFORD GREEN 1,4700 Ashford Dunwoody road,,Brookhaven,GA,30319,888-758-4389,E,Public,24 hours daily,,,2,0,33.914857,-84.338821,12/01/2023,99844,2023-01-12 23:10:42 UTC,21/07/2018,J1772,
ELEC,CDC CHEV01 & 02,Parking Lot adjacent to bldg 105,,Chamblee,GA,30341,888-758-4389,E,Public,24 hours daily,,,2,0,33.881276,-84.294262,23/01/2023,99926,2023-01-23 23:08:30 UTC,26/07/2018,J1772,
ELEC,WEINSTEIN BRIER1,8200 Stonebrook Terrace,,Raleigh,NC,27617,888-758-4389,E,Public,24 hours daily,,,2,0,35.910497,-78.787751,12/01/2023,99977,2023-01-12 23:10:44 UTC,27/07/2018,J1772,
ELEC,ORANGE STATIONS NORTHSIDE EV1,5730-5736 Peachtree Dunwoody Rd,,Sandy Springs,GA,30342,888-758-4389,E,Public,24 hours daily,,,2,0,33.910947,-84.353575,23/01/2023,99984,2023-01-23 23:08:09 UTC,27/07/2018,J1772,
ELEC,ORANGE STATIONS NORTHSIDE EV2,5730 Peachtree Dunwoody Rd,,Sandy Springs,GA,30342,888-758-4389,E,Public,24 hours daily,,,2,0,33.910911,-84.353545,23/01/2023,99985,2023-01-23 23:08:04 UTC,27/07/2018,J1772,
ELEC,HAMPTON INN SUITES DOBSON,150 Charlestowne Dr,,Elkin,NC,28621,888-758-4389,E,Public,24 hours daily,,,2,0,36.393098,-80.786257,23/01/2023,99997,2023-01-23 23:09:42 UTC,28/07/2018,J1772,
ELEC,CHOA CHOA EV P1,1400 Tullie Rd NE,,Atlanta,GA,30329,888-758-4389,E,Public,24 hours daily,,,2,0,33.831218,-84.3325,23/01/2023,100033,2023-01-23 23:09:19 UTC,01/08/2018,J1772,
ELEC,WEINSTEIN CONCORD1,611 Blue Sky Dr,,Concord,NC,28027,888-758-4389,E,Public,24 hours daily,,,2,0,35.375523,-80.720205,12/01/2023,100044,2023-01-12 23:10:45 UTC,02/08/2018,J1772,
ELEC,Integra Hills (Location 1),9198 Integra Hills Lane,,Ooltewah,TN,37363,888-998-2546,E,Public,MON: 24 hours | TUE: 24 hours | WED: 24 hours | THU: 24 hours | FRI: 24 hours | SAT: 24 hours | SUN: 24 hours,,,2,0,35.066943,-85.074911,23/01/2023,100238,2023-01-23 22:57:49 UTC,08/08/2018,J1772,
ELEC,Integra Hills (Location 2),9198 Integra Hills Lane,,Ooltewah,TN,37363,888-998-2546,E,Public,MON: 24 hours | TUE: 24 hours | WED: 24 hours | THU: 24 hours | FRI: 24 hours | SAT: 24 hours | SUN: 24 hours,,,2,0,35.068252,-85.073931,23/01/2023,100239,2023-01-23 22:57:49 UTC,08/08/2018,J1772,
ELEC,MARIPOSA MARIPOSA EV1,100 Montag Cir,,Atlanta,GA,30307,888-758-4389,E,Public,24 hours daily,,,2,0,33.760294,-84.361704,23/01/2023,100293,2023-01-23 23:08:06 UTC,09/08/2018,J1772,
ELEC,McMinnville Electric System - Main Building,200 W Morford St,,McMinnville,TN,37110,931-473-3144,E,Public,24 hours daily,,,1,0,35.682623,-85.774901,14/01/2021,100324,2023-01-05 00:44:48 UTC,01/03/2018,J1772,UTILITY
ELEC,JLR CARY LEITH 1 - FRONT,1000 Autopark Blvd,,Cary,NC,27511,888-758-4389,E,Public,24 hours daily,,,2,0,35.73965,-78.814925,12/01/2023,100336,2023-01-12 23:10:11 UTC,10/08/2018,J1772,
ELEC,DELTA AIR LINES TRAINING CNTR 4,1021 N Outer Loop Rd,,Atlanta,GA,30320,888-758-4389,E,Public,24 hours daily,,,2,0,33.658678,-84.42534,12/01/2023,100369,2023-01-12 23:13:08 UTC,14/08/2018,J1772,
ELEC,PARKING LOT1 ALOFT GW,7895 North Point Pkwy,,Alpharetta,GA,30009,888-758-4389,E,Public,24 hours daily,,,2,0,34.039088,-84.30613,23/01/2023,100374,2023-01-23 23:09:04 UTC,14/08/2018,J1772,
ELEC,DELTA AIR LINES OC3 CHARGER 2,980 Virginia ave,,Hapeville,GA,30354,888-758-4389,E,Public,24 hours daily,,,2,0,33.658015,-84.421226,12/01/2023,100393,2023-01-12 23:10:48 UTC,16/08/2018,J1772,
ELEC,SYEMC HQ,510 S Main St,,Dobson,NC,27017,888-758-4389,E,Public,24 hours daily,,,2,0,36.388179,-80.718715,12/01/2023,100397,2023-01-12 23:10:42 UTC,16/08/2018,J1772,
ELEC,BUILDINGB1 EV STATION 03,Ingersoll-Rand Rd,,Davidson,NC,28036,888-758-4389,T,TEMPORARILY UNAVAILABLE (Public),24 hours daily,,,2,0,35.511096,-80.847662,12/01/2023,100413,2023-01-12 23:10:35 UTC,17/08/2018,J1772,
ELEC,BUILDINGB1 EV STATION 04,800 Beaty St,,Davidson,NC,28036,888-758-4389,E,Public,24 hours daily,,,2,0,35.511692,-80.851429,23/01/2023,100415,2023-01-23 23:09:41 UTC,17/08/2018,J1772,
ELEC,GEORGIA STATE GSU CLARKSTON,629 N Indian Creek Dr,,Clarkston,GA,30021,888-758-4389,E,Public,24 hours daily,,,2,0,33.791288,-84.233887,12/01/2023,100446,2023-01-12 23:10:49 UTC,21/08/2018,J1772,
ELEC,BEACON STATION 2,1035 Grant St SE,,Atlanta,GA,30315,888-758-4389,E,Public,24 hours daily,,,2,0,33.726018,-84.377472,12/01/2023,100465,2023-01-12 23:10:44 UTC,22/08/2018,J1772,
ELEC,City of Kingsport - Water Sewer Department,1213 Konnarock R,,Kingsport,TN,37660,,E,Private,For fleet use only,,,1,0,36.522178,-82.528577,14/09/2022,100478,2022-09-14 15:49:44 UTC,01/01/2016,J1772,MUNI_GOV
ELEC,Ingles Market,1257 Georgia Rd,Located in front and to the left of the store entrance,Franklin,NC,28734,828-524-9321,E,Public,24 hours daily,,,2,0,35.156931,-83.392158,10/01/2023,100482,2023-01-10 16:44:47 UTC,01/08/2018,J1772,GROCERY
ELEC,The Factory - Franklin,1024 Georgia Rd,,Franklin,NC,28734,828-349-8888,E,Public,24 hours daily,,,2,0,35.160381,-83.389547,10/11/2022,100483,2022-11-10 16:40:31 UTC,01/08/2018,TESLA,OTHER_ENTERTAINMENT
ELEC,The Inn on Biltmore Estate,1 Antler Hill Rd,Located in the guest parking lot,Asheville,NC,28803,828-225-1625,E,Public,24 hours daily; for guest use only,,,2,0,35.5568,-82.577065,10/01/2023,100484,2023-01-10 16:44:47 UTC,01/08/2018,J1772,INN
ELEC,Village Hotel on Biltmore Estate,207 Dairy Rd,Located in the hotel overnight guest parking area,Asheville,NC,28803,828-225-1362,E,Public,24 hours daily; for guest use only,,,1,0,35.554142,-82.582147,10/01/2023,100485,2023-01-10 16:44:47 UTC,01/08/2018,J1772,HOTEL
ELEC,DELTA AIR LINES DOMESTIC CARGO1,1600 M H Jackson Service Rd,,Atlanta,GA,30320,888-758-4389,E,Public,24 hours daily,,,2,0,33.64049,-84.412414,12/01/2023,100511,2023-01-12 23:10:46 UTC,24/08/2018,J1772,
ELEC,CITY OF WILM MKT ST DECK,11 N 2nd St,,Wilmington,NC,28401,888-758-4389,E,Public,24 hours daily,,,2,0,34.235975,-77.947846,12/01/2023,100567,2023-01-12 23:10:55 UTC,30/08/2018,J1772,
ELEC,Epps Bridge Centre - Tesla Supercharger,1791 Oconee Connector,,Athens,GA,30606,877-798-3752,E,Public,24 hours daily; for Tesla use only,,,,1,33.917081,-83.452989,03/10/2022,102133,2022-12-01 17:40:26 UTC,23/07/2018,TESLA,
ELEC,Atlantic Station - Tesla Supercharger,1380 Atlantic Drive NW,,Atlanta,GA,30363,877-798-3752,E,Public,24 hours daily; for Tesla use only,,,,3,33.79382,-84.39713,03/10/2022,102134,2022-12-01 17:40:26 UTC,01/01/2015,TESLA,
ELEC,Sheraton Augusta Hotel - Tesla Supercharger,1069 Stevens Creek Road,,Augusta,GA,30907,877-798-3752,E,Public,24 hours daily; for Tesla use only,,,,8,33.514985,-82.04446,03/10/2022,102135,2022-12-01 17:40:26 UTC,01/06/2016,TESLA,
ELEC,Kingsland Welcome Center - Tesla Supercharger,1190 East Boone Avenue,,Kingsland,GA,31548,877-798-3752,E,Public,24 hours daily; for Tesla use only,,,,8,30.790734,-81.663625,03/10/2022,102137,2022-12-01 17:40:26 UTC,01/10/2015,TESLA,
ELEC,Savannah/Hilton Head International Airport - Tesla Supercharger,400 Airways Avenue,,Savannah,GA,31408,877-798-3752,E,Public,24 hours daily; for Tesla use only,,,,8,32.135885,-81.212853,03/10/2022,102139,2022-12-01 17:40:26 UTC,01/01/2014,TESLA,
ELEC,Asheville Outlets - Tesla Supercharger,800 Brevard Road,,Asheville,NC,28806,877-798-3752,E,Public,24 hours daily; for Tesla use only,,,,12,35.531428,-82.604495,03/10/2022,102268,2022-12-01 17:40:26 UTC,19/12/2015,TESLA,
ELEC,Alamance Crossing - Tesla Supercharger,1080 Piper Ln,,Burlington,NC,27215,877-798-3752,E,Public,24 hours daily; for Tesla use only,,,,8,36.070788,-79.511222,03/10/2022,102269,2022-12-01 17:40:26 UTC,31/10/2013,TESLA,
ELEC,Cochran Commons - Tesla Supercharger,2720 W Mallard Creek Church Rd,,Charlotte,NC,28262,877-798-3752,E,Public,24 hours daily; for Tesla use only,,,,8,35.34075,-80.76579,03/10/2022,102270,2022-12-01 17:40:26 UTC,01/03/2015,TESLA,
ELEC,DoubleTree by Hilton Hotel - Tesla Supercharger,1965 Cedar Creek Road,,Fayetteville,NC,28312,877-798-3752,E,Public,24 hours daily; for Tesla use only,,,,16,35.009458,-78.822461,03/10/2022,102271,2022-12-01 17:40:26 UTC,23/07/2018,TESLA,
ELEC,Sheetz - Tesla Supercharger,5421 Hornaday Road,,Greensboro,NC,27407,877-798-3752,E,Public,24 hours daily; for Tesla use only,,,,8,36.05946,-79.908323,03/10/2022,102272,2022-12-01 17:40:26 UTC,23/07/2018,TESLA,
ELEC,Sheetz - Tesla Supercharger,2191 13th Avenue Drive SE,,Hickory,NC,28602,877-798-3752,E,Public,24 hours daily; for Tesla use only,,,,8,35.706541,-81.294428,03/10/2022,102273,2022-12-01 17:40:26 UTC,23/07/2018,TESLA,
ELEC,Texas Steakhouse and Saloon - Lumberton - Tesla Supercharger,5093 Fayetteville Rd.,,Lumberton,NC,28358,877-798-3752,E,Public,24 hours daily; for Tesla use only,,,,8,34.667629,-79.002343,03/10/2022,102274,2022-12-01 17:40:26 UTC,01/01/2014,TESLA,
ELEC,North Hills - Tesla Supercharger,Lassiter at North Hills Ave,,Raleigh,NC,27609,877-798-3752,E,Public,24 hours daily; for Tesla use only,,,,24,35.835539,-78.643001,03/10/2022,102276,2022-12-01 17:40:26 UTC,01/11/2017,TESLA,
ELEC,DoubleTree Rocky Mount - Tesla Supercharger,651 N. Winstead Avenue,,Rocky Mount,NC,27804,877-798-3752,E,Public,24 hours daily; for Tesla use only,,,,8,35.972904,-77.846845,03/10/2022,102277,2022-12-01 17:40:26 UTC,15/12/2013,TESLA,
ELEC,Mad Boar Restaurant - Tesla Supercharger,111 River Village Place,,Wallace,NC,28466,877-798-3752,E,Public,24 hours daily; for Tesla use only,,,,8,34.756268,-77.947684,03/10/2022,102278,2022-12-01 17:40:26 UTC,23/07/2018,TESLA,
ELEC,Mayfaire Town Center - Tesla Supercharger,6835 Conservation Way,,Wilmington,NC,28405,877-798-3752,E,Public,24 hours daily; for Tesla use only,,,,1,34.240825,-77.829189,03/10/2022,102279,2022-12-01 17:40:26 UTC,01/09/2017,TESLA,
ELEC,The Pinnacle - Tesla Supercharger,416 Pinnacle Parkway,,Bristol,TN,37620,877-798-3752,E,Public,24 hours daily; for Tesla use only,,,,8,36.59171,-82.261227,03/10/2022,102414,2022-12-01 17:40:26 UTC,01/09/2017,TESLA,
ELEC,Chattanooga Airport (CHA) - Tesla Supercharger,1001 Airport Road,,Chattanooga,TN,37421,877-798-3752,E,Public,24 hours daily; for Tesla use only,,,,6,35.038644,-85.19593,03/10/2022,102415,2022-12-01 17:40:26 UTC,01/09/2014,TESLA,
ELEC,Jackson Plaza - Tesla Supercharger,377 West Jackson Street,,Cookeville,TN,38501,877-798-3752,E,Public,24 hours daily; for Tesla use only,,,,8,36.155817,-85.515186,03/10/2022,102416,2022-12-01 17:40:26 UTC,23/07/2018,TESLA,
ELEC,Holiday Inn Express & Suites - Tesla Supercharger,100 Barzani Blvd,,Dickson,TN,37055,877-798-3752,E,Public,24 hours daily; for Tesla use only,,,,8,36.018436,-87.333018,03/10/2022,102417,2022-12-01 17:40:26 UTC,23/07/2018,TESLA,
ELEC,Casey Jones Village - Tesla Supercharger,56 Casey Jones Lane,,Jackson,TN,38305,877-798-3752,E,Public,24 hours daily; for Tesla use only,,,,8,35.66042,-88.855619,03/10/2022,102418,2022-12-01 17:40:26 UTC,01/12/2016,TESLA,
ELEC,Pavilion of Turkey Creek - Tesla Supercharger,10936 Parkside Dr,,Knoxville,TN,37934,877-798-3752,E,Public,24 hours daily; for Tesla use only,,,,8,35.901319,-84.149634,03/10/2022,102419,2022-12-01 17:40:26 UTC,01/04/2015,TESLA,
ELEC,Dunkin Donuts - Tesla Supercharger,2224 Hillsboro Blvd.,,Manchester,TN,37355,877-798-3752,E,Public,24 hours daily; for Tesla use only,,,,1,35.458629,-86.057393,03/10/2022,102420,2022-12-01 17:40:26 UTC,23/07/2018,TESLA,
ELEC,Park Place Centre - Tesla Supercharger,6073 Park Avenue,,Memphis,TN,38119,877-798-3752,E,Public,24 hours daily; for Tesla use only,,,,8,35.097801,-89.858957,03/10/2022,102421,2022-12-01 17:40:26 UTC,01/12/2016,TESLA,
ELEC,SANDY SPRINGSEV CITY SPRINGS 3,1 Galambos Way,,Sandy Springs,GA,30328,888-758-4389,E,Public,24 hours daily,,,2,0,33.924713,-84.380418,23/01/2023,102604,2023-01-23 23:09:14 UTC,06/09/2018,J1772,
ELEC,Memphis Federal Correctional Institute,1101 John A. Denie Dr.,,Memphis,TN,38134,,E,Private - Government only,,,,2,0,35.156368,-89.867466,22/02/2021,102655,2021-03-11 23:22:17 UTC,01/09/2018,J1772 NEMA515,FED_GOV
ELEC,PF PARKING LOT PF PARKING LOT,Iver Place,,Fayetteville,GA,30214,888-758-4389,E,Public,24 hours daily,,,2,0,33.468129,-84.506795,23/01/2023,102663,2023-01-23 23:09:43 UTC,07/09/2018,J1772,
ELEC,CAPE HATTERAS HATTERAS,59063 NC-12,,Hatteras,NC,27953,888-758-4389,E,Public,24 hours daily,,,2,0,35.207636,-75.701494,23/01/2023,102675,2023-01-23 23:09:19 UTC,08/09/2018,J1772,
ELEC,WTCC SWC SWC STATION 3&4,4400 Chandler Ridge Cir Wake Tech College,,Raleigh,NC,27603,888-758-4389,E,Public,24 hours daily,,,2,0,35.652141,-78.706033,23/01/2023,102678,2023-01-23 23:08:33 UTC,08/09/2018,J1772,
ELEC,COCPARKING STATION 1,28 Cabarrus Ave W,,Concord,NC,28025,888-758-4389,T,TEMPORARILY UNAVAILABLE (Public),24 hours daily,,,2,0,35.410242,-80.58205,12/01/2023,102702,2023-01-12 23:10:57 UTC,12/09/2018,J1772,
ELEC,PF PARKING LOT PF IDEA HOUSE,290 Heatherden Avenue,,Fayetteville,GA,30214,888-758-4389,E,Public,24 hours daily,,,2,0,33.467302,-84.506609,23/01/2023,102779,2023-01-23 23:09:43 UTC,14/09/2018,J1772,
ELEC,CLT AIRPORT BUS. VALET 05,325 W 6th St,,Charlotte,NC,28202,888-758-4389,E,Public,24 hours daily,,,2,0,35.2303,-80.8443,12/01/2023,102938,2023-01-12 23:10:55 UTC,15/09/2018,J1772,
ELEC,GABLES EMORY EV STATION 02,1540 Avenue Place,,Atlanta,GA,30329,888-758-4389,E,Public,24 hours daily,,,2,0,33.801946,-84.327492,12/01/2023,102957,2023-01-12 23:10:54 UTC,18/09/2018,J1772,
ELEC,GABLES EMORY EV STATION 01,1579 Avenue Pl,,Atlanta,GA,30322,888-758-4389,E,Public,24 hours daily,,,2,0,33.800705,-84.325453,12/01/2023,102958,2023-01-12 23:10:50 UTC,18/09/2018,J1772,
ELEC,JLR NASHVILLE STATION1,3 Cadillac Dr,,Brentwood,TN,37027,888-758-4389,E,Public,24 hours daily,,,2,0,36.03643,-86.797484,23/01/2023,103077,2023-01-23 23:09:13 UTC,20/09/2018,J1772,
ELEC,NCR HQ  MIDTOW NCR EV 19,858 Spring St NW,,Atlanta,GA,30308,888-758-4389,E,Public,24 hours daily,,,2,0,33.778542,-84.389477,12/01/2023,103878,2023-01-12 23:11:02 UTC,05/10/2018,J1772,
ELEC,HIGHWOODS RTP 751 CORP EV 1,751 Corporate Center Drive,,Raleigh,NC,27607,888-758-4389,E,Public,24 hours daily,,,2,0,35.793618,-78.741801,23/01/2023,104039,2023-01-23 23:08:07 UTC,11/10/2018,J1772,
ELEC,Sierra Nevada Brewery,100 Sierra Nevada Way,Located in the parking lot in front of the brewery,Mills River,NC,28732,828-681-5300,E,Public,9am-7pm daily; for customer use only,,,2,0,35.430833,-82.553153,12/07/2022,104145,2022-07-12 20:31:42 UTC,01/10/2018,J1772,BREWERY_DISTILLERY_WINERY
ELEC,Secure Parking - BAC Parking Deck,150 N College St,2nd floor of parking deck,Charlotte,NC,28202,704-331-0055,E,Private,Employee use only,,,2,0,35.226655,-80.840749,13/12/2022,104202,2022-12-13 14:36:26 UTC,31/12/2011,J1772,PAY_GARAGE
ELEC,Town of Elkin - Farmers Market,101 E Market St,,Elkin,NC,28621,336-258-8908,E,Public,7am-10pm daily,,,1,0,36.245222,-80.850472,10/11/2022,104306,2022-11-10 16:40:31 UTC,01/01/2018,J1772,STREET_PARKING
ELEC,Town of Elkin - Heritage and Trails Center,257 Standard St,,Elkin,NC,28621,336-526-1111,E,Public,7am-10pm daily,,,1,0,36.242635,-80.851461,10/11/2022,104307,2022-11-10 16:40:31 UTC,01/09/2018,J1772,MUNI_GOV
ELEC,Town of Elkin - Recreation Center,399 NC Highway 268 W,,Elkin,NC,28621,336-258-8917,E,Public,7am-10pm daily,,,2,0,36.247855,-80.855906,10/11/2022,104308,2022-11-10 16:40:31 UTC,01/01/2017,J1772,MUNI_GOV
ELEC,TRI-COUNTY EMC EV STATION 01,4381 State Hwy 11,,Gray,GA,31032,888-758-4389,E,Public,24 hours daily,,,2,0,33.00272,-83.550636,12/01/2023,104419,2023-01-12 23:10:28 UTC,30/10/2018,J1772,
ELEC,FLOWJLR SHOP 01,1205 Bridford Pkwy,,Greensboro,NC,27407,888-758-4389,T,TEMPORARILY UNAVAILABLE (Public),24 hours daily,,,1,0,36.05985,-79.902453,12/01/2023,104489,2023-01-12 23:10:44 UTC,02/11/2018,J1772,
ELEC,GASTONIA CITY HALL,181 S South St,,Gastonia,NC,28052,888-758-4389,T,TEMPORARILY UNAVAILABLE (Public),24 hours daily,,,2,0,35.26251,-81.183977,12/01/2023,104534,2023-01-12 23:11:14 UTC,06/11/2018,J1772,
ELEC,EV STATION LOT NGHS BRASELTON,1400 River Pl,,Braselton,GA,30517,888-758-4389,E,Public,24 hours daily,,,2,0,34.120551,-83.837821,12/01/2023,104559,2023-01-12 23:11:09 UTC,07/11/2018,J1772,
ELEC,McGhee Tyson Airport,2055 Alcoa Hwy,Located on the first level of the short term parking garage,Alcoa,TN,37701,865-970-2749,E,Public,24 hours daily; pay parking lot,,,2,0,35.8049767,-83.98941891,10/09/2021,104586,2022-02-10 19:42:29 UTC,01/01/2014,J1772,AIRPORT
ELEC,HCA Healthcare,2000 Health Park Dr,,Brentwood,TN,37027,,E,Private,Employee and visitor use only,,,4,0,36.044988,-86.774068,10/11/2022,104587,2022-11-10 16:40:31 UTC,01/02/2018,J1772,OFFICE_BLDG
ELEC,Mountain View Chevrolet,310 E 20th St,,Chattanooga,TN,37408,,E,Private,Dealership business hours,,,2,0,35.02970505,-85.30593766,10/01/2022,104588,2022-02-10 19:42:29 UTC,01/01/2015,J1772,CAR_DEALER
ELEC,Cumberland Plaza Garage,133 Commerce St,,Clarksville,TN,37040,931-553-2436,E,Public,24 hours daily,,,1,0,36.525861,-87.361493,10/11/2022,104591,2022-11-10 16:40:31 UTC,01/01/2017,J1772,PARKING_GARAGE
ELEC,Dickson Electric System,236 Cowan Rd,,Dickson,TN,37055,615-446-9051,E,Public,24 hours daily,,,1,0,36.065339,-87.386541,10/09/2021,104592,2022-02-10 19:42:29 UTC,01/05/2016,J1772,UTILITY
ELEC,Ford Lincoln of Franklin,1129 Murfreesboro Rd,,Franklin,TN,37064,615-823-7196,E,Public - Call ahead,Dealership business hours,,,2,0,35.918324,-86.833177,10/09/2021,104593,2022-02-10 19:42:29 UTC,01/01/2014,J1772,CAR_DEALER
ELEC,McEwen Building,1550 W McEwen Dr,,Franklin,TN,37067,615-970-3536,E,Public,24 hours daily,,,1,0,35.936008,-86.827124,10/01/2023,104594,2023-01-10 16:44:47 UTC,01/01/2015,J1772,OFFICE_BLDG
ELEC,Whole Foods Market,7825 US-72,,Germantown,TN,38138,901-896-3245,E,Public,24 hours daily,,,2,0,35.08896,-89.80219,10/09/2021,104595,2022-02-10 19:42:29 UTC,01/08/2015,J1772,GROCERY
ELEC,Brown Squirrel Furniture,9901 Sherrill Blvd,,Knoxville,TN,37932,865-693-1291,E,Public,"10am-8pm M-Sat, 1pm-6pm Sun; for customer use only",,,2,0,35.914452,-84.112427,10/09/2021,104596,2022-04-28 20:01:31 UTC,01/01/2015,J1772,SHOPPING_CENTER
ELEC,Whole Foods Market,6730 Paper Mill Dr,,Knoxville,TN,37919,865-291-6400,E,Public,8am-9pm daily,,,2,0,35.933079,-84.015922,10/09/2021,104599,2022-02-10 19:42:29 UTC,01/01/2015,J1772,GROCERY
ELEC,Melton Hill Dam - Overlook Parking Area,1824 Woodlawn Rd,,Lenoir City,TN,37771,800-882-5263,E,Public,Park hours,,,2,0,35.88315568,-84.30259448,10/09/2021,104600,2022-02-10 19:42:29 UTC,01/01/2014,J1772,PARKING_LOT
ELEC,Melton Hill Dam - Tailwater Parking Area,2015 Grubb Rd,,Lenoir City,TN,37771,865-632-2264,E,Public,Park hours,,,2,0,35.88578498,-84.3036185,10/09/2021,104601,2022-02-10 19:42:29 UTC,01/01/2014,J1772,PARKING_LOT
ELEC,Ingles Market,404 US-321,,Lenoir City,TN,37771,865-988-5902,E,Public,24 hours daily,,,2,0,35.802582,-84.262589,10/01/2023,104602,2023-01-10 16:44:47 UTC,01/01/2017,J1772,GROCERY
ELEC,Memphis International Airport,2491 Winchester Rd,Located on level 5 of Economy Parking,Memphis,TN,38116,901-922-8065,E,Public,24 hours daily,,,10,0,35.04880295,-89.98090376,10/09/2021,104603,2022-02-10 19:42:29 UTC,01/01/2014,J1772,PARKING_GARAGE
ELEC,Chamber of Commerce,3050 Medical Center Pkwy,,Murfreesboro,TN,37129,615-893-6565,E,Public,24 hours daily,,,2,0,35.866934,-86.449001,10/09/2021,104604,2022-02-10 19:42:29 UTC,01/01/2011,J1772,MUNI_GOV
ELEC,CHOA HUGHES SPALDING,Jesse Hill Jr Dr SE @ Coca Cola Pl,,Atlanta,GA,30313,888-758-4389,E,Public,24 hours daily,,,2,0,33.753597,-84.381125,12/01/2023,104794,2023-01-12 23:11:30 UTC,20/11/2018,J1772,
ELEC,JLR GWINNETT 1 DC FAST 02,3243 Old Norcross Road,,Duluth,GA,30096,888-758-4389,T,TEMPORARILY UNAVAILABLE (Public),24 hours daily,,,,1,33.964915,-84.130733,23/01/2023,104804,2023-01-23 23:08:32 UTC,20/11/2018,J1772COMBO,
ELEC,CARTA CHATTANOOGA COL,4501 Amnicola Hwy,,Chattanooga,TN,37406,888-758-4389,E,Public,24 hours daily,,,2,0,35.102057,-85.235075,23/01/2023,104917,2023-01-23 23:04:18 UTC,24/11/2018,J1772,
ELEC,PARK CENTRAL PC STATION 2,200 Park at N Hills St,,Raleigh,NC,27609,888-758-4389,E,Public,24 hours daily,,,1,0,35.835634,-78.637195,23/01/2023,104930,2023-01-23 23:09:26 UTC,27/11/2018,J1772,
ELEC,HCA Corporate Headquarters - Building 3,One Park Plaza,,Nashville,TN,37203,,E,Private,Employee use only,,,2,0,36.15142053,-86.8166802,14/09/2022,105044,2022-09-14 15:49:44 UTC,27/11/2019,J1772,OFFICE_BLDG
ELEC,HCA Corporate Headquarters - Building 4,One Park Plaza,,Nashville,TN,37203,,E,Private,Employee use only,,,2,0,36.14971387,-86.81877233,14/09/2022,105045,2022-09-14 15:49:44 UTC,01/10/2018,J1772,OFFICE_BLDG
ELEC,HCA Corporate Headquarters - Charlotte Garage,One Park Plaza,,Nashville,TN,37203,,E,Private,Employee use only,,,5,0,36.1522002,-86.81565024,14/09/2022,105046,2022-09-14 15:49:44 UTC,01/10/2018,J1772,OFFICE_BLDG
ELEC,AVALON CHARGE 7000 EAST,7000 Avalon Boulevard,,Alpharetta,GA,30009,888-758-4389,E,Public,24 hours daily,,,2,0,34.0708,-84.274702,23/01/2023,105107,2023-01-23 23:07:19 UTC,05/12/2018,J1772,
ELEC,VMC VIDANT HEALTH,365 Emergency Dr,,Greenville,NC,27834,888-758-4389,E,Public,24 hours daily,,,2,0,35.607875,-77.407225,23/01/2023,105149,2023-01-23 23:06:28 UTC,08/12/2018,J1772,
ELEC,Cafe Root Cellar,35 Suttles Rd,,Pittsboro,NC,27312,919-674-2990,E,Public,24 hours daily,,,1,0,35.72130458,-79.17745311,13/12/2022,105189,2022-12-13 14:36:26 UTC,01/12/2017,J1772,SHOPPING_CENTER
ELEC,DELTA AIR LINES MIDFIELD #1,1000 Toffie Terrace,,Atlanta,GA,30354,888-758-4389,T,TEMPORARILY UNAVAILABLE (Public),24 hours daily,,,2,0,33.653021,-84.430135,12/01/2023,105209,2023-01-12 23:11:36 UTC,12/12/2018,J1772,
ELEC,CHOA SCOTTISH RITE 1,5455 Meridian Mark Rd,,Sandy Springs,GA,30342,888-758-4389,E,Public,24 hours daily,,,2,0,33.904775,-84.354486,12/01/2023,105342,2023-01-12 23:11:38 UTC,18/12/2018,J1772,
ELEC,CHOA EGLESTON 1,2015 Uppergate Dr,,Atlanta,GA,30322,888-758-4389,E,Public,24 hours daily,,,2,0,33.793652,-84.318888,12/01/2023,105343,2023-01-12 23:11:38 UTC,18/12/2018,J1772,
ELEC,KROGER MARKET CARTERSVILLE 1,127 Main Street Market Place,,Cartersville,GA,30121,888-758-4389,E,Public,24 hours daily,,,2,0,34.173287,-84.776994,23/01/2023,105351,2023-01-23 23:05:12 UTC,18/12/2018,J1772,
ELEC,TERM GARAGE 2 MNAA PARK GA 2,Nashville,,Nashville,TN,37214,888-758-4389,E,Public,24 hours daily,,,2,0,36.130497,-86.667155,12/01/2023,105377,2023-01-12 23:11:26 UTC,19/12/2018,J1772,
ELEC,CHARGER 1 DC FAST 02,3825 Jonesboro Rd,,Union City,GA,30291,888-758-4389,E,Public,24 hours daily,,,,1,33.559394,-84.513862,12/01/2023,105446,2023-01-12 23:11:35 UTC,21/12/2018,J1772COMBO,
ELEC,ARKOFSALVATION EV STATION 01,344 Pavillion St SE,,Atlanta,GA,30315,888-758-4389,E,Public,24 hours daily,,,2,0,33.735702,-84.376095,12/01/2023,105534,2023-01-12 23:11:54 UTC,01/01/2019,J1772,
ELEC,Fire and Brimstone Tavern - Tesla Destination,10595 Old Alabama Rd Connector,,Alpharetta,GA,30022,678-421-4213  877-798-3752,E,Public,,,,4,0,34.037667,-84.290277,06/10/2022,113970,2023-01-18 15:15:20 UTC,16/05/2016,TESLA,RESTAURANT
ELEC,Springhill Suites Athens Downtown/University Area - Tesla Destination,220 S Hull St,,Athens,GA,30605,706-850-2072  877-798-3752,E,Public,,,,6,0,33.956097,-83.378922,06/10/2022,113971,2023-01-18 15:15:20 UTC,19/09/2018,J1772 TESLA,HOTEL
ELEC,Graduate Hotel Athens - Tesla Destination,295 E Dougherty St,,Athens,GA,30601,706-549-7020  877-798-3752,E,Public,,,,3,0,33.963805,-83.374642,06/10/2022,113972,2023-01-18 15:15:20 UTC,05/02/2018,J1772 TESLA,HOTEL
ELEC,The Colonels B&B and Inn - Tesla Destination,3890 Barnett Shoals Rd,,Athens,GA,30605,706-559-9595  877-798-3752,E,Public,,,,2,0,33.889858,-83.327356,06/10/2022,113973,2023-01-18 15:15:20 UTC,27/04/2017,J1772 TESLA,INN
ELEC,Hotel Indigo - Athens - Tesla Destination,500 College Ave,,Athens,GA,30601,706-546-0430  877-798-3752,E,Public,,,,2,0,33.961983,-83.375885,06/10/2022,113974,2023-01-18 15:15:20 UTC,07/11/2014,TESLA,HOTEL
ELEC,Le Meridien Atlanta Perimeter - Tesla Destination,111 Perimeter Center W,,Atlanta,GA,30346,770-396-6800  877-798-3752,E,Public,,,,3,0,33.92816,-84.338456,06/10/2022,113975,2023-01-18 15:15:20 UTC,06/06/2017,J1772 TESLA,HOTEL
ELEC,Crowne Plaza Atlanta Airport - Tesla Destination,1325 Virginia Ave,,Atlanta,GA,30334,404-768-6660  877-798-3752,E,Public,,,,2,0,33.660132,-84.431519,06/10/2022,113977,2023-01-18 15:15:20 UTC,17/07/2017,J1772 TESLA,HOTEL
ELEC,"The Ritz-Carlton, Atlanta - Tesla Destination",181 Peachtree St NE,,Atlanta,GA,30303,404-659-0400  877-798-3752,E,Public,,,,8,0,33.758431,-84.387067,06/10/2022,113978,2023-01-18 15:15:20 UTC,15/11/2016,J1772 TESLA,HOTEL
ELEC,Atlanta Airport Marriott Gateway - Tesla Destination,2020 Convention Center Concourse,,Atlanta,GA,30337,404-763-1544  877-798-3752,E,Public,,,,2,0,33.644389,-84.455351,06/10/2022,113979,2023-01-18 15:15:20 UTC,16/08/2017,J1772 TESLA,HOTEL
ELEC,The Westin Peachtree Plaza - Tesla Destination,210 Peachtree St,,Atlanta,GA,30303,404-659-1400  877-798-3752,E,Public,,,,3,0,33.75946,-84.389174,06/10/2022,113980,2023-01-18 15:15:20 UTC,19/08/2014,J1772 TESLA,HOTEL
ELEC,Centennial Park District Public Parking - 9th Level - Tesla Destination,275 Baker St,,Atlanta,GA,30313,404-658-1877  877-798-3752,E,Public,,,,3,0,33.762053,-84.395873,06/10/2022,113981,2023-01-18 15:15:20 UTC,01/12/2016,TESLA,PARKING_GARAGE
ELEC,Hyatt Place Atlanta/Cobb Galleria - Tesla Destination,2876 Spring Hill Pkwy SE,,Atlanta,GA,30080,770-384-0060  877-798-3752,E,Public,,,,2,0,33.881785,-84.473461,06/10/2022,113982,2023-01-18 15:15:20 UTC,20/03/2017,J1772 TESLA,HOTEL
ELEC,Aloft Atlanta Downtown Hotel - Tesla Destination,300 Spring St NW,,Atlanta,GA,30308,678-515-0300  877-798-3752,E,Public,,,,3,0,33.762633,-84.389629,06/10/2022,113983,2023-01-18 15:15:20 UTC,28/03/2016,J1772 TESLA,HOTEL
ELEC,05 Buckhead Parking Garage - Tesla Destination,3242 Peachtree Rd NE,,Atlanta,GA,30305,855-677-2936  877-798-3752,E,Public,,,,6,0,33.843212,-84.37258,06/10/2022,113984,2023-01-18 15:15:20 UTC,01/10/2018,J1772 TESLA,PARKING_GARAGE
ELEC,JW Marriott Atlanta Buckhead - Tesla Destination,3300 Lenox Rd NE,,Atlanta,GA,30326,404-262-3344  877-798-3752,E,Public,,,,3,0,33.8454512,-84.3600387,06/10/2022,113985,2023-01-18 15:15:20 UTC,16/12/2014,J1772 TESLA,HOTEL
ELEC,Grand Hyatt Atlanta in Buckhead - Tesla Destination,3300 Peachtree Rd NE,,Atlanta,GA,30305,404-237-1234  877-798-3752,E,Public,,,,2,0,33.844994,-84.370185,06/10/2022,113986,2023-01-18 15:15:20 UTC,18/06/2015,TESLA,HOTEL
ELEC,InterContinental Buckhead Atlanta - Tesla Destination,3315 Peachtree Rd,,Atlanta,GA,30326,404-946-9000  877-798-3752,E,Public,,,,3,0,33.845377,-84.368627,06/10/2022,113987,2023-01-18 15:15:20 UTC,16/10/2014,J1772 TESLA,HOTEL
ELEC,"Mandarin Oriental, Atlanta - Tesla Destination",3376 Peachtree Rd NE,,Atlanta,GA,30326,404-995-7500  877-798-3752,E,Public,,,,2,0,33.84892,-84.36607,06/10/2022,113988,2023-01-18 15:15:20 UTC,19/11/2014,J1772 TESLA,HOTEL
ELEC,W Atlanta - Buckhead - Tesla Destination,3377 Peachtree Rd NE,,Atlanta,GA,30326,678-500-3100  877-798-3752,E,Public,,,,4,0,33.847895,-84.366215,06/10/2022,113989,2023-01-18 15:15:20 UTC,03/09/2015,J1772 TESLA,HOTEL
ELEC,The Westin Buckhead Atlanta - Tesla Destination,3391 Peachtree Rd,,Atlanta,GA,30326,404-365-0065  877-798-3752,E,Public,,,,3,0,33.848401,-84.365385,06/10/2022,113990,2023-01-18 15:15:20 UTC,27/03/2015,J1772 TESLA,HOTEL
ELEC,Hampton Inn Atlanta - Buckhead - Tesla Destination,3398 Piedmont Rd,,Atlanta,GA,30305,404-233-5656  877-798-3752,E,Public,,,,2,0,33.847158,-84.373871,06/10/2022,113991,2023-01-18 15:15:20 UTC,09/10/2017,J1772 TESLA,HOTEL
ELEC,Atlanta Marriott Buckhead Hotel & Conference Center - Tesla Destination,3405 Lenox Rd NE,,Atlanta,GA,30326,404-261-9250  877-798-3752,E,Public,,,,2,0,33.848176,-84.359664,06/10/2022,113992,2023-01-18 15:15:20 UTC,17/07/2017,J1772 TESLA,HOTEL
ELEC,Stoddard's Range and Guns - Tesla Destination,485 Bishop St NW,,Atlanta,GA,30318,404-355-4867  877-798-3752,E,Public,,,,2,0,33.793136,-84.40391,06/10/2022,113993,2023-01-18 15:15:20 UTC,23/03/2017,TESLA,REC_SPORTS_FACILITY
ELEC,Westin Atlanta Perimeter Center - Tesla Destination,7 Concourse Pkwy NE,,Atlanta,GA,30328,770-395-3900  877-798-3752,E,Public,,,,1,0,33.914827,-84.355804,06/10/2022,113994,2023-01-18 15:15:20 UTC,03/12/2014,TESLA,HOTEL
ELEC,Four Seasons Hotel Atlanta - Tesla Destination,75 Fourteenth St NE,,Atlanta,GA,30309,404-881-9898  877-798-3752,E,Public,,,,3,0,33.786647,-84.385533,06/10/2022,113995,2023-01-18 15:15:20 UTC,06/11/2014,J1772 TESLA,HOTEL
ELEC,The St. Regis Atlanta & Atlas Buckhead - Tesla Destination,88 W Paces Ferry Rd,,Atlanta,GA,30305,404-563-7900  877-798-3752,E,Public,,,,3,0,33.839773,-84.383023,06/10/2022,113996,2023-01-18 15:15:20 UTC,22/12/2015,J1772 TESLA,HOTEL
ELEC,Homewood Suites Atlanta Perimeter Center - Tesla Destination,915 Crestline Pkwy,,Atlanta,GA,30328,770-415-3200  877-798-3752,E,Public,,,,2,0,33.928401,-84.356541,06/10/2022,113997,2023-01-18 15:15:20 UTC,17/07/2017,TESLA,HOTEL
ELEC,Hyatt Place Augusta - Tesla Destination,160 Mason McKnight Jr. Pkwy,,Augusta,GA,30907,706-396-4040  877-798-3752,E,Public,,,,3,0,33.489835,-82.107923,06/10/2022,113999,2023-01-18 15:15:20 UTC,19/12/2016,J1772 TESLA,HOTEL
ELEC,Augusta Marriott at the Convention Center - Tesla Destination,2 10th St,,Augusta,GA,30901,706-722-8900  877-798-3752,E,Public,,,,2,0,33.479143,-81.968019,06/10/2022,114000,2023-01-18 15:15:20 UTC,27/10/2015,TESLA,HOTEL
ELEC,Partridge Inn - Tesla Destination,2110 Walton Wy,,Augusta,GA,30904,706-737-8888  877-798-3752,E,Public,,,,3,0,33.475028,-82.0101,06/10/2022,114001,2023-01-18 15:15:20 UTC,13/10/2015,J1772 TESLA,INN
ELEC,Holiday Inn Express Augusta Downtown - Tesla Destination,444 Broad St,,Augusta,GA,30901,706-922-1414  877-798-3752,E,Public,,,,2,0,33.472116,-81.958171,06/10/2022,114002,2023-01-18 15:15:20 UTC,27/07/2017,J1772 TESLA,HOTEL
ELEC,Blue Ridge Inn Bed and Breakfast - Tesla Destination,477 W First St,,Blue Ridge,GA,30513,706-661-7575  877-798-3752,E,Public,,,,1,0,34.866382,-84.325454,06/10/2022,114003,2023-01-18 15:15:20 UTC,08/11/2016,TESLA,B_AND_B
ELEC,Chateau Elan Winery & Resort - Tesla Destination,100 Rue Charlemagne,,Braselton,GA,30517,678-425-0900  877-798-3752,E,Public,,,,8,0,34.101297,-83.817654,06/10/2022,114004,2023-01-18 15:15:20 UTC,26/02/2015,J1772 TESLA,HOTEL
ELEC,Cheddar's Restaurant - Brunswick - Tesla Destination,551 Canal Rd,,Brunswick,GA,31525,912-275-7384  877-798-3752,E,Public,,,,3,0,31.2348557,-81.4962418,06/10/2022,114005,2023-01-18 15:15:20 UTC,19/09/2017,J1772 TESLA,RESTAURANT
ELEC,Lake Lanier Islands Lodge and Waterpark - Tesla Destination,7000 Lanier Islands Pkwy,,Buford,GA,30518,770-945-8787  877-798-3752,E,Public,,,,14,0,34.178501,-84.03158,06/10/2022,114006,2023-01-18 15:15:20 UTC,20/02/2018,J1772 TESLA,HOTEL
ELEC,Cedartown Museum of Coca-Cola Memorabilia - Tesla Destination,209 Main St,,Cedartown,GA,30125,678-901-0245  877-798-3752,E,Public,,,,12,0,34.01265,-85.254699,06/10/2022,114007,2023-01-18 15:15:20 UTC,14/06/2018,J1772 TESLA,MUSEUM
ELEC,Atlanta Chinatown Mall - Tesla Destination,5383 New Peachtree Rd,,Chamblee,GA,30341,770-458-6660  877-798-3752,E,Public,,,,12,0,33.8903894,-84.3001479,06/10/2022,114008,2023-01-18 15:15:20 UTC,05/12/2017,J1772 TESLA,SHOPPING_MALL
ELEC,The Inn at Serenbe + Farmhouse Restaurant at Serenbe - Tesla Destination,10950 Hutchesons Ferry Rd,,Chatt Hills,GA,30268,770-463-2610  877-798-3752,E,Public,,,,2,0,33.528602,-84.743971,06/10/2022,114009,2023-01-18 15:15:20 UTC,18/02/2015,J1772 TESLA,INN
ELEC,"Glen-Ella Springs, a Select Registry Property - Tesla Destination",1789 Bear Gap Rd,,Clarkesville,GA,30523,706-754-7295  877-798-3752,E,Public,,,,2,0,34.7250279,-83.4535375,06/10/2022,114010,2023-01-18 15:15:20 UTC,02/04/2015,J1772 TESLA,HOTEL
ELEC,Beechwood Inn - Georgia's Premier wine Country Inn - Tesla Destination,220 Beechwood Dr,,Clayton,GA,30525,706-782-5485  877-798-3752,E,Public,,,,1,0,34.871496,-83.396552,06/10/2022,114011,2023-01-18 15:15:20 UTC,23/12/2015,TESLA,INN
ELEC,Yonah Mountain Vineyards - Tesla Destination,1717 Hwy 255 S,,Cleveland,GA,30528,706-878-5522  877-798-3752,E,Public,,,,9,0,34.615371,-83.70197,06/10/2022,114013,2023-01-18 15:15:20 UTC,06/05/2019,TESLA,HOTEL
ELEC,Holiday Inn Atlanta Airport South - Tesla Destination,4669 Airport Blvd,,College Park,GA,30337,404-487-5000  877-798-3752,E,Public,,,,2,0,33.62799,-84.452639,06/10/2022,114014,2023-01-18 15:15:20 UTC,17/04/2017,J1772 TESLA,HOTEL
ELEC,Hilton Garden Inn Columbus - Tesla Destination,1500 Bradley Lake Blvd,,Columbus,GA,31904,706-660-1000  877-798-3752,E,Public,,,,3,0,32.537694,-84.975016,06/10/2022,114015,2023-01-18 15:15:20 UTC,10/07/2017,TESLA,HOTEL
ELEC,Homewood Suites by Hilton Columbus - Tesla Destination,6614 Whittlesey Blvd,,Columbus,GA,31909,706-568-3545  877-798-3752,E,Public,,,,6,0,32.54917,-84.934406,06/10/2022,114016,2023-01-18 15:15:20 UTC,30/11/2017,J1772 TESLA,HOTEL
ELEC,Fairfield Inn & Suites by Marriott Cordele - Tesla Destination,2001 16th Ave E,,Cordele,GA,31015,229-273-0042  877-798-3752,E,Public,,,,5,0,31.960712,-83.7502152,06/10/2022,114017,2023-01-18 15:15:20 UTC,16/03/2018,J1772 TESLA,HOTEL
ELEC,Twelve Oaks Bed & Breakfast - Tesla Destination,2176 Monticello St SW,,Covington,GA,30014,770-385-4005  877-798-3752,E,Public,,,,2,0,33.591998,-83.860383,06/10/2022,114018,2023-01-18 15:15:20 UTC,24/04/2015,J1772 TESLA,B_AND_B
ELEC,The Dahlonega Square Hotel & Villas - Tesla Destination,135 N Chestatee St,,Dahlonega,GA,30533,706-867-1313  877-798-3752,E,Public,,,,3,0,34.53318,-83.986424,06/10/2022,114019,2023-01-18 15:15:20 UTC,15/12/2016,J1772 TESLA,HOTEL
ELEC,Montaluce Winery & Restaurant - Tesla Destination,501 Hightower Church Rd,,Dahlonega,GA,30533,706-867-4060  877-798-3752,E,Public,,,,3,0,34.564973,-84.058426,06/10/2022,114020,2023-01-18 15:15:20 UTC,19/09/2017,J1772 TESLA,BREWERY_DISTILLERY_WINERY
ELEC,Kaya Vineyard & Winery - Tesla Destination,5400 Town Creek Rd,,Dahlonega,GA,30533,706-219-3514  877-798-3752,E,Public,,,,2,0,34.6077551,-83.8578646,06/10/2022,114021,2023-01-18 15:15:20 UTC,14/09/2017,TESLA,BREWERY_DISTILLERY_WINERY
ELEC,Atlanta Motorsports Park - Tesla Destination,20 Duck Thurmond Road,,Dawsonville,GA,30534,678-381-8527  877-798-3752,E,Public,,,,10,0,34.432752,-84.177105,06/10/2022,114022,2023-01-18 15:15:20 UTC,28/06/2016,TESLA,REC_SPORTS_FACILITY
ELEC,Paradise Valley Resort and Club - Tesla Destination,49 Valley Dr,,Dawsonville,GA,30534,706-265-6110  877-798-3752,E,Public,,,,3,0,34.409563,-84.04335,06/10/2022,114023,2023-01-18 15:15:20 UTC,27/02/2017,J1772 TESLA,HOTEL
ELEC,Hampton Inn & Suites Dublin - Tesla Destination,103 Travel Venter Blvd,,Dublin,GA,31021,478-275-2390  877-798-3752,E,Public,,,,2,0,32.486795,-82.937445,06/10/2022,114024,2023-01-18 15:15:20 UTC,06/06/2016,J1772 TESLA,HOTEL
ELEC,Residence Inn Atlanta NE/Duluth Sugarloaf - Tesla Destination,1940 Satellite Blvd,,Duluth,GA,30097,770-814-2929  877-798-3752,E,Public,,,,3,0,33.991634,-84.085065,06/10/2022,114025,2023-01-18 15:15:20 UTC,29/11/2017,J1772 TESLA,HOTEL
ELEC,Courtyard Atlanta NE/Duluth Sugarloaf - Tesla Destination,1948 Satellite Blvd,,Duluth,GA,30097,770-622-6427  877-798-3752,E,Public,,,,4,0,33.991604,-84.085083,06/10/2022,114026,2023-01-18 15:15:20 UTC,17/07/2017,J1772 TESLA,HOTEL
ELEC,Elite Airport Parking - Tesla Destination,3151 Camp Creek Pkwy,,East Point,GA,30344,470-575-5444  877-798-3752,E,Public,,,,12,0,33.653746,-84.492495,06/10/2022,114027,2023-01-18 15:15:20 UTC,14/06/2018,J1772 TESLA,PARKING_LOT
ELEC,Holiday Inn Express Hotel & Suites Atlanta Fairburn - Tesla Destination,7905 Senoia Rd,,Fairburn,GA,30213,678-674-2200  877-798-3752,E,Public,,,,6,0,33.540727,-84.5782672,06/10/2022,114028,2023-01-18 15:15:20 UTC,02/02/2018,J1772 TESLA,HOTEL
ELEC,"The Ritz Carlton Reynolds, Lake Oconee - Tesla Destination",1 Lake Oconee Trl,,Greensboro,GA,30642,706-467-6000  877-798-3752,E,Public,,,,7,0,33.439109,-83.194766,06/10/2022,114029,2023-01-18 15:15:20 UTC,07/06/2017,J1772 TESLA,HOTEL
ELEC,The Creek Club at Reynolds Lake Oconee - Tesla Destination,1100 Creek Club Dr,,Greensboro,GA,30642,706-467-1680  877-798-3752,E,Public,,,,2,0,33.449986,-83.224391,06/10/2022,114030,2023-01-18 15:15:20 UTC,20/12/2017,J1772 TESLA,HOTEL
ELEC,Valhalla Resort Hotel - Tesla Destination,688 Bahn Innsbruck,,Helen,GA,30545,706-878-2200  877-798-3752,E,Public,,,,3,0,34.705966,-83.714718,06/10/2022,114031,2023-01-18 15:15:20 UTC,06/09/2017,J1772 TESLA,HOTEL
ELEC,The Westin Jekyll Island - Tesla Destination,110 Ocean Way,,Jekyll Island,GA,31527,912-635-4545  877-798-3752,E,Public,,,,8,0,31.046057,-81.411542,06/10/2022,114032,2023-01-18 15:15:20 UTC,16/04/2018,J1772 TESLA,HOTEL
ELEC,The Georgia Sea Turtle Center - Tesla Destination,214 Stable Rd,,Jekyll Island,GA,31527,912-635-4444  877-798-3752,E,Public,,,,6,0,31.0598463,-81.4197261,06/10/2022,114033,2023-01-18 15:15:20 UTC,26/02/2018,J1772 TESLA,MUSEUM
ELEC,Hampton Inn & Suites Jekyll Island - Tesla Destination,220 S Beachview Dr,,Jekyll Island,GA,31527,912-635-3733  877-798-3752,E,Public,,,,8,0,31.0336251,-81.4163031,06/10/2022,114034,2023-01-18 15:15:20 UTC,05/07/2018,J1772 TESLA,HOTEL
ELEC,Jekyll Island Club Resort - Tesla Destination,371 Riverview Dr,,Jekyll Island,GA,31527,855-535-9547  877-798-3752,E,Public,,,,6,0,31.0593778,-81.4221865,06/10/2022,114035,2023-01-18 15:15:20 UTC,26/02/2018,J1772 TESLA,HOTEL
ELEC,Jekyll Island Convention Center - Tesla Destination,75 Beachview Drive North,,Jekyll Island,GA,31527,912-635-6400  877-798-3752,E,Public,,,,10,0,31.0484859,-81.4113314,06/10/2022,114036,2023-01-18 15:15:20 UTC,26/02/2018,J1772 TESLA,HOTEL
ELEC,European Collision Repair-Jonesboro - Tesla Destination,1934 Hwy 85,,Jonesboro,GA,30238,678-817-4722  877-798-3752,E,Public,,,,1,0,33.51505,-84.429233,06/10/2022,114038,2023-01-18 15:15:20 UTC,24/11/2015,TESLA,AUTO_REPAIR
ELEC,Hawthorne Global Aviation Services - Tesla Destination,1723 McCollum Pkwy NW,,Kennesaw,GA,30127,770-422-4300  877-798-3752,E,Public,,,,3,0,34.0153,-84.601344,06/10/2022,114039,2023-01-18 15:15:20 UTC,03/10/2016,TESLA,OFFICE_BLDG
ELEC,Embassy Suites by Hilton Atlanta Kennesaw Town Ctr - Tesla Destination,620 Chastain Rd NW,,Kennesaw,GA,30144,770-420-2505  877-798-3752,E,Public,,,,4,0,34.038202,-84.569349,06/10/2022,114040,2023-01-18 15:15:20 UTC,20/02/2018,J1772 TESLA,HOTEL
ELEC,Hilton Garden Inn Atlanta NW/Kennesaw Town Center - Tesla Destination,895 Cobb Pl Blvd NW,,Kennesaw,GA,30144,678-322-1140  877-798-3752,E,Public,,,,2,0,34.010854,-84.574979,06/10/2022,114041,2023-01-18 15:15:20 UTC,17/07/2017,TESLA,HOTEL
ELEC,Homewood Suites by Hilton Atlanta NW-Kennesaw - Tesla Destination,905 Cobb Pl Blvd NW,,Kennesaw,GA,30144,678-354-2800  877-798-3752,E,Public,,,,6,0,34.011213,-84.575745,06/10/2022,114042,2023-01-18 15:15:20 UTC,22/01/2018,J1772 TESLA,HOTEL
ELEC,Hawthorn Suites by Wyndham Kingsland - Tesla Destination,1323 E King Ave,,Kingsland,GA,31548,912-882-4170  877-798-3752,E,Public,,,,2,0,30.791597,-81.654403,06/10/2022,114043,2023-01-18 15:15:20 UTC,20/01/2017,TESLA,HOTEL
ELEC,Great Wolf Lodge Georgia - Tesla Destination,150 Tom Hall Pkwy,,LaGrange,GA,30240,844-473-9653  877-798-3752,E,Public,,,,6,0,32.99466,-85.02515,06/10/2022,114044,2023-01-18 15:15:20 UTC,05/09/2018,J1772 TESLA,HOTEL
ELEC,Courtyard by Marriott La Grange - Tesla Destination,25 W LaFayette Sq,,LaGrange,GA,30240,706-668-5600  877-798-3752,E,Public,,,,4,0,33.038755,-85.0326898,06/10/2022,114045,2023-01-18 15:15:20 UTC,19/01/2018,J1772 TESLA,HOTEL
ELEC,Holiday Inn Express Lithia Springs - Tesla Destination,850 Crestmark Dr,,Lithia Springs,GA,30122,770-941-5384  877-798-3752,E,Public,,,,6,0,33.7806816,-84.6097451,06/10/2022,114046,2023-01-18 15:15:20 UTC,04/12/2017,J1772 TESLA,HOTEL
ELEC,Hilton Garden Inn Atlanta East/Stonecrest - Tesla Destination,78990 Mall Ring Rd,,Lithonia,GA,30038,678-526-1000  877-798-3752,E,Public,,,,2,0,33.700929,-84.099336,06/10/2022,114047,2023-01-18 15:15:20 UTC,30/11/2015,J1772 TESLA,HOTEL
ELEC,Chanticleer Inn Bed & Breakfast - Tesla Destination,1300 Mockingbird Lane,,Lookout Mountain,GA,30750,706-820-6221  877-798-3752,E,Public,,,,3,0,34.97548,-85.3507081,06/10/2022,114048,2023-01-18 15:15:20 UTC,17/04/2015,J1772 TESLA,B_AND_B
ELEC,Burke Mansion - Tesla Destination,1085 Georgia Ave,,Macon,GA,31201,478-238-1731  877-798-3752,E,Public,,,,2,0,32.841256,-83.636497,06/10/2022,114049,2023-01-18 15:15:20 UTC,07/06/2016,J1772 TESLA,HOTEL
ELEC,"1842 Inn, a Select Registry Property - Tesla Destination",353 College St,,Macon,GA,31201,478-741-1842  877-798-3752,E,Public,,,,2,0,32.8419782,-83.6383323,06/10/2022,114050,2023-01-18 15:15:20 UTC,21/04/2015,J1772 TESLA,INN
ELEC,SpringHill Suites by Marriott Macon - Tesla Destination,4630 Sheraton Dr,,Macon,GA,31210,478-803-9100  877-798-3752,E,Public,,,,4,0,32.919321,-83.706463,06/10/2022,114051,2023-01-18 15:15:20 UTC,22/05/2017,J1772 TESLA,HOTEL
ELEC,Tru by Hilton Atlanta/McDonough - Tesla Destination,251 Avalon Ct,,McDonough,GA,30253,678-809-9444  877-798-3752,E,Public,,,,6,0,33.424652,-84.179568,06/10/2022,114053,2023-01-18 15:15:20 UTC,17/05/2018,J1772 TESLA,HOTEL
ELEC,Home2 Suites Atlanta South/McDonough - Tesla Destination,60 Mill Rd,,McDonough,GA,30253,678-369-2527  877-798-3752,E,Public,,,,2,0,33.460018,-84.21585,06/10/2022,114054,2023-01-18 15:15:20 UTC,17/07/2017,J1772 TESLA,HOTEL
ELEC,Fairfield Inn & Suites by Marriott Milledgeville - Tesla Destination,2631 N Columbia St,,Milledgeville,GA,31061,478-452-5202  877-798-3752,E,Public,,,,9,0,33.1287561,-83.265203,06/10/2022,114056,2023-01-18 15:15:20 UTC,16/03/2018,J1772 TESLA,HOTEL
ELEC,Home2 Suites by Hilton Newnan - Tesla Destination,4551 McIntosh Pkwy,,Newnan,GA,30263,770-400-8830  877-798-3752,E,Public,,,,2,0,33.383313,-84.765432,06/10/2022,114057,2023-01-18 15:15:20 UTC,06/02/2017,TESLA,HOTEL
ELEC,Crowne Plaza Atlanta SW - Peachtree City - Tesla Destination,201 Aberdeen Pkwy,,Peachtree City,GA,30269,770-487-2666  877-798-3752,E,Public,,,,4,0,33.4058654,-84.5947892,06/10/2022,114058,2023-01-18 15:15:20 UTC,06/02/2018,J1772 TESLA,HOTEL
ELEC,Hilton Garden Inn Atlanta/Peachtree City - Tesla Destination,2010 Commerce Dr N,,Peachtree City,GA,30269,678-827-8400  877-798-3752,E,Public,,,,4,0,33.4049704,-84.5980861,06/10/2022,114059,2023-01-18 15:15:20 UTC,05/02/2018,J1772 TESLA,HOTEL
ELEC,Royal Cinemas - Tesla Destination,5 Towne Center Ct,,Pooler,GA,31322,912-988-4025  877-798-3752,E,Public,,,,5,0,32.146895,-81.25244,06/10/2022,114060,2023-01-18 15:15:20 UTC,30/04/2018,J1772 TESLA,OTHER_ENTERTAINMENT
ELEC,York House Inn - Tesla Destination,416 York House Rd,,Rabun Gap,GA,30568,706-746-2068  877-798-3752,E,Public,,,,2,0,34.9374316,-83.3831738,06/10/2022,114061,2023-01-18 15:15:20 UTC,21/04/2016,J1772 TESLA,INN
ELEC,Museum of Flight - Tesla Destination,304 Russell Field Rd NE,,Rome,GA,30165,423-228-2359  877-798-3752,E,Public,,,,2,0,35.189909,-85.173093,06/10/2022,114062,2023-01-18 15:15:20 UTC,06/10/2016,TESLA,MUSEUM
ELEC,Hampton Inn & Suites Rome - Tesla Destination,875 W 1st ST NW,,Rome,GA,30161,706-622-5631  877-798-3752,E,Public,,,,1,0,34.258126,-85.165391,06/10/2022,114063,2023-01-18 15:15:20 UTC,15/03/2016,TESLA,HOTEL
ELEC,DoubleTree by Hilton Hotel Atlanta - Roswell - Tesla Destination,1075 Holcomb Bridge Rd,,Roswell,GA,30076,770-992-9600  877-798-3752,E,Public,,,,1,0,34.021851,-84.330059,06/10/2022,114064,2023-01-18 15:15:20 UTC,04/05/2016,TESLA,HOTEL
ELEC,European Collision Repair-Sandy Springs - Tesla Destination,8655 Roswell Rd,,Sandy Springs,GA,30350,678-973-4379  877-798-3752,E,Public,,,,1,0,33.991767,-84.351229,06/10/2022,114065,2023-01-18 15:15:20 UTC,18/11/2015,TESLA,AUTO_REPAIR
ELEC,Lucille's Mountain Top Inn & Spa - Tesla Destination,964 Rabun Rd,,Sautee Nacoochee,GA,30571,706-878-5055  877-798-3752,E,Public,,,,2,0,34.692831,-83.681681,06/10/2022,114066,2023-01-18 15:15:20 UTC,08/04/2015,J1772 TESLA,HOTEL
ELEC,Fairfield Inn and Suites Savannah Airport - Tesla Destination,10 Stephen S Green Dr,,Savannah,GA,31408,912-965-9777  877-798-3752,E,Public,,,,4,0,32.139921,-81.236427,06/10/2022,114068,2023-01-18 15:15:20 UTC,13/03/2018,J1772 TESLA,HOTEL
ELEC,Bryan Street Garage - Tesla Destination,100 E Bryan St,,Savannah,GA,31401,912-651-6477  877-798-3752,E,Public,,,,4,0,32.079988,-81.089785,06/10/2022,114069,2023-01-18 15:15:20 UTC,24/05/2018,J1772 TESLA,PARKING_GARAGE
ELEC,State Street Garage - Tesla Destination,100 E State St,,Savannah,GA,31401,912-651-6473  877-798-3752,E,Public,,,,4,0,32.078011,-81.090948,06/10/2022,114070,2023-01-18 15:15:20 UTC,24/05/2018,J1772 TESLA,PARKING_GARAGE
ELEC,Robinson Parking Garage - Tesla Destination,132 Montgomery St,,Savannah,GA,31401,912-651-6478  877-798-3752,E,Public,,,,4,0,32.078883,-81.096295,06/10/2022,114071,2023-01-18 15:15:20 UTC,23/05/2018,J1772 TESLA,PARKING_GARAGE
ELEC,"Azalea Inn & Villas, a Select Registry Property - Tesla Destination",217 E Huntingdon St,,Savannah,GA,31401,912-236-6080  877-798-3752,E,Public,,,,2,0,32.0682392,-81.0925612,06/10/2022,114072,2023-01-18 15:15:20 UTC,07/04/2015,J1772 TESLA,INN
ELEC,Liberty Street Parking Garage - Tesla Destination,401 W Liberty St,,Savannah,GA,31401,912-644-5934  877-798-3752,E,Public,,,,4,0,32.075561,-81.09798,06/10/2022,114073,2023-01-18 15:15:20 UTC,24/05/2018,J1772 TESLA,PARKING_GARAGE
ELEC,"The BRICE, A Kimpton Hotel - Tesla Destination",601 E Bay St,,Savannah,GA,31401,912-238 1200  877-798-3752,E,Public,,,,3,0,32.078708,-81.08522,06/10/2022,114074,2023-01-18 15:15:20 UTC,09/05/2016,J1772 TESLA,HOTEL
ELEC,Whitaker Street Parking Garage - Tesla Destination,7 Whitaker St,,Savannah,GA,31401,912-525-2820  877-798-3752,E,Public,,,,4,0,32.080999,-81.092436,06/10/2022,114075,2023-01-18 15:15:20 UTC,24/05/2018,J1772 TESLA,PARKING_GARAGE
ELEC,Mansion on Forsyth Park - Tesla Destination,700 Drayton St,,Savannah,GA,31401,912-238-5158  877-798-3752,E,Public,,,,3,0,32.067258,-81.094412,06/10/2022,114076,2023-01-18 15:15:20 UTC,16/03/2016,J1772 TESLA,HOTEL
ELEC,The Cloister at Sea Island - Tesla Destination,100 Cloister Dr,,Sea Island,GA,31561,888-732-4752  877-798-3752,E,Public,,,,2,0,31.181406,-81.349942,06/10/2022,114077,2023-01-18 15:15:20 UTC,10/06/2015,J1772 TESLA,HOTEL
ELEC,"Spencer House Inn, a Select Registry Property - Tesla Destination",101 East Bryant St,,St Marys,GA,31558,912-882-1872  877-798-3752,E,Public,,,,2,0,30.721805,-81.547885,06/10/2022,114078,2023-01-18 15:15:20 UTC,02/03/2015,J1772 TESLA,INN
ELEC,The Lodge on Little St. Simons Island - Tesla Destination,1000 Hampton River Club Marina Dr,,St Simons Island,GA,31522,888-733-5774  877-798-3752,E,Public,,,,2,0,31.294609,-81.344733,06/10/2022,114079,2023-01-18 15:15:20 UTC,08/06/2015,J1772 TESLA,HOTEL
ELEC,Hampton Inn St. Simons Island - Tesla Destination,2204 Old Demere Rd,,St Simons Island,GA,31522,912-634-2204  877-798-3752,E,Public,,,,6,0,31.1603633,-81.3900545,06/10/2022,114081,2023-01-18 15:15:20 UTC,08/05/2018,J1772 TESLA,HOTEL
ELEC,King and Prince Beach & Golf Resort - Tesla Destination,201 Arnold Rd,,St. Simons Island,GA,31522,912-638-3631  877-798-3752,E,Public,,,,2,0,31.139504,-81.379431,06/10/2022,114083,2023-01-18 15:15:20 UTC,27/01/2017,TESLA,HOTEL
ELEC,Atlanta Evergreen Marriott Conference Resort - Tesla Destination,4021 Lakeview Dr,,Stone Mountain,GA,30083,770-879-9900  877-798-3752,E,Public,,,,3,0,33.798495,-84.130427,06/10/2022,114084,2023-01-18 15:15:20 UTC,07/08/2017,J1772 TESLA,HOTEL
ELEC,Hilton Garden Inn Tifton - Tesla Destination,201 Boo Dr,,Tifton,GA,31793,229-382-8484  877-798-3752,E,Public,,,,2,0,31.447475,-83.534205,06/10/2022,114085,2023-01-18 15:15:20 UTC,01/12/2016,TESLA,HOTEL
ELEC,Holiday Inn Express Tifton - Tesla Destination,814 7th St W,,Tifton,GA,31794,229-382-3300  877-798-3752,E,Public,,,,6,0,31.4493381,-83.5267192,06/10/2022,114086,2023-01-18 15:15:20 UTC,14/05/2018,J1772 TESLA,HOTEL
ELEC,Holiday Inn Express Hotel & Suites Valdosta West - Tesla Destination,1330 St Augustine Rd,,Valdosta,GA,31601,229-249-8900  877-798-3752,E,Public,,,,6,0,30.8422962,-83.3287993,06/10/2022,114088,2023-01-18 15:15:20 UTC,07/05/2018,J1772 TESLA,HOTEL
ELEC,Comfort Suites Valdosta - Tesla Destination,1332 St. Augustine Rd,,Valdosta,GA,31601,229-249-8880  877-798-3752,E,Public,,,,8,0,30.8417625,-83.3288373,06/10/2022,114089,2023-01-18 15:15:20 UTC,21/05/2018,J1772 TESLA,HOTEL
ELEC,Comfort Inn & Suites Valdosta - Tesla Destination,1785 W Hill Ave,,Valdosta,GA,31601,229-249-1000  877-798-3752,E,Public,,,,4,0,30.8201035,-83.3090492,06/10/2022,114090,2023-01-18 15:15:20 UTC,02/05/2018,J1772 TESLA,HOTEL
ELEC,Courtyard by Marriott Warner Robins - Tesla Destination,589 Carl Vinson Pkwy,,Warner Robbins,GA,31088,478-602-6200  877-798-3752,E,Public,,,,4,0,32.616857,-83.670379,06/10/2022,114091,2023-01-18 15:15:20 UTC,17/07/2017,J1772 TESLA,HOTEL
ELEC,Candlewood Suites Warner Robins/Robins AFB - Tesla Destination,110 Willie Lee Pkwy,,Warner Robins,GA,31088,478-333-6850  877-798-3752,E,Public,,,,6,0,32.6148165,-83.6947921,06/10/2022,114092,2023-01-18 15:15:20 UTC,05/02/2018,J1772 TESLA,HOTEL
ELEC,Fairfield Inn & Suites by Marriott Warner Robins - Tesla Destination,221 Margie Dr,,Warner Robins,GA,31088,478-953-4200  877-798-3752,E,Public,,,,7,0,32.6148899,-83.6906001,06/10/2022,114093,2023-01-18 15:15:20 UTC,05/02/2018,J1772 TESLA,HOTEL
ELEC,Holiday Inn Express & Suites Warner Robins - Tesla Destination,4020 Watson Blvd,,Warner Robins,GA,31093,478-333-2737  877-798-3752,E,Public,,,,8,0,32.6166443,-83.6990012,06/10/2022,114094,2023-01-18 15:15:20 UTC,05/02/2018,J1772 TESLA,HOTEL
ELEC,Tellus Science Museum - Tesla Destination,100 Tellus Dr,,White,GA,30184,770-606-5700  877-798-3752,E,Public,,,,3,0,34.241831,-84.770259,06/10/2022,114095,2023-01-18 15:15:20 UTC,22/10/2015,J1772 TESLA,MUSEUM
ELEC,Brasstown Valley Resort and Spa - Tesla Destination,6321 US-76,,Young Harris,GA,30582,706-379-9900  877-798-3752,E,Public,,,,2,0,34.9526059,-83.8379768,06/10/2022,114096,2023-01-18 15:15:20 UTC,06/09/2018,TESLA,HOTEL
ELEC,Bunn House Boutique Hotel - Tesla Destination,15 Clayton St,,Asheville,NC,28801,828-333-8700  877-798-3752,E,Public,,,,2,0,35.601686,-82.549146,06/10/2022,114639,2023-01-18 15:15:20 UTC,19/09/2016,J1772 TESLA,HOTEL
ELEC,DoubleTree by Hilton Asheville Downtown - Tesla Destination,199 Haywood St,,Asheville,NC,28801,828-505-8500  877-798-3752,E,Public,,,,3,0,35.596138,-82.559747,06/10/2022,114640,2023-01-18 15:15:20 UTC,22/11/2021,J1772 TESLA,HOTEL
ELEC,The Omni Grove Park Inn - Tesla Destination,290 Macon Ave,,Asheville,NC,28804,828-252-2711  877-798-3752,E,Public,,,,2,0,35.620754,-82.542186,06/10/2022,114641,2023-01-18 15:15:20 UTC,03/03/2016,TESLA,HOTEL
ELEC,"Albemarle Inn, a Select Registry Property - Tesla Destination",86 Edgemont Rd,,Asheville,NC,28801,828-255-0027  877-798-3752,E,Public,,,,3,0,35.614854,-82.541825,06/10/2022,114642,2023-01-18 15:15:20 UTC,24/04/2015,J1772 TESLA,INN
ELEC,Grand Bohemian Hotel Asheville - Tesla Destination,11 Boston Wy,,Asheville,NC,28803,828-505-2949  877-798-3752,E,Public,,,,3,0,35.566805,-82.544006,06/10/2022,114643,2023-01-18 15:15:20 UTC,16/11/2016,J1772 TESLA,HOTEL
ELEC,The Mast Farm Inn - Tesla Destination,2543 Broadstone Rd,,Banner Elk,NC,28604,828-963-5857  877-798-3752,E,Public,,,,2,0,36.2070886,-81.7715921,06/10/2022,114644,2023-01-18 15:15:20 UTC,28/11/2016,J1772 TESLA,INN
ELEC,Pecan Tree Inn - Tesla Destination,116 Queen St,,Beaufort,NC,28516,252-728-6733  877-798-3752,E,Public,,,,2,0,34.716518,-76.662908,06/10/2022,114645,2023-01-18 15:15:20 UTC,22/06/2016,J1772 TESLA,INN
ELEC,The Boathouse at Front Street Village - Tesla Destination,2400 Lennoxville Rd,,Beaufort,NC,28516,252-504-4799  877-798-3752,E,Public,,,,4,0,34.710116,-76.632036,06/10/2022,114646,2023-01-18 15:15:20 UTC,12/08/2015,J1772 TESLA,PARK
ELEC,Old Stone Steakhouse - Tesla Destination,23 S Main St,,Belmont,NC,28012,704-825-9995  877-798-3752,E,Public,,,,2,0,35.241715,-81.037882,06/10/2022,114647,2023-01-18 15:15:20 UTC,15/05/2017,TESLA,RESTAURANT
ELEC,Hampton Inn Benson - Tesla Destination,100 Water Place Lndg,,Benson,NC,27504,919-701-8000  877-798-3752,E,Public,,,,2,0,35.374259,-78.541779,06/10/2022,114648,2023-01-18 15:15:20 UTC,30/05/2018,TESLA,HOTEL
ELEC,Hemlock Inn - Tesla Destination,134 Morris St,,Blowing Rock,NC,28605,828-295-0091  877-798-3752,E,Public,,,,2,0,36.131495,-81.67785,06/10/2022,114649,2023-01-18 15:15:20 UTC,09/05/2017,J1772 TESLA,INN
ELEC,Chetola Resort at Blowing Rock - Tesla Destination,185 Chetola Lake Dr,,Blowing Rock,NC,28605,828-295-5500  877-798-3752,E,Public,,,,3,0,36.139501,-81.673121,06/10/2022,114650,2023-01-18 15:15:20 UTC,05/12/2016,J1772 TESLA,HOTEL
ELEC,The Inn at Ragged Gardens / Best Cellar Restaurant - Tesla Destination,203 Sunset Dr,,Blowing Rock,NC,28605,828-295-9703  877-798-3752,E,Public,,,,2,0,36.133358,-81.676381,06/10/2022,114651,2023-01-18 15:15:20 UTC,29/11/2016,J1772 TESLA,INN
ELEC,Mountainaire Inn & Log Cabins - Tesla Destination,827 Main St,,Blowing Rock,NC,28605,828-295-7991  877-798-3752,E,Public,,,,1,0,36.135234,-81.677183,06/10/2022,114652,2023-01-18 15:15:20 UTC,16/06/2016,TESLA,INN
ELEC,Makoto's Japanese Steakhouse & Sushi Bar - Tesla Destination,2124 Blowing Rock Rd,,Boone,NC,28607,828-264-7977  877-798-3752,E,Public,,,,2,0,36.195272,-81.654462,06/10/2022,114654,2023-01-18 15:15:20 UTC,28/05/2015,J1772 TESLA,RESTAURANT
ELEC,Brevard College - Appalachian Coffee Company - Tesla Destination,135 East French Broad St,,Brevard,NC,28712,828-883-8292  877-798-3752,E,Public,,,,3,0,35.23576,-82.730093,06/10/2022,114655,2023-01-18 15:15:20 UTC,09/11/2015,J1772 TESLA,COLLEGE_CAMPUS
ELEC,Brevard College - Sims Art Center - Tesla Destination,55 East Campus Dr,,Brevard,NC,28712,828-883-8292  877-798-3752,E,Public,,,,2,0,35.238498,-82.729392,06/10/2022,114656,2023-01-18 15:15:20 UTC,20/01/2016,J1772 TESLA,COLLEGE_CAMPUS
ELEC,"Country Inn & Suites - Burlington, NC - Tesla Destination",3211 Wilson Dr,,Burlington,NC,27215,336-584-1115  877-798-3752,E,Public,,,,2,0,36.067842,-79.502316,06/10/2022,114657,2023-01-18 15:15:20 UTC,05/10/2015,J1772 TESLA,HOTEL
ELEC,The Inn on Pamlico Sound - Tesla Destination,49684 Hwy 12,,Buxton,NC,27920,252-995-7030  877-798-3752,E,Public,,,,2,0,35.262552,-75.569361,06/10/2022,114658,2023-01-18 15:15:20 UTC,02/12/2014,J1772 TESLA,INN
ELEC,Carteret Crossing Shopping Center - Tesla Destination,313 WB McLean Dr,,Cape Carteret,NC,28584,910-239-5580  877-798-3752,E,Public,,,,2,0,34.69077,-77.067127,06/10/2022,114659,2023-01-18 15:15:20 UTC,16/09/2016,TESLA,SHOPPING_CENTER
ELEC,The Umstead Hotel and Spa - Tesla Destination,100 Woodland Pond Dr,,Cary,NC,27513,919-447-4000  877-798-3752,E,Public,,,,1,0,35.82945,-78.76476,06/10/2022,114660,2023-01-18 15:15:20 UTC,02/09/2015,TESLA,HOTEL
ELEC,The Mayton Inn - Tesla Destination,301 S Academy St,,Cary,NC,27511,919-670-5000  877-798-3752,E,Public,,,,3,0,35.784968,-78.780676,06/10/2022,114661,2023-01-18 15:15:20 UTC,21/03/2016,J1772 TESLA,INN
ELEC,The Ugly Dog Public House - Cashiers - Tesla Destination,25 Frank Allen Rd,,Cashiers,NC,28717,828-743-3000  877-798-3752,E,Public,,,,2,0,35.111098,-83.099145,06/10/2022,114662,2023-01-18 15:15:20 UTC,01/02/2016,J1772 TESLA,RESTAURANT
ELEC,The Inn at Governors Club - Tesla Destination,11470 Club Dr,,Chapel Hill,NC,27517,919-360-5321  877-798-3752,E,Public,,,,2,0,35.846885,-79.041415,06/10/2022,114664,2023-01-18 15:15:20 UTC,06/11/2015,J1772 TESLA,INN
ELEC,The Carolina Inn - Tesla Destination,211 Pittsboro St,,Chapel Hill,NC,27516,919-933-2001  877-798-3752,E,Public,,,,2,0,35.909583,-79.054686,06/10/2022,114665,2023-01-18 15:15:20 UTC,09/12/2015,J1772 TESLA,INN
ELEC,"The Franklin Hotel Chapel Hill, Curio Collection - Tesla Destination",311 W Franklin St,,Chapel Hill,NC,27516,919-442-9000  877-798-3752,E,Public,,,,8,0,35.911118,-79.060128,06/10/2022,114666,2023-01-18 15:15:20 UTC,30/11/2017,J1772 TESLA,HOTEL
ELEC,SpringHill Suites Charlotte Ballantyne Area - Tesla Destination,12325 Johnston Rd,,Charlotte,NC,28277,704-817-1500  877-798-3752,E,Public,,,,4,0,35.070875,-80.842091,06/10/2022,114667,2023-01-18 15:15:20 UTC,20/04/2016,J1772 TESLA,HOTEL
ELEC,Aloft Charlotte Ballantyne - Tesla Destination,13139 Ballantyne Corporate Pl,,Charlotte,NC,28277,704-247-2222  877-798-3752,E,Public,,,,3,0,35.0582012,-80.8446616,06/10/2022,114668,2023-01-18 15:15:20 UTC,15/01/2018,J1772 TESLA,HOTEL
ELEC,Embassy Suites Charlotte Ayrsley - Tesla Destination,1917 Ayrsley Town Blvd,,Charlotte,NC,28273,704-970-5400  877-798-3752,E,Public,,,,2,0,35.136731,-80.92999,06/10/2022,114669,2023-01-18 15:15:20 UTC,11/04/2017,TESLA,HOTEL
ELEC,Homewood Suites Charlotte Ayresly - Tesla Destination,1921 Ayrsley Town Blvd,,Charlotte,NC,28273,704-970-5500  877-798-3752,E,Public,,,,2,0,35.137302,-80.931188,06/10/2022,114670,2023-01-18 15:15:20 UTC,17/07/2017,TESLA,HOTEL
ELEC,Hyatt Place Charlotte Downtown - Tesla Destination,222 S Caldwell St,,Charlotte,NC,28202,704-227-0500  877-798-3752,E,Public,,,,2,0,35.222575,-80.841084,06/10/2022,114671,2023-01-18 15:15:20 UTC,16/06/2017,J1772 TESLA,HOTEL
ELEC,Renaissance Charlotte Suites Hotel - Tesla Destination,2800 Coliseum Centre Dr,,Charlotte,NC,28217,704-357-1414  877-798-3752,E,Public,,,,2,0,35.188152,-80.914969,06/10/2022,114672,2023-01-18 15:15:20 UTC,17/07/2017,J1772 TESLA,HOTEL
ELEC,Wingate By Wyndham Charlotte Airport I-85/I-485 - Tesla Destination,4238 Business Center Dr,,Charlotte,NC,28214,704-395-3600  877-798-3752,E,Public,,,,3,0,35.242709,-80.939556,06/10/2022,114673,2023-01-18 15:15:20 UTC,17/07/2017,J1772 TESLA,HOTEL
ELEC,Le Meridien Charlotte Hotel - Tesla Destination,555 S McDowell St,,Charlotte,NC,28204,704-362-9710  877-798-3752,E,Public,,,,2,0,35.216778,-80.837748,06/10/2022,114674,2023-01-18 15:15:20 UTC,03/01/2017,TESLA,HOTEL
ELEC,Crowne Plaza Charlotte Executive Park - Tesla Destination,5700 Westpark Dr,,Charlotte,NC,28217,704-527-9650  877-798-3752,E,Public,,,,6,0,35.159454,-80.889803,06/10/2022,114675,2023-01-18 15:15:20 UTC,10/01/2018,J1772 TESLA,HOTEL
ELEC,DoubleTree by Hilton Hotel Charlotte - Tesla Destination,895 W Trade St,,Charlotte,NC,28202,704-347-0070  877-798-3752,E,Public,,,,3,0,35.233065,-80.851861,06/10/2022,114676,2023-01-18 15:15:20 UTC,02/10/2017,J1772 TESLA,HOTEL
ELEC,Residence Inn & Courtyard by Marriott Charlotte Nort - Tesla Destination,9110 Harris Corners Pkwy,,Charlotte,NC,28208,704-719-9444  877-798-3752,E,Public,,,,2,0,35.346241,-80.842233,06/10/2022,114677,2023-01-18 15:15:20 UTC,28/08/2018,TESLA,HOTEL
ELEC,Cherokee Welcome Center - Tesla Destination,498 Tsali Blvd,,Cherokee,NC,28719,800-438-1601  877-798-3752,E,Public,,,,1,0,35.483174,-83.316004,06/10/2022,114678,2023-01-18 15:15:20 UTC,14/03/2016,TESLA,PARK
ELEC,Western Carolina University - Lot 30 - Tesla Destination,320 Memorial Dr,,Cullowhee,NC,28723,828-227-7411  877-798-3752,E,Public,,,,1,0,35.310532,-83.18503649,06/10/2022,114679,2023-01-18 15:15:20 UTC,06/06/2017,TESLA,COLLEGE_CAMPUS
ELEC,The Waterfront Shops - Tesla Destination,1240 Duck Rd,,Duck,NC,27949,252-256-0550  877-798-3752,E,Public,,,,4,0,36.1700359,-75.7567885,06/10/2022,114680,2023-01-18 15:15:20 UTC,18/10/2017,TESLA,SHOPPING_CENTER
ELEC,Sanderling Resort - Tesla Destination,1461 Duck Rd,,Duck,NC,27949,855-412-7866  877-798-3752,E,Public,,,,3,0,36.223442,-75.770782,06/10/2022,114681,2023-01-18 15:15:20 UTC,22/08/2017,J1772 TESLA,HOTEL
ELEC,Arrowhead Inn Bed & Breakfast - Tesla Destination,106 Mason Rd,,Durham,NC,27712,919-477-8430  877-798-3752,E,Public,,,,2,0,36.11826,-78.903672,06/10/2022,114682,2023-01-18 15:15:20 UTC,27/04/2015,J1772 TESLA,B_AND_B
ELEC,The King's Daughters Inn - Tesla Destination,204 N Buchanan Blvd,,Durham,NC,27701,877-534-8534  877-798-3752,E,Public,,,,3,0,36.003871,-78.91213,06/10/2022,114683,2023-01-18 15:15:20 UTC,18/11/2015,J1772 TESLA,INN
ELEC,Homewood Suites by Hilton Durham-Chapel Hill - Tesla Destination,3600 Mt. Moriah Rd,,Durham,NC,27707,919-401-0610  877-798-3752,E,Public,,,,2,0,35.949499,-78.995446,06/10/2022,114684,2023-01-18 15:15:20 UTC,09/11/2015,J1772 TESLA,HOTEL
ELEC,Elon University Inman Admissions Welcome Center - Tesla Destination,100 Campus Dr,,Elon,NC,27244,336-278-3566  877-798-3752,E,Public,,,,1,0,36.104778,-79.50363,06/10/2022,114685,2023-01-18 15:15:20 UTC,15/07/2015,TESLA,COLLEGE_CAMPUS
ELEC,Best Western Plus Greensboro Airport Hotel - Tesla Destination,7800 National Service Rd,,Greensboro,NC,27409,336-454-0333  877-798-3752,E,Public,,,,5,0,36.077033,-79.959879,06/10/2022,114686,2023-01-18 15:15:20 UTC,12/03/2018,J1772 TESLA,HOTEL
ELEC,Pinebrook Manor - Tesla Destination,2701 Kanuga Road,,Hendersonville,NC,28739,828-698-2707  877-798-3752,E,Public,,,,1,0,35.2793994,-82.4888109,06/10/2022,114687,2023-01-18 15:15:20 UTC,17/06/2015,TESLA,HOTEL
ELEC,200 Main - Tesla Destination,200 Main St,,Highlands,NC,28741,855-271-2809  877-798-3752,E,Public,,,,2,0,35.054647,-83.201175,06/10/2022,114688,2023-01-18 15:15:20 UTC,03/11/2017,J1772 TESLA,HOTEL
ELEC,The Ugly Dog Public House - Highlands - Tesla Destination,420 Spring St,,Highlands,NC,28741,828-526-8364  877-798-3752,E,Public,,,,2,0,35.050994,-83.197429,06/10/2022,114689,2023-01-18 15:15:20 UTC,24/08/2015,J1772 TESLA,RESTAURANT
ELEC,Old Edwards Inn and Spa - Tesla Destination,445 Main St,,Highlands,NC,28741,828-526-8008  877-798-3752,E,Public,,,,2,0,35.052297,-83.196938,06/10/2022,114690,2023-01-18 15:15:20 UTC,13/02/2015,J1772 TESLA,INN
ELEC,Holiday Inn Express & Suites Concord - Tesla Destination,2491 Wonder Dr NE,,Kannapolis,NC,28083,704-743-1080  877-798-3752,E,Public,,,,5,0,35.4640148,-80.5893789,06/10/2022,114691,2023-01-18 15:15:20 UTC,05/10/2017,J1772 TESLA,HOTEL
ELEC,Outer Banks Brewing Station - Tesla Destination,600 S Croatan Hwy,,Kill Devil Hills,NC,27948,252-449-2739  877-798-3752,E,Public,,,,3,0,36.009476,-75.659455,06/10/2022,114692,2023-01-18 15:15:20 UTC,30/10/2017,J1772 TESLA,BREWERY_DISTILLERY_WINERY
ELEC,Roanoke Island Inn - Tesla Destination,305 Fernando St,,Manteo,NC,27954,252-473-5511  877-798-3752,E,Public,,,,1,0,35.907631,-75.67063,06/10/2022,114693,2023-01-18 15:15:20 UTC,24/08/2016,TESLA,INN
ELEC,Holiday Inn Express Mooresville - Lake Norman - Tesla Destination,1300 Norman Station Blvd,,Mooresville,NC,28115,704-662-6900  877-798-3752,E,Public,,,,4,0,35.590989,-80.857206,06/10/2022,114694,2023-01-18 15:15:20 UTC,07/06/2017,J1772 TESLA,HOTEL
ELEC,Hilton Garden Inn Charlotte/Mooresville - Tesla Destination,159 Gateway Blvd,,Mooresville,NC,28117,704-663-6468  877-798-3752,E,Public,,,,9,0,35.5573581,-80.8571928,06/10/2022,114695,2023-01-18 15:15:20 UTC,22/11/2017,J1772 TESLA,HOTEL
ELEC,Harrah's Cherokee Valley River Casino - Tesla Destination,777 Casino Pkwy,,Murphy,NC,28906,828-422-7777  877-798-3752,E,Public,,,,24,0,35.114969,-83.992954,06/10/2022,114696,2023-01-18 15:15:20 UTC,21/06/2018,TESLA,OTHER_ENTERTAINMENT
ELEC,Carolina Colours Town Centre - Tesla Destination,2032 Waterscape Wy,,New Bern,NC,28562,910-239-5580  877-798-3752,E,Public,,,,2,0,35.01584,-77.009037,06/10/2022,114697,2023-01-18 15:15:20 UTC,01/11/2016,TESLA,SHOPPING_CENTER
ELEC,Hanna House Bed & Breakfast - Tesla Destination,218 Pollock St,,New Bern,NC,28560,252-635-3209  877-798-3752,E,Public,,,,1,0,35.106758,-77.037017,06/10/2022,114698,2023-01-18 15:15:20 UTC,21/03/2016,TESLA,B_AND_B
ELEC,The Aerie Bed and Breakfast - Tesla Destination,509 Pollock St,,New Bern,NC,28562,252-636-5553  877-798-3752,E,Public,,,,2,0,35.1067998,-77.04247,06/10/2022,114699,2023-01-18 15:15:20 UTC,02/04/2015,J1772 TESLA,B_AND_B
ELEC,TC Corriher Implement Co. - Tesla Destination,12 S Ashe Ave,,Newton,NC,28658,828-381-6571  877-798-3752,E,Public,,,,1,0,35.662822,-81.223768,06/10/2022,114700,2023-01-18 15:15:20 UTC,13/08/2015,TESLA,OFFICE_BLDG
ELEC,Pinehurst Resort - Tesla Destination,80 Carolina Vista Dr,,Pinehurst,NC,28374,910-295-6811  877-798-3752,E,Public,,,,4,0,35.19562,-79.473736,06/10/2022,114702,2023-01-18 15:15:20 UTC,04/01/2016,J1772 TESLA,HOTEL
ELEC,Aloft Raleigh - Tesla Destination,2100 Hillsborough St,,Raleigh,NC,27607,919-828-9900  877-798-3752,E,Public,,,,2,0,35.786773,-78.663311,06/10/2022,114703,2023-01-18 15:15:20 UTC,11/11/2015,J1772 TESLA,HOTEL
ELEC,Quality Inn Roanoke Rapids - Tesla Destination,1914 Julian R Allsbrook Hwy,,Roanoke Rapids,NC,27870,252-537-9927  877-798-3752,E,Public,,,,1,0,36.43214,-77.631891,06/10/2022,114704,2023-01-18 15:15:20 UTC,16/05/2017,TESLA,HOTEL
ELEC,Historic Tapoco Lodge - Tesla Destination,14981 Tapoco Rd,,Robbinsville,NC,28771,828-498-2800  877-798-3752,E,Public,,,,4,0,35.443635,-83.938445,06/10/2022,114705,2023-01-18 15:15:20 UTC,21/07/2016,J1772 TESLA,HOTEL
ELEC,Deal's Gap Motorcycle Resort - Tesla Destination,17555 Tapoco Rd,,Robbinsville,NC,28771,800-889-5550  877-798-3752,E,Public,,,,1,0,35.466445,-83.920015,06/10/2022,114706,2023-01-18 15:15:20 UTC,28/07/2014,TESLA,HOTEL
ELEC,Snowbird Mountain Lodge - Tesla Destination,4633 Santeetlah Rd,,Robbinsville,NC,28771,828-479-3433  877-798-3752,E,Public,,,,4,0,35.342588,-83.890898,06/10/2022,114707,2023-01-18 15:15:20 UTC,22/06/2015,J1772 TESLA,HOTEL
ELEC,Hampton Inn Salisbury - Tesla Destination,1001 Klumac Rd,,Salisbury,NC,28147,704-637-8000  877-798-3752,E,Public,,,,2,0,35.642388,-80.484833,06/10/2022,114708,2023-01-18 15:15:20 UTC,10/12/2015,TESLA,HOTEL
ELEC,"The Orchard Inn, a Select Registry Property - Tesla Destination",100 Orchard Inn Ln,,Saluda,NC,28773,828-749-5471  877-798-3752,E,Public,,,,2,0,35.229295,-82.335268,06/10/2022,114709,2023-01-18 15:15:20 UTC,27/10/2014,J1772 TESLA,INN
ELEC,Hampton Inn Selma/Smithfield I-95 - Tesla Destination,1695 Outlet Center Dr,,Selma,NC,27576,919-965-6151  877-798-3752,E,Public,,,,4,0,35.517803,-78.295406,06/10/2022,114710,2023-01-18 15:15:20 UTC,29/11/2017,J1772 TESLA,HOTEL
ELEC,Residence Inn by Marriott Pinehurst Southern Pines - Tesla Destination,105 Brucewood Rd,,Southern Pines,NC,28387,910-693-3400  877-798-3752,E,Public,,,,8,0,35.1728307,-79.4246222,06/10/2022,114711,2023-01-18 15:15:20 UTC,20/02/2018,J1772 TESLA,HOTEL
ELEC,National Athletic Village - Tesla Destination,201 Air Tool Dr,,Southern Pines,NC,28387,910-585-3212  877-798-3752,E,Public,,,,2,0,35.194297,-79.373228,06/10/2022,114712,2023-01-18 15:15:20 UTC,30/03/2017,TESLA,PARK
ELEC,Comfort Suites Southport - Tesla Destination,4963 Southport-Supply Rd SE,,Southport,NC,28461,910-454-7444  877-798-3752,E,Public,,,,3,0,33.9522552,-78.0514828,06/10/2022,114713,2023-01-18 15:15:20 UTC,18/12/2017,J1772 TESLA,HOTEL
ELEC,"1906 Pine Crest Inn, a Select Registry Property - Tesla Destination",85 Pine Crest Ln,,Tryon,NC,28782,800-633-3001  877-798-3752,E,Public,,,,2,0,35.208469,-82.233456,06/10/2022,114714,2023-01-18 15:15:20 UTC,28/03/2016,J1772 TESLA,INN
ELEC,Candlewood Suites Wake Forest Raleigh Area - Tesla Destination,12050 Retail Dr,,Wake Forest,NC,27587,919-554-6901  877-798-3752,E,Public,,,,4,0,35.976409,-78.542788,06/10/2022,114715,2023-01-18 15:15:20 UTC,13/02/2017,J1772 TESLA,HOTEL
ELEC,The Swag - Tesla Destination,2300 Swag Rd,,Waynesville,NC,28785,828-926-0430  877-798-3752,E,Public,,,,1,0,35.573886,-83.093919,06/10/2022,114716,2023-01-18 15:15:20 UTC,01/06/2015,TESLA,HOTEL
ELEC,Inn On Main - Tesla Destination,88 S Main St,,Weaverville,NC,28787,828-645-4935  877-798-3752,E,Public,,,,1,0,35.6927437,-82.559905,06/10/2022,114717,2023-01-18 15:15:20 UTC,02/05/2018,TESLA,INN
ELEC,Red Oak Brewery - Tesla Destination,6901 Konica Dr,,Whitsett,NC,27377,336-447-2055  877-798-3752,E,Public,,,,6,0,36.061886,-79.5705922,06/10/2022,114718,2023-01-18 15:15:20 UTC,25/05/2018,J1772 TESLA,BREWERY_DISTILLERY_WINERY
ELEC,The Forum - Tesla Destination,1125 Military Cutoff Rd,,Wilmington,NC,28405,910-256-2211  877-798-3752,E,Public,,,,2,0,34.235388,-77.82831,06/10/2022,114719,2023-01-18 15:15:20 UTC,24/06/2015,TESLA,SHOPPING_CENTER
ELEC,Ceviche's - Tesla Destination,7210 Wrightsville Ave,,Wilmington,NC,28403,910-256-3131  877-798-3752,E,Public,,,,1,0,34.219908,-77.817552,06/10/2022,114720,2023-01-18 15:15:20 UTC,18/04/2017,TESLA,RESTAURANT
ELEC,Southeastern Center for Contemporary Art (SECCA) - Tesla Destination,750 Marguerite Dr,,Winston-Salem,NC,27106,336-725-1904  877-798-3752,E,Public,,,,2,0,36.119675,-80.289502,06/10/2022,114721,2023-01-18 15:15:20 UTC,31/08/2015,J1772 TESLA,MUSEUM
ELEC,Holiday Inn Express & Suites Nashville SE Antioch - Tesla Destination,201 Crossings Pl,,Antioch,TN,37013,615-731-2361  877-798-3752,E,Public,,,,8,0,36.0439915,-86.6480986,06/10/2022,115575,2023-01-18 15:15:20 UTC,29/11/2017,J1772 TESLA,HOTEL
ELEC,Hampton Inn Nashville-I-24 Hickory Hollow - Tesla Destination,210 Crossings Pl,,Antioch,TN,37013,615-731-9911  877-798-3752,E,Public,,,,5,0,36.0448739,-86.6479546,06/10/2022,115576,2023-01-18 15:15:20 UTC,05/10/2017,J1772 TESLA,HOTEL
ELEC,DelMonaco Winery & Vineyards - Tesla Destination,600 Lance Dr,,Baxter,TN,38544,931-858-1177  877-798-3752,E,Public,,,,3,0,36.163439,-85.615665,06/10/2022,115577,2023-01-18 15:15:20 UTC,01/02/2018,TESLA,BREWERY_DISTILLERY_WINERY
ELEC,Hampton Inn & Suites Chattanooga/ Downtown - Tesla Destination,400 Chestnut St,,Chattanooga,TN,37402,423-693-0501  877-798-3752,E,Public,,,,3,0,35.0517332,-85.3113814,06/10/2022,115578,2023-01-18 15:15:20 UTC,25/05/2018,J1772 TESLA,HOTEL
ELEC,DoubleTree by Hilton Chattanooga Downtown - Tesla Destination,407 Chestnut St,,Chattanooga,TN,37402,423-756-5150  877-798-3752,E,Public,,,,4,0,35.0512209,-85.3124976,06/10/2022,115579,2023-01-18 15:15:20 UTC,26/03/2018,J1772 TESLA,HOTEL
ELEC,Holiday Inn & Suites Chattanooga Downtown - Tesla Destination,434 Chestnut St,,Chattanooga,TN,37402,423-777-5858  877-798-3752,E,Public,,,,3,0,35.051119,-85.311229,06/10/2022,115580,2023-01-18 15:15:20 UTC,16/11/2016,J1772 TESLA,HOTEL
ELEC,Home2 Suites by Hilton Clarksville/Ft. Campbell - Tesla Destination,"3020 Mr. ""C"" Dr",,Clarksville,TN,37040,931-645-7771  877-798-3752,E,Public,,,,10,0,36.5930397,-87.2863968,06/10/2022,115581,2023-01-18 15:15:20 UTC,02/10/2017,J1772 TESLA,HOTEL
ELEC,Old Glory Distilling Co. - Tesla Destination,451 Alfred Thun Rd,,Clarksville,TN,37040,931-919-2522  877-798-3752,E,Public,,,,2,0,36.596445,-87.277796,06/10/2022,115582,2023-01-18 15:15:20 UTC,07/03/2016,J1772 TESLA,BREWERY_DISTILLERY_WINERY
ELEC,Stonehaus Winery - Tesla Destination,2444 Genesis Rd,,Crossville,TN,38571,931-484-8461  877-798-3752,E,Public,,,,2,0,35.985032,-85.010353,06/10/2022,115584,2023-01-18 15:15:20 UTC,18/03/2016,J1772 TESLA,BREWERY_DISTILLERY_WINERY
ELEC,Comfort Inn Dickson - Tesla Destination,1085 E Christi Dr,,Dickson,TN,37055,615-740-1000  877-798-3752,E,Public,,,,10,0,36.0221579,-87.3347879,06/10/2022,115585,2023-01-18 15:15:20 UTC,12/03/2018,J1772 TESLA,HOTEL
ELEC,Home2 Suites by Hilton Nashville Franklin - Tesla Destination,107 International Dr,,Franklin,TN,37067,615-771-8032  877-798-3752,E,Public,,,,8,0,35.9559429,-86.8054694,06/10/2022,115586,2023-01-18 15:15:20 UTC,12/02/2018,J1772 TESLA,HOTEL
ELEC,Hampton Inn & Suites Nashville/Franklin/Cool Springs - Tesla Destination,7141 South Springs Dr,,Franklin,TN,37067,615-771-7225  877-798-3752,E,Public,,,,2,0,35.952404,-86.813731,06/10/2022,115587,2023-01-18 15:15:20 UTC,03/11/2016,TESLA,HOTEL
ELEC,Hilton Garden Inn Nashville Franklin/ Cool Springs - Tesla Destination,9150 Carothers Pkwy,,Franklin,TN,37067,615-656-2700  877-798-3752,E,Public,,,,2,0,35.959448,-86.800246,06/10/2022,115588,2023-01-18 15:15:20 UTC,17/07/2017,J1772 TESLA,HOTEL
ELEC,Wildwood Resort & Marina - Tesla Destination,7316 Granville Hwy,,Granville,TN,38564,931-653-4360  877-798-3752,E,Public,,,,2,0,36.2712,-85.7953,06/10/2022,115589,2023-01-18 15:15:20 UTC,15/10/2018,TESLA,HOTEL
ELEC,General Morgan Inn - Tesla Destination,111 N Main St,,Greeneville,TN,37743,423-787-1000  877-798-3752,E,Public,,,,3,0,36.163621,-82.830959,06/10/2022,115590,2023-01-18 15:15:20 UTC,16/02/2017,TESLA,INN
ELEC,Holiday Inn Express & Suites Chattanooga-Hixson - Tesla Destination,4820 Hixson Pike,,Hixson,TN,37343,423-877-6464  877-798-3752,E,Public,,,,6,0,35.127276,-85.246608,06/10/2022,115591,2023-01-18 15:15:20 UTC,02/05/2018,J1772 TESLA,HOTEL
ELEC,Hilton Garden Inn Jackson - Tesla Destination,1324 Vann Dr,,Jackson,TN,38305,731-868-3500  877-798-3752,E,Public,,,,3,0,35.66221,-88.861765,06/10/2022,115592,2023-01-18 15:15:20 UTC,19/06/2018,J1772 TESLA,HOTEL
ELEC,Rush Street Neighborhood Grill - Tesla Destination,1229 E Stone Dr,,Kingsport,TN,37660,423-247-3184  877-798-3752,E,Public,,,,2,0,36.549767,-82.525923,06/10/2022,115593,2023-01-18 15:15:20 UTC,15/05/2017,J1772 TESLA,RESTAURANT
ELEC,MeadowView Conference Resort & Convention Center - Tesla Destination,1901 Meadowview Pkwy,,Kingsport,TN,37664,423-578-6600  877-798-3752,E,Public,,,,3,0,36.506546,-82.568279,06/10/2022,115594,2023-01-18 15:15:20 UTC,05/07/2017,J1772 TESLA,HOTEL
ELEC,The Tennessean Hotel - Tesla Destination,531 Henley St,,Knoxville,TN,37902,865-232-1800  877-798-3752,E,Public,,,,2,0,35.9623888,-83.923282,06/10/2022,115595,2023-01-18 15:15:20 UTC,05/09/2017,TESLA,HOTEL
ELEC,Embassy Suites Knoxville West - Tesla Destination,9621 Parkside Dr,,Knoxville,TN,37922,865-246-2309  877-798-3752,E,Public,,,,10,0,35.9131838,-84.1068105,06/10/2022,115596,2023-01-18 15:15:20 UTC,22/11/2017,J1772 TESLA,HOTEL
ELEC,Mountain Motorsports - Tesla Destination,3422 Adventure Ln,,Kodak,TN,37764,865-932-7433  877-798-3752,E,Public,,,,1,0,35.98178,-83.613345,06/10/2022,115597,2023-01-18 15:15:20 UTC,30/12/2014,TESLA,OTHER_ENTERTAINMENT
ELEC,The Peabody Hotel - Tesla Destination,149 Union Ave,,Memphis,TN,38103,901-529-4000  877-798-3752,E,Public,,,,2,0,35.142409,-90.051998,06/10/2022,115598,2023-01-18 15:15:20 UTC,15/07/2016,J1772 TESLA,HOTEL
ELEC,La Quinta Inn & Suites Memphis Wolfchase - Tesla Destination,2839 New Brunswick Rd,,Memphis,TN,38133,901-377-2772  877-798-3752,E,Public,,,,3,0,35.203262,-89.778509,06/10/2022,115599,2023-01-18 15:15:20 UTC,07/07/2017,J1772 TESLA,HOTEL
ELEC,Hyatt Place Memphis Wolfchase Galleria - Tesla Destination,7905 Giacosa Pl,,Memphis,TN,38133,901-371-0010  877-798-3752,E,Public,,,,2,0,35.196114,-89.797391,06/10/2022,115600,2023-01-18 15:15:20 UTC,01/03/2017,J1772 TESLA,HOTEL
ELEC,Best Western Galleria Inn & Suites - Tesla Destination,8635 US-64,,Memphis,TN,38133,901-372-0000  877-798-3752,E,Public,,,,4,0,35.20374,-89.775131,06/10/2022,115601,2023-01-18 15:15:20 UTC,30/08/2017,J1772 TESLA,HOTEL
ELEC,Hilton Garden Inn Murfreesboro - Tesla Destination,1335 Conference Center Boulevard,,Murfreesboro,TN,37129,615-225-2345  877-798-3752,E,Public,,,,12,0,35.8644112,-86.4508482,06/10/2022,115602,2023-01-18 15:15:20 UTC,19/10/2017,J1772 TESLA,HOTEL
ELEC,Hilton Nashville Downtown - Tesla Destination,121 4th Ave S,,Nashville,TN,37201,615-620-1000  877-798-3752,E,Public,,,,4,0,36.159949,-86.777271,06/10/2022,115603,2023-01-18 15:15:20 UTC,17/04/2017,J1772 TESLA,HOTEL
ELEC,Urban Cookhouse Nashville - Tesla Destination,1907 Broadway,,Nashville,TN,37203,615-953-6449  877-798-3752,E,Public,,,,1,0,36.150445,-86.79679,06/10/2022,115605,2023-01-18 15:15:20 UTC,26/09/2017,TESLA,RESTAURANT
ELEC,The Hermitage Hotel - Tesla Destination,231 6th Ave N,,Nashville,TN,37219,615-244-3121  877-798-3752,E,Public,,,,2,0,36.163688,-86.782274,06/10/2022,115606,2023-01-18 15:15:20 UTC,21/03/2016,J1772 TESLA,HOTEL
ELEC,Gaylord Opryland Resort & Convention Center - Tesla Destination,2800 Opryland Dr,,Nashville,TN,37214,615-889-1000  877-798-3752,E,Public,,,,3,0,36.212449,-86.696838,06/10/2022,115608,2023-01-18 15:15:20 UTC,15/07/2016,J1772 TESLA,HOTEL
ELEC,Thompson Nashville - Tesla Destination,401 11th Ave S,,Nashville,TN,37203,615-262-6000  877-798-3752,E,Public,,,,4,0,36.152491,-86.784039,06/10/2022,115609,2023-01-18 15:15:20 UTC,12/07/2018,TESLA,HOTEL
ELEC,Hotel Preston - Tesla Destination,733 Briley Pkwy,,Nashville,TN,37217,615-361-5900  877-798-3752,E,Public,,,,8,0,36.1420023,-86.7013478,06/10/2022,115610,2023-01-18 15:15:20 UTC,09/02/2018,J1772 TESLA,HOTEL
ELEC,Fairfield Inn & Suites Nashville Downtown/The Gulch - Tesla Destination,901 Division St,,Nashville,TN,37203,615-690-1740  877-798-3752,E,Public,,,,6,0,36.15033,-86.781542,06/10/2022,115611,2023-01-18 15:15:20 UTC,08/06/2017,J1772 TESLA,HOTEL
ELEC,Christopher Place Resort - Tesla Destination,1500 Pinnacles Way,,Newport,TN,37821,423-623-6555  877-798-3752,E,Public,,,,2,0,35.920625,-83.252367,06/10/2022,115612,2023-01-18 15:15:20 UTC,15/06/2015,J1772 TESLA,HOTEL
ELEC,The Inn at Christmas Place - Tesla Destination,119 Christmas Tree Ln,,Pigeon Forge,TN,37863,888-465-9644  877-798-3752,E,Public,,,,4,0,35.809438,-83.576405,06/10/2022,115613,2023-01-18 15:15:20 UTC,31/08/2015,J1772 TESLA,INN
ELEC,Margaritaville - Tesla Destination,130 The Island Dr,,Pigeon Forge,TN,37863,865-210-8530  877-798-3752,E,Public,,,,4,0,35.802613,-83.568554,06/10/2022,115614,2023-01-18 15:15:20 UTC,14/04/2016,J1772 TESLA,HOTEL
ELEC,Titanic Pigeon Forge - Tesla Destination,2134 Parkway,,Pigeon Forge,TN,37863,800-381-7670  877-798-3752,E,Public,,,,2,0,35.821495,-83.578399,06/10/2022,115615,2023-01-18 15:15:20 UTC,14/04/2016,TESLA,OTHER_ENTERTAINMENT
ELEC,"Berry Springs Lodge, a Select Registry Property - Tesla Destination",2149 Seaton Springs Rd,,Sevierville,TN,37862,865-908-7935  877-798-3752,E,Public,,,,2,0,35.81792,-83.501509,06/10/2022,115616,2023-01-18 15:15:20 UTC,08/07/2015,J1772 TESLA,HOTEL
ELEC,TownePlace Suites by Marriott Nashville Smyrna - Tesla Destination,990 Colonnade Dr,,Smyrna,TN,37167,615-459-2017  877-798-3752,E,Public,,,,3,0,35.975191,-86.577625,06/10/2022,115617,2023-01-18 15:15:20 UTC,17/07/2017,J1772 TESLA,HOTEL
ELEC,Dancing Bear Lodge & Appalachian Bistro - Tesla Destination,7140 E Lamar Alexander Pkwy,,Townsend,TN,37882,800-369-0111  877-798-3752,E,Public,,,,1,0,35.678761,-83.782354,06/10/2022,115618,2023-01-18 15:15:20 UTC,22/03/2017,TESLA,HOTEL
ELEC,Hampton Inn Tullahoma - Tesla Destination,1922 N Jackson St,,Tullahoma,TN,37388,931-461-5222  877-798-3752,E,Public,,,,3,0,35.385701,-86.231766,06/10/2022,115619,2023-01-18 15:15:20 UTC,26/04/2017,J1772 TESLA,HOTEL
ELEC,Blackberry Farm - Tesla Destination,1471 W Millers Cove Rd,,Walland,TN,37886,865-984-8166  877-798-3752,E,Public,,,,2,0,35.687809,-83.86247,06/10/2022,115620,2023-01-18 15:15:20 UTC,04/06/2015,TESLA,HOTEL
ELEC,Westmoreland Family Clinic - Tesla Destination,100-B Mallard Sunrise Dr,,Westmoreland,TN,37186,615-644-3000  877-798-3752,E,Public,,,,1,0,36.554146,-86.237929,06/10/2022,115621,2023-01-18 15:15:20 UTC,26/11/2014,TESLA,OFFICE_BLDG
ELEC,Best Western Winchester - Tesla Destination,1602 Dinah Shore Blvd,,Winchester,TN,37398,931-967-9444  877-798-3752,E,Public,,,,6,0,35.200297,-86.0943006,06/10/2022,115622,2023-01-18 15:15:20 UTC,10/05/2018,J1772 TESLA,HOTEL
ELEC,METRO NASHVILLE 2,610 Murfreesboro Pike,,Nashville,TN,37210,888-758-4389,E,Public,24 hours daily,,,2,0,36.142179,-86.739249,12/01/2023,116720,2023-01-12 23:11:55 UTC,04/01/2019,J1772,
ELEC,Lenox Square - Tesla Supercharger,3393 Peachtree Road,,Atlanta,GA,30326,877-798-3752,E,Public,24 hours daily; for Tesla use only,,,,5,33.848756,-84.36434,03/10/2022,116796,2022-12-01 17:40:26 UTC,01/12/2018,TESLA,SHOPPING_CENTER
ELEC,Steak 'n Shake - Tesla Supercharger,4329 Belair Frontage Road,,Augusta,GA,30909,877-798-3752,E,Public,24 hours daily; for Tesla use only,,,,1,33.481657,-82.130253,03/10/2022,116798,2022-12-01 17:40:26 UTC,01/12/2018,TESLA,RESTAURANT
ELEC,Marketplace at Millcreek - Tesla Supercharger,1695 Mall of Georgia Blvd,,Buford,GA,30519,877-798-3752,E,Public,24 hours daily; for Tesla use only,,,,1,34.061756,-83.994375,03/10/2022,116799,2022-12-01 17:40:26 UTC,01/12/2018,TESLA,SHOPPING_CENTER
ELEC,Rivergate Shopping Center - Tesla Supercharger,121 Tom Hill Senior Boulevard,,Macon,GA,31210,877-798-3752,E,Public,24 hours daily; for Tesla use only,,,,1,32.89715,-83.689132,03/10/2022,116800,2022-12-01 17:40:26 UTC,01/12/2018,TESLA,SHOPPING_CENTER
ELEC,FAIRFIELD ELKIN STATION 1,640 NC-268 Bypass,,Elkin,NC,28621,888-758-4389,T,TEMPORARILY UNAVAILABLE (Public),24 hours daily,,,2,0,36.279691,-80.823667,23/01/2023,116828,2023-01-23 23:08:15 UTC,05/01/2019,J1772,
ELEC,FAIRFIELD ELKIN STATION 2,NC-268 Bypass,,Elkin,NC,28621,888-758-4389,T,TEMPORARILY UNAVAILABLE (Public),24 hours daily,,,2,0,36.279583,-80.823689,23/01/2023,116829,2023-01-23 23:08:00 UTC,05/01/2019,J1772,
ELEC,LEXINGTON NC S. MAIN #1,333 S Main St,,Lexington,NC,27292,888-758-4389,E,Public,24 hours daily,,,2,0,35.821356,-80.256161,12/01/2023,116843,2023-01-12 23:11:58 UTC,08/01/2019,J1772,
ELEC,ORANGE STATIONS NORTHSIDE EV2P2,1110 West Peachtree Street Northwest,,Atlanta,GA,30309,888-758-4389,E,Public,24 hours daily,,,2,0,33.78505,-84.388269,23/01/2023,116884,2023-01-23 23:09:43 UTC,09/01/2019,J1772,
ELEC,HONDASOUTHPOINT STATION01,1001 Southpoint Autopark Blvd,,Durham,NC,27713,888-758-4389,E,Public,24 hours daily,,,2,0,35.907356,-78.954543,12/01/2023,116939,2023-01-12 23:11:56 UTC,11/01/2019,J1772,
ELEC,GPH SHOP02,3325 Satellite Blvd,,Duluth,GA,30096,888-758-4389,E,Public,24 hours daily,,,1,0,33.964996,-84.124537,12/01/2023,116972,2023-01-12 23:12:01 UTC,12/01/2019,J1772,
ELEC,WHOLE FOODS MKT CHARLOTTE 01,6610 Fairview Rd,,Charlotte,NC,28210,888-758-4389,E,Public,24 hours daily,,,1,0,35.147177,-80.829899,12/01/2023,117021,2023-01-12 23:12:02 UTC,16/01/2019,J1772,
ELEC,8K PARKING DECK STATION 3,8000 Avalon Boulevard,,Alpharetta,GA,30009,888-758-4389,E,Public,24 hours daily,,,2,0,34.070443,-84.274215,12/01/2023,117023,2023-01-12 23:12:01 UTC,16/01/2019,J1772,
ELEC,WHOLE FOODS MKT RALEIGH NRL 1,8710 Six Forks Rd,,Raleigh,NC,27615,888-758-4389,E,Public,24 hours daily,,,1,0,35.899423,-78.649948,12/01/2023,117049,2023-01-12 23:12:03 UTC,17/01/2019,J1772,
ELEC,HIGHWOODS RTP CENTREGREEN 1,5000 Centregreen Way,,Cary,NC,27513,888-758-4389,T,TEMPORARILY UNAVAILABLE (Public),24 hours daily,,,2,0,35.82667,-78.79456,12/01/2023,117060,2023-01-12 23:11:43 UTC,17/01/2019,J1772,
ELEC,HIGHWOODS RTP CENTREGREEN 4,5000 Centregreen Way,,Cary,NC,27513,888-758-4389,E,Public,24 hours daily,,,2,0,35.826494,-78.794894,12/01/2023,117062,2023-01-12 23:11:43 UTC,17/01/2019,J1772,
ELEC,BUILDINGB1 EV STATION 06,Ingersoll-Rand Rd Building A Lot,,Davidson,NC,28036,888-758-4389,T,TEMPORARILY UNAVAILABLE (Public),24 hours daily,,,2,0,35.513713,-80.847256,12/01/2023,117152,2023-01-12 23:11:57 UTC,18/01/2019,J1772,
ELEC,HENDRICK SBLVD SERVICE 2,8901 South Blvd,,Charlotte,NC,28273,888-758-4389,E,Public,24 hours daily,,,1,0,35.116208,-80.881641,12/01/2023,117333,2023-01-12 23:11:57 UTC,25/01/2019,J1772,
ELEC,SIMON LENOX SQUARE 3,3399 Peachtree Rd NE,,Atlanta,GA,30326,888-758-4389,E,Public,24 hours daily,,,1,0,33.845079,-84.361551,12/01/2023,117463,2023-01-12 23:12:07 UTC,26/01/2019,J1772,
ELEC,METRO NASHVILLE WEST PRECINCT,5500 Charlotte Pike,,Nashville,TN,37209,888-758-4389,E,Public,24 hours daily,,,1,0,36.151278,-86.855062,12/01/2023,117616,2023-01-12 23:12:10 UTC,02/02/2019,J1772,
ELEC,BLOWING ROCK BLOWING ROCK,333 Wallingford Rd,,Blowing Rock,NC,28605,888-758-4389,E,Public,24 hours daily,,,2,0,36.132945,-81.679738,23/01/2023,117633,2023-01-23 23:06:27 UTC,02/02/2019,J1772,
ELEC,OLD FOURTH WARD DUAL PORT,608 Ralph McGill Blvd NE,,Atlanta,GA,30312,888-758-4389,E,Public,24 hours daily,,,2,0,33.764464,-84.367162,12/01/2023,117634,2023-01-12 23:12:26 UTC,02/02/2019,J1772,
ELEC,AUTONATIONHONDA SHOP02,1979 Thornton Rd,,Lithia Springs,GA,30122,888-758-4389,E,Public,24 hours daily,,,1,0,33.786059,-84.611885,12/01/2023,117678,2023-01-12 23:12:25 UTC,05/02/2019,J1772,
ELEC,2473 SHOP 01,10117 Parkside Dr,,Knoxville,TN,37922,888-758-4389,E,Public,24 hours daily,,,1,0,35.909186,-84.122148,12/01/2023,117698,2023-01-12 23:12:11 UTC,06/02/2019,J1772,
ELEC,METRO NASHVILLE SE LIBRARY 2,5264 Hickory Hollow Pl,,Nashville,TN,37013,888-758-4389,E,Public,24 hours daily,,,1,0,36.052522,-86.656983,12/01/2023,117699,2023-01-12 23:12:11 UTC,06/02/2019,J1772,
ELEC,METRO NASHVILLE HCH GARAGE 2,101 James Robertson Pkwy,,Nashville,TN,37201,888-758-4389,E,Public,24 hours daily,,,2,0,36.167275,-86.777527,12/01/2023,117772,2023-01-12 23:12:33 UTC,09/02/2019,J1772,
ELEC,MJM GROUP STATION 1,5110 Trojan Dr,,Charlotte,NC,28278,888-758-4389,E,Public,24 hours daily,,,2,0,35.164749,-80.972577,12/01/2023,117778,2023-01-12 23:12:10 UTC,09/02/2019,J1772,
ELEC,FAYETTEVILLE NC TRANS.MUSEUM 01,325 Franklin Street,,Fayetteville,NC,28301,888-758-4389,T,TEMPORARILY UNAVAILABLE (Public),24 hours daily; Drivers must bring their own J1772 cordset for Level 1 charging,,1,1,0,35.051844,-78.881861,23/01/2023,118051,2023-01-23 23:00:23 UTC,16/02/2019,J1772 NEMA515,
ELEC,GATEWAY PARK MINT PARK,115 Depot St Historical Mint Park,,Salisbury,NC,28144,888-758-4389,E,Public,24 hours daily,,,2,0,35.666362,-80.467532,23/01/2023,118205,2023-01-23 23:06:54 UTC,17/02/2019,J1772,
ELEC,Paris Surgical Specialists,235 Tyson Ave,,Paris,TN,38242,888-998-2546,E,Public,MON: 24 hours | TUE: 24 hours | WED: 24 hours | THU: 24 hours | FRI: 24 hours | SAT: 24 hours | SUN: 24 hours,,,3,0,36.298253,-88.310053,23/01/2023,118930,2023-01-23 22:57:18 UTC,01/03/2019,J1772,
ELEC,Capital Ford,5411 N Tryon St,Located on the pillar near the service bay,Charlotte,NC,28213,844-242-1515,E,Public - Call ahead,Dealership business hours,,,1,0,35.261309,-80.776713,14/01/2021,118968,2022-11-16 14:15:11 UTC,01/03/2019,J1772,CAR_DEALER
ELEC,RALEIGH STATION DC FAST 02,4005 Capital Hills Dr,,Raleigh,NC,27616,888-758-4389,E,Public,24 hours daily,,,,1,35.887798,-78.568955,12/01/2023,119005,2023-01-12 23:12:29 UTC,08/03/2019,J1772COMBO,
ELEC,HENDRICKCONCORD SHOP02,10037 Weddington Rd Ext.,,Concord,NC,28027,888-758-4389,E,Public,24 hours daily,,,1,0,35.378923,-80.699979,12/01/2023,119033,2023-01-12 23:12:12 UTC,08/03/2019,J1772,
ELEC,HENDRICKCONCORD STATION01,7650 Bruton Smith Blvd,,Concord,NC,28027,888-758-4389,E,Public,24 hours daily,,,2,0,35.363961,-80.704474,12/01/2023,119034,2023-01-12 23:12:12 UTC,08/03/2019,J1772,
ELEC,HONDA MALL GA STATION01,3699 Buford Dr,,Buford,GA,30519,888-758-4389,E,Public,24 hours daily,,,2,0,34.08169,-83.986254,12/01/2023,120795,2023-01-12 23:12:13 UTC,12/03/2019,J1772,
ELEC,Greystone at Oakland,245 Oakland Pkwy,,Leesburg,GA,31763,229-483-7812,E,Public,24 hours daily; see Clubhouse staff for access,,,2,0,31.644868,-84.246305,11/10/2022,120809,2022-10-11 18:56:12 UTC,01/03/2019,J1772,MULTI_UNIT_DWELLING
ELEC,Greystone Farms Reserve,7461 Blackmon Rd,,Columbus,GA,31909,706-507-7400,E,Public,24 hours daily; see Clubhouse staff for access,,,2,0,32.548986,-84.894472,11/10/2022,120810,2022-10-11 18:56:12 UTC,01/02/2019,J1772,MULTI_UNIT_DWELLING
ELEC,SEE ROCK CITY SEE ROCK 1,1400 Patten Rd,,Lookout Mountain,GA,30750,888-758-4389,E,Public,24 hours daily,,,2,0,34.973892,-85.350535,12/01/2023,120844,2023-01-12 23:10:40 UTC,14/03/2019,J1772,
ELEC,Marlowe Lake Boone Apartments,1731 Tupelo Hill Lane,.||,Raleigh,NC,27607,888-998-2546,E,Public,MON: 24 hours | TUE: 24 hours | WED: 24 hours | THU: 24 hours | FRI: 24 hours | SAT: 24 hours | SUN: 24 hours,,,2,0,35.814248,-78.689886,23/01/2023,120893,2023-01-23 22:57:51 UTC,19/03/2019,J1772,
ELEC,City of Shelby,126 W Marion St,,Shelby,NC,28150,704-484-6866,E,Public,24 hours daily,,,2,0,35.29268,-81.541343,10/01/2023,120910,2023-01-10 16:44:47 UTC,01/07/2015,J1772,MUNI_GOV
ELEC,Hendersonville Community Co-op,60 S Charleston Ln,,Hendersonville,NC,28792,828-693-0505,E,Public,"7am-9pm M-Sat, 8am-8pm Sun",,,4,0,35.305269,-82.44885,13/12/2022,120914,2022-12-13 14:36:26 UTC,01/01/2019,J1772,COOP
ELEC,COCPARKING STATION 3,80 Union St S,,Concord,NC,28025,888-758-4389,E,Public,24 hours daily,,,2,0,35.408549,-80.579914,12/01/2023,120970,2023-01-12 23:12:33 UTC,27/03/2019,J1772,
ELEC,CITY OF ELIZABE MARINERS EV 1,707 E Fearing St,,Elizabeth City,NC,27909,888-758-4389,T,TEMPORARILY UNAVAILABLE (Public),24 hours daily,,,2,0,36.298787,-76.218709,12/01/2023,120977,2023-01-12 23:12:28 UTC,27/03/2019,J1772,
ELEC,SPG 119 SOUTH,3000 Bluebird Lane,,Mebane,NC,27302,888-758-4389,E,Public,24 hours daily,,,2,0,36.063466,-79.299886,23/01/2023,120999,2023-01-23 23:09:42 UTC,27/03/2019,J1772,
ELEC,DEWBERRY GROUP PEACHTREE 02,1555 Peachtree St NW,,Atlanta,GA,30309,888-758-4389,E,Public,24 hours daily,,,2,0,33.797858,-84.387898,12/01/2023,121021,2023-01-12 23:12:38 UTC,28/03/2019,J1772,
ELEC,FOUR COUNTY EMC FOUR COUNTY HQ,1822 NC-53 West,,Burgaw,NC,28425,888-758-4389,T,TEMPORARILY UNAVAILABLE (Public),24 hours daily,,,2,0,34.545632,-77.954039,12/01/2023,121052,2023-01-12 23:12:29 UTC,29/03/2019,J1772,
ELEC,EMORY UNIV CPE250,1390 Oxford Road,,Atlanta,GA,30307,888-758-4389,E,Public,Mon 12:00am - 12:00am; Tue 12:00am - 12:00am; Wed 12:00am - 12:00am; Thu 12:00am - 12:00am; Fri 12:00am - 12:00am; Sat 12:00am - 12:00am; Sun 12:00am - 12:00am,,,,1,33.789692,-84.327126,12/01/2023,121097,2023-01-12 23:12:40 UTC,02/04/2019,CHADEMO J1772COMBO,
ELEC,SERVICECHARGER SHOP 01,242 Underwood Rd,,Fletcher,NC,28732,888-758-4389,E,Public,24 hours daily,,,1,0,35.440907,-82.533853,12/01/2023,121106,2023-01-12 23:11:11 UTC,02/04/2019,J1772,
ELEC,WHOLE FOODS MKT ATLANTA 4,22 14th St NW,,Atlanta,GA,30309,888-758-4389,E,Public,24 hours daily,,,1,0,33.786153,-84.388529,12/01/2023,121240,2023-01-12 23:12:42 UTC,06/04/2019,J1772,
ELEC,WHOLE FOODS MKT CARY 1,5055 Arco Street,,Cary,NC,27519,888-758-4389,T,TEMPORARILY UNAVAILABLE (Public),24 hours daily,,,2,0,35.833397,-78.882386,12/01/2023,121242,2023-01-12 23:12:39 UTC,06/04/2019,J1772,
ELEC,Residence Inn & Courtyard - Charlotte North,9110 Harris Corners Pkwy,,Charlotte,NC,28208,704-719-9444,E,Public,24 hours daily; for guest use only,,,2,0,35.344936,-80.842227,10/01/2023,121301,2023-01-10 16:44:47 UTC,01/11/2018,J1772,HOTEL
ELEC,University of North Carolina Charlotte - CRI Deck 1,9100 Robert D. Snyder Rd,Located at Robert D. Snyder Rd and University City Blvd; chargers on Level 2,Charlotte,NC,28223,704-687-0161,E,Public,Garage business hours,,,4,0,35.31027,-80.74364,13/12/2022,121304,2022-12-13 14:36:26 UTC,01/01/2016,J1772,COLLEGE_CAMPUS
ELEC,University of North Carolina Charlotte - South Village Parking Deck,8880 Johnson Alumni Way,,Charlotte,NC,28223,704-687-0161,E,Public,Garage business hours,,,12,0,35.30438,-80.736847,13/12/2022,121305,2022-12-13 14:36:26 UTC,01/01/2016,J1772,COLLEGE_CAMPUS
ELEC,University of North Carolina Charlotte - East Deck 3,9328 Van Landingham Rd,,Charlotte,NC,28223,704-687-0161,E,Public,Garage business hours,,,4,0,35.30656,-80.72646,13/12/2022,121306,2022-12-13 14:36:26 UTC,01/01/2016,J1772,COLLEGE_CAMPUS
ELEC,Keffer Chrysler Jeep Dodge Ram,8214 E Independence Blvd,,Charlotte,NC,28227,877-426-0070,E,Public - Call ahead,Dealership business hours; customers only,,,1,0,35.152137,-80.729776,13/12/2022,121308,2022-12-13 14:36:26 UTC,01/04/2019,J1772,CAR_DEALER
ELEC,Publix #1518,4425 Randolph Rd,,Charlotte,NC,28211,704-367-5208,E,Public,Store business hours; customer use only while shopping at Publix,,,2,0,35.177786,-80.799739,06/04/2022,121309,2022-04-28 20:01:31 UTC,01/04/2019,J1772,GROCERY
ELEC,Sterling Services,3372 Smith Farm Rd,,Matthews,NC,28104,704-821-3300,E,Public,24 hours daily; priority for employee use,,,1,0,35.086503,-80.678455,13/12/2022,121310,2022-12-13 14:36:26 UTC,01/04/2019,J1772,SHOPPING_CENTER
ELEC,Indian Trail Chrysler Dodge Jeep Ram,5501 W Highway 74,,Monroe,NC,28110,704-220-4370,E,Public - Call ahead,Dealership business hours,,,1,0,35.058525,-80.632095,14/01/2021,121312,2022-11-16 14:53:41 UTC,01/10/2017,J1772,CAR_DEALER
ELEC,Whole Foods Market,7221 Waverly Walk Ave,,Charlotte,NC,28277,980-213-2400,E,Public,7am-10pm daily,,,4,0,35.05123,-80.766313,08/04/2020,121313,2022-12-22 21:37:03 UTC,01/05/2017,J1772,GROCERY
ELEC,High Point NC Public Library,901 N Main St,,High Point,NC,27262,855-885-9571,E,Public,,,,4,0,35.96615,-80.01336,23/01/2023,121644,2023-01-23 23:34:48 UTC,01/04/2019,J1772,
ELEC,METRO NASHVILLE FIRE STATION 33,2501 Forest View Dr,,Nashville,TN,37013,888-758-4389,E,Public,24 hours daily,,,1,0,36.067571,-86.630697,12/01/2023,121675,2023-01-12 23:12:13 UTC,24/04/2019,J1772,
ELEC,ENMARKET POOLER DC,1601 Pooler Pkwy,,Pooler,GA,31322,888-758-4389,E,Public,24 hours daily,,,,1,32.087861,-81.277069,12/01/2023,121682,2023-01-12 23:12:52 UTC,25/04/2019,CHADEMO J1772COMBO,
ELEC,Walmart 673 Clarksville,3050 Wilma Rudolph Blvd,,Clarksville,TN,37040,833-632-2778,E,Public,24 hours daily,,,,4,36.59519,-87.2897,23/01/2023,121800,2023-01-23 23:14:36 UTC,30/08/2018,CHADEMO J1772COMBO,
ELEC,"Sam's Club 4930 (Cookeville, TN)",1177 Sams Street,,Cookeville,TN,38506,833-632-2778,E,Public,24 hours daily,,,,4,36.13346,-85.50762,23/01/2023,121803,2023-01-23 23:14:32 UTC,26/10/2018,CHADEMO J1772COMBO,
ELEC,"Walmart 2065 - Knoxville, TN",8445 Walbrook Drive,,Knoxville,TN,37923,833-632-2778,E,Public,24 hours daily,,,,4,35.92626,-84.06107,23/01/2023,121808,2023-01-23 23:14:19 UTC,26/04/2019,CHADEMO J1772COMBO,
ELEC,Pleasant Valley Promenade,6204 Glenwood Ave,,Raleigh,NC,27612,833-632-2778,E,Public,24 hours daily,,,,6,35.85731,-78.70359,23/01/2023,121809,2023-01-23 23:13:46 UTC,26/04/2019,CHADEMO J1772COMBO,
ELEC,"Walmart 335 - Jackson, TN",2196 Emporium Drive,,Jackson,TN,38305,833-632-2778,E,Public,24 hours daily,,,,4,35.66807,-88.85308,23/01/2023,121811,2023-01-23 23:14:37 UTC,26/04/2019,CHADEMO J1772COMBO,
ELEC,Commons at Wolf Creek,2755 North Germantown Parkway,,Memphis,TN,38133,833-632-2778,E,Public,24 hours daily,,,,4,35.20177,-89.79382,23/01/2023,121816,2023-01-23 23:13:41 UTC,20/07/2018,CHADEMO J1772COMBO,
ELEC,Walmart 3835 Ooltewah,5588 Little Debbie Parkway,,Ooltewah,TN,37363,833-632-2778,E,Public,24 hours daily,,,,8,35.0825,-85.06368,23/01/2023,121818,2023-01-23 23:14:02 UTC,23/08/2018,CHADEMO J1772COMBO,
ELEC,Barrett Place,860 Cobb Place Boulevard NW,,Kennesaw,GA,30144,833-632-2778,E,Public,24 hours daily,,,,1,34.011,-84.57233,23/01/2023,121825,2023-01-23 23:14:20 UTC,02/08/2018,CHADEMO J1772COMBO,
ELEC,"Walmart 639 - Brunswick, GA",150 Altama Connector,,Brunswick,GA,31525,833-632-2778,E,Public,24 hours daily,,,,4,31.21352,-81.48659,23/01/2023,121837,2023-01-23 23:14:22 UTC,26/04/2019,CHADEMO J1772COMBO,
ELEC,"Hampton Inn Benson, NC",100 Water Place Landing,,Benson,NC,27504,866-816-7584,T,TEMPORARILY UNAVAILABLE (Public),,,,2,0,35.37441,-78.541206,23/01/2023,121862,2023-01-23 23:37:05 UTC,01/04/2019,J1772,
ELEC,Naval Facilities Engineering Command -  Naval Support Activity Mid South,5722 Integrity Dr,,Millington,TN,38053,,E,Private,Fleet use only; Drivers must bring their own J1772 cordset for Level 1 charging,,15,,0,35.33,-89.87,22/02/2021,122148,2022-02-10 21:00:18 UTC,01/02/2019,NEMA520,FED_GOV
ELEC,Naval Facilities Engineering Command -  Naval Support Activity Mid South - Building 544,5722 Integrity Dr,,Millington,TN,38053,,E,Private,Fleet use only,,10,10,0,35.338945,-89.86969,22/02/2021,122149,2021-03-11 23:22:17 UTC,01/02/2019,J1772 NEMA520,FED_GOV
ELEC,Naval Facilities Engineering Command -  Naval Support Activity Mid South - Building 752,5722 Integrity Dr,,Millington,TN,38053,,E,Private,Fleet use only,,,1,0,35.33,-89.87,22/02/2021,122150,2021-03-11 23:22:17 UTC,01/02/2019,J1772,FED_GOV
ELEC,Naval Facilities Engineering Command -  Naval Support Activity Mid South - Building 771,5722 Integrity Dr,,Millington,TN,38053,,E,Private,Fleet use only,,,1,0,35.33,-89.87,22/02/2021,122151,2021-03-11 23:22:17 UTC,01/02/2019,J1772,FED_GOV
ELEC,Naval Facilities Engineering Command -  Naval Support Activity Mid South - Building 790,5722 Integrity Dr,,Millington,TN,38053,,E,Private,Fleet use only,,,1,0,35.33,-89.87,22/02/2021,122152,2021-03-11 23:22:17 UTC,01/02/2019,J1772,FED_GOV
ELEC,Naval Facilities Engineering Command -  Naval Support Activity Mid South - Building 938,5722 Integrity Dr,,Millington,TN,38053,,E,Private,Fleet use only,,,2,0,35.33,-89.87,22/02/2021,122153,2021-03-11 23:22:17 UTC,01/02/2019,J1772,FED_GOV
ELEC,Naval Facilities Engineering Command - Naval Support Activity Mid South - Building 940,Kittyhawk Ave,,Millington,TN,38053,,E,Private - Government only,,,,9,0,35.332599,-89.880914,22/02/2021,122154,2021-03-11 23:22:17 UTC,01/02/2019,J1772,FED_GOV
ELEC,PORTMAN CODA CODA TECH GW1,771 Spring St NW,,Atlanta,GA,30308,888-758-4389,E,Public,24 hours daily,,,2,0,33.775655,-84.388375,12/01/2023,122180,2023-01-12 23:12:39 UTC,30/04/2019,J1772,
ELEC,Holiday Inn Express - Plymouth - Tesla Supercharger,840 U.S. 64,,Plymouth,NC,27962,877-798-3752,E,Public,24 hours daily; for Tesla use only,,,,8,35.850587,-76.756116,03/10/2022,122272,2022-12-01 17:40:26 UTC,01/03/2019,TESLA,
ELEC,Lenox Square - Tesla Supercharger,3393 Peachtree Road Northeast,,Atlanta,GA,30326,877-798-3752,E,Public,24 hours daily; for Tesla use only,,,,16,33.846487,-84.360172,03/10/2022,122285,2022-12-01 17:40:26 UTC,01/03/2019,TESLA,
ELEC,Starbucks - Tesla Supercharger,1204 U.S. 82,,Tifton,GA,31794,877-798-3752,E,Public,24 hours daily; for Tesla use only,,,,1,31.448847,-83.53221,03/10/2022,122322,2022-12-01 17:40:26 UTC,01/03/2019,TESLA,
ELEC,Signature Flight Support PDK - Tesla Destination,1 Corsair Dr Ste 108,,Atlanta,GA,30341,770-452-0010  877-798-3752,E,Public,,,,1,0,33.88401,-84.3027,06/10/2022,122423,2023-01-18 15:15:20 UTC,08/02/2019,TESLA,
ELEC,One Atlantic Center - Tesla Destination,1201 Peachtree St NW #1710,,Atlanta,GA,30309,404-870-2900  877-798-3752,E,Public,,,,6,0,33.799841,-84.392363,06/10/2022,122424,2023-01-18 15:15:20 UTC,16/08/2018,TESLA,
ELEC,NetJets PDK - Tesla Destination,2040 Airport Rd,,Atlanta,GA,30341,770-936-5440  877-798-3752,E,Public,,,,6,0,33.875864,-84.304233,06/10/2022,122425,2023-01-18 15:15:20 UTC,08/02/2019,J1772 TESLA,
ELEC,Atlantic Aviation PDK - Tesla Destination,2040 Airport Rd,,Atlanta,GA,30341,770-454-5000  877-798-3752,E,Public,,,,12,0,33.876036,-84.304316,06/10/2022,122426,2023-01-18 15:15:20 UTC,06/02/2019,J1772 TESLA,
ELEC,Springhill Suites Atlanta Downtown - Tesla Destination,239 Ivan Allen Jr Blvd NW,,Atlanta,GA,30313,678-539-2900  877-798-3752,E,Public,,,,2,0,33.76472,-84.39512,06/10/2022,122427,2023-01-18 15:15:20 UTC,31/01/2019,TESLA,
ELEC,Eclipse Buckhead Public Garage - Tesla Destination,250 Pharr Rd NE,,Atlanta,GA,30305,877-727-5714  877-798-3752,E,Public,,,,18,0,33.837504,-84.378132,06/10/2022,122428,2023-01-18 15:15:20 UTC,17/12/2018,J1772 TESLA,
ELEC,Fat Man's Cafe & Catering - Tesla Destination,1450 Greene St #600,,Augusta,GA,30901,706-733-1740  877-798-3752,E,Public,,,,4,0,33.477533,-81.98202,06/10/2022,122429,2023-01-18 15:15:20 UTC,23/04/2018,J1772 TESLA,
ELEC,Augusta University - Tesla Destination,2500 Walton Wy,,Augusta,GA,30904,706-729-2090  877-798-3752,E,Public,,,,4,0,33.478168,-82.022644,06/10/2022,122430,2023-01-18 15:15:20 UTC,19/11/2018,TESLA,
ELEC,Jekyll Ocean Club - Tesla Destination,80 Ocean Wy,,Jekyll Island,GA,31527,912-635-5234  877-798-3752,E,Public,,,,6,0,44.335154,-73.352053,06/10/2022,122431,2023-01-18 15:15:20 UTC,19/12/2018,J1772 TESLA,
ELEC,Comfort Suites McDonough - Tesla Destination,64 Hwy 81 W at Exit 218,,McDonough,GA,30253,678-216-1900  877-798-3752,E,Public,,,,2,0,33.42794,-84.184666,06/10/2022,122432,2023-01-18 15:15:20 UTC,26/07/2018,J1772 TESLA,
ELEC,Hyatt Place Chapel Hill Southern Village - Tesla Destination,1090 US Hwy 15 501 S,,Chapel Hill,NC,27517,919-929-9511  877-798-3752,E,Public,,,,3,0,35.881172,-79.062708,06/10/2022,122499,2023-01-18 15:15:20 UTC,19/04/2017,J1772 TESLA,
ELEC,237 S Tryon St Garage - Tesla Destination,237 S Tryon St,,Charlotte,NC,28202,704-375-6014  877-798-3752,E,Public,,,,6,0,35.225407,-80.844865,06/10/2022,122500,2023-01-18 15:15:20 UTC,02/01/2019,J1772 TESLA,
ELEC,La Quinta Inn & Suites Cookeville - Tesla Destination,1131 S Jefferson Ave,,Cookeville,TN,38506,931-520-3800  877-798-3752,E,Public,,,,3,0,36.13295,-85.50475,06/10/2022,122547,2023-01-18 15:15:20 UTC,31/01/2019,J1772 TESLA,
ELEC,Fairfield Inn & Suites by Marriott Nashville - Tesla Destination,100 French Landing Dr,,Nashville,TN,37228,615-432-4677  877-798-3752,E,Public,,,,3,0,36.188956,-86.797155,06/10/2022,122548,2023-01-18 15:15:20 UTC,29/01/2019,J1772 TESLA,
ELEC,DELTA AIR LINES A2 CHARGER #10,3450 Main St,,Atlanta,GA,30337,888-758-4389,E,Public,24 hours daily,,,2,0,33.657669,-84.421716,12/01/2023,122611,2023-01-12 23:13:05 UTC,04/05/2019,J1772,
ELEC,DELTA AIR LINES A2 CHARGER #7,N Inner Loop Rd,,Hapeville,GA,30354,888-758-4389,E,Public,24 hours daily,,,2,0,33.657737,-84.421292,12/01/2023,122612,2023-01-12 23:13:05 UTC,04/05/2019,J1772,
ELEC,DELTA AIR LINES DELTA FP 2,3980 Tradeport Blvd,,Atlanta,GA,30354,888-758-4389,E,Public,24 hours daily,,,2,0,33.645961,-84.392823,12/01/2023,122631,2023-01-12 23:13:08 UTC,07/05/2019,J1772,
ELEC,WINSTON-SALEM 4TH AND CHURCH,171 4th Street East Inside Parking Deck,,Winston-Salem,NC,27101,888-758-4389,E,Public,24 hours daily,,,2,0,36.099111,-80.242665,23/01/2023,122662,2023-01-23 23:06:27 UTC,08/05/2019,J1772,
ELEC,NORTH AND LINE NORTH AND LINE2,385 N Angier Ave NE,,Atlanta,GA,30308,888-758-4389,E,Public,24 hours daily,,,2,0,33.769971,-84.363785,12/01/2023,122737,2023-01-12 23:12:29 UTC,14/05/2019,J1772,
ELEC,NORTH AND LINE NORTH AND LINE1,365 Angier Pl NE,,Atlanta,GA,30308,888-758-4389,E,Public,24 hours daily,,,2,0,33.770391,-84.363842,12/01/2023,122738,2023-01-12 23:12:29 UTC,14/05/2019,J1772,
ELEC,Sustainable Future Center,201 Ogle Ave,,Knoxville,TN,37920,865-603-0520  865-294-0154,E,Public - Call ahead,Variable business hours; available to building guests,,,1,0,35.933369,-83.915176,10/01/2023,122755,2023-01-10 16:44:47 UTC,01/03/2015,J1772,OFFICE_BLDG
ELEC,Tru Hotel - Pigeon Forge,2815 Teaster Ln,,Pigeon Forge,TN,37863,866-816-7584,E,Public,,,,2,0,35.801853,-83.563944,23/01/2023,123152,2023-01-23 23:37:08 UTC,01/04/2019,J1772,
ELEC,Captrust Tower,4208 Six Forks Rd.,,Raleigh,NC,27609,866-816-7584,E,Public,,,,3,0,35.837015,-78.640051,23/01/2023,123246,2023-01-23 23:37:20 UTC,01/04/2019,J1772,
ELEC,Verizon - Alpharetta,1 Verizon Pl,,Alpharetta,GA,30004,,E,Private,For employee use only,,,4,0,34.092857,-84.267034,14/09/2022,123305,2022-09-14 15:49:44 UTC,01/05/2019,J1772,OFFICE_BLDG
ELEC,Verizon - Alpharetta RNC,10300 Old Alabama Connector Rd,,Alpharetta,GA,30022,,E,Private,For employee use only,,,2,0,34.031056,-84.290245,14/09/2022,123309,2022-09-14 15:49:44 UTC,01/05/2019,J1772,OFFICE_BLDG
ELEC,Verizon - Alpharetta,2 Verizon Pl,,Alpharetta,GA,30004,,E,Private,For employee use only,,,4,0,34.093101,-84.268797,14/09/2022,123318,2022-09-14 15:49:44 UTC,01/05/2019,J1772,OFFICE_BLDG
ELEC,Verizon - Atlanta,2002 Summit Blvd,,Atlanta,GA,30319,,E,Private,For employee use only,,,2,0,33.914681,-84.342039,14/09/2022,123321,2022-09-14 15:49:44 UTC,01/05/2019,J1772,OFFICE_BLDG
ELEC,Verizon - Charlotte,2401 Sardis Rd N,,Charlotte,NC,28227,,E,Private,For employee use only,,,4,0,35.146862,-80.728887,14/09/2022,123325,2022-09-14 15:49:44 UTC,01/05/2019,J1772,OFFICE_BLDG
ELEC,Verizon - Murfreesboro,300 River Rock Blvd,,Murfreesboro,TN,37128,,E,Private,For employee use only,,,8,0,35.843499,-86.435147,14/09/2022,123329,2022-09-14 15:49:44 UTC,01/05/2019,J1772,OFFICE_BLDG
ELEC,Verizon - Alpharetta,5055 N Point Pkwy,,Alpharetta,GA,30009,,E,Private,For employee use only,,,8,0,34.056208,-84.278013,14/09/2022,123339,2022-09-14 15:49:44 UTC,01/05/2019,J1772,OFFICE_BLDG
ELEC,Verizon - Cary,7000 Weston Pkwy,,Cary,NC,27513,,E,Private,For employee use only,,,4,0,35.830871,-78.791809,14/09/2022,123352,2022-09-14 15:49:44 UTC,01/05/2019,J1772,OFFICE_BLDG
ELEC,CP EV STATION HARVARD AVE 2,1886 Harvard Avenue,,Atlanta,GA,30337,888-758-4389,E,Public,24 hours daily,,,2,0,33.653491,-84.450653,12/01/2023,123432,2023-01-12 23:13:27 UTC,31/05/2019,J1772,
ELEC,ASHFORD GREEN ASHFORD GREEN 2,4700 ashford dunwoody road,,Atlanta,GA,30319,888-758-4389,E,Public,24 hours daily,,,1,0,33.915191,-84.338856,12/01/2023,123440,2023-01-12 23:10:42 UTC,31/05/2019,J1772,
ELEC,Serra Chevrolet,7850 US Highway 64,,Bartlett,TN,38133,901-382-5644,E,Public - Call ahead,Dealership business hours,,,5,0,35.205106,-89.801697,03/09/2020,123452,2022-12-29 16:42:18 UTC,01/03/2019,J1772,CAR_DEALER
ELEC,Bank of America - Financial Center,201 N Tryon St,,Charlotte,NC,28202,980-335-3561,E,Public,Business hours,,,4,0,35.230261,-80.839631,14/06/2022,123510,2022-06-14 16:24:51 UTC,01/05/2019,J1772,BANK
ELEC,CITY-BROOKHAVEN LYNWOOD,3360 Osborne Rd NE,,Atlanta,GA,30319,888-758-4389,E,Public,24 hours daily,,,2,0,33.887324,-84.345699,12/01/2023,123535,2023-01-12 23:13:28 UTC,04/06/2019,J1772,
ELEC,CITY-BROOKHAVEN CITY HALL 1,4362 Peachtree Rd,,Brookhaven,GA,30319,888-758-4389,T,TEMPORARILY UNAVAILABLE (Public),24 hours daily,,,2,0,33.870801,-84.333911,12/01/2023,123536,2023-01-12 23:13:28 UTC,04/06/2019,J1772,
ELEC,CROWN HONDA SHOP02,3633 W Wendover Ave,,Greensboro,NC,27407,888-758-4389,E,Public,24 hours daily,,,1,0,36.059154,-79.869729,12/01/2023,123583,2023-01-12 23:13:31 UTC,07/06/2019,J1772,
ELEC,CITY-BROOKHAVEN BLACKBURN 2,3517 Ashford Dunwoody Rd NE,,Atlanta,GA,30319,888-758-4389,E,Public,24 hours daily,,,2,0,33.89689,-84.327796,12/01/2023,123615,2023-01-12 23:13:29 UTC,08/06/2019,J1772,
ELEC,CITY-BROOKHAVEN ASHFORD,3384 Ashford Park Ct,,Atlanta,GA,30319,888-758-4389,E,Public,24 hours daily,,,2,0,33.875082,-84.326191,12/01/2023,123617,2023-01-12 23:13:29 UTC,08/06/2019,J1772,
ELEC,Publix #1473,1830 Hendersonville Rd,Right side of building in parking lot,Asheville,NC,28803,828-274-6287,E,Public,Store business hours; customer use only while shopping at Publix,,,2,0,35.50344,-82.52405,06/04/2022,124563,2022-04-28 20:01:31 UTC,01/06/2019,J1772,GROCERY
ELEC,Ingles Market,140 Weaver Blvd,,Weaverville,NC,28787,828-645-2902,E,Public,6am-12am daily,,,2,0,35.702679,-82.566669,10/01/2023,131995,2023-01-10 16:44:47 UTC,01/06/2019,J1772,GROCERY
ELEC,Great Smoky Mountains National Park - North District,107 Park Headquarters Rd,,Gatlinburg,TN,37738,,E,Private,,,,1,1,35.69242,-83.533731,11/10/2022,138543,2022-10-11 18:56:12 UTC,15/07/2019,J1772 J1772COMBO,NATL_PARK
ELEC,Hands On!,1212 Suncrest Dr,,Gray,TN,37615,423-434-4263,E,Public,24 hours daily,,,2,0,36.386632,-82.498535,11/10/2022,138583,2022-10-11 18:56:12 UTC,30/07/2019,J1772,MUSEUM
ELEC,EUHOME LEXINGTON,1900 Odell Owen Rd,,Lexington,NC,27295,888-758-4389,E,Public,24 hours daily,,,2,0,35.803939,-80.292592,12/01/2023,143144,2023-01-12 23:14:15 UTC,15/08/2019,J1772,
ELEC,FBHDCHARGING DCFAST HOG,3950 Sycamore Dairy Rd,,Fayetteville,NC,28303,888-758-4389,T,TEMPORARILY UNAVAILABLE (Public),24 hours daily,,,,1,35.078682,-78.95002,12/01/2023,143164,2023-01-12 23:14:12 UTC,15/08/2019,J1772COMBO,
ELEC,SPEEDWAY HD DCFAST HOG,10049 Weddington Rd,,Concord,NC,28027,888-758-4389,E,Public,24 hours daily,,,,1,35.364433,-80.71057,12/01/2023,143174,2023-01-12 23:14:11 UTC,15/08/2019,J1772COMBO,
ELEC,NORTH HILLS 201 PARK,201 Park at N Hills St,,Raleigh,NC,27609,888-758-4389,E,Public,24 hours daily,,,2,0,35.836906,-78.63726,12/01/2023,143180,2023-01-12 23:14:11 UTC,15/08/2019,J1772,
ELEC,EUHOME STATESVILLE,567 Mocksville Hwy,,Statesville,NC,28625,888-758-4389,E,Public,24 hours daily,,,2,0,35.808683,-80.810922,12/01/2023,143211,2023-01-12 23:14:08 UTC,15/08/2019,J1772,
ELEC,WHOLE FOODS MKT HUNTERSVILLE 2,9129 Sam Furr Rd,,Huntersville,NC,28078,888-758-4389,E,Public,24 hours daily,,,1,0,35.443676,-80.871495,12/01/2023,143294,2023-01-12 23:14:01 UTC,15/08/2019,J1772,
ELEC,RIDING HIGH H-D DCFAST HOG,3036 NC Hwy 68,,High Point,NC,27265,888-758-4389,E,Public,24 hours daily,,,,1,36.062581,-79.959277,12/01/2023,143311,2023-01-12 23:13:59 UTC,15/08/2019,J1772COMBO,
ELEC,EUHOME MADISON OFFICE,4626 NC-704,,Madison,NC,27025,888-758-4389,E,Public,24 hours daily,,,2,0,36.379565,-79.947818,12/01/2023,143340,2023-01-12 23:13:57 UTC,15/08/2019,J1772,
ELEC,TOBACCOROADHD DCFAST HOG,1126 S Saunders St,,Raleigh,NC,27603,888-758-4389,E,Public,24 hours daily,,,,1,35.764973,-78.64961,12/01/2023,143347,2023-01-12 23:13:56 UTC,15/08/2019,J1772COMBO,
ELEC,WHOLE FOODS MKT CARY 2,5000 NC-55,,Cary,NC,27519,888-758-4389,T,TEMPORARILY UNAVAILABLE (Public),24 hours daily,,,2,0,35.833866,-78.882119,12/01/2023,143362,2023-01-12 23:13:54 UTC,15/08/2019,J1772,
ELEC,TERM GARAGE 2 MNAA FAST DC 4,1 Terminal Dr,,Nashville,TN,37214,888-758-4389,E,Public,24 hours daily,,,,1,36.131522,-86.669243,12/01/2023,143383,2023-01-12 23:13:52 UTC,15/08/2019,CHADEMO,
ELEC,MONTFORD PARK EV CHARGER 01,4701 Park Rd,,Charlotte,NC,28209,888-758-4389,T,TEMPORARILY UNAVAILABLE (Public),24 hours daily,,,2,0,35.1668,-80.849396,12/01/2023,143533,2023-01-12 23:13:26 UTC,15/08/2019,J1772,
ELEC,AT THE HILL STATION 3,1160 Johnson Ferry Rd NE,,Sandy Springs,GA,30342,888-758-4389,T,TEMPORARILY UNAVAILABLE (Public),24 hours daily,,,2,0,33.90508,-84.34903,12/01/2023,143565,2023-01-12 23:13:02 UTC,15/08/2019,J1772,
ELEC,MODERN TOYOTA STATION 2,3178 Peters Creek Pkwy,,Winston-Salem,NC,27127,888-758-4389,E,Public,24 hours daily,,,1,0,36.045755,-80.261723,12/01/2023,143587,2023-01-12 23:12:35 UTC,15/08/2019,J1772,
ELEC,THUNDER TOWER 1 DCFAST HOG,1384 Southlake Pkwy,,Morrow,GA,30260,888-758-4389,E,Public,24 hours daily,,,,1,33.575905,-84.34529,12/01/2023,143758,2023-01-12 23:14:09 UTC,16/08/2019,J1772COMBO,
ELEC,GOOGLE ATL-LCD1000-04,1000 Logistics Center Dr,,Fairburn,GA,30213,888-758-4389,E,Public,24 hours daily,,,2,0,33.541998,-84.597978,12/01/2023,143760,2023-01-12 23:14:02 UTC,16/08/2019,J1772,
ELEC,MetLife - Cary,201 MetLife Way,,Cary,NC,27513,,E,Private,Employee Use Only,,,44,0,35.830019,-78.799133,10/11/2022,143810,2022-11-10 16:40:31 UTC,01/06/2015,J1772,OFFICE_BLDG
ELEC,MetLife - Charlotte,11225 N Community House Rd,,Charlotte,NC,28277,,E,Private,Employee Use Only,,,2,0,35.055125,-80.835756,10/11/2022,143811,2022-11-10 16:40:31 UTC,18/08/2019,J1772,OFFICE_BLDG
ELEC,PC MUSUEM STATION 1,309 N Main St,,Roxboro,NC,27573,888-758-4389,E,Public,24 hours daily,,,1,0,36.39612,-78.98161,12/01/2023,143818,2023-01-12 23:14:23 UTC,17/08/2019,J1772,
ELEC,Theory West Mid Town,800 Marietta St NW,,Atlanta,GA,30318,888-998-2546,E,Private,MON: 24 hours | TUE: 24 hours | WED: 24 hours | THU: 24 hours | FRI: 24 hours | SAT: 24 hours | SUN: 24 hours,,,4,0,33.774143,-84.405941,23/01/2023,143910,2023-01-23 22:57:55 UTC,21/08/2019,J1772,
ELEC,SD3#1 LEVINE 1,2820 Campus Ridge Rd,,Matthews,NC,28105,888-758-4389,E,Public,24 hours daily,,,2,0,35.105824,-80.69647,12/01/2023,144981,2023-01-12 23:12:25 UTC,05/09/2019,J1772,
ELEC,BLOWING ROCK BROCKOUTLET2,278 Shoppes on the Parkway Rd,,Blowing Rock,NC,28605,888-758-4389,E,Public,24 hours daily,,,2,0,36.139992,-81.670816,12/01/2023,145085,2023-01-12 23:14:21 UTC,10/09/2019,J1772,
ELEC,RIVERWALK APTS STATION 4,140 E Blount Ave,,Knoxville,TN,37920,888-758-4389,E,Public,24 hours daily,,,2,0,35.955168,-83.914568,23/01/2023,145149,2023-01-23 23:08:15 UTC,12/09/2019,J1772,
ELEC,RIVERWALK APTS STATION 1,211 E Blount Ave,,Knoxville,TN,37920,888-758-4389,E,Public,24 hours daily,,,2,0,35.955201,-83.915992,23/01/2023,145150,2023-01-23 23:08:15 UTC,12/09/2019,J1772,
ELEC,WF EV STATIONS TOWN HALL EV2,301 Brooks St,,Wake Forest,NC,27587,888-758-4389,E,Public,24 hours daily,,,1,0,35.976385,-78.508178,12/01/2023,145218,2023-01-12 23:14:40 UTC,14/09/2019,J1772,
ELEC,WF EV STATIONS TOWN HALL EV1,317 Brooks St,,Wake Forest,NC,27587,888-758-4389,E,Public,24 hours daily,,,1,0,35.97614,-78.508776,12/01/2023,145219,2023-01-12 23:14:40 UTC,14/09/2019,J1772,
ELEC,720 GARAGE STATION 03,621 S Poplar St,,Charlotte,NC,28202,888-758-4389,E,Public,24 hours daily,,,2,0,35.223964,-80.850699,12/01/2023,145223,2023-01-12 23:14:06 UTC,14/09/2019,J1772,
ELEC,720 GARAGE STATION 01,720 S Church St,,Charlotte,NC,28202,888-758-4389,E,Public,24 hours daily,,,2,0,35.223952,-80.850715,12/01/2023,145224,2023-01-12 23:14:06 UTC,14/09/2019,J1772,
ELEC,Mills Rentals,201 Carr St,,Carrboro,NC,27510,919-967-0045,E,Public - Credit card at all times,24 hours daily,M V,,6,0,35.909422,-79.071185,13/12/2022,145473,2022-12-13 14:36:26 UTC,01/03/2014,J1772,OFFICE_BLDG
ELEC,Mooresville Ford,151 E Plaza Dr,,Mooresville,NC,28115,704-664-1300,E,Public,Service Center use only,,,1,0,35.589615,-80.834215,04/11/2021,145491,2022-04-28 20:01:31 UTC,01/04/2013,J1772,CAR_DEALER
ELEC,BRIGHTRIDGE EV BR-JONESBOROUGH,117 Boone St,,Jonesborough,TN,37659,888-758-4389,E,Public,24 hours daily,,,2,0,36.296748,-82.471256,12/01/2023,145555,2023-01-12 23:14:57 UTC,27/09/2019,J1772,
ELEC,BRIGHTRIDGE EV BR-JC LIBRARY,201 N Roan St,,Johnson City,TN,37601,888-758-4389,T,TEMPORARILY UNAVAILABLE (Public),24 hours daily,,,2,0,36.319022,-82.353549,12/01/2023,145557,2023-01-12 23:14:56 UTC,27/09/2019,J1772,
ELEC,THORNWOOD THORNWOOD,7794 Kings College Ave,,Germantown,TN,38138,888-758-4389,E,Public,24 hours daily,,,2,0,35.10303,-89.803246,12/01/2023,146773,2023-01-12 23:14:37 UTC,10/10/2019,J1772,
ELEC,WFM - SOUTH EAST ASHEVILLE,14 S Tunnel Rd,,Asheville,NC,28805,888-758-4389,E,Public,24 hours daily,,,2,0,35.582481,-82.523562,12/01/2023,146880,2023-01-12 23:15:07 UTC,12/10/2019,J1772,
ELEC,COC CORNING OPT 4,4200 Corning Pl,,Charlotte,NC,28216,888-758-4389,E,Public,24 hours daily,,,2,0,35.33055,-80.938725,12/01/2023,146881,2023-01-12 23:15:07 UTC,12/10/2019,J1772,
ELEC,"Walmart 272 - Franklin, TN",3600 Mallory Ln.,,Franklin,TN,37067,833-632-2778,E,Public,24 hours daily,,,,4,35.94053,-86.81945,23/01/2023,146949,2023-01-23 23:14:27 UTC,12/10/2019,CHADEMO J1772COMBO,
ELEC,SAS Institute Inc - A,920 SAS Campus Dr,Building A,Cary,NC,27513,,E,Private,Employee and guest use only,,,17,0,35.81617,-78.747624,10/01/2023,146978,2023-01-10 16:44:47 UTC,01/02/2019,J1772,OFFICE_BLDG
ELEC,METRO NASHVILLE BELLEVUE ICE 4,7634 US-70S,,Nashville,TN,37221,888-758-4389,E,Public,24 hours daily,,,2,0,36.081158,-86.951253,12/01/2023,146988,2023-01-12 23:15:01 UTC,16/10/2019,J1772,
ELEC,METRO NASHVILLE BELLEVUE ICE 3,7640 US-70S,,Nashville,TN,37221,888-758-4389,E,Public,24 hours daily,,,2,0,36.080881,-86.950813,12/01/2023,146989,2023-01-12 23:15:01 UTC,16/10/2019,J1772,
ELEC,CITY HALL NEW CITY HALL,310 Technology Pkwy NW,,Peachtree Corners,GA,30092,888-758-4389,T,TEMPORARILY UNAVAILABLE (Public),24 hours daily,,,2,0,33.958195,-84.225252,23/01/2023,147053,2023-01-23 23:08:36 UTC,18/10/2019,J1772,
ELEC,CHARGER123 STATION 1,3774 Doctor M.L.K. Jr Blvd,,New Bern,NC,28562,888-758-4389,T,TEMPORARILY UNAVAILABLE (Public),24 hours daily,,,1,0,35.09647,-77.109276,12/01/2023,147113,2023-01-12 23:15:19 UTC,22/10/2019,J1772,
ELEC,TOWN OF CARY DT DECK P5,113 Walnut St,,Cary,NC,27511,888-758-4389,E,Public,24 hours daily,,,2,0,35.783205,-78.779345,12/01/2023,147303,2023-01-12 23:15:09 UTC,26/10/2019,J1772,
ELEC,EDGE OTB STATION 02,679 Edgewood Ave SE,,Atlanta,GA,30307,888-758-4389,T,TEMPORARILY UNAVAILABLE (Public),24 hours daily,,,2,0,33.754281,-84.36487,12/01/2023,147306,2023-01-12 23:12:03 UTC,26/10/2019,J1772,
ELEC,EDGE OTB STATION 01,679 Edgewood Ave NE,,Atlanta,GA,30307,888-758-4389,T,TEMPORARILY UNAVAILABLE (Public),24 hours daily,,,2,0,33.754219,-84.364843,12/01/2023,147307,2023-01-12 23:12:03 UTC,26/10/2019,J1772,
ELEC,City of Raleigh - Moore Square Deck,233 S Wilmington St,P5 Level of Parking Deck,Raleigh,NC,27601,919-996-3030,E,Public,24 hours daily; pay garage,,,1,0,35.777463,-78.637505,10/01/2023,147315,2023-01-10 16:44:47 UTC,01/09/2019,J1772,PAY_GARAGE
ELEC,GA TECH W22 #1,925 Dalney Street NW,,Atlanta,GA,30318,888-758-4389,E,Public,24 hours daily,,,2,0,33.779888,-84.400621,12/01/2023,147343,2023-01-12 23:14:25 UTC,29/10/2019,J1772,
ELEC,DC FAST CHARGER DC FAST CHARGER,100 Cooperative Way,,Lenoir,NC,28645,888-758-4389,E,Public,24 hours daily,,,,1,35.934843,-81.531396,23/01/2023,147405,2023-01-23 23:05:55 UTC,31/10/2019,CHADEMO J1772COMBO,
ELEC,Skyland Exchange,12 Sky Exchange Drive,One charger located on the East Side ||and the other is located on the West ||Side. Tenants Only!||,Asheville,NC,28803,888-998-2546,E,Private,MON: 24 hours | TUE: 24 hours | WED: 24 hours | THU: 24 hours | FRI: 24 hours | SAT: 24 hours | SUN: 24 hours,,,2,0,35.52993,-82.609809,23/01/2023,147454,2023-01-23 22:57:56 UTC,02/11/2019,J1772,
ELEC,ACCESSO SERVICE EVARC 252,2605 Meridian Pkwy,,Durham,NC,27713,888-758-4389,E,Public,Mon 8:00am - 5:00pm; Tue 8:00am - 5:00pm; Wed 8:00am - 5:00pm; Thu 8:00am - 5:00pm; Fri 8:00am - 5:00pm,,,2,0,35.91207,-78.903574,12/01/2023,147472,2023-01-12 23:14:22 UTC,02/11/2019,J1772,
ELEC,ACCESSO SERVICE EVARC 253,2600 Meridian Pkwy,,Durham,NC,27713,888-758-4389,E,Public,Mon 8:00am - 5:00pm; Tue 8:00am - 5:00pm; Wed 8:00am - 5:00pm; Thu 8:00am - 5:00pm; Fri 8:00am - 5:00pm,,,2,0,35.913395,-78.90265,12/01/2023,147473,2023-01-12 23:14:11 UTC,02/11/2019,J1772,
ELEC,ACCESSO SERVICE EVARC 251,2525 Meridian Pkwy,,Durham,NC,27713,888-758-4389,T,TEMPORARILY UNAVAILABLE (Public),Mon 8:00am - 5:00pm; Tue 8:00am - 5:00pm; Wed 8:00am - 5:00pm; Thu 8:00am - 5:00pm; Fri 8:00am - 5:00pm,,,2,0,35.91031,-78.898291,12/01/2023,147474,2023-01-12 23:14:10 UTC,02/11/2019,J1772,
ELEC,CAPE HATTERAS AVON DC FAST,41001 NC-12,,Avon,NC,27915,888-758-4389,E,Public,24 hours daily,,,,1,35.34699,-75.503559,12/01/2023,147587,2023-01-12 23:15:33 UTC,08/11/2019,CHADEMO J1772COMBO,
ELEC,Eleven North,210 11th Avenue N,null,Nashville,TN,37203,800-663-5633,E,Public,,,,2,0,36.159706,-86.788598,21/12/2022,148476,2022-12-21 23:01:00 UTC,04/07/2019,J1772,
ELEC,Bob Barker Company,134 North Main Street,,Fuquay Varina,NC,27526,800-663-5633,E,Public,,,,2,0,35.586162,-78.79956,21/12/2022,148553,2022-12-21 23:00:44 UTC,17/06/2015,J1772,
ELEC,Barrier Island Station,"1245 Duck Road
Bldg 200","Located in front of Building 200 ocean side.
Available to all BIS owners and guests with priority given to Building 200 owners and guests, naturally.",Duck,NC,27949,800-663-5633,E,Public,24 hours daily,,,2,0,36.174915,-75.755662,21/12/2022,148596,2022-12-21 22:59:55 UTC,07/08/2019,J1772,
ELEC,Emerson Sleep Inn and Mainstay Suites,Old Allatoona Road Southeast,Stations open for hotel guests as well as travel stop visitors. Cost is $2/hr,Cartersville,GA,30121,800-663-5633,E,Public,24 hours daily,,,2,0,34.11349,-84.73018,21/12/2022,148602,2022-12-21 23:00:40 UTC,26/12/2014,J1772,
ELEC,"Walgreens - Woodstock, GA #9749",950 Towne Lake Parkway,,Woodstock,GA,30189,800-663-5633,T,TEMPORARILY UNAVAILABLE (Public),,,,1,0,34.1025,-84.5351,21/12/2022,148611,2022-12-21 23:00:56 UTC,16/02/2012,J1772,
ELEC,Station 92 at Woodstock Apartment,10247 Highway 92,,Woodstock,GA,30188,800-663-5633,E,Public,,,,2,0,34.085765,-84.516071,21/12/2022,148620,2022-12-21 23:00:43 UTC,07/01/2015,J1772,
ELEC,"Walgreens - Kennesaw, GA #7764",4360 Bells Ferry Rd NW,,Kennesaw,GA,30144,800-663-5633,E,Public,,,,1,0,34.058345,-84.557204,21/12/2022,148629,2022-12-21 23:00:56 UTC,01/03/2012,J1772,
ELEC,"Walgreens - Alpharetta, GA #6999",173 S Main Street,,Alpharetta,GA,30004,800-663-5633,E,Public,,,,1,0,34.070855,-84.297,21/12/2022,148636,2022-12-21 23:00:57 UTC,01/12/2011,J1772,
ELEC,Royal Centre Four,11700 Great Oaks Way,"1st 2 hrs-$2.00 an hr
After 2 hrs-$5.00 an hr",Alpharetta,GA,30022,800-663-5633,E,Public,,,,4,0,34.063365,-84.26724,21/12/2022,148641,2022-12-21 23:00:39 UTC,23/11/2015,J1772,
ELEC,GA 400 CTR - 2400,2400 Lakeview Parkway,,Alpharetta,GA,30009,800-663-5633,E,Public,,,,4,0,34.058978,-84.289599,21/12/2022,148642,2022-12-21 23:00:24 UTC,01/09/2017,J1772,
ELEC,GA 400 CTR - 2325,2325 Lakeview Parkway,,Alpharetta,GA,30009,800-663-5633,E,Public,,,,2,0,34.056995,-84.292971,21/12/2022,148643,2022-12-21 23:00:23 UTC,01/09/2017,J1772,
ELEC,Royal Centre Two,11575 Great Oaks Way,"1st 2 hrs-$2.00 an hr
After 2 hrs-$5.00 an hr",Alpharetta,GA,30022,800-663-5633,E,Public,,,,3,0,34.060329,-84.270078,21/12/2022,148644,2022-12-21 23:00:36 UTC,23/11/2015,J1772,
ELEC,Royal Centre Three,11475 Great Oaks Way,"1st 2 hrs-$2.00 an hr
After 2 hrs-$5.00 an hr",Alpharetta,GA,30022,800-663-5633,E,Public,,,,3,0,34.058499,-84.2697,21/12/2022,148645,2022-12-21 23:00:39 UTC,23/11/2015,J1772,
ELEC,Woodlawn Point Shopping Center,1100 Johnson Ferry Road,,Marietta,GA,30068,800-663-5633,E,Public,,,,2,0,33.977135,-84.41492,21/12/2022,148649,2022-12-21 23:00:37 UTC,24/11/2011,J1772,
ELEC,Veridian at Sandy Springs,1800 Windridge Drive,,Sandy Springs,GA,30350,800-663-5633,E,Public,,,,2,0,33.981285,-84.352919,21/12/2022,148650,2022-12-21 23:00:36 UTC,04/04/2016,J1772,
ELEC,District at Duluth,3465 Duluth Highway 120,,Duluth,GA,30096,800-663-5633,E,Public,,,,2,0,34.000628,-84.143599,21/12/2022,148653,2022-12-21 23:00:20 UTC,30/11/2017,J1772,
ELEC,Tech Parkway,155 Technology Parkway,$1.00 for the first hour and $3.50 for every hour thereafter.,Norcross,GA,30092,800-663-5633,E,Public,,,,2,0,33.9623,-84.222191,21/12/2022,148663,2022-12-21 23:00:42 UTC,13/08/2015,J1772,
ELEC,3 Glenlake,3 Glenlake Parkway,,Atlanta,GA,30328,800-663-5633,E,Public,,,,4,0,33.935549,-84.359996,21/12/2022,148664,2022-12-21 23:00:02 UTC,04/10/2011,J1772,
ELEC,Sugarloaf Summit,1887 Duluth Highway,,Lawrenceville,GA,30043,800-663-5633,T,TEMPORARILY UNAVAILABLE (Public),,,,2,0,33.977231,-84.078075,21/12/2022,148667,2022-12-21 22:59:55 UTC,13/09/2016,J1772,
ELEC,64166 PCE,"64 Perimeter Center East, Suite 220","Max Charge time is 3 Hours.

8:00 AM 8:00 PM--$1.50
All other times--$1.00",Atlanta,GA,30346,800-663-5633,T,TEMPORARILY UNAVAILABLE (Public),24 hours daily,,,2,0,33.921024,-84.330959,21/12/2022,148673,2022-12-21 23:00:37 UTC,19/11/2015,J1772,
ELEC,"POP 3 Ravinia, LLC",3 Ravinia Drive Northeast,,Atlanta,GA,30346,800-663-5633,E,Public,24 hours daily,,,6,0,33.919997,-84.334684,21/12/2022,148674,2022-12-21 23:00:51 UTC,17/02/2012,J1772,
ELEC,Jonquil,2995 Atlanta Road,,Smyrna,GA,30080,800-663-5633,E,Public,,,,2,0,33.879768,-84.512217,21/12/2022,148678,2022-12-21 23:00:28 UTC,28/12/2011,J1772,
ELEC,Parking Deck,3290 Cobb Galleria Parkway,,Atlanta,GA,30339,800-663-5633,E,Public,,,,5,0,33.880027,-84.454759,21/12/2022,148683,2022-12-21 23:00:06 UTC,29/12/2015,J1772,
ELEC,Main Location,3205 Cumberland Blvd SE,,Atlanta,GA,30339,800-663-5633,E,Public,,,,3,0,33.877835,-84.462058,21/12/2022,148684,2022-12-21 22:59:54 UTC,27/11/2017,J1772,
ELEC,Cumberland Center II,"3100 Cumberland Blvd, Suite 1060",,Atlanta,GA,30339,800-663-5633,E,Public,24 hours daily,,,4,0,33.87695,-84.465533,21/12/2022,148685,2022-12-21 23:00:43 UTC,29/04/2015,J1772,
ELEC,"Walgreens - Lawrenceville, GA #5899",181 South Clayton St,,Lawrenceville,GA,30046,800-663-5633,E,Public,,,,1,0,33.94728,-83.986829,21/12/2022,148687,2022-12-21 23:00:57 UTC,29/11/2011,J1772,
ELEC,"Walgreens - Lawrenceville, GA #5896",1556 Lawrenceville Highway,,Lawrenceville,GA,30044,800-663-5633,E,Public,,,,1,0,33.937602,-84.034019,21/12/2022,148689,2022-12-21 23:00:58 UTC,04/11/2011,J1772,
ELEC,"Walgreens - Atlanta, GA #10422",3658 Roswell Rd NE,,Atlanta,GA,30342,800-663-5633,E,Public,,,,1,0,33.854784,-84.383031,21/12/2022,148693,2022-12-21 23:00:56 UTC,10/02/2012,J1772,
ELEC,Cortland at Phipps Plaza,707 Park Ave NE,,Atlanta,GA,30326,800-663-5633,E,Public,,,,2,0,33.854973,-84.361228,21/12/2022,148695,2022-12-21 23:00:07 UTC,16/08/2017,J1772,
ELEC,DAC,2965 Flowers Road South,,Atlanta,GA,30341,800-663-5633,E,Public,,,,4,0,33.870214,-84.26712,21/12/2022,148696,2022-12-21 23:00:07 UTC,02/08/2018,J1772,
ELEC,Tower Place Parking Deck,3340 Peachtree Road N.E.,,Atlanta,GA,30326,800-663-5633,E,Public,,,,2,0,33.847434,-84.370906,21/12/2022,148700,2022-12-21 23:00:23 UTC,26/12/2013,J1772,
ELEC,3M/Atlanta,"3700 Atlanta Industrial Pkwy, NW",,Atlanta,GA,30331,800-663-5633,E,Public,,,,2,0,33.802335,-84.496781,21/12/2022,148708,2022-12-21 23:00:36 UTC,02/09/2015,J1772,
ELEC,"Walgreens - Grayson, GA #7546",2075 Grayson Highway,,Grayson,GA,30017,800-663-5633,T,TEMPORARILY UNAVAILABLE (Public),,,,1,0,33.893968,-83.957199,21/12/2022,148709,2022-12-21 23:00:58 UTC,29/11/2011,J1772,
ELEC,Lakeside Centre,1979 Lakeside Parkway,,Tucker,GA,30084,800-663-5633,E,Public,,,,1,0,33.841624,-84.240841,21/12/2022,148712,2022-12-21 23:00:06 UTC,16/12/2013,J1772,
ELEC,"Walgreens - Decatur, GA #7478",2781 LaVista Rd,,Decatur,GA,30033,800-663-5633,E,Public,,,,1,0,33.824257,-84.292605,21/12/2022,148714,2022-12-21 23:00:56 UTC,01/12/2011,J1772,
ELEC,Morningside Atlanta by Windsor,1845 Piedmont Ave,,Atlanta,GA,30324,800-663-5633,T,TEMPORARILY UNAVAILABLE (Public),,,,2,0,33.806573,-84.36597,21/12/2022,148715,2022-12-21 22:59:53 UTC,17/08/2015,J1772,
ELEC,464 Bishop Street NW station location,464 Bishop Street NW,These stations are available for tenants of 464 Bishop Apartments only. No public charging available.,Atlanta,GA,30318,800-663-5633,E,Public,24 hours daily,,,4,0,33.792706,-84.403171,21/12/2022,148716,2022-12-21 23:00:24 UTC,15/06/2017,J1772,
ELEC,Bishop Park,705 Sunset Drive,,Athens,GA,30606,800-663-5633,E,Public,24 hours daily,,,2,0,33.964938,-83.412568,21/12/2022,148717,2022-12-21 23:00:40 UTC,02/01/2015,J1772,
ELEC,Walton Westside Apartments,790 Huff Road NW,,Atlanta,GA,30318,800-663-5633,E,Public,,,,4,0,33.786912,-84.413706,21/12/2022,148718,2022-12-21 23:00:43 UTC,05/06/2015,J1772,
ELEC,"Walgreens - Snellville, GA #6185",2220 Hewatt Rd,,Snellville,GA,30039,800-663-5633,E,Public,,,,1,0,33.841685,-84.059536,21/12/2022,148720,2022-12-21 23:00:59 UTC,29/11/2011,J1772,
ELEC,Washington Deck,125 W. Washington Street,,Athens,GA,30601,800-663-5633,E,Public,24 hours daily,,,1,0,33.958629,-83.378055,21/12/2022,148721,2022-12-21 23:00:39 UTC,02/01/2015,J1772,
ELEC,Modera Midtown,95 8th Street Northwest,,Atlanta,GA,30309,800-663-5633,E,Public,,,,5,0,33.780021,-84.390075,21/12/2022,148722,2022-12-21 22:59:55 UTC,12/01/2017,J1772,
ELEC,Suburban Plaza,2645 North Decatur Road,,Decatur,GA,30033,800-663-5633,E,Public,,,,2,0,33.790565,-84.287676,21/12/2022,148724,2022-12-21 23:00:20 UTC,02/02/2018,J1772,
ELEC,Athens Library,2025 Baxter Street,,Athens,GA,30606,800-663-5633,E,Public,24 hours daily,,,2,0,33.945337,-83.403704,21/12/2022,148725,2022-12-21 23:00:42 UTC,17/06/2015,J1772,
ELEC,"Walgreens - Stone Mountain, GA #5336",5320 Memorial Dr,,Stone Mountain,GA,30083,800-663-5633,T,TEMPORARILY UNAVAILABLE (Public),,,,1,0,33.79949,-84.220303,21/12/2022,148726,2022-12-21 23:00:57 UTC,06/12/2011,J1772,
ELEC,Oconee Park & Ride,1330 Oconee Street,,Athens,GA,30605,800-663-5633,E,Public,24 hours daily,,,2,0,33.947651,-83.35791,21/12/2022,148727,2022-12-21 23:00:40 UTC,02/01/2015,J1772,
ELEC,The Place on Ponce,220 Ponce de Leon Place,,Decatur,GA,30030,800-663-5633,E,Public,,,,2,0,33.776073,-84.300055,21/12/2022,148728,2022-12-21 23:00:36 UTC,20/10/2015,J1772,
ELEC,KWD- Station B,71 Howard Street Southeast,The stations are behind an access-only gate and available for residents only. No public charging allowed.,Atlanta,GA,30317,800-663-5633,E,Public,24 hours daily,,,1,0,33.75072,-84.324286,21/12/2022,148734,2022-12-21 23:00:11 UTC,21/05/2018,J1772,
ELEC,"Walgreens - Decatur, GA #6138",2065 S Hairston Rd,,Decatur,GA,30035,800-663-5633,E,Public,,,,1,0,33.728339,-84.196069,21/12/2022,148736,2022-12-21 23:00:57 UTC,02/12/2011,J1772,
ELEC,"Walgreens - Lithonia, GA #6202",6671 Covington Hwy,,Lithonia,GA,30058,800-663-5633,E,Public,,,,1,0,33.716791,-84.145194,21/12/2022,148737,2022-12-21 23:00:57 UTC,01/03/2012,J1772,
ELEC,"Walgreens - Monroe, GA #11539",319 S Broad St,,Monroe,GA,30655,800-663-5633,E,Public,,,,1,0,33.791232,-83.712529,21/12/2022,148738,2022-12-21 23:00:59 UTC,06/10/2011,J1772,
ELEC,Rockdale Tax Office,969 Pine Street,,Conyers,GA,30012,800-663-5633,E,Public,,,,1,0,33.668048,-84.015874,21/12/2022,148741,2022-12-21 23:00:16 UTC,31/05/2018,J1772,
ELEC,"Walgreens - Ellenwood, GA #9621",315 Fairview Rd,,Ellenwood,GA,30294,800-663-5633,E,Public,,,,1,0,33.618196,-84.246751,21/12/2022,148742,2022-12-21 23:00:58 UTC,07/12/2011,J1772,
ELEC,Homewood Suites Wilmington Mayfaire,6732 Swan Mill Road,,Wilmington,NC,28405,800-663-5633,E,Public,,,,1,0,34.238094,-77.832522,21/12/2022,148761,2022-12-21 22:59:56 UTC,10/08/2019,J1772,
ELEC,Veterans Park Apartments,"161 Halyburton Memorial Parkway
Building 157",,Wilmington,NC,28412,800-663-5633,E,Public,,,,2,0,34.096196,-77.918876,21/12/2022,148762,2022-12-21 22:59:57 UTC,19/03/2019,J1772,
ELEC,GRESCO GEORGIA STATION 1,1135 Rumble Rd,,Forsyth,GA,31029,888-758-4389,T,TEMPORARILY UNAVAILABLE (Public),24 hours daily,,,2,0,32.987779,-83.849087,12/01/2023,149090,2023-01-12 23:15:34 UTC,12/11/2019,J1772,
ELEC,Halcyon Parking Deck,1400 McFarland Parkway,,Alpharetta,GA,30005,800-663-5633,E,Public,,,,6,0,34.110617,-84.225456,21/12/2022,149110,2022-12-21 22:59:51 UTC,28/06/2019,J1772,
ELEC,725 Ponce,725 Ponce De Leon Avenue Northeast,,Atlanta,GA,30306,800-663-5633,E,Public,,,,10,0,33.77169,-84.363355,21/12/2022,149131,2022-12-21 22:59:51 UTC,02/08/2018,J1772,
ELEC,CENTRAL EMC HQ DCFC STATION 1,8038 Moncure Pittsboro Rd,,Moncure,NC,27559,888-758-4389,E,Public,24 hours daily,,,,1,35.623202,-79.088471,12/01/2023,149225,2023-01-12 23:15:35 UTC,17/11/2019,CHADEMO J1772COMBO,
ELEC,Publix - Tesla Supercharger,3500 Baker Road,,Acworth,GA,30101,877-798-3752,E,Public,24 hours daily; for Tesla use only,,,,12,34.075818,-84.652184,03/10/2022,149286,2022-12-01 17:40:26 UTC,30/09/2019,TESLA,
ELEC,Sheetz - Tesla Supercharger,619 Ruin Creek Road,,Henderson,NC,27536,877-798-3752,E,Public,24 hours daily; for Tesla use only,,,,8,36.329091,-78.44779,03/10/2022,149314,2022-12-01 17:40:26 UTC,30/09/2019,TESLA,
ELEC,Kill Devil Hills - Tesla Supercharger,2012 S Croatan Hwy,,Kill Devil Hills,NC,27948,877-798-3752,E,Public,24 hours daily; for Tesla use only,,,,8,35.993182,-75.651504,03/10/2022,149319,2022-12-01 17:40:26 UTC,30/09/2019,TESLA,
ELEC,Sheetz - Tesla Supercharger,2905 Rockford Street,,Mt Airy,NC,27030,877-798-3752,E,Public,24 hours daily; for Tesla use only,,,,8,36.458854,-80.636672,03/10/2022,149335,2022-12-01 17:40:26 UTC,30/09/2019,TESLA,
ELEC,Nalley Nissan - Cumming,1310 Buford Hd,,Cumming,GA,30041,678-648-7290,E,Public - Call ahead,Dealership business hours,,,1,1,34.1696097,-84.1251252,07/03/2022,149469,2022-03-07 19:49:53 UTC,01/05/2019,CHADEMO J1772 J1772COMBO,CAR_DEALER
ELEC,Heritage Nissan,1500 Verterans Memorial Hwy,,Rome,GA,30165,706-291-1981,E,Public - Call ahead,Dealership business hours,,,1,1,34.2855251,-85.1366731,09/06/2020,149470,2021-03-11 23:22:17 UTC,01/05/2019,CHADEMO J1772,CAR_DEALER
ELEC,Deacon Jones Nissan,3305 McLain St,,Goldsboro,NC,27534,,E,Public - Call ahead,Dealership business hours; contact 919-734-2411 for more information,,,1,1,35.368612,-77.929719,09/06/2020,149475,2021-03-11 23:22:17 UTC,01/05/2019,CHADEMO J1772,CAR_DEALER
ELEC,Nissan of Paris,1490 Mineral Wells Ave,,Paris,TN,38242,731-642-0601,E,Public - Call ahead,Dealership business hours,,,1,0,36.279223,-88.304458,09/11/2020,149480,2021-03-11 23:22:17 UTC,01/05/2019,J1772,CAR_DEALER
ELEC,Nalley Nissan - Cumming,1310 Buford Hd,,Cumming,GA,30041,678-648-7290,E,Private,Service center use only,,,1,0,34.1696097,-84.1251252,07/03/2022,149484,2022-03-07 19:49:53 UTC,01/05/2019,J1772,CAR_DEALER
ELEC,Deacon Jones Nissan,3305 McLain St,,Goldsboro,NC,27534,,E,Private,Service center use only,,,1,0,35.368612,-77.929719,09/06/2020,149489,2021-03-11 23:22:17 UTC,01/05/2019,J1772,CAR_DEALER
ELEC,Nissan of Paris,1490 Mineral Wells Ave,,Paris,TN,38242,731-642-0601,E,Private,Service center use only,,,1,0,36.279223,-88.304458,09/11/2020,149495,2021-03-11 23:22:17 UTC,01/05/2019,J1772,CAR_DEALER
ELEC,NORTHWINDS NORTHWINDS 5,11625 Rainwater Dr,,Alpharetta,GA,30009,888-758-4389,E,Public,24 hours daily,,,2,0,34.062912,-84.288574,12/01/2023,149496,2023-01-12 23:15:52 UTC,24/11/2019,J1772,
ELEC,MAIN STREET STATION 2,100 W Main St,,Wilkesboro,NC,28697,888-758-4389,T,TEMPORARILY UNAVAILABLE (Public),24 hours daily,,,2,0,36.148506,-81.15196,23/01/2023,149524,2023-01-23 23:07:40 UTC,26/11/2019,J1772,
ELEC,MAIN STREET STATION 1,100 E Main St,,Wilkesboro,NC,28697,888-758-4389,E,Public,24 hours daily,,,2,0,36.148705,-81.151412,23/01/2023,149525,2023-01-23 23:07:37 UTC,26/11/2019,J1772,
ELEC,Smyrna Town Centre,100 Sam Ridley Pkwy,,Smyrna,TN,37167,888-998-2546,E,Public,MON: 24 hours | TUE: 24 hours | WED: 24 hours | THU: 24 hours | FRI: 24 hours | SAT: 24 hours | SUN: 24 hours,,,1,0,35.996046,-86.525702,23/01/2023,149536,2023-01-23 22:57:28 UTC,27/11/2019,J1772,
ELEC,TriStar Southern Hills Medical Center,391 Wallace Road,Unit 672 under repair.||,Nashville,TN,37211,888-998-2546,E,Public,MON: 24 hours | TUE: 24 hours | WED: 24 hours | THU: 24 hours | FRI: 24 hours | SAT: 24 hours | SUN: 24 hours,,,6,0,36.0767,-86.7212,23/01/2023,149537,2023-01-23 22:57:47 UTC,27/11/2019,J1772,
ELEC,FIELDSTONE STATION 1,3276 eagle lake drive,,Memphis,TN,38119,888-758-4389,E,Public,24 hours daily,,,2,0,35.058727,-89.802956,12/01/2023,149554,2023-01-12 23:12:52 UTC,27/11/2019,J1772,
ELEC,COREV CITY CENTER 2,429 S Wilmington Street,,Raleigh,NC,27601,888-758-4389,E,Public,24 hours daily,,,1,0,35.774316,-78.638077,23/01/2023,149634,2023-01-23 23:09:09 UTC,28/11/2019,J1772,
ELEC,NORTHWINDS NORTHWINDS1,2475 Northwinds Pkwy,,Alpharetta,GA,30009,888-758-4389,T,TEMPORARILY UNAVAILABLE (Public),24 hours daily,,,2,0,34.058598,-84.28537,12/01/2023,149653,2023-01-12 23:15:56 UTC,01/12/2019,J1772,
ELEC,BLOC83 TOWER 1 STATION 1,607 W Morgan Street,,Raleigh,NC,27603,888-758-4389,E,Public,24 hours daily,,,2,0,35.780115,-78.648556,12/01/2023,149667,2023-01-12 23:15:00 UTC,03/12/2019,J1772,
ELEC,WISTERIA COFFEE WISTERIA COFFEE,537 S Main St,,King,NC,27021,888-758-4389,E,Public,24 hours daily,,,2,0,36.27016,-80.36066,12/01/2023,149707,2023-01-12 23:15:39 UTC,04/12/2019,J1772,
ELEC,FOOD CITY FOOD CITY651 #1,1715 W Broadway Ave,,Maryville,TN,37801,888-758-4389,E,Public,24 hours daily,,,2,0,35.736697,-83.99328,12/01/2023,150000,2023-01-12 23:16:04 UTC,13/12/2019,J1772,
ELEC,GSD STATION 1,Unnamed Road,,Duluth,GA,30097,888-758-4389,E,Public,24 hours daily,,,2,0,33.989123,-84.092054,12/01/2023,150044,2023-01-12 23:14:30 UTC,14/12/2019,J1772,
ELEC,Toringdon Market - Tesla Supercharger,3429 Toringdon Way,,Charlotte,NC,28277,877-798-3752,E,Public,24 hours daily; for Tesla use only,,,,12,35.069256,-80.842023,03/10/2022,150209,2022-12-01 17:40:26 UTC,19/11/2019,TESLA,SHOPPING_CENTER
ELEC,Willowbrook Commons - Tesla Supercharger,61 East Thompson Lane,,Nashville,TN,37211,877-798-3752,E,Public,24 hours daily; for Tesla use only,,,,8,36.110515,-86.723904,03/10/2022,150215,2022-12-01 17:40:26 UTC,19/11/2019,TESLA,SHOPPING_CENTER
ELEC,Parkers - Tesla Supercharger,1118 South Lewis Street,,Metter,GA,30439,877-798-3752,E,Public,24 hours daily; for Tesla use only,,,,8,32.378977,-82.062649,03/10/2022,150223,2022-12-01 17:40:26 UTC,19/11/2019,TESLA,SHOPPING_CENTER
ELEC,Sheetz - Tesla Supercharger,1700 East Market Street,,Smithfield,NC,27577,877-798-3752,E,Public,24 hours daily; for Tesla use only,,,,8,35.504972,-78.325441,03/10/2022,150227,2022-12-01 17:40:26 UTC,19/11/2019,TESLA,SHOPPING_CENTER
ELEC,The Centre at Panola - Tesla Supercharger,3007 Panola Road,,Lithonia,GA,30038,877-798-3752,E,Public,24 hours daily; for Tesla use only,,,,12,33.698936,-84.173176,03/10/2022,150230,2022-12-01 17:40:26 UTC,19/11/2019,TESLA,SHOPPING_CENTER
ELEC,"CHARLOTTE, NC DISCOVERY 1",315 N Church St,,Charlotte,NC,28202,888-758-4389,E,Public,24 hours daily,,,1,0,35.230311,-80.841356,23/01/2023,150271,2023-01-23 23:05:39 UTC,17/12/2019,J1772,
ELEC,BMW Asheville,31 Skyland Inn Dr,,Arden,NC,28704,,E,Private,Dealership business hours; customer use only; contact 828-681-9900 for more information,,,8,0,35.481309,-82.553588,10/01/2022,150279,2022-02-10 19:42:29 UTC,01/12/2019,J1772,CAR_DEALER
ELEC,BMW Asheville,31 Skyland Inn Dr,,Arden,NC,28704,,E,Private,Service center use only,,,2,0,35.481309,-82.553588,10/01/2022,150280,2022-02-10 19:42:29 UTC,01/12/2019,J1772,CAR_DEALER
ELEC,COREV MOORE SQUARE 1,233 S Wilmington Street,,Raleigh,NC,27601,888-758-4389,E,Public,24 hours daily,,,1,0,35.777156,-78.6377,23/01/2023,150317,2023-01-23 23:09:09 UTC,18/12/2019,J1772,
ELEC,Smithfield's Chicken 'N Bar-B-Q Market Street - Tesla Destination,7300 Market St,,Wilmington,NC,28405,910-686-4175  877-798-3752,E,Public,,,,2,0,34.274394,-77.81613,06/10/2022,150553,2023-01-18 15:15:20 UTC,16/07/2019,TESLA,
ELEC,Smithfield's Chicken 'N Bar-B-Q-Dunn - Tesla Destination,2102 W Cumberland St,,Dunn,NC,28334,910-892-2693  877-798-3752,E,Public,,,,2,0,35.321249,-78.635358,06/10/2022,150554,2023-01-18 15:15:20 UTC,21/08/2019,TESLA,
ELEC,Courtyard by Marriott Atlanta/Vinings - Tesla Destination,2829 Overlook Pkwy,,Atlanta,GA,30339,770-436-8300  877-798-3752,E,Public,,,,2,0,33.780634,-84.480871,06/10/2022,150562,2023-01-18 15:15:20 UTC,12/06/2019,TESLA,
ELEC,La Quinta Inn & Suites by Wyndham Brunswick - Tesla Destination,100 Capital Square Dr,,Brunswick,GA,31525,912-263-3000  877-798-3752,E,Public,,,,2,0,31.243279,-81.507286,06/10/2022,150605,2023-01-18 15:15:20 UTC,20/05/2019,TESLA,
ELEC,City of Jesup - Tesla Destination,101 SW Broad St,,Jesup,GA,31545,912-427-1313  877-798-3752,E,Public,,,,2,0,31.605,-81.883056,06/10/2022,150651,2023-01-18 15:15:20 UTC,07/08/2019,TESLA,
ELEC,Candlewood Suites Smyrna - Nashville - Tesla Destination,930 Colonnade Dr,,Smyrna,TN,37167,615-442-8427  877-798-3752,E,Public,,,,2,0,35.974206,-86.576891,06/10/2022,150659,2023-01-18 15:15:20 UTC,15/03/2019,TESLA,
ELEC,Courtyard by Marriott Nashville/Murfreesboro - Tesla Destination,1306 Greshampark Dr,,Murfreesboro,TN,37129,615-907-3105  877-798-3752,E,Public,,,,1,0,35.86208,-86.450357,06/10/2022,150670,2023-01-18 15:15:20 UTC,04/03/2019,TESLA,
ELEC,Tropical Cuisine Restaurant - Tesla Destination,4899 Old National Hwy,,College Park,GA,30337,404-767-7421  877-798-3752,E,Public,,,,4,0,33.622108,-84.476883,06/10/2022,150687,2023-01-18 15:15:20 UTC,25/06/2019,TESLA,
ELEC,Tru by Hilton Smyrna Nashville - Tesla Destination,950 Colonnade Dr,,Smyrna,TN,37617,615-462-5075  877-798-3752,E,Public,,,,2,0,35.974685,-86.577599,06/10/2022,150689,2023-01-18 15:15:20 UTC,15/03/2019,TESLA,
ELEC,Rock Eagle 4-H Center - Tesla Destination,350 Rock Eagle Rd,,Eatonton,GA,31024,706-484-2899  877-798-3752,E,Public,,,,1,0,33.4231625,-83.3972435,06/10/2022,150708,2023-01-18 15:15:20 UTC,07/06/2019,TESLA,
ELEC,Big Green Egg - Tesla Destination,3786 DeKalb Technology Pkwy,,Atlanta,GA,30340,770-938-9394  877-798-3752,E,Public,,,,2,0,33.88719,-84.2674,06/10/2022,150716,2023-01-18 15:15:20 UTC,08/05/2019,TESLA,
ELEC,CHOA SUP CHARGER 07,1911 Cliff Valley Way NE,,Atlanta,GA,30329,888-758-4389,E,Public,24 hours daily,,,2,0,33.835653,-84.325298,12/01/2023,150826,2023-01-12 23:16:22 UTC,28/12/2019,J1772,
ELEC,Butler Creek,3330 Cobb Pkwy NW,,Acworth,GA,30101,888-264-2208,E,Public,6am-12am daily,,,2,0,34.035714,-84.676044,08/04/2021,151273,2022-10-17 15:38:16 UTC,11/04/2019,J1772,SHOPPING_CENTER
ELEC,North Point Mall,1000 North Point Cir,,Alpharetta,GA,30022,888-264-2208,E,Public,6am-12am daily,,,4,0,34.048216,-84.297096,05/05/2022,151274,2022-12-30 17:58:11 UTC,31/05/2019,J1772,SHOPPING_MALL
ELEC,Cumberland Mall,2860 Cumberland Mall SE,,Atlanta,GA,30339,888-264-2208,E,Public,6am-12am daily,,,3,0,33.881396,-84.468107,05/05/2022,151276,2022-12-30 17:58:11 UTC,14/03/2019,J1772,SHOPPING_MALL
ELEC,AMC Camp Creek 14,3760 Princeton Lakes Pkwy,,Atlanta,GA,30331,888-264-2208,E,Public,6am-12am daily,,,2,0,33.657761,-84.510387,08/04/2021,151277,2022-10-17 15:38:16 UTC,30/09/2019,J1772,SHOPPING_CENTER
ELEC,Perimter Mall,4400 Ashford Dunwoody Rd,,Atlanta,GA,30346,888-264-2208,E,Public,6am-12am daily,,,2,0,33.924893,-84.339423,05/05/2022,151278,2022-12-30 17:58:11 UTC,15/03/2019,J1772,SHOPPING_MALL
ELEC,Cumming Town Center,NEC I-19 & Marketplace Blvd,,Cumming,GA,30041,888-264-2208,E,Public,6am-12am daily,,,2,0,34.192909,-84.129777,08/04/2021,151720,2022-10-17 15:38:16 UTC,21/06/2019,J1772,SHOPPING_CENTER
ELEC,Whole Foods 365 Decatur,1555 Church St,,Decatur,GA,30030,888-264-2208,E,Public,6am-12am daily,,,2,0,33.792498,-84.283784,08/04/2021,151721,2022-10-17 15:38:16 UTC,29/12/2018,J1772,GROCERY
ELEC,Fairview Oaks,101 Fairview Rd,,Ellenwood,GA,30294,888-264-2208,E,Public,6am-12am daily,,,4,0,33.620027,-84.239229,14/06/2022,151722,2022-12-30 17:58:11 UTC,15/03/2019,J1772,SHOPPING_CENTER
ELEC,Shiloh Square Shopping Center,3895 Cherokee St NW,,Kennesaw,GA,30144,888-264-2208,E,Public,6am-12am daily,,,2,0,34.049105,-84.602816,08/04/2021,151723,2022-10-17 15:38:16 UTC,12/04/2019,J1772,SHOPPING_CENTER
ELEC,Paradise Crossing,2675 Lee Rd,,Lithia Springs,GA,30122,888-264-2208,E,Public,6am-12am daily,,,2,0,33.735196,-84.668179,08/04/2021,151724,2022-10-17 15:38:16 UTC,29/03/2019,J1772,SHOPPING_CENTER
ELEC,Mableton Crossing,4875 Floyd Rd SW,,Mableton,GA,30126,888-264-2208,E,Public,6am-12am daily,,,2,0,33.835703,-84.574765,08/04/2021,151725,2022-10-17 15:38:16 UTC,28/03/2019,J1772,SHOPPING_CENTER
ELEC,Macland Pointe,1750 Powder Springs Rd SW,,Marietta,GA,30064,888-264-2208,E,Public,6am-12am daily,,,2,0,33.903985,-84.606545,08/04/2021,151726,2022-10-17 15:38:16 UTC,27/03/2019,J1772,SHOPPING_CENTER
ELEC,Everson Pointe,3035 Centerville Hwy SW,,Snellville,GA,30039,888-264-2208,E,Public,6am-12am daily,,,2,0,33.825463,-84.033077,08/04/2021,151727,2022-10-17 15:38:16 UTC,18/03/2019,J1772,SHOPPING_CENTER
ELEC,Woodstock Square,120 Woodstock Square Ave,,Woodstock,GA,30189,888-264-2208,E,Public,6am-12am daily,,,2,0,34.084453,-84.545908,08/04/2021,151728,2022-10-17 15:38:16 UTC,30/04/2019,J1772,SHOPPING_CENTER
ELEC,Village Shoppes of East Cherokee,6236 Old Highway 5,,Woodstock,GA,30188,888-264-2208,E,Public,6am-12am daily,,,2,0,34.129501,-84.499189,08/04/2021,151729,2022-10-17 15:38:16 UTC,22/07/2019,J1772,SHOPPING_CENTER
ELEC,GEORGIA POWER MOROSGO DC,2452 Morosgo Way NE,,Atlanta,GA,30324,888-758-4389,E,Public,24 hours daily,,,,1,33.822336,-84.365415,12/01/2023,151923,2023-01-12 23:16:26 UTC,31/12/2019,CHADEMO J1772COMBO,
ELEC,MARTA KENSINGTON L2 3,3350 Kensington Rd,,Decatur,GA,30032,888-758-4389,E,Public,24 hours daily,,,2,0,33.771897,-84.25296,12/01/2023,151956,2023-01-12 23:16:26 UTC,01/01/2020,J1772,
ELEC,WB OFFICE 1 PD DC 1,9825 US HWY 74 E,,Lilesville,NC,28091,888-758-4389,E,Public,24 hours daily,,,,1,34.951946,-79.906958,12/01/2023,152049,2023-01-12 23:16:11 UTC,03/01/2020,CHADEMO J1772COMBO,
ELEC,PEMBROKE HQ CP2,8344 Fayetteville Rd,,Raeford,NC,28376,888-758-4389,E,Public,24 hours daily,,,2,0,35.031247,-79.119196,12/01/2023,152098,2023-01-12 23:16:54 UTC,04/01/2020,J1772,
ELEC,LEGACY AFC STATION 3,3353 Peachtree Rd NE,,Atlanta,GA,30326,888-758-4389,E,Public,24 hours daily,,,2,0,33.847485,-84.36689,12/01/2023,152107,2023-01-12 23:16:23 UTC,04/01/2020,J1772,
ELEC,CHOA CHARGER 01,1605 I - 85 Frontage Rd,,Atlanta,GA,30329,888-758-4389,E,Public,24 hours daily,,,2,0,33.835442,-84.326173,12/01/2023,152108,2023-01-12 23:16:22 UTC,04/01/2020,J1772,
ELEC,Perimter Mall,4400 Ashford Dunwoody Rd,,Atlanta,GA,30346,888-264-2208,E,Public,6am-12pm daily,,,2,0,33.924944,-84.341996,05/05/2022,152165,2022-12-30 17:58:11 UTC,20/01/2020,J1772,SHOPPING_MALL
ELEC,Perimter Mall,4400 Ashford Dunwoody Rd,,Atlanta,GA,30346,888-264-2208,E,Public,6am-12pm daily,,,2,0,33.92279,-84.339648,05/05/2022,152166,2022-12-30 17:58:11 UTC,20/01/2020,J1772,SHOPPING_MALL
ELEC,Perimter Mall,4400 Ashford Dunwoody Rd,,Atlanta,GA,30346,888-264-2208,E,Public,6am-12pm daily,,,2,0,33.921994,-84.340543,05/05/2022,152167,2022-12-30 17:58:11 UTC,20/01/2020,J1772,SHOPPING_MALL
ELEC,Perimter Mall,4400 Ashford Dunwoody Rd,,Atlanta,GA,30346,888-264-2208,E,Public,6am-12pm daily,,,2,0,33.922624,-84.340293,05/05/2022,152168,2022-12-30 17:58:11 UTC,20/01/2020,J1772,SHOPPING_MALL
ELEC,Cumberland Mall,2860 Cumberland Mall,,Atlanta,GA,30339,888-264-2208,E,Public,6am-12pm daily,,,3,0,33.881047,-84.46727,05/05/2022,152169,2022-12-30 17:58:11 UTC,20/01/2020,J1772,SHOPPING_MALL
ELEC,Cumberland Mall,2860 Cumberland Mall,,Atlanta,GA,30339,888-264-2208,E,Public,6am-12pm daily,,,2,0,33.87917,-84.467531,05/05/2022,152170,2022-12-30 17:58:11 UTC,20/01/2020,J1772,SHOPPING_MALL
ELEC,Cumberland Mall,2860 Cumberland Mall,,Atlanta,GA,30339,888-264-2208,E,Public,6am-12pm daily,,,2,0,33.879275,-84.468578,05/05/2022,152171,2022-12-30 17:58:11 UTC,20/01/2020,J1772,SHOPPING_MALL
ELEC,CANDLEWOOD CANDLEWOOD,1161 S Jefferson Ave,,Cookeville,TN,38506,888-758-4389,T,TEMPORARILY UNAVAILABLE (Public),24 hours daily,,,2,0,36.132294,-85.504364,12/01/2023,152235,2023-01-12 23:16:04 UTC,07/01/2020,J1772,
ELEC,Home 2 Suites by Hilton,2809 New Brunswick Road,,Memphis,TN,38133,888-998-2546,E,Public,MON: 24 hours | TUE: 24 hours | WED: 24 hours | THU: 24 hours | FRI: 24 hours | SAT: 24 hours | SUN: 24 hours,,,2,0,35.202501,-89.779719,23/01/2023,152338,2023-01-23 22:58:00 UTC,10/01/2020,J1772,
ELEC,SNOW HILL SNOW HILL,34 N. Perry Dr,,Snow Hill,NC,28580,888-758-4389,E,Public,24 hours daily,,,2,0,35.456219,-77.691922,12/01/2023,152346,2023-01-12 23:16:31 UTC,10/01/2020,J1772,
ELEC,MARTA HE HOLMES L2 1,Hamilton E. Holmes Station Bus Bay,,Atlanta,GA,30311,888-758-4389,E,Public,24 hours daily,,,2,0,33.753767,-84.469442,12/01/2023,152382,2023-01-12 23:16:33 UTC,11/01/2020,J1772,
ELEC,NC STATE CBC PARKING DEC,William Moore Dr,,Raleigh,NC,27606,888-758-4389,E,Public,24 hours daily,,,2,0,35.797681,-78.70632,23/01/2023,152410,2023-01-23 23:06:59 UTC,14/01/2020,J1772,
ELEC,NC STATE RESEARCH IV,909 Capability Dr,,Raleigh,NC,27606,888-758-4389,E,Public,24 hours daily,,,2,0,35.772503,-78.681099,23/01/2023,152411,2023-01-23 23:06:59 UTC,14/01/2020,J1772,
ELEC,NC STATE OVAL WEST DECK,Partners Way,,Raleigh,NC,27606,888-758-4389,E,Public,24 hours daily,,,2,0,35.771109,-78.67638,23/01/2023,152412,2023-01-23 23:06:55 UTC,14/01/2020,J1772,
ELEC,NC STATE PARTNERS II,840 Main Campus Dr,,Raleigh,NC,27606,888-758-4389,E,Public,24 hours daily,,,2,0,35.775484,-78.675918,23/01/2023,152413,2023-01-23 23:06:55 UTC,14/01/2020,J1772,
ELEC,NC STATE PARTNERS I,1017 Main Campus Dr,,Raleigh,NC,27606,888-758-4389,E,Public,24 hours daily,,,2,0,35.77042,-78.677132,23/01/2023,152414,2023-01-23 23:05:22 UTC,14/01/2020,J1772,
ELEC,NC STATE DAN ALLEN DR 01,110 Dan Allen Dr,,Raleigh,NC,27607,888-758-4389,E,Public,24 hours daily,,,2,0,35.787383,-78.675611,23/01/2023,152415,2023-01-23 23:04:06 UTC,14/01/2020,J1772,
ELEC,NC STATE COLISEUM 01,Cates Ave,,Raleigh,NC,27606,888-758-4389,E,Public,24 hours daily,,,2,0,35.782117,-78.667907,23/01/2023,152416,2023-01-23 23:04:06 UTC,14/01/2020,J1772,
ELEC,MARTA LINDBERGH L2 3,Sidney Marcus Blvd NE,,Atlanta,GA,30324,888-758-4389,E,Public,24 hours daily,,,2,0,33.825935,-84.369255,12/01/2023,152457,2023-01-12 23:16:38 UTC,16/01/2020,J1772,
ELEC,MARTA DORAVILLE L2 1,5932 New Peachtree Rd,,Atlanta,GA,30340,888-758-4389,E,Public,24 hours daily,,,2,0,33.90128,-84.282118,12/01/2023,152523,2023-01-12 23:16:40 UTC,18/01/2020,J1772,
ELEC,PEMBROKE HQ PM 1,6090 NC-711,,Pembroke,NC,28372,888-758-4389,E,Public,24 hours daily,,,2,0,34.653101,-79.153324,12/01/2023,152533,2023-01-12 23:12:10 UTC,18/01/2020,J1772,
ELEC,FOOD CITY STORE 625,110 N Industrial Dr,,Erwin,TN,37650,888-758-4389,E,Public,24 hours daily,,,2,0,36.149586,-82.418377,12/01/2023,152563,2023-01-12 23:16:48 UTC,22/01/2020,J1772,
ELEC,BLUERIDGEENERGY CORP HQ LEVEL 2,1216 Blowing Rock Blvd,,Lenoir,NC,28645,888-758-4389,E,Public,24 hours daily,,,2,0,35.9339,-81.52959,12/01/2023,152882,2023-01-12 23:16:48 UTC,23/01/2020,J1772,
ELEC,BEMC BOARDMAN,1029 Old Boardman Rd,,Evergreen,NC,28438,888-758-4389,E,Public,24 hours daily,,,,1,34.436977,-78.95024,12/01/2023,152884,2023-01-12 23:16:41 UTC,23/01/2020,CHADEMO J1772COMBO,
ELEC,Publix #1680,1010 Dr Martin L King Jr Blvd,,Nashville,TN,37203,615-259-6072,E,Public,Store business hours; customer use only while shopping at Publix,,,2,0,36.16331,-86.789734,06/04/2022,152995,2022-04-06 14:08:04 UTC,02/10/2019,J1772,PARKING_LOT
ELEC,Northwinds Summit 3000 location name,3000 Summit Place,,Alpharetta,GA,30009,800-663-5633,E,Public,,,,2,0,34.056177,-84.285802,21/12/2022,153000,2022-12-21 22:59:46 UTC,20/08/2019,J1772,
ELEC,HENDRICK MINI HENDRICK MINI,7036 E Independence Blvd,,Charlotte,NC,28227,888-758-4389,E,Public,24 hours daily,,,1,0,35.16482,-80.74191,12/01/2023,153007,2023-01-12 23:16:47 UTC,24/01/2020,J1772,
ELEC,GEORGIA POWER ATHENS DC (KRG),1001 Prince Ave,,Athens,GA,30606,888-758-4389,E,Public,24 hours daily,,,,1,33.961326,-83.394014,12/01/2023,153118,2023-01-12 23:16:55 UTC,29/01/2020,CHADEMO J1772COMBO,
ELEC,AEMC- AEMC HAMPTON IN,115 Hampton Dr,,Edenton,NC,27932,888-758-4389,E,Public,24 hours daily,,,2,0,36.078542,-76.617002,12/01/2023,153145,2023-01-12 23:16:54 UTC,30/01/2020,J1772,
ELEC,GALLERIA IMT GALLERIA GW,427 Nichol Mill Ln,,Brentwood,TN,37027,888-758-4389,E,Public,24 hours daily,,,2,0,35.956664,-86.818953,23/01/2023,153159,2023-01-23 23:09:08 UTC,30/01/2020,J1772,
ELEC,Harrah's Cherokee Casino and Resort location,777 Casino Drive,,Cherokee,NC,28719,800-663-5633,E,Public,,,,12,0,35.469824,-83.299459,21/12/2022,153246,2022-12-21 22:59:45 UTC,06/05/2019,J1772,
ELEC,WFM - SOUTH WHOLEFOODS MARK,5014 Poplar Ave,,Memphis,TN,38117,888-758-4389,T,TEMPORARILY UNAVAILABLE (Public),24 hours daily,,,2,0,35.113681,-89.894207,12/01/2023,153303,2023-01-12 23:16:56 UTC,05/02/2020,J1772,
ELEC,TVA DEMO 1 DEMO,26 Century Blvd,,Nashville,TN,37214,888-758-4389,T,TEMPORARILY UNAVAILABLE (Public),24 hours daily,,,2,0,36.150316,-86.685079,12/01/2023,153309,2023-01-12 23:16:19 UTC,05/02/2020,J1772,
ELEC,HAMPTON STATION 1,2825 Elm Hill Pike,,Nashville,TN,37214,888-758-4389,E,Public,24 hours daily,,,2,0,36.148162,-86.665805,12/01/2023,153325,2023-01-12 23:16:25 UTC,06/02/2020,J1772,
ELEC,Avalon - Tesla Supercharger,400 Avalon Boulevard,,Alpharetta,GA,30009,877-798-3752,E,Public,24 hours daily; for Tesla use only,,,,1,34.071365,-84.275362,03/10/2022,153442,2022-12-01 17:40:26 UTC,31/01/2020,TESLA,
ELEC,Parkside Town Commons - Tesla Supercharger,7119 O'Kelly Chapel Road,,Cary,NC,27519,877-798-3752,E,Public,24 hours daily; for Tesla use only,,,,12,35.84359,-78.886368,03/10/2022,153454,2022-12-01 17:40:26 UTC,31/01/2020,TESLA,
ELEC,MILL CHARGER LRC CORDOBA,807 E Main St,,Durham,NC,27701,888-758-4389,E,Public,24 hours daily,,,2,0,35.990618,-78.890272,12/01/2023,153510,2023-01-12 23:16:28 UTC,07/02/2020,J1772,
ELEC,Arrive Perimeter,2000 Asbury Square,,Atlanta,GA,30346,855-900-7584,E,Public,24 hours daily,,,2,0,33.927793,-84.332853,23/01/2023,153564,2023-01-23 23:11:57 UTC,08/02/2020,J1772,
ELEC,CAMERONATFP CAMERON AT FP 2,6300 Tower Cir,,Franklin,TN,37067,888-758-4389,E,Public,24 hours daily,,,2,0,35.937412,-86.81097,12/01/2023,153685,2023-01-12 23:17:02 UTC,13/02/2020,J1772,
ELEC,WARNER ROBINS PUBLIC 1,002 Myrtle St,,Warner Robins,GA,31093,888-758-4389,E,Public,24 hours daily,,,2,0,32.61957,-83.60671,12/01/2023,154018,2023-01-12 23:14:30 UTC,27/02/2020,J1772,
ELEC,TCEMC TRI-COUNTY ELEC,4255 S U.S. 117 Alt Hwy,,Dudley,NC,28333,888-758-4389,E,Public,24 hours daily,,,2,0,35.275194,-78.038723,12/01/2023,154063,2023-01-12 23:17:07 UTC,27/02/2020,J1772,
ELEC,SPG ELVT BRIER CRK.,9921 Horizon Overlook Rd,,Raleigh,NC,27617,888-758-4389,E,Public,24 hours daily,,,2,0,35.896455,-78.805318,12/01/2023,154064,2023-01-12 23:12:41 UTC,27/02/2020,J1772,
ELEC,TCMC B GARAGE CENTENNIAL B3,311 23rd Ave N,,Nashville,TN,37203,888-758-4389,E,Public,24 hours daily,,,2,0,36.152315,-86.807851,12/01/2023,154079,2023-01-12 23:16:02 UTC,27/02/2020,J1772,
ELEC,NASHVILLE VAMC NASH 1,1310 24th Ave S,,Nashville,TN,37212,888-758-4389,E,Public,24 hours daily,,,1,0,36.140718,-86.803386,23/01/2023,154145,2023-01-23 23:05:43 UTC,28/02/2020,J1772,
ELEC,TVHS STATION5,101-123 TN-268,,Murfreesboro,TN,37130,888-758-4389,T,TEMPORARILY UNAVAILABLE (Public),24 hours daily,,,1,0,35.910725,-86.383374,23/01/2023,154147,2023-01-23 23:01:02 UTC,28/02/2020,J1772,
ELEC,TVHS STATION4,188-244 TN-268,,Murfreesboro,TN,37129,888-758-4389,T,TEMPORARILY UNAVAILABLE (Public),24 hours daily,,,1,0,35.910369,-86.384607,23/01/2023,154148,2023-01-23 23:01:01 UTC,28/02/2020,J1772,
ELEC,THE ALASTAIR STATION 4,6500 Aria Blvd,,Sandy Springs,GA,30328,888-758-4389,E,Public,24 hours daily,,,2,0,33.93441,-84.365144,12/01/2023,154167,2023-01-12 23:17:34 UTC,29/02/2020,J1772,
ELEC,THE ALASTAIR STATION 2,6500 Aria Blvd,,Atlanta,GA,30328,888-758-4389,E,Public,24 hours daily,,,2,0,33.933284,-84.364535,12/01/2023,154168,2023-01-12 23:15:59 UTC,29/02/2020,J1772,
ELEC,MARTA COLLEGEPARK L23,"3800 E Main St,",,College Park,GA,30337,888-758-4389,E,Public,24 hours daily,,,2,0,33.650656,-84.447945,12/01/2023,154195,2023-01-12 23:17:22 UTC,01/03/2020,J1772,
ELEC,MARTA COLLEGEPARK L21,3800 Main St,,College Park,GA,30337,888-758-4389,E,Public,24 hours daily,,,2,0,33.65071,-84.448031,12/01/2023,154196,2023-01-12 23:17:21 UTC,01/03/2020,J1772,
ELEC,GABLES BUCKHEAD TAGB LVL1 1W,514 East Paces Ferry Rd NE,,Atlanta,GA,30305,888-758-4389,T,TEMPORARILY UNAVAILABLE (Public),24 hours daily,,,1,0,33.838598,-84.371431,23/01/2023,154227,2023-01-23 23:09:27 UTC,03/03/2020,J1772,
ELEC,GABLES BUCKHEAD TAGB LVL1 2S 3S,3092 Piedmont Rd NE,,Atlanta,GA,30305,888-758-4389,T,TEMPORARILY UNAVAILABLE (Public),24 hours daily,,,2,0,33.839695,-84.370372,23/01/2023,154228,2023-01-23 23:08:45 UTC,03/03/2020,J1772,
ELEC,MARTA NORTHSPRING L25,7010 Peachtree Dunwoody Rd,,Sandy Springs,GA,30328,888-758-4389,E,Public,24 hours daily,,,2,0,33.94429,-84.356829,12/01/2023,154273,2023-01-12 23:17:28 UTC,04/03/2020,J1772,
ELEC,AC HOTEL ATL AC HOTEL 3,2079 Hospitality Way,,College Park,GA,30337,888-758-4389,E,Public,24 hours daily,,,2,0,33.641296,-84.45709,12/01/2023,154363,2023-01-12 23:16:33 UTC,07/03/2020,J1772,
ELEC,Peabody Place Garage 1,110 Peabody Place,Chargers are located on Level 2 of the ||Parking Garage. Near Elevators.||,Memphis,TN,38103,888-998-2546,E,Public,MON: 24 hours | TUE: 24 hours | WED: 24 hours | THU: 24 hours | FRI: 24 hours | SAT: 24 hours | SUN: 24 hours,,,2,0,35.1409419,-90.0538061,23/01/2023,154404,2023-01-23 22:57:23 UTC,11/03/2020,J1772,
ELEC,GO BRAVES RED PARKING EV6,553 Circle 75 Pkwy Level 6,,Atlanta,GA,30339,888-758-4389,T,TEMPORARILY UNAVAILABLE (Public),24 hours daily,,,2,0,33.888754,-84.468605,23/01/2023,154432,2023-01-23 23:06:23 UTC,12/03/2020,J1772,
ELEC,CENTRAL EMC HQ CEMCHQ,125 Wilson Rd,,Sanford,NC,27332,888-758-4389,E,Public,24 hours daily,,,2,0,35.446423,-79.134325,12/01/2023,154434,2023-01-12 23:17:29 UTC,12/03/2020,J1772,
ELEC,"Blood Assurance, Inc.",705 E. 4th St,,Chattanooga,TN,37403,888-998-2546,E,Public,MON: 24 hours | TUE: 24 hours | WED: 24 hours | THU: 24 hours | FRI: 24 hours | SAT: 24 hours | SUN: 24 hours,,,1,0,35.051272,-85.301082,23/01/2023,154498,2023-01-23 22:57:21 UTC,17/03/2020,J1772,
ELEC,CITY OF ROSWELL SO.PARKING LOT,38 Hill St,,Roswell,GA,30075,888-758-4389,E,Public,24 hours daily,,,2,0,34.021984,-84.35969,12/01/2023,154580,2023-01-12 23:17:39 UTC,20/03/2020,J1772,
ELEC,CITY OF ROSWELL ROSWELL AREA PA,10495 Woodstock Rd,,Roswell,GA,30075,888-758-4389,E,Public,24 hours daily,,,2,0,34.038711,-84.36363,12/01/2023,154699,2023-01-12 23:17:40 UTC,25/03/2020,J1772,
ELEC,CITY OF ROSWELL E.ROSWELL PARK,9000 Fouts Rd,,Roswell,GA,30076,888-758-4389,E,Public,24 hours daily,,,2,0,34.0011,-84.297187,12/01/2023,154700,2023-01-12 23:17:39 UTC,25/03/2020,J1772,
ELEC,WFM - SOUTH WHOLEFOODS NAS1,1210 Broadway,,Nashville,TN,37203,888-758-4389,E,Public,24 hours daily,,,2,0,36.156702,-86.788385,12/01/2023,154784,2023-01-12 23:17:21 UTC,27/03/2020,J1772,
ELEC,JOEMC SF HAMPTON INN,1248 NC-210,,Sneads Ferry,NC,28460,888-758-4389,E,Public,24 hours daily,,,2,0,34.529071,-77.435023,12/01/2023,155152,2023-01-12 23:17:59 UTC,03/04/2020,J1772,
ELEC,JOEMC JOEMC HQ,259 Western Blvd,,Jacksonville,NC,28546,888-758-4389,E,Public,24 hours daily,,,2,0,34.75864,-77.382337,12/01/2023,155153,2023-01-12 23:17:59 UTC,03/04/2020,J1772,
ELEC,REVUP1 MCDONALDS ASHBO,1415 E Dixie Dr,,Asheboro,NC,27203,888-758-4389,E,Public,24 hours daily,,,,1,35.699907,-79.787618,12/01/2023,155154,2023-01-12 23:17:57 UTC,03/04/2020,CHADEMO J1772COMBO,
ELEC,McDonald's Store #27548,3494 Kildaire Farm Road,,Cary,NC,27518,888-998-2546,E,Public,MON: 24 hours | TUE: 24 hours | WED: 24 hours | THU: 24 hours | FRI: 24 hours | SAT: 24 hours | SUN: 24 hours,,,1,0,35.704118,-78.795636,23/01/2023,155208,2023-01-23 22:57:56 UTC,07/04/2020,J1772,
ELEC,THE WORKS CHATTAHOOCHEE 1,1235 Chattahoochee Ave NW,,Atlanta,GA,30318,888-758-4389,E,Public,24 hours daily,,,2,0,33.8031,-84.42836,12/01/2023,155222,2023-01-12 23:17:56 UTC,07/04/2020,J1772,
ELEC,COBB EMC OFFICE STATION #1,1000 EMC Pkwy,,Marietta,GA,30060,888-758-4389,E,Public,24 hours daily,,,,1,33.979965,-84.556744,12/01/2023,155241,2023-01-12 23:15:02 UTC,08/04/2020,CHADEMO J1772COMBO,
ELEC,ROANOKE EMC VISITOR LOT,518 NC-561,,Aulander,NC,27805,888-758-4389,E,Public,24 hours daily,,,2,0,36.307209,-77.035876,12/01/2023,155247,2023-01-12 23:17:51 UTC,08/04/2020,J1772,
ELEC,8K PARKING DECK 10K PARKING #2,10000 Avalon Blvd,,Alpharetta,GA,30009,888-758-4389,E,Public,24 hours daily,,,2,0,34.069778,-84.2743,12/01/2023,155283,2023-01-12 23:19:12 UTC,10/04/2020,J1772,
ELEC,UPC VISITOR PARKING,1525 N Rocky River Rd,,Monroe,NC,28110,888-758-4389,E,Public,24 hours daily,,,2,0,35.015972,-80.60669,12/01/2023,155291,2023-01-12 23:17:38 UTC,10/04/2020,J1772,
ELEC,Doubletree Hotel and Restaurant,1850 Old Fort Parkway,,Murfreesboro,TN,37129,888-998-2546,E,Public,MON: 24 hours | TUE: 24 hours | WED: 24 hours | THU: 24 hours | FRI: 24 hours | SAT: 24 hours | SUN: 24 hours,,,2,0,35.847488,-86.424329,23/01/2023,155332,2023-01-23 22:57:17 UTC,14/04/2020,J1772,
ELEC,FPWC MARKETFAIR MALL,5084-5398 Campground Rd,,Fayetteville,NC,28314,888-758-4389,E,Public,24 hours daily,,,2,0,35.068306,-78.969186,23/01/2023,155429,2023-01-23 23:03:25 UTC,18/04/2020,J1772,
ELEC,CHARLESHARDY STATION #1,176  Hillside Overlook,,Dallas,GA,30157,888-758-4389,E,Public,24 hours daily,,,2,0,33.93433,-84.729096,12/01/2023,155522,2023-01-12 23:18:07 UTC,23/04/2020,J1772,
ELEC,GO BRAVES ORANGE EV LV3 2,1800 Windy Ridge Pkwy SE,,Atlanta,GA,30339,888-758-4389,T,TEMPORARILY UNAVAILABLE (Public),24 hours daily,,,2,0,33.891304,-84.469213,23/01/2023,155523,2023-01-23 23:06:32 UTC,23/04/2020,J1772,
ELEC,GO BRAVES PURPLE DECK EV1,2675 Cobb Pkwy SE,,Smyrna,GA,30080,888-758-4389,T,TEMPORARILY UNAVAILABLE (Public),24 hours daily,,,2,0,33.887392,-84.471326,23/01/2023,155524,2023-01-23 23:06:22 UTC,23/04/2020,J1772,
ELEC,GO BRAVES PURPLE DECK EV2,925 Battery Ave SE,,Atlanta,GA,30339,888-758-4389,E,Public,24 hours daily,,,2,0,33.887256,-84.470586,23/01/2023,155525,2023-01-23 23:06:22 UTC,23/04/2020,J1772,
ELEC,STOCKYARDS UNION STCKYDS 1,801 2nd Ave N,,Nashville,TN,37201,888-758-4389,E,Public,24 hours daily,,,2,0,36.171467,-86.7815,12/01/2023,155530,2023-01-12 23:16:57 UTC,23/04/2020,J1772,
ELEC,CHATHAMELECTRIC BEV DISTRICT,130 Lorax Ln,,Pittsboro,NC,27312,888-758-4389,E,Public,24 hours daily,,,2,0,35.711341,-79.15664,12/01/2023,155546,2023-01-12 23:15:05 UTC,24/04/2020,J1772,
ELEC,SD3#1 PD2 STATION 1,1108 Charlottetowne Avenue,,Charlotte,NC,28204,888-758-4389,E,Public,24 hours daily,,,2,0,35.214645,-80.829184,12/01/2023,155547,2023-01-12 23:15:04 UTC,24/04/2020,J1772,
ELEC,Hartsfield-Jackson Atlanta International Airport - Domestic Terminal North Economy,6000 N Terminal Pkwy,,Atlanta,GA,30320,404-530-7300,E,Public,24 hours daily,,18,8,0,33.642956,-84.446969,13/12/2022,155584,2022-12-13 14:36:26 UTC,14/04/2020,J1772,AIRPORT
ELEC,Hartsfield-Jackson Atlanta International Airport - Domestic Terminal South Economy,6000 N Terminal Pkwy,,Atlanta,GA,30320,404-530-7300,E,Public,24 hours daily,,18,8,0,33.638834,-84.4465,13/12/2022,155585,2022-12-13 14:36:26 UTC,01/04/2020,J1772,AIRPORT
ELEC,Hartsfield-Jackson Atlanta International Airport - Domestic Terminal South Daily,6000 N Terminal Pkwy,,Atlanta,GA,30320,404-530-7300,E,Public,24 hours daily,,22,9,0,33.638427,-84.442878,13/12/2022,155586,2022-12-13 14:36:26 UTC,01/04/2020,J1772,AIRPORT
ELEC,Hartsfield-Jackson Atlanta International Airport - Domestic Terminal North Daily,6000 N Terminal Pkwy,,Atlanta,GA,30320,404-530-7300,E,Public,24 hours daily,,16,8,0,33.643771,-84.443812,13/12/2022,155587,2022-12-13 14:36:26 UTC,01/04/2020,J1772,AIRPORT
ELEC,The 500 Apartments,500 Northside Cir NW,,Atlanta,GA,30309,888-998-2546,E,Public,MON: 24 hours | TUE: 24 hours | WED: 24 hours | THU: 24 hours | FRI: 24 hours | SAT: 24 hours | SUN: 24 hours,,,3,0,33.799653,-84.402458,23/01/2023,155611,2023-01-23 22:57:54 UTC,29/04/2020,J1772,
ELEC,Bank of America - Charlotte,150 N College St,,Charlotte,NC,28202,,E,Private,Business hours,,,6,0,35.226655,-80.840749,14/06/2022,155670,2022-06-14 16:24:51 UTC,05/10/2017,J1772,BANK
ELEC,"Replacements, Ltd",1089 Knox Rd,,Mcleansville,NC,27301,336-697-3000,E,Public,8am-9pm daily,,,4,0,36.062008,-79.681901,13/12/2022,155682,2022-12-13 14:36:26 UTC,01/01/2020,J1772,SHOPPING_CENTER
ELEC,CITY OF GRIFFIN COG STATION 1,132 E Broad St,,Griffin,GA,30223,888-758-4389,E,Public,24 hours daily,,,2,0,33.250007,-84.263377,12/01/2023,155874,2023-01-12 23:18:05 UTC,30/04/2020,J1772,
ELEC,ENMARKET WENTWORTH DC,7002 GA-21,,Savannah,GA,31407,888-758-4389,E,Public,24 hours daily,,,,1,32.189128,-81.193298,12/01/2023,156075,2023-01-12 23:14:52 UTC,06/05/2020,CHADEMO J1772COMBO,
ELEC,Courtyard by Marriott Albany,3019 Kensington Court,,Albany,GA,31721,888-998-2546,E,Public,MON: 24 hours | TUE: 24 hours | WED: 24 hours | THU: 24 hours | FRI: 24 hours | SAT: 24 hours | SUN: 24 hours,,,2,0,31.620643,-84.229873,23/01/2023,156131,2023-01-23 22:58:04 UTC,08/05/2020,J1772,
ELEC,ENTRA WEST END STATION1 LEVEL1,451 Lee st sw,,Atlanta,GA,30310,888-758-4389,E,Public,24 hours daily,,,2,0,33.742912,-84.415191,12/01/2023,156139,2023-01-12 23:18:06 UTC,08/05/2020,J1772,
ELEC,LEXINGTON NC PARKWAY PLAZA#1,11 Plaza Pkwy,,Lexington,NC,27292,888-758-4389,E,Public,24 hours daily,,,2,0,35.783118,-80.256998,12/01/2023,156140,2023-01-12 23:18:24 UTC,08/05/2020,J1772,
ELEC,MARTA EDGEWOOD L1,1414 DeKalb Ave NE,,Atlanta,GA,30307,888-758-4389,E,Public,24 hours daily,,,2,0,33.76215,-84.341332,12/01/2023,156203,2023-01-12 23:18:25 UTC,12/05/2020,J1772,
ELEC,DURHAM COUNTY JUSTICE 1LEFT,510 S Dillard St,,Durham,NC,27701,888-758-4389,E,Public,24 hours daily,,,2,0,35.992184,-78.90133,12/01/2023,156319,2023-01-12 23:18:30 UTC,16/05/2020,J1772,
ELEC,DURHAM COUNTY SLIB LEFT,4515 S Alston Ave,,Durham,NC,27713,888-758-4389,E,Public,24 hours daily,,,2,0,35.902015,-78.887916,12/01/2023,156353,2023-01-12 23:18:32 UTC,19/05/2020,J1772,
ELEC,DURHAM COUNTY SLIB RIGHT,4505 S Alston Ave,,Durham,NC,27713,888-758-4389,E,Public,24 hours daily,,,2,0,35.90196,-78.887922,12/01/2023,156354,2023-01-12 23:18:32 UTC,19/05/2020,J1772,
ELEC,DURHAM COUNTY HHS 1,500 E Main St,,Durham,NC,27701,888-758-4389,E,Public,24 hours daily,,,2,0,35.991094,-78.894954,12/01/2023,156355,2023-01-12 23:18:32 UTC,19/05/2020,J1772,
ELEC,LEXINGTON NC PARKWAY PLAZA#2,11 Plaza Pkwy,,Lexington,NC,27292,888-758-4389,E,Public,24 hours daily,,,2,0,35.78313,-80.256915,12/01/2023,156356,2023-01-12 23:18:32 UTC,19/05/2020,J1772,
ELEC,DURHAM COUNTY NLIB RIGHT,221 Milton Rd,,Durham,NC,27712,888-758-4389,E,Public,24 hours daily,,,2,0,36.087715,-78.914126,12/01/2023,156357,2023-01-12 23:18:31 UTC,19/05/2020,J1772,
ELEC,Icon Buckhead Luxury Apartments,3372 Peachtree Rd NE,"Basement, 2nd, 4th, 5th, & 6th floors ||have 2 chargers. 3rd floor has 4 ||chargers. Unit numbers indicate what ||floor the charger is on.||",Atlanta,GA,30326,888-998-2546,E,Public,MON: 24 hours | TUE: 24 hours | WED: 24 hours | THU: 24 hours | FRI: 24 hours | SAT: 24 hours | SUN: 24 hours,,,13,0,33.849,-84.367,23/01/2023,156364,2023-01-23 22:58:03 UTC,20/05/2020,J1772,
ELEC,Alamo Steakhouse - Pigeon Forge,3050 Parkway,,Pigeon Forge,TN,37863,888-998-2546,E,Public,MON: 24 hours | TUE: 24 hours | WED: 24 hours | THU: 24 hours | FRI: 24 hours | SAT: 24 hours | SUN: 24 hours,,,2,0,35.794309,-83.562277,23/01/2023,156603,2023-01-23 22:57:46 UTC,22/05/2020,J1772,
ELEC,Hendrick Chevrolet,127 Kentington Dr,,Durham,NC,27713,919-827-0913,E,Public,Dealership business hours,,,4,1,35.898567,-78.942932,10/01/2023,157968,2023-01-10 16:44:47 UTC,15/05/2020,J1772 J1772COMBO,CAR_DEALER
ELEC,Orange County - Motor Pool Fueling Station,600 NC Highway 86 N,,Hillsborough,NC,27278,919-245-2625,E,Public,8:30am-4:30pm daily,,,3,0,36.092325,-79.106383,13/12/2022,158454,2022-12-13 14:36:26 UTC,31/12/2019,J1772,MUNI_GOV
ELEC,BROADSTONE DRM LEVEL 2 B,600 Willard St,,Durham,NC,27701,888-758-4389,T,TEMPORARILY UNAVAILABLE (Public),24 hours daily,,,1,0,35.993759,-78.908234,12/01/2023,158513,2023-01-12 23:17:04 UTC,04/06/2020,J1772,
ELEC,SREMC RAVENROCK,3299 Raven Rock Rd,,Lillington,NC,27546,888-758-4389,E,Public,24 hours daily,,,2,0,35.463818,-78.914215,12/01/2023,158536,2023-01-12 23:18:33 UTC,05/06/2020,J1772,
ELEC,PIVET PUBLIC DC4,2244 Metropolitan Pkwy SW,,Atlanta,GA,30315,888-758-4389,E,Public,24 hours daily,,,,1,33.692326,-84.406758,12/01/2023,158550,2023-01-12 23:18:35 UTC,06/06/2020,CHADEMO J1772COMBO,
ELEC,ATHERTONGARAGE 2ND LVL STN 1,2100 South Blvd,,Charlotte,NC,28203,888-758-4389,E,Public,24 hours daily,,,2,0,35.207005,-80.861607,12/01/2023,158573,2023-01-12 23:16:02 UTC,09/06/2020,J1772,
ELEC,"Brixmor Mansell Crossing (Alpharetta, GA)",7660 NORTH POINT PARKWAY,,Alpharetta,GA,30022,833-632-2778,E,Public,24 hours daily,,,,4,34.03882,-84.30476,23/01/2023,158609,2023-01-23 23:13:47 UTC,10/06/2020,CHADEMO J1772COMBO,
ELEC,Dorsey Alston Realtors,100 W. Paces Ferry Road,,Atlanta,GA,30305,888-998-2546,E,Public,MON: 24 hours | TUE: 24 hours | WED: 24 hours | THU: 24 hours | FRI: 24 hours | SAT: 24 hours | SUN: 24 hours,,,1,0,33.84111,-84.384784,23/01/2023,158617,2023-01-23 22:57:33 UTC,11/06/2020,J1772,
ELEC,GEORGIA POWER MERCER DC,1501 Mercer University Dr,,Macon,GA,31204,888-758-4389,E,Public,24 hours daily,,,,1,32.825982,-83.654742,23/01/2023,161685,2023-01-23 23:03:54 UTC,12/06/2020,CHADEMO J1772COMBO,
ELEC,GEORGIA POWER LAKEPOINT DC,171 LakePoint Pkwy,,Cartersville,GA,30121,888-758-4389,E,Public,24 hours daily,,,,1,34.119332,-84.746023,23/01/2023,161686,2023-01-23 23:03:54 UTC,12/06/2020,CHADEMO J1772COMBO,
ELEC,GEORGIA POWER VININGS L2,4300 Paces Ferry Rd,,Atlanta,GA,30339,888-758-4389,E,Public,24 hours daily,,,2,0,33.864377,-84.466737,23/01/2023,161688,2023-01-23 23:03:53 UTC,12/06/2020,J1772,
ELEC,METRO DC HOLCOMB BR DC,8465 Holcomb Bridge Rd,,JOHNS CREEK,GA,30022,888-758-4389,E,Public,24 hours daily,,,,1,33.986511,-84.270167,23/01/2023,161689,2023-01-23 23:03:54 UTC,12/06/2020,CHADEMO J1772COMBO,
ELEC,GEORGIA POWER CUMMING L2,1610 Market Pl Blvd,,Cumming,GA,30041,888-758-4389,E,Public,24 hours daily,,,2,0,34.187472,-84.130997,23/01/2023,161691,2023-01-23 23:03:53 UTC,12/06/2020,J1772,
ELEC,161 PEACHTREE STATION 1,161 Peachtree Center Ave NE,,Atlanta,GA,30303,888-758-4389,T,TEMPORARILY UNAVAILABLE (Public),24 hours daily,,,2,0,33.759447,-84.385629,23/01/2023,161693,2023-01-23 23:03:53 UTC,12/06/2020,J1772,
ELEC,HIGHWOODS 2500 NGW1,2500 Century Pkwy NE,,Atlanta,GA,30345,888-758-4389,E,Public,24 hours daily,,,2,0,33.848493,-84.306583,23/01/2023,161695,2023-01-23 23:03:47 UTC,12/06/2020,J1772,
ELEC,CORT WINDWARD LAKES EV1,905 Lake Union Hill Way,,Alpharetta,GA,30004,888-758-4389,E,Public,24 hours daily,,,2,0,34.082394,-84.279387,23/01/2023,161696,2023-01-23 23:03:47 UTC,12/06/2020,J1772,
ELEC,NORTHPARK 500 STATION 4,1100 Abernathy Rd NE,,Atlanta,GA,30328,888-758-4389,E,Public,24 hours daily,,,2,0,33.934552,-84.352375,23/01/2023,161697,2023-01-23 23:03:46 UTC,12/06/2020,J1772,
ELEC,MCGILL PARK 123 MCGILL PARK,101 McGill Park Ave NE,,Atlanta,GA,30312,888-758-4389,E,Public,24 hours daily,,,2,0,33.762771,-84.376919,23/01/2023,161698,2023-01-23 23:03:46 UTC,12/06/2020,J1772,
ELEC,CAMDEN BUCKHEAD THE BUCKHEAD,3097 Maple Dr NE,,Atlanta,GA,30305,888-758-4389,T,TEMPORARILY UNAVAILABLE (Public),24 hours daily,,,2,0,33.840017,-84.3714,23/01/2023,161699,2023-01-23 23:03:45 UTC,12/06/2020,J1772,
ELEC,THE GOODWYNN RETAIL,705 Town Blvd,,Atlanta,GA,30319,888-758-4389,T,TEMPORARILY UNAVAILABLE (Public),24 hours daily,,,2,0,33.870177,-84.337253,23/01/2023,161700,2023-01-23 23:03:40 UTC,12/06/2020,J1772,
ELEC,DOWNTOWN MILL ST LOT,818 Market St,,Woodstock,GA,30188,888-758-4389,E,Public,24 hours daily,,,2,0,34.100383,-84.520833,23/01/2023,161701,2023-01-23 23:03:38 UTC,12/06/2020,J1772,
ELEC,GA GWINNETT COL FACULTY LOT,225 Collins Industrial Way,,Lawrenceville,GA,30043,888-758-4389,E,Public,24 hours daily,,,2,0,33.97728,-84.002755,23/01/2023,161702,2023-01-23 23:03:34 UTC,12/06/2020,J1772,
ELEC,DEKALB COUNTY BOBBY BURGESS,3630 Camp Cir,,Decatur,GA,30032,888-758-4389,E,Public,24 hours daily,,,2,0,33.776547,-84.241129,23/01/2023,161703,2023-01-23 23:03:33 UTC,12/06/2020,J1772,
ELEC,GWCC GWCC 2,285 Andrew Young International Blvd,,Atlanta,GA,30313,888-758-4389,E,Public,24 hours daily,,,2,0,33.756865,-84.397691,23/01/2023,161705,2023-01-23 23:03:33 UTC,12/06/2020,J1772,
ELEC,WELCOME CENTER WELCOME CENTER,5 Griffin St,,McDonough,GA,30253,888-758-4389,E,Public,24 hours daily,,,2,0,33.447505,-84.14744,23/01/2023,161707,2023-01-23 23:03:31 UTC,12/06/2020,J1772,
ELEC,NORTHPARK 400 STATION 1,1000 Abernathy Rd NE,,Atlanta,GA,30328,888-758-4389,E,Public,24 hours daily,,,2,0,33.934762,-84.354626,23/01/2023,161708,2023-01-23 23:03:24 UTC,12/06/2020,J1772,
ELEC,GEORGIA STATE GSU LAW,85 Park Pl NE,,Atlanta,GA,30303,888-758-4389,E,Public,24 hours daily,,,2,0,33.756625,-84.387178,23/01/2023,161709,2023-01-23 23:03:23 UTC,12/06/2020,J1772,
ELEC,DEKALB COUNTY TIRE FLEET SHOP,4380 Memorial Dr,,Decatur,GA,30032,888-758-4389,E,Public,24 hours daily,,,2,0,33.77765,-84.245062,23/01/2023,161710,2023-01-23 23:03:22 UTC,12/06/2020,J1772,
ELEC,ALLIANCE CENTER ONE ALLIANCE #3,3500 Lenox Rd,,Atlanta,GA,30326,888-758-4389,E,Public,24 hours daily,,,2,0,33.852185,-84.366004,23/01/2023,161711,2023-01-23 23:03:22 UTC,12/06/2020,J1772,
ELEC,ALLIANCE CENTER TWO ALLIANCE #1,3560 Lenox Road,,Atlanta,GA,30326,888-758-4389,E,Public,24 hours daily,,,2,0,33.851657,-84.365865,23/01/2023,161712,2023-01-23 23:03:22 UTC,12/06/2020,J1772,
ELEC,PROMENADE DECK PROMENADE 2,15th St NE @ Lombardy Way NE,,Atlanta,GA,30309,888-758-4389,E,Public,24 hours daily,,,2,0,33.78806,-84.385908,23/01/2023,161714,2023-01-23 23:03:16 UTC,12/06/2020,J1772,
ELEC,SAVANNAH TANGER 1,200 Tanger Outlet Blvd.,,Pooler,GA,31322,888-758-4389,E,Public,24 hours daily,,,2,0,32.133933,-81.241584,23/01/2023,161715,2023-01-23 23:03:08 UTC,12/06/2020,J1772,
ELEC,SAVANNAH TANGER 3,200 Tanger Blvd.,,Pooler,GA,31322,888-758-4389,E,Public,24 hours daily,,,2,0,32.134055,-81.241522,23/01/2023,161716,2023-01-23 23:03:05 UTC,12/06/2020,J1772,
ELEC,CROCKER PARTNER CP PROMINENCE 1,3475 Piedmont Rd NE,,Atlanta,GA,30305,888-758-4389,T,TEMPORARILY UNAVAILABLE (Public),24 hours daily,,,2,0,33.850095,-84.375025,23/01/2023,161717,2023-01-23 23:03:04 UTC,12/06/2020,J1772,
ELEC,THE SHOPS BA 297 EAST PACES,The Shops Buckhead Atlanta 297 East Paces Fer,,Atlanta,GA,30305,888-758-4389,E,Public,24 hours daily,,,2,0,33.838963,-84.378422,23/01/2023,161718,2023-01-23 23:02:58 UTC,12/06/2020,J1772,
ELEC,4TH FLOOR NORTH STATION 1,297 East Paces Ferry Rd NE,,Atlanta,GA,30305,888-758-4389,E,Public,24 hours daily,,,2,0,33.838963,-84.378436,23/01/2023,161719,2023-01-23 23:02:58 UTC,12/06/2020,J1772,
ELEC,7000 PARKWAY 2,7000 Central Pkwy,,Atlanta,GA,30328,888-758-4389,E,Public,24 hours daily,,,2,0,33.92721,-84.348715,23/01/2023,161720,2023-01-23 23:02:55 UTC,12/06/2020,J1772,
ELEC,NORTHWINDS NORTHWINDS6-1,11675 Rainwater Dr,,Alpharetta,GA,30009,888-758-4389,E,Public,24 hours daily,,,2,0,34.065003,-84.28954,23/01/2023,161721,2023-01-23 23:02:54 UTC,12/06/2020,J1772,
ELEC,COUSINS 3348 P6 #1,3348 Peachtree Rd NE,,Atlanta,GA,30326,888-758-4389,E,Public,24 hours daily,,,2,0,33.847872,-84.369679,23/01/2023,161722,2023-01-23 23:02:54 UTC,12/06/2020,J1772,
ELEC,NORTHWINDS NORTHWINDS4-1,11605 Haynes Bridge Rd,,Alpharetta,GA,30009,888-758-4389,E,Public,24 hours daily,,,2,0,34.063068,-84.29029,23/01/2023,161724,2023-01-23 23:02:53 UTC,12/06/2020,J1772,
ELEC,CHOICE ST CHIOCE AVE LOT1,159 Choice Avenue,,Dahlonega,GA,30533,888-758-4389,T,TEMPORARILY UNAVAILABLE (Public),24 hours daily,,,2,0,34.532572,-83.983281,23/01/2023,161725,2023-01-23 23:02:51 UTC,12/06/2020,J1772,
ELEC,LOCUST GROVE TANGER EV 1,1000 Tanger Dr,,Locust Grove,GA,30248,888-758-4389,T,TEMPORARILY UNAVAILABLE (Public),24 hours daily,,,2,0,33.348908,-84.12272,23/01/2023,161727,2023-01-23 23:02:48 UTC,12/06/2020,J1772,
ELEC,COUSINS 3344 P6 #1,3344 Peachtree Rd NE,,Atlanta,GA,30305,888-758-4389,E,Public,24 hours daily,,,2,0,33.847407,-84.368503,23/01/2023,161730,2023-01-23 23:02:44 UTC,12/06/2020,J1772,
ELEC,DEKALB COUNTY FLEET,5350 Memorial Dr,,Stone Mountain,GA,30083,888-758-4389,E,Public,24 hours daily,,,2,0,33.800454,-84.218953,23/01/2023,161733,2023-01-23 23:02:17 UTC,12/06/2020,J1772,
ELEC,DEKALB COUNTY SANITATION,Leroy Scott Dr,,Decatur,GA,30032,888-758-4389,E,Public,24 hours daily,,,2,0,33.773652,-84.23738,23/01/2023,161734,2023-01-23 23:02:17 UTC,12/06/2020,J1772,
ELEC,DEKALB COUNTY MALOOF,1300 Commerce Dr,,Decatur,GA,30030,888-758-4389,E,Public,24 hours daily,,,2,0,33.774276,-84.299816,23/01/2023,161735,2023-01-23 23:02:17 UTC,12/06/2020,J1772,
ELEC,DEPOT CITY OF TOCCOA,160 N. Alexander St,,Toccoa,GA,30577,888-758-4389,T,TEMPORARILY UNAVAILABLE (Public),24 hours daily,,,2,0,34.578773,-83.331708,23/01/2023,161738,2023-01-23 23:02:08 UTC,12/06/2020,J1772,
ELEC,UGA EAST DECK,East Campus Deck,,Athens,GA,30605,888-758-4389,E,Public,24 hours daily,,,2,0,33.937777,-83.36914,23/01/2023,161739,2023-01-23 23:02:08 UTC,12/06/2020,J1772,
ELEC,UGA SOUTH DECK,South Campus Deck,,Athens,GA,30605,888-758-4389,E,Public,24 hours daily,,,2,0,33.945267,-83.377682,23/01/2023,161740,2023-01-23 23:02:08 UTC,12/06/2020,J1772,
ELEC,HAYNES HOUSE SINGLE CHARGER,2420 Peachtree Rd,,Atlanta,GA,30305,888-758-4389,E,Public,24 hours daily,,,1,0,33.821009,-84.388902,23/01/2023,161744,2023-01-23 23:02:05 UTC,12/06/2020,J1772,
ELEC,GA TECH AREA 4 #2,837 State St NW,,Atlanta,GA,30313,888-758-4389,E,Public,24 hours daily,,,2,0,33.777503,-84.399303,23/01/2023,161745,2023-01-23 23:02:03 UTC,12/06/2020,J1772,
ELEC,GA TECH W23 #2,352 Peachtree Pl NW,,Atlanta,GA,30318,888-758-4389,E,Public,24 hours daily,,,2,0,33.780046,-84.398503,23/01/2023,161746,2023-01-23 23:02:03 UTC,12/06/2020,J1772,
ELEC,GA TECH W02 #2,353 Ferst Dr NW,,Atlanta,GA,30313,888-758-4389,E,Public,24 hours daily,,,2,0,33.774416,-84.400414,23/01/2023,161747,2023-01-23 23:02:03 UTC,12/06/2020,J1772,
ELEC,HAYNES HOUSE DUAL CHARGER,2500 Peachtree Rd NW,,Atlanta,GA,30305,888-758-4389,E,Public,24 hours daily,,,2,0,33.823395,-84.387851,23/01/2023,161748,2023-01-23 23:02:01 UTC,12/06/2020,J1772,
ELEC,ATLANTA FALCONS MBS CFHOF,250 Marietta St NW,,Atlanta,GA,30313,888-758-4389,E,Public,24 hours daily,,,2,0,33.760464,-84.3956,23/01/2023,161749,2023-01-23 23:02:01 UTC,12/06/2020,J1772,
ELEC,THE SHOPS BA 220 PHARR RD NE,"The Shops Buckhead Atlanta 220 Pharr Road, NE",,Atlanta,GA,30305,888-758-4389,E,Public,24 hours daily,,,2,0,33.837367,-84.380243,23/01/2023,161750,2023-01-23 23:02:01 UTC,12/06/2020,J1772,
ELEC,GA TECH CURRAN,875 Curran St NW,,Atlanta,GA,30318,888-758-4389,E,Public,24 hours daily,,,2,0,33.779423,-84.405185,23/01/2023,161753,2023-01-23 23:02:00 UTC,12/06/2020,J1772,
ELEC,CITY HALL PROTOTYPE PRIME,147 Technology Pkwy,,Peachtree Corners,GA,30092,888-758-4389,T,TEMPORARILY UNAVAILABLE (Public),24 hours daily,,,2,0,33.963573,-84.220907,23/01/2023,161754,2023-01-23 23:02:00 UTC,12/06/2020,J1772,
ELEC,ATLANTIC STN 1682LF 1683RT,261 19th St NW,,Atlanta,GA,30363,888-758-4389,E,Public,24 hours daily,,,2,0,33.793756,-84.395912,23/01/2023,161756,2023-01-23 23:01:57 UTC,12/06/2020,J1772,
ELEC,AVALON CHARGE AVALON STATION4,1400 Alpha Ct,,Alpharetta,GA,30009,888-758-4389,E,Public,24 hours daily,,,2,0,34.071245,-84.277527,23/01/2023,161757,2023-01-23 23:01:54 UTC,12/06/2020,J1772,
ELEC,AVALON CHARGE AVALON STATION5,2200 Avalon Boulevard,,Alpharetta,GA,30009,888-758-4389,E,Public,24 hours daily,,,2,0,34.070403,-84.278266,23/01/2023,161758,2023-01-23 23:01:54 UTC,12/06/2020,J1772,
ELEC,BMW OF ROSWELL STATION 13,11458 Alpharetta Hwy,,Roswell,GA,30076,888-758-4389,T,TEMPORARILY UNAVAILABLE (Public),24 hours daily,,,1,0,34.058519,-84.328297,23/01/2023,161759,2023-01-23 23:01:42 UTC,12/06/2020,J1772,
ELEC,AVALON CHARGE AVALON STATION1,3000 Old Milton Pkwy,,Alpharetta,GA,30004,888-758-4389,E,Public,24 hours daily,,,2,0,34.070161,-84.275247,23/01/2023,161760,2023-01-23 23:01:42 UTC,12/06/2020,J1772,
ELEC,BROADCOM DULUTH 01,4385 River Green Pkwy,,Duluth,GA,30096,888-758-4389,E,Public,24 hours daily,,,2,0,34.020991,-84.167148,23/01/2023,161762,2023-01-23 23:01:36 UTC,12/06/2020,J1772,
ELEC,ATLANTA FALCONS AF EXEC LOT 3,4400 Falcon Pkwy,,Flowery Branch,GA,30542,888-758-4389,E,Public,24 hours daily,,,2,0,34.192062,-83.898393,23/01/2023,161763,2023-01-23 23:01:30 UTC,12/06/2020,J1772,
ELEC,ATLANTA FALCONS AMBFO,3223 Howell Mill Road Northwest,,Atlanta,GA,30327,888-758-4389,T,TEMPORARILY UNAVAILABLE (Public),24 hours daily,,,2,0,33.844056,-84.427773,23/01/2023,161764,2023-01-23 23:01:30 UTC,12/06/2020,J1772,
ELEC,EV CHARGER DOUBLETREE,5351 Sidney Simons Blvd,,Columbus,GA,31904,888-758-4389,E,Public,24 hours daily,,,2,0,32.517868,-84.953876,23/01/2023,161765,2023-01-23 23:01:28 UTC,12/06/2020,J1772,
ELEC,EV CHARGER MARRIOTT,800 Front Ave,,Columbus,GA,31901,888-758-4389,E,Public,24 hours daily,,,2,0,32.462458,-84.993941,23/01/2023,161766,2023-01-23 23:01:28 UTC,12/06/2020,J1772,
ELEC,GOVERNMENT GOVT CENTER EV,200 Central Ave SW,,Atlanta,GA,30303,888-758-4389,E,Public,24 hours daily,,,2,0,33.747541,-84.39115,23/01/2023,161769,2023-01-23 23:01:23 UTC,12/06/2020,J1772,
ELEC,GEORGIA STATE GSU-W LOT,100 Auburn Ave,,Atlanta,GA,30312,888-758-4389,E,Public,24 hours daily,,,1,0,33.756423,-84.383817,23/01/2023,161770,2023-01-23 23:01:17 UTC,12/06/2020,J1772,
ELEC,GEORGIA STATE GSU-M DECK,11-33 Auditorium Pl SE,,Atlanta,GA,30303,888-758-4389,E,Public,24 hours daily,,,1,0,33.753387,-84.383819,23/01/2023,161771,2023-01-23 23:01:16 UTC,12/06/2020,J1772,
ELEC,PROMENADE DECK PROMENADE,1230 Peachtree Street,,Atlanta,GA,30309,888-758-4389,E,Public,24 hours daily,,,2,0,33.787868,-84.386047,23/01/2023,161773,2023-01-23 23:01:12 UTC,12/06/2020,J1772,
ELEC,ACCESSO SERVICE BLDG 555 GW,555 North Point Center East,,Alpharetta,GA,30022,888-758-4389,T,TEMPORARILY UNAVAILABLE (Public),24 hours daily,,,2,0,34.047943,-84.300965,23/01/2023,161774,2023-01-23 23:01:12 UTC,12/06/2020,J1772,
ELEC,250WILLIAMS STATION 1,250 Williams St NW,,Atlanta,GA,30303,888-758-4389,E,Public,24 hours daily,,,2,0,33.761611,-84.391309,23/01/2023,161779,2023-01-23 23:01:07 UTC,12/06/2020,J1772,
ELEC,SNAFC 1 EPA_SNAFC_1,61 Forsyth St SW,,Atlanta,GA,30303,888-758-4389,E,Public,24 hours daily,,,1,0,33.754284,-84.393607,23/01/2023,161781,2023-01-23 23:01:06 UTC,12/06/2020,J1772,
ELEC,WOCC COCA-COLA UNIT #1,126 Ivan Allen Jr Blvd,,Atlanta,GA,30313,888-758-4389,E,Public,24 hours daily,,,2,0,33.764345,-84.393964,23/01/2023,161784,2023-01-23 23:01:01 UTC,12/06/2020,J1772,
ELEC,TURNER TECHWOOD TECH 1000 2,1000 Techwood Dr NW,,Atlanta,GA,30318,888-758-4389,E,Public,24 hours daily,,,2,0,33.781903,-84.393491,23/01/2023,161785,2023-01-23 23:01:00 UTC,12/06/2020,J1772,
ELEC,FORT BENNING STAFF GARAGE 1,Martin Loop,,Fort Benning,GA,31905,888-758-4389,E,Public,24 hours daily,,,2,0,32.371303,-84.928001,23/01/2023,161786,2023-01-23 23:01:00 UTC,12/06/2020,J1772,
ELEC,FORT BENNING VISITOR GARAGE1,6600 Van Aalst Blvd,,Fort Benning,GA,31905,888-758-4389,T,TEMPORARILY UNAVAILABLE (Public),24 hours daily,,,2,0,32.374362,-84.930617,23/01/2023,161787,2023-01-23 23:01:00 UTC,12/06/2020,J1772,
ELEC,WELLSTAR WELLSTAR,2518 Jimmy Lee Smith Parkway,,Hiram,GA,30141,888-758-4389,E,Public,24 hours daily,,,2,0,33.901247,-84.780228,23/01/2023,161788,2023-01-23 23:00:58 UTC,12/06/2020,J1772,
ELEC,UGA NORTH DECK,230-270 S Thomas St,,Athens,GA,30602,888-758-4389,E,Public,24 hours daily,,,2,0,33.956125,-83.372654,23/01/2023,161789,2023-01-23 23:00:58 UTC,12/06/2020,J1772,
ELEC,GEORGIA STATE GSU-M DECK 2,Piedmont Ave SE,,Atlanta,GA,30303,888-758-4389,E,Public,24 hours daily,,,1,0,33.753323,-84.383877,23/01/2023,161790,2023-01-23 23:00:58 UTC,12/06/2020,J1772,
ELEC,GA TECH E81 #2,81 4th St NW,,Atlanta,GA,30308,888-758-4389,E,Public,24 hours daily,,,2,0,33.775217,-84.389428,23/01/2023,161791,2023-01-23 23:00:56 UTC,12/06/2020,J1772,
ELEC,BMW S ATLANTA CT4000-SERVICE,4171 Jonesboro Rd,,Union City,GA,30291,888-758-4389,E,Public,24 hours daily,,,2,0,33.567325,-84.522661,23/01/2023,161792,2023-01-23 23:00:54 UTC,12/06/2020,J1772,
ELEC,BMW GWINNETT STATION 01,3264 Commerce Ave NW,,Duluth,GA,30096,888-758-4389,T,TEMPORARILY UNAVAILABLE (Public),24 hours daily,,,2,0,33.959613,-84.11946,23/01/2023,161794,2023-01-23 23:00:52 UTC,12/06/2020,J1772,
ELEC,TURNER PROPERTI CNN CENTER U1,Centennial Olympic Park Dr NW,,Atlanta,GA,30303,888-758-4389,E,Public,24 hours daily,,,2,0,33.756115,-84.39534,23/01/2023,161796,2023-01-23 23:00:50 UTC,12/06/2020,J1772,
ELEC,TURNER TECHWOOD TECH 1030 02,1030 Techwood Dr NW,,Atlanta,GA,30318,888-758-4389,E,Public,24 hours daily,,,2,0,33.78313,-84.394965,23/01/2023,161797,2023-01-23 23:00:47 UTC,12/06/2020,J1772,
ELEC,GEORGIA BUILD GBA 02,216 Capitol Avenue SW,,Atlanta,GA,30334,888-758-4389,E,Public,24 hours daily,,,2,0,33.747665,-84.387242,23/01/2023,161799,2023-01-23 23:00:34 UTC,12/06/2020,J1772,
ELEC,BEMC SUNSET BEACH,401-419 State Rd 1172,,Sunset Beach,NC,28468,888-758-4389,E,Public,24 hours daily,,,1,0,33.870296,-78.507535,23/01/2023,162526,2023-01-23 23:05:09 UTC,12/06/2020,J1772,
ELEC,7SPC GREENEVILLE TA,195 Van Hill Rd,,Greeneville,TN,37745,888-758-4389,E,Public,24 hours daily,,,,1,36.32513,-82.835075,12/01/2023,162530,2023-01-12 23:18:52 UTC,12/06/2020,CHADEMO J1772COMBO,
ELEC,Bessemer City NC,132 W Virginia Ave,,Bessemer City,NC,28016,855-900-7584,E,Public,24 hours daily,,,4,0,35.285187,-81.285203,23/01/2023,163317,2023-01-23 23:12:02 UTC,12/06/2020,J1772,
ELEC,MARTA WINDWARD L2 2,12585 Dryden RD,,Alpharetta,GA,30005,888-758-4389,E,Public,24 hours daily,,,2,0,34.086039,-84.260709,12/01/2023,163326,2023-01-12 23:18:53 UTC,13/06/2020,J1772,
ELEC,121 PWC P DECK PRADO 2,121 Perimeter Center W,,Atlanta,GA,30346,888-758-4389,E,Public,24 hours daily,,,2,0,33.927557,-84.342843,12/01/2023,163327,2023-01-12 23:14:57 UTC,13/06/2020,J1772,
ELEC,Piedmont Columbus Regional Northside,100 Frist Ct,,Columbus,GA,31909,706-494-2100,E,Public,24 hours daily,,,2,0,32.534718,-84.950518,11/10/2022,163378,2022-10-11 18:56:12 UTC,12/06/2020,J1772,HOSPITAL
ELEC,Piedmont Columbus Regional Northside - Tesla,100 Frist Ct,,Columbus,GA,31909,706-494-2100,E,Public,24 hours daily,,,2,0,32.535334,-84.951209,11/10/2022,163379,2022-10-11 18:56:12 UTC,12/06/2020,TESLA,HOSPITAL
ELEC,Columbus Convention & Visitors Bureau,900 Front Ave,,Columbus,GA,31901,706-322-1613,E,Public,24 hours daily,,,1,0,32.463269,-84.993544,11/10/2022,163383,2022-10-11 18:56:12 UTC,12/06/2020,J1772,CONVENTION_CENTER
ELEC,Oxford Gateway Apartments LLC station location,Libby Way,,Charlotte,NC,28213,800-663-5633,E,Public,,,,6,0,35.286612,-80.758519,21/12/2022,163400,2022-12-21 22:59:40 UTC,19/07/2018,J1772,
ELEC,CRITZ MB 01,7000 Abercorn St,,Savannah,GA,31406,888-758-4389,E,Public,24 hours daily,,,2,0,32.013141,-81.112718,12/01/2023,163408,2023-01-12 23:18:38 UTC,16/06/2020,J1772,
ELEC,BEMC BRUNSWICKFOREST,1210 Dickinson Dr,,Leland,NC,28451,888-758-4389,E,Public,24 hours daily,,,2,0,34.201645,-78.04511,23/01/2023,163411,2023-01-23 23:09:32 UTC,16/06/2020,J1772,
ELEC,Mama's Farmhouse,208 Pickel Street,,Pigeon Forge,TN,37863,888-998-2546,E,Public,MON: 24 hours | TUE: 24 hours | WED: 24 hours | THU: 24 hours | FRI: 24 hours | SAT: 24 hours | SUN: 24 hours,,,2,0,35.79482,-83.566248,23/01/2023,163419,2023-01-23 22:57:15 UTC,17/06/2020,J1772,
ELEC,HAMPTON HAMPTON 1,5001 Crossings Cir,,Mt. Juliet,TN,37122,888-758-4389,E,Public,24 hours daily,,,2,0,36.168122,-86.51569,12/01/2023,163587,2023-01-12 23:13:30 UTC,24/06/2020,J1772,
ELEC,HAMPTON MARRIOTT,1980 Providence Pkwy,,Mt. Juliet,TN,37122,888-758-4389,T,TEMPORARILY UNAVAILABLE (Public),24 hours daily,,,2,0,36.164289,-86.518671,12/01/2023,163588,2023-01-12 23:13:30 UTC,24/06/2020,J1772,
ELEC,121 PWC P DECK PRADO 1,120 Perimeter Center Pkwy West,,Atlanta,GA,30346,888-758-4389,E,Public,24 hours daily,,,2,0,33.927557,-84.342907,12/01/2023,163604,2023-01-12 23:14:57 UTC,25/06/2020,J1772,
ELEC,EPA-RTP N. SURFACE LOT,109 T.W. Alexander Drive,,Research Triangle Park,NC,27711,888-758-4389,E,Public,24 hours daily,,,2,0,35.883498,-78.872654,12/01/2023,163607,2023-01-12 23:18:04 UTC,25/06/2020,J1772,
ELEC,CANDLEWOOD FRANKLIN,1305 Murfreesboro Rd,,Franklin,TN,37064,888-758-4389,E,Public,24 hours daily,,,2,0,35.915624,-86.827691,12/01/2023,163613,2023-01-12 23:18:59 UTC,25/06/2020,J1772,
ELEC,"Walmart 1181 (Marietta, GA)",1785 Cobb Pkwy S,,Marietta,GA,30060,833-632-2778,E,Public,24 hours daily,,,,4,33.90911,-84.48888,23/01/2023,163678,2023-01-23 23:13:51 UTC,27/06/2020,CHADEMO J1772COMBO,
ELEC,Staybridge Suites Downtown,1300 Carter Street,,Chattanooga,TN,37402,888-998-2546,E,Public,MON: 24 hours | TUE: 24 hours | WED: 24 hours | THU: 24 hours | FRI: 24 hours | SAT: 24 hours | SUN: 24 hours,,,2,0,35.040649,-85.31432,23/01/2023,163721,2023-01-23 22:57:18 UTC,01/07/2020,J1772,
ELEC,Rivertop Apartments,5800 River Rd,,Nashville,TN,37209,888-998-2546,E,Public,MON: 24 hours | TUE: 24 hours | WED: 24 hours | THU: 24 hours | FRI: 24 hours | SAT: 24 hours | SUN: 24 hours,,,1,0,36.130606,-86.913108,23/01/2023,163823,2023-01-23 22:57:55 UTC,03/07/2020,J1772,
ELEC,Park & Market,121 St Albans Drive,,Raleigh,NC,27609,866-816-7584,E,Public,,,,4,0,35.837988,-78.638219,23/01/2023,163963,2023-01-23 23:37:12 UTC,26/06/2020,J1772,
ELEC,City of Conover,501 1st Ave S,,Conover,NC,28613,866-816-7584,E,Public,,,,4,0,35.702669,-81.220209,23/01/2023,163964,2023-01-23 23:37:10 UTC,26/06/2020,J1772,
ELEC,Home2 Suites - Pigeon Forge,2819 Teaster LN,,Pigeon Forge,TN,37863,866-816-7584,E,Public,,,,2,0,35.802035,-83.564431,23/01/2023,163965,2023-01-23 23:37:08 UTC,26/06/2020,J1772,
ELEC,3800 GLENWOOD STATION 1,3701 National Dr PARKING DECK,,Raleigh,NC,27612,888-758-4389,E,Public,24 hours daily,,,1,0,35.831954,-78.66663,12/01/2023,164031,2023-01-12 23:16:34 UTC,07/07/2020,J1772,
ELEC,AAA - PIEDMONT PIEDMONT EV1,1968 Peachtree Rd NW,,Atlanta,GA,30309,888-758-4389,E,Public,24 hours daily,,,2,0,33.808757,-84.394504,23/01/2023,164047,2023-01-23 23:04:41 UTC,08/07/2020,J1772,
ELEC,AAA - PIEDMONT PIEDMONT EV2,1968 Peachtree Rd,,Atlanta,GA,30309,888-758-4389,E,Public,24 hours daily,,,2,0,33.808748,-84.39444,23/01/2023,164048,2023-01-23 23:04:38 UTC,08/07/2020,J1772,
ELEC,PEMBROKE HQ HI-EXPRESS 1,2521 Two Bale Ln,,Fayetteville,NC,28304,888-758-4389,E,Public,24 hours daily,,,2,0,35.025913,-79.058483,12/01/2023,164130,2023-01-12 23:19:12 UTC,10/07/2020,J1772,
ELEC,PF PARKING LOT BARLEY GARDEN L,500 Heatherden Ave,,Fayetteville,GA,30214,888-758-4389,E,Public,24 hours daily,,,2,0,33.470281,-84.506934,12/01/2023,164208,2023-01-12 23:19:20 UTC,14/07/2020,J1772,
ELEC,7SPC TTU DC FAST 1,320 University Drive,,Cookeville,TN,38501,888-758-4389,E,Public,24 hours daily,,,,1,36.176765,-85.511381,12/01/2023,164275,2023-01-12 23:17:25 UTC,16/07/2020,CHADEMO J1772COMBO,
ELEC,7SPC TRI-COUNTY EMC,405 College St,,Lafayette,TN,37083,888-758-4389,E,Public,24 hours daily,,,2,0,36.51925,-86.0307,12/01/2023,164334,2023-01-12 23:19:22 UTC,17/07/2020,J1772,
ELEC,401 Oberlin Apartments,401 Oberlin Road,Charger under repair. Residents & ||Guests Only||,Raleigh,NC,27605,888-998-2546,E,Public,MON: 24 hours | TUE: 24 hours | WED: 24 hours | THU: 24 hours | FRI: 24 hours | SAT: 24 hours | SUN: 24 hours,,,1,0,35.790001,-78.663673,23/01/2023,164409,2023-01-23 22:57:36 UTC,22/07/2020,J1772,
ELEC,"Simon Sugarloaf Mills (Lawrenceville, GA)",5900 SUGARLOAF PKWY,,Lawrenceville,GA,30043,833-632-2778,E,Public,24 hours daily,,,,4,33.97892,-84.083,23/01/2023,164430,2023-01-23 23:13:34 UTC,22/07/2020,CHADEMO J1772COMBO,
ELEC,Audi Northlake North Side,10831 Northlake Auto Plaza Blvd,,Charlotte,NC,28269,888-998-2546,E,Public,MON: 24 hours | TUE: 24 hours | WED: 24 hours | THU: 24 hours | FRI: 24 hours | SAT: 24 hours | SUN: 24 hours,,,1,0,35.36764,-80.833319,23/01/2023,164482,2023-01-23 22:58:06 UTC,24/07/2020,J1772,
ELEC,Audi Northlake South Side,10831 Northlake Auto Plaza Blvd,,Charlotte,NC,28269,888-998-2546,E,Public,MON: 24 hours | TUE: 24 hours | WED: 24 hours | THU: 24 hours | FRI: 24 hours | SAT: 24 hours | SUN: 24 hours,,,2,0,35.367969,-80.833713,23/01/2023,164484,2023-01-23 22:58:06 UTC,24/07/2020,J1772,
ELEC,MINI OF RALEIGH CUST SERVICE,5600 Capital Blvd,,Raleigh,NC,27616,888-758-4389,E,Public,24 hours daily,,,2,0,35.86181,-78.579836,12/01/2023,164525,2023-01-12 23:19:40 UTC,25/07/2020,J1772,
ELEC,GREENSBORO EV ARC 283,300 W Washington St,,Greensboro,NC,27401,888-758-4389,T,TEMPORARILY UNAVAILABLE (Public),24 hours daily,,,1,0,36.070089,-79.793024,12/01/2023,164526,2023-01-12 23:18:23 UTC,25/07/2020,J1772,
ELEC,GREENSBORO EV ARC 257,305W E Washington St,,Greensboro,NC,27401,888-758-4389,E,Public,24 hours daily,,,1,0,36.070008,-79.793001,12/01/2023,164527,2023-01-12 23:18:22 UTC,25/07/2020,J1772,
ELEC,New River Light & Power Co,220 Winklers Creek Rd,,Boone,NC,28607,828-264-3671,E,Public,24 hours daily,,,1,0,36.204401,-81.669919,10/01/2023,164556,2023-01-10 16:44:47 UTC,24/07/2020,J1772,UTILITY
ELEC,Town of Boone Public Parking,115 N Depot St,,Boone,NC,28607,828-268-6200,E,Public,24 hours daily,,,1,1,36.219181,-81.683769,13/12/2022,164557,2022-12-13 14:36:26 UTC,24/07/2020,CHADEMO J1772,PARKING_LOT
ELEC,Bodegas Kitchen and Wine Bar,488 Main St W,,Banner Elk,NC,28604,800-455-1981,E,Public,24 hours daily,,,2,0,36.162028,-81.878557,10/01/2023,164558,2023-01-10 16:44:47 UTC,24/07/2020,TESLA,RESTAURANT
ELEC,Bristol City Hall - Justice Center Parking Lot,801 Anderson St,,Bristol,TN,37620,423-989-5500,E,Public,24 hours daily,,,2,0,36.592938,-82.187959,05/08/2020,164559,2023-01-05 12:14:22 UTC,24/07/2020,J1772,MUNI_GOV
ELEC,Greeneville Light & Power System,110 N College St,,Greeneville,TN,37743,423-636-6200,E,Public,24 hours daily,,,1,0,36.163325,-82.828167,10/01/2023,164560,2023-01-10 16:44:47 UTC,24/07/2020,J1772,UTILITY
ELEC,Mountain Loft,110 Mountain Loft Dr,,Gatlinburg,TN,37738,865-436-4367,E,Public,24 hours daily; for guest use only,,,2,0,35.729904,-83.483826,10/01/2023,164562,2023-01-10 16:44:47 UTC,24/07/2020,J1772,HOTEL
ELEC,Southern Alliance for Clean Energy,3804 Middlebrook Pike,,Knoxville,TN,37921,865-637-6055,E,Public,24 hours daily,,,2,0,35.961862,-83.972406,10/01/2023,164563,2023-01-10 16:44:47 UTC,24/07/2020,J1772,OFFICE_BLDG
ELEC,Victor Ashe Park,4901 Bradshaw Rd,,Knoxville,TN,37912,865-215-4311,E,Public,24 hours daily,,,1,0,35.982641,-83.993154,10/08/2022,164564,2022-08-10 13:32:10 UTC,24/07/2020,J1772,MUNI_GOV
ELEC,Oconaluftee Visitor Center,1194 Newfound Gap Rd,,Cherokee,NC,28719,,E,Public,24 hours daily,,,,1,35.51307899,-83.30660868,22/02/2021,164621,2021-03-11 23:22:17 UTC,29/07/2020,CHADEMO J1772COMBO,NATL_PARK
ELEC,M3 STATION 2 - M3,1600 N Brown Rd,,Lawrenceville,GA,30043,888-758-4389,E,Public,24 hours daily,,,2,0,33.995461,-84.072887,12/01/2023,164631,2023-01-12 23:19:30 UTC,30/07/2020,J1772,
ELEC,PF PARKING LOT TOGWOTEE #4,1240 GA-54,,Fayetteville,GA,30214,888-758-4389,E,Public,24 hours daily,,,2,0,33.450397,-84.5073,12/01/2023,164658,2023-01-12 23:19:31 UTC,31/07/2020,J1772,
ELEC,METRO NASHVILLE NFD STATION 37,656 Colice Jeanne Rd,,Nashville,TN,37221,888-758-4389,E,Public,24 hours daily,,,2,0,36.072424,-86.933537,12/01/2023,164671,2023-01-12 23:19:24 UTC,31/07/2020,J1772,
ELEC,NOGAS,2612 Winford Ave,Charger under repair.||,Nashville,TN,37211,888-998-2546,E,Public,MON: 24 hours | TUE: 24 hours | WED: 24 hours | THU: 24 hours | FRI: 24 hours | SAT: 24 hours | SUN: 24 hours,,,1,0,36.115736,-86.752546,23/01/2023,164736,2023-01-23 22:58:02 UTC,01/08/2020,J1772,
ELEC,Fairfield Inn & Suites by Marriott - Smyrna,810 Expo Drive,The unit 024 is under repairs.||,Smyrna,TN,37167,888-998-2546,E,Public,MON: 24 hours | TUE: 24 hours | WED: 24 hours | THU: 24 hours | FRI: 24 hours | SAT: 24 hours | SUN: 24 hours,,,2,0,35.974702,-86.575069,23/01/2023,164745,2023-01-23 22:57:23 UTC,01/08/2020,J1772,
ELEC,"Hampton Inn & Suites Albany, GA",2628 Dawson Rd,NW of the entrance to the Building||,Albany,GA,31707,888-998-2546,E,Public,MON: 24 hours | TUE: 24 hours | WED: 24 hours | THU: 24 hours | FRI: 24 hours | SAT: 24 hours | SUN: 24 hours,,,3,0,31.615686,-84.221783,23/01/2023,164761,2023-01-23 22:58:04 UTC,01/08/2020,J1772,
ELEC,Avondale Estates,10 Sutton Place,,Avondale Estates,GA,30002,888-998-2546,E,Public,MON: 24 hours | TUE: 24 hours | WED: 24 hours | THU: 24 hours | FRI: 24 hours | SAT: 24 hours | SUN: 24 hours,,,2,0,33.763221,-84.2683859,23/01/2023,164775,2023-01-23 22:57:31 UTC,01/08/2020,J1772,
ELEC,Hilton Garden Inn Knoxville,216 Peregrine Way,,Knoxville,TN,37922,888-998-2546,E,Public,MON: 24 hours | TUE: 24 hours | WED: 24 hours | THU: 24 hours | FRI: 24 hours | SAT: 24 hours | SUN: 24 hours,,,1,0,35.915395,-84.094352,23/01/2023,164779,2023-01-23 22:57:36 UTC,01/08/2020,J1772,
ELEC,DUKEPTS H LOT ANDERSON,Yearby Ave at Anderson St,,Durham,NC,27705,888-758-4389,E,Public,24 hours daily,,,2,0,36.005122,-78.930204,12/01/2023,164836,2023-01-12 23:19:24 UTC,05/08/2020,J1772,
ELEC,Windsor at Midtown,2222 14th St NE,,Atlanta,GA,30309,800-663-5633,E,Public,,,,2,0,33.786461,-84.382876,21/12/2022,164855,2022-12-21 22:59:38 UTC,19/03/2019,J1772,
ELEC,IMT 8 SOUTH STATION 1,2405 8th Ave S,,Nashville,TN,37204,888-758-4389,E,Public,24 hours daily,,,2,0,36.126212,-86.77796,23/01/2023,164857,2023-01-23 23:06:40 UTC,06/08/2020,J1772,
ELEC,7SPC SCES DREAM MORE,2525 DreamMore Way DreamMore Resort Parking L,,Pigeon Forge,TN,37862,888-758-4389,E,Public,24 hours daily,,,2,0,35.812756,-83.536514,12/01/2023,164862,2023-01-12 23:15:34 UTC,06/08/2020,J1772,
ELEC,7SPC SCES DOLLYWOOD,2700 Dollywood Parks Blvd. Dollywood's Prefer,,Pigeon Forge,TN,37863,888-758-4389,E,Public,24 hours daily,,,2,0,35.796936,-83.53263,12/01/2023,164863,2023-01-12 23:15:34 UTC,06/08/2020,J1772,
ELEC,IMT 8 SOUTH STATION 2,2405 8th Ave S,,Nashville,TN,37204,888-758-4389,T,TEMPORARILY UNAVAILABLE (Public),24 hours daily,,,2,0,36.126204,-86.777957,23/01/2023,164864,2023-01-23 23:06:40 UTC,06/08/2020,J1772,
ELEC,SYEMC CIRCLE K FAST,2372 State Rd 1001,,Dobson,NC,27017,888-758-4389,E,Public,24 hours daily,,,,1,36.395182,-80.785255,12/01/2023,165069,2023-01-12 23:19:35 UTC,07/08/2020,CHADEMO J1772COMBO,
ELEC,RAMADA WYNDHAM STATION 3,1 Gateway Blvd E,,Savannah,GA,31419,888-758-4389,E,Public,24 hours daily,,,2,0,32.006743,-81.279498,12/01/2023,165081,2023-01-12 23:19:29 UTC,08/08/2020,J1772,
ELEC,Chevron - Loganville,2975 Highway 81 Southeast,,Loganville,GA,30052,888-998-2546,E,Public,MON: 24 hours | TUE: 24 hours | WED: 24 hours | THU: 24 hours | FRI: 24 hours | SAT: 24 hours | SUN: 24 hours,,,2,0,33.805402,-83.874036,23/01/2023,165101,2023-01-23 22:58:07 UTC,11/08/2020,J1772,
ELEC,Town Center at Cobb,400 Ernest W Barrett Pkwy,,Kennesaw,GA,30144,888-264-2208,E,Public,6am-12am daily,,,2,0,34.0188,-84.562664,05/05/2022,165151,2022-12-30 17:58:11 UTC,31/07/2020,J1772,SHOPPING_MALL
ELEC,Town Center at Cobb,400 Ernest W Barrett Pkwy,,Kennesaw,GA,30144,888-264-2208,E,Public,6am-12am daily,,,2,0,34.017524,-84.561989,05/05/2022,165152,2022-12-30 17:58:11 UTC,31/07/2020,J1772,SHOPPING_MALL
ELEC,North Point Mall,1000 North Point Cir,,Alpharetta,GA,30022,888-264-2208,E,Public,6am-12am daily,,,4,0,34.04692,-84.292848,05/05/2022,165153,2022-12-30 17:58:11 UTC,31/07/2020,J1772,SHOPPING_MALL
ELEC,The Avenue Murfreesboro - Sports Clips,2615 Medical Center Parkway,Chargers are in front of Sports Clips ||and Alumni Hall.||,Murfreesboro,TN,37129,888-998-2546,E,Public,MON: 24 hours | TUE: 24 hours | WED: 24 hours | THU: 24 hours | FRI: 24 hours | SAT: 24 hours | SUN: 24 hours,,,2,0,35.860445,-86.44726,23/01/2023,165163,2023-01-23 22:58:07 UTC,12/08/2020,J1772,
ELEC,EVERY CHARGING NEW BERN,145 New Bern St,,Charlotte,NC,28209,888-758-4389,E,Public,24 hours daily,,,2,0,35.199345,-80.867961,12/01/2023,165174,2023-01-12 23:18:38 UTC,12/08/2020,J1772,
ELEC,ECU HSC BRODY LOT,600 Moye Blvd,,Greenville,NC,27834,888-758-4389,E,Public,24 hours daily,,,2,0,35.610961,-77.402468,23/01/2023,165175,2023-01-23 23:06:28 UTC,12/08/2020,J1772,
ELEC,ECU COLLEGE HILL,28884 College Hill Dr,,Greenville,NC,27858,888-758-4389,E,Public,24 hours daily,,,2,0,35.602351,-77.361964,23/01/2023,165200,2023-01-23 23:06:28 UTC,13/08/2020,J1772,
ELEC,7SPC UC - CARTHAGE,84 Dixon Springs Hwy,,Carthage,TN,37030,888-758-4389,E,Public,24 hours daily,,,2,0,36.266594,-85.95863,12/01/2023,165229,2023-01-12 23:19:41 UTC,14/08/2020,J1772,
ELEC,TERMINAL 1 P2 STATION 3,Terminal Garage 1 140 BNA Park Dr,,Nashville,TN,37214,888-758-4389,E,Public,24 hours daily,,,2,0,36.133227,-86.666937,12/01/2023,165230,2023-01-12 23:18:57 UTC,14/08/2020,J1772,
ELEC,EMERALD ISLE EMERALD ISLE,216 Islander Dr,,Emerald Isle,NC,28594,888-758-4389,E,Public,24 hours daily,,,2,0,34.659595,-77.056016,12/01/2023,165271,2023-01-12 23:19:25 UTC,15/08/2020,J1772,
ELEC,"Lenox Square (Atlanta, GA)",3393 Peachtree Rd NE,,Atlanta,GA,30326,833-632-2778,E,Public,24 hours daily,,,,4,33.84471,-84.36042,23/01/2023,165341,2023-01-23 23:13:48 UTC,20/08/2020,CHADEMO J1772COMBO,
ELEC,Golden Isles Strike Zone - Tesla Supercharger,380 Millennium Boulevard,,Brunswick,GA,31525,877-798-3752,E,Public,24 hours daily; for Tesla use only,,,,24,31.245945,-81.501682,03/10/2022,165418,2022-12-01 17:40:26 UTC,17/08/2020,TESLA,OTHER_ENTERTAINMENT
ELEC,Exxon Skyway,507 E James Campbell Blvd,,Columbia,TN,38401,931-381-4121,E,Public,24 hours daily,,,1,0,35.589076,-87.01835,10/01/2023,165443,2023-01-10 16:44:47 UTC,17/08/2020,J1772,CONVENIENCE_STORE
ELEC,Tennessee River Museum,495 Main St,,Savannah,TN,38372,731-925-2364,E,Public,24 hours daily,,,1,0,35.225049,-88.250841,10/01/2023,165453,2023-01-10 16:44:47 UTC,17/08/2020,J1772,MUSEUM
ELEC,EV STATION LOT B- BRASELTON,1404 River Pl,,Hoschton,GA,30548,888-758-4389,E,Public,24 hours daily,,,2,0,34.119987,-83.83886,12/01/2023,165487,2023-01-12 23:19:53 UTC,26/08/2020,J1772,
ELEC,MUNICIPAL COMPL SWANSBORO,601 W Corbett Ave Town Hall,,Swansboro,NC,28584,888-758-4389,E,Public,24 hours daily,,,2,0,34.689331,-77.122579,23/01/2023,165500,2023-01-23 23:08:08 UTC,26/08/2020,J1772,
ELEC,HAMPTON HOLIDAY INN 1,110 Interstate Dr NW,,Cleveland,TN,37312,888-758-4389,E,Public,24 hours daily,,,2,0,35.193655,-84.890415,12/01/2023,165502,2023-01-12 23:19:41 UTC,26/08/2020,J1772,
ELEC,Horizon Condominium,3300 Windy Ridge Parkway SE,,Atlanta,GA,30339,855-885-9571,E,Public,,,,6,0,36.06358,-83.84144,23/01/2023,165603,2023-01-23 23:34:49 UTC,27/08/2020,J1772,
ELEC,"Walmart 3402 (Stockbridge, GA)",1400 Hudson Bridge Rd,,Stockbridge,GA,30281,833-632-2778,E,Public,24 hours daily,,,,4,33.5059,-84.23486,23/01/2023,165659,2023-01-23 23:14:13 UTC,28/08/2020,CHADEMO J1772COMBO,
ELEC,Duke Energy,6301 Wilkinson Blvd,,Charlotte,NC,28214,,E,Private,Employee and fleet use only,,,2,0,35.234528,-80.949512,10/01/2023,165799,2023-01-10 16:44:47 UTC,31/08/2020,J1772,UTILITY
ELEC,Duke Energy,805 N Pinehurst St,,Aberdeen,NC,28315,,E,Private,,,,2,0,35.160545,-79.416622,10/01/2023,165800,2023-01-10 16:44:47 UTC,31/08/2020,J1772,UTILITY
ELEC,Duke Energy,100 E Davie St,,Raleigh,NC,27601,,E,Private,Drivers must bring their own J1772 cordset for Level 1 charging,,1,2,0,35.775181,-78.637626,10/01/2023,165801,2023-01-10 16:44:47 UTC,31/08/2020,J1772 NEMA1450,UTILITY
ELEC,Modera Reynoldstown Retail,780 Memorial Drive SE,,Atlanta,GA,30316,800-663-5633,E,Public,,,,6,0,33.747023,-84.361927,21/12/2022,165822,2022-12-21 22:59:36 UTC,12/04/2019,J1772,
ELEC,ATL WEST LEVEL1 STATION4,4199 Skytrain Way,,College Park,GA,30337,888-758-4389,E,Public,24 hours daily,,,1,0,33.641229,-84.459202,12/01/2023,165854,2023-01-12 23:18:54 UTC,03/09/2020,J1772,
ELEC,Winston-Salem,414 N. Patterson Ave.,,Winston-Salem,NC,27101,855-885-9571,E,Public,,,,2,0,36.09908,-80.241009,23/01/2023,166213,2023-01-23 23:34:47 UTC,04/09/2020,J1772,
ELEC,Mecklenburg County - Land Use & Environmental Services Agency,2145 Suttle Ave,,Charlotte,NC,28208,,E,Private,24 hours daily,A D M V,,6,0,35.223591,-80.871421,09/10/2020,166359,2021-03-11 23:22:17 UTC,26/12/2019,J1772,MUNI_GOV
ELEC,Roswell Depot,408 Atlanta Street,,Roswell,GA,30075,866-816-7584,T,TEMPORARILY UNAVAILABLE (Public),,,,2,0,34.009508,-84.361722,23/01/2023,166426,2023-01-23 23:37:27 UTC,17/06/2020,J1772,
ELEC,AMC Colonial 18,825 Lawrenceville-Suwanee Rd,,Lawrenceville,GA,30043,888-264-2208,E,Public,6am-12am daily,,,2,0,33.969516,-84.019,05/05/2022,166750,2022-12-30 17:58:11 UTC,31/08/2020,J1772,SHOPPING_MALL
ELEC,Marine Chevrolet Cadillac,1408 Western Blvd,,Jacksonville,NC,28546,910-455-2121,E,Public,7am-8pm daily,,,1,0,34.789404,-77.402415,10/11/2022,166781,2022-11-10 16:40:31 UTC,01/01/2010,J1772,CAR_DEALER
ELEC,GEORGIA POWER BRADLEYPARK DC2,1514 Bradley Park Dr,,Columbus,GA,31904,888-758-4389,E,Public,24 hours daily,,,,1,32.531716,-84.970362,12/01/2023,166817,2023-01-12 23:20:04 UTC,12/09/2020,CHADEMO J1772COMBO,
ELEC,7SPC UC - LIVINGSTON,210 N McHenry St,,Livingston,TN,38570,888-758-4389,E,Public,24 hours daily,,,2,0,36.381214,-85.323326,12/01/2023,166825,2023-01-12 23:20:04 UTC,12/09/2020,J1772,
ELEC,"Sheetz 504 (Rocky Mount, NC)",157 N Old Carriage Road,,Rocky Mount,NC,27804,833-632-2778,E,Public,24 hours daily,,,,4,35.97208,-77.89565,23/01/2023,166835,2023-01-23 23:14:34 UTC,13/09/2020,CHADEMO J1772COMBO,
ELEC,Ingles Market,625 W Henderson St,Next to gas station,Marion,NC,28752,828-652-8588,E,Public,6am-11pm daily,,,2,0,35.675106,-82.012496,10/01/2023,166840,2023-01-10 16:44:47 UTC,17/08/2020,J1772,GROCERY
ELEC,HUNTERSVILLE MARK OIL L3,101 Statesville Rd,,Huntersville,NC,28078,888-758-4389,E,Public,24 hours daily,,,,1,35.409541,-80.85426,12/01/2023,166854,2023-01-12 23:20:04 UTC,15/09/2020,CHADEMO J1772COMBO,
ELEC,Target - Tesla Supercharger,780 Old Hickory Boulevard,,Brentwood,TN,37027,877-798-3752,E,Public,24 hours daily; for Tesla use only,,,,12,36.042359,-86.777834,03/10/2022,166863,2022-12-01 17:40:26 UTC,10/09/2020,TESLA,SHOPPING_CENTER
ELEC,HALIFAX EMC HALIFAX EMC DC1,23945 NC-561,,Enfield,NC,27823,888-758-4389,E,Public,24 hours daily,,,,1,36.268879,-77.723942,12/01/2023,166882,2023-01-12 23:20:04 UTC,16/09/2020,CHADEMO J1772COMBO,
ELEC,"Walgreens - Marietta, GA #1646",23 S Marietta Pkwy,,Marietta,GA,30064,800-663-5633,E,Public,,,,1,0,33.951817,-84.551523,21/12/2022,166892,2022-12-21 23:00:57 UTC,14/07/2015,J1772,
ELEC,"Walmart 6998 (East Point, GA)",844 CLEVELAND AVENUE,,East Point,GA,30344,833-632-2778,E,Public,24 hours daily,,,,8,33.67975,-84.41572,23/01/2023,166910,2023-01-23 23:14:04 UTC,17/09/2020,CHADEMO J1772COMBO,
ELEC,Smithfield's Chicken 'N Bar-B-Q-Nashville - Tesla Destination,1169 Eastern Ave,,Nashville,NC,27856,252-459-0092  877-798-3752,E,Public,,,,2,0,35.970521,-77.938648,06/10/2022,166934,2023-01-18 15:15:20 UTC,30/10/2019,TESLA,RESTAURANT
ELEC,Smithfield's Chicken 'N Bar-B-Q-Rocky Mount - Tesla Destination,670 N Wesleyan Blvd,,Rocky Mount,NC,27804,252-937-3032  877-798-3752,E,Public,,,,2,0,35.963082,-77.820369,06/10/2022,166935,2023-01-18 15:15:20 UTC,30/10/2019,TESLA,RESTAURANT
ELEC,Smithfield's Chicken 'N Bar-B-Q-Burlington - Tesla Destination,1372 Tiki Ln,,Burlington,NC,27215,336-586-9333  877-798-3752,E,Public,,,,2,0,36.067024,-79.513077,06/10/2022,166936,2023-01-18 15:15:20 UTC,30/10/2019,TESLA,RESTAURANT
ELEC,Holiday Inn Express & Suites Greensboro East - Tesla Destination,3111 Cedar Park Rd,,Greensboro,NC,27405,1-888-480-0427  877-798-3752,E,Public,,,,2,0,36.053609,-79.733876,06/10/2022,166937,2023-01-18 15:15:20 UTC,11/07/2020,TESLA,HOTEL
ELEC,Sweetwater Coffeehouse - Tesla Destination,2242 Hwy 17,,Sautee Nacoochee,GA,30571,706-878-1521  877-798-3752,E,Public,,,,2,0,34.683592,-83.675398,06/10/2022,166938,2023-01-18 15:15:20 UTC,31/10/2019,TESLA,RESTAURANT
ELEC,Apago,4080 McGinnis Ferry Road,unit#526 under repair||,Alpharetta,GA,30005,888-998-2546,E,Public,MON: 24 hours | TUE: 24 hours | WED: 24 hours | THU: 24 hours | FRI: 24 hours | SAT: 24 hours | SUN: 24 hours,,,2,0,34.1023657,-84.2366416,23/01/2023,166965,2023-01-23 22:58:10 UTC,22/09/2020,J1772,
ELEC,CITY-BROOKHAVEN BLACKBURN 1,3400 Donaldson Dr NE,,Atlanta,GA,30319,888-758-4389,E,Public,24 hours daily,,,2,0,33.898176,-84.329668,12/01/2023,166980,2023-01-12 23:13:29 UTC,22/09/2020,J1772,
ELEC,"Target 0961 - Cary, NC",2021 Walnut Street,,Cary,NC,27518,833-632-2778,E,Public,24 hours daily,,,,3,35.7586,-78.73923,23/01/2023,166988,2023-01-23 23:13:42 UTC,22/09/2020,CHADEMO J1772COMBO,
ELEC,"Walmart 5254 - Wake Forest, NC",2114 S. Main St.,,Wake Forest,NC,27587,833-632-2778,E,Public,24 hours daily,,,1,3,35.95154,-78.53398,23/01/2023,166989,2023-01-23 23:14:24 UTC,22/09/2020,CHADEMO J1772 J1772COMBO,
ELEC,DD Scott Blvd JV,2588 Decatur Village Drive,The units are at the top of the parking ||garage.||,Decatur,GA,30033,888-998-2546,E,Public,MON: 24 hours | TUE: 24 hours | WED: 24 hours | THU: 24 hours | FRI: 24 hours | SAT: 24 hours | SUN: 24 hours,,,3,0,33.796112,-84.284384,23/01/2023,167027,2023-01-23 22:58:07 UTC,24/09/2020,J1772,
ELEC,SAVANNAH 1 CITY HALL,15 Bull St W Bryan st,,Savannah,GA,31401,888-758-4389,E,Public,24 hours daily,,,2,0,32.08032,-81.091493,12/01/2023,167068,2023-01-12 23:20:20 UTC,25/09/2020,J1772,
ELEC,SAVANNAH 1 SAVANNAH 2,MLK &amp; Liberty SB,,Savannah,GA,31415,888-758-4389,E,Public,24 hours daily,,,1,0,32.076503,-81.099006,12/01/2023,167069,2023-01-12 23:10:20 UTC,25/09/2020,J1772,
ELEC,Hyatt Place - Raleigh / Cary,710 Corporate Center Dr,,Raleigh,NC,27607,919-233-2205,E,Public,24 hours daily; guest use only; see front desk for access,,,2,0,35.791673,-78.738308,10/01/2023,167100,2023-01-10 16:44:47 UTC,14/09/2020,J1772,HOTEL
ELEC,UNC Rex Healthcare Parking Deck,4420 Lake Boone Trail,,Raleigh,NC,27607,919-784-3100,E,Public,24 hours daily,,,4,0,35.816952,-78.70409,09/10/2020,167101,2023-01-05 12:39:32 UTC,14/09/2020,J1772,HOSPITAL
ELEC,UNC Rex Healthcare Heart and Vascular Parking Deck,4420 Lake Boone Trail,,Raleigh,NC,27607,919-784-3100,E,Public,24 hours daily,,,4,0,35.81987,-78.702876,09/10/2020,167102,2023-01-05 12:40:54 UTC,14/09/2020,J1772,HOSPITAL
ELEC,Hilton Raleigh North Hills,3415 Wake Forest Rd,,Raleigh,NC,27609,919-872-2323,E,Public,24 hours daily; guest use only; see front desk for access,,,2,0,35.829812,-78.619724,10/01/2023,167103,2023-01-10 16:44:47 UTC,14/09/2020,J1772,HOTEL
ELEC,Hampton Inn & Suites Raleigh Midtown,1229 Wake Towne Dr,,Raleigh,NC,27609,919-831-4700,E,Public,24 hours daily; guest use only; see front desk for access,,,2,0,35.822,-78.618794,09/10/2020,167104,2022-04-28 20:01:31 UTC,14/09/2020,J1772,HOTEL
ELEC,Rocky Mount Mills,1151 Falls Rd,,Rocky Mount,NC,27804,252-969-0909,E,Public,24 hours daily,,,4,0,35.958435,-77.801787,09/10/2020,167114,2023-01-05 12:43:42 UTC,14/09/2020,TESLA,MUSEUM
ELEC,Rocky Mount High School,1400 Bethlehem Rd,,Rocky Mount,NC,27803,252-937-9050,E,Public,24 hours daily,,,2,0,35.939546,-77.835925,10/01/2023,167115,2023-01-10 16:44:47 UTC,14/09/2020,J1772,SCHOOL
ELEC,Town of Warrenton - Market Street,117 W Market St,,Warrenton,NC,27589,252-257-1122,E,Public,24 hours daily,,,2,0,36.397918,-78.155927,10/01/2023,167116,2023-01-10 16:44:47 UTC,14/09/2020,J1772,MUNI_GOV
ELEC,The University of North Carolina at Greensboro - McIver Street Parking Deck,132 McIver St,,Greensboro,NC,27403,336-334-5681,E,Public,Parking deck hours; four hour limit,,,4,0,36.071448,-79.806876,10/01/2023,167118,2023-01-10 16:44:47 UTC,14/09/2020,J1772,COLLEGE_CAMPUS
ELEC,The University of North Carolina at Greensboro - Oakland Street Parking Deck,690 Forest St,,Greensboro,NC,27403,336-334-5681,E,Public,Parking deck hours; eight hour limit,,,4,0,36.064629,-79.810548,10/01/2023,167119,2023-01-10 16:44:47 UTC,14/09/2020,J1772,COLLEGE_CAMPUS
ELEC,Wake Forest Baptist Health - Parking Deck C,1 Medical Center Blvd,,Winston-Salem,NC,27103,336-716-2011,E,Public,24 hours daily,,,4,0,36.089912,-80.270798,10/01/2023,167121,2023-01-10 16:44:47 UTC,14/09/2020,J1772,HOSPITAL
ELEC,Kaya Vineyard & Winery,5400 Town Creek Rd,,Dahlonega,GA,30533,706-219-3514,E,Public,Business hours; for customer use only; see front desk for access,,,2,0,34.607257,-83.858152,11/10/2022,167122,2022-10-11 18:56:12 UTC,14/09/2020,J1772,BREWERY_DISTILLERY_WINERY
ELEC,Smithfield's Chicken 'N Bar-B-Q - Tesla Supercharger,4483 U.S. Highway 70,,Kinston,NC,28504,877-798-3752,E,Public,24 hours daily; for Tesla use only,,,,8,35.26058,-77.649684,03/10/2022,167124,2022-12-01 17:40:26 UTC,21/09/2020,TESLA,RESTAURANT
ELEC,"Walmart 1155 (Lumberton, NC)",5070 Fayetteville Road,,Lumberton,NC,28358,833-632-2778,E,Public,24 hours daily,,,,4,34.66506,-79.00666,23/01/2023,167147,2023-01-23 23:13:40 UTC,26/09/2020,CHADEMO J1772COMBO,
ELEC,TOWN OF CARY TOWN HALL-PWH,228 Ambassador Loop Page-Walker Hotel,,Cary,NC,27513,888-758-4389,E,Public,24 hours daily,,,2,0,35.789215,-78.77882,12/01/2023,167160,2023-01-12 23:19:56 UTC,29/09/2020,J1772,
ELEC,222 GLENWOOD STATION #1,222 Glenwood Ave,,Raleigh,NC,27603,888-758-4389,E,Public,24 hours daily,,,2,0,35.783534,-78.647169,12/01/2023,167161,2023-01-12 23:17:52 UTC,29/09/2020,J1772,
ELEC,"Sam's Club 6452 (Asheville, NC)",645 Patton Ave.,,Asheville,NC,28806,833-632-2778,E,Public,24 hours daily,,,,4,35.59119,-82.5816,23/01/2023,167166,2023-01-23 23:14:13 UTC,29/09/2020,CHADEMO J1772COMBO,
ELEC,Carolina Premium Outlets,1025 Outlet Center Drive,,Smithfield,NC,27577,833-632-2778,E,Public,24 hours daily,,,,4,35.50811,-78.31505,23/01/2023,167212,2023-01-23 23:14:37 UTC,01/10/2020,CHADEMO J1772COMBO,
ELEC,GEORGIA POWER MACON L2,6255 Zebulon Road,,Macon,GA,31210,888-758-4389,E,Public,24 hours daily,,,2,0,32.881994,-83.766718,12/01/2023,167227,2023-01-12 23:20:25 UTC,02/10/2020,J1772,
ELEC,"Walmart 5320 - Greensboro, NC",121 W. Elmsley Street,,Greensboro,NC,27406,833-632-2778,E,Public,24 hours daily,,,,8,36.00315,-79.79819,23/01/2023,167269,2023-01-23 23:14:03 UTC,03/10/2020,CHADEMO J1772COMBO,
ELEC,Smithfield's Chicken 'N Bar-B-Q-Garner - Tesla Destination,5180 NC Hwy 42 W,,Garner,NC,27529,919-773-0774  877-798-3752,E,Public,,,,2,0,35.608592,-78.562481,06/10/2022,167288,2023-01-18 15:15:20 UTC,30/10/2019,TESLA,RESTAURANT
ELEC,Holiday Inn Valdosta Conference Center - Tesla,1805 W Hill Ave,,Valdosta,GA,31601,229-244-1111,E,Public,24 hours daily; for customer use only; see front desk for access,,,4,0,30.819147,-83.310776,11/10/2022,167300,2022-10-11 18:56:12 UTC,28/09/2020,TESLA,HOTEL
ELEC,Holiday Inn Valdosta Conference Center,1805 W Hill Ave,,Valdosta,GA,31601,229-244-1111,E,Public,24 hours daily; for customer use only; see front desk for access,,,2,0,30.819147,-83.310776,11/10/2022,167301,2022-10-11 18:56:12 UTC,28/09/2020,J1772,HOTEL
ELEC,UNCW-1 UNCW2 CEN DECK,4941 Riegel Rd,,Wilmington,NC,28403,888-758-4389,E,Public,24 hours daily,,,2,0,34.22257,-77.871666,12/01/2023,167352,2023-01-12 23:18:29 UTC,06/10/2020,J1772,
ELEC,JASBER PLAZA JASBER EV 2,1105 Main St,,Forest Park,GA,30297,888-758-4389,E,Public,24 hours daily,,,2,0,33.618367,-84.353593,12/01/2023,167369,2023-01-12 23:20:27 UTC,07/10/2020,J1772,
ELEC,GEORGIA POWER LAVONIA DC2,14177 Jones St,,Lavonia,GA,30553,888-758-4389,E,Public,24 hours daily,,,,1,34.447837,-83.126002,12/01/2023,167370,2023-01-12 23:19:33 UTC,07/10/2020,CHADEMO J1772COMBO,
ELEC,Galleria 600,600 Galleria Parkway Southeast,,Atlanta,GA,30339,800-663-5633,E,Public,,,,6,0,33.885284,-84.461244,21/12/2022,167386,2022-12-21 22:59:35 UTC,25/03/2020,J1772,
ELEC,Windsor Tower Condos,4215 Harding PIke,,Nashville,TN,37205,888-998-2546,E,Public,MON: 24 hours | TUE: 24 hours | WED: 24 hours | THU: 24 hours | FRI: 24 hours | SAT: 24 hours | SUN: 24 hours,,,1,0,36.127888,-86.841022,23/01/2023,167403,2023-01-23 22:58:10 UTC,09/10/2020,J1772,
ELEC,DoubleTree by Hilton Hotel Rocky Mount,651 N Winstead Ave,,Rocky Mount,NC,27804,252-937-6888,E,Public,24 hours daily; for customer use only; see front desk for access,,,2,0,35.97332,-77.846846,10/01/2023,167455,2023-01-10 16:44:47 UTC,05/10/2020,J1772,HOTEL
ELEC,The Station at Savannah Quarters,100 Harley Lane,,Pooler,GA,31322,888-998-2546,E,Public,MON: 24 hours | TUE: 24 hours | WED: 24 hours | THU: 24 hours | FRI: 24 hours | SAT: 24 hours | SUN: 24 hours,,,1,0,32.084167,-81.285278,23/01/2023,167459,2023-01-23 22:58:11 UTC,10/10/2020,J1772,
ELEC,"Simon Mall of Georgia (Buford, GA)",3333 Buford Dr,,Buford,GA,30519,833-632-2778,E,Public,24 hours daily,,,,4,34.06342,-83.98365,23/01/2023,167475,2023-01-23 23:14:36 UTC,10/10/2020,CHADEMO J1772COMBO,
ELEC,LEXINGTON NC HAMPTON INN,1245 Fairview Dr,,Lexington,NC,27292,888-758-4389,E,Public,24 hours daily,,,2,0,35.78651,-80.25969,12/01/2023,167514,2023-01-12 23:20:32 UTC,14/10/2020,J1772,
ELEC,SunStop / Inland - Tesla Supercharger,2112 West Hill Avenue,,Valdosta,GA,31601,877-798-3752,E,Public,24 hours daily; for Tesla use only,,,,8,30.81734,-83.32082,03/10/2022,167575,2022-12-01 17:40:26 UTC,12/10/2020,TESLA,GAS_STATION
ELEC,Brentwood Commons,750 Old Hickory Blvd,,Brentwood,TN,37027,615-550-5575,E,Public,Visitor use only,,,2,0,36.042394,-86.773017,09/11/2020,167580,2021-03-11 23:22:17 UTC,12/10/2020,J1772,OFFICE_BLDG
ELEC,Aldon at Powell and Broad,141 Stobhill Lane,,Fuquay Varina,NC,27526,800-663-5633,E,Public,,,,2,0,35.613739,-78.811745,21/12/2022,167642,2022-12-21 22:59:34 UTC,18/03/2019,J1772,
ELEC,FORSYTH COUNTY STATION 1,215 Mason St,,Cumming,GA,30040,888-758-4389,E,Public,24 hours daily,,,2,0,34.207645,-84.138012,12/01/2023,167645,2023-01-12 23:20:32 UTC,21/10/2020,J1772,
ELEC,GEORGIA POWER KINGSLAND DC1,1375 Hospitality Ave,,Kingsland,GA,31548,888-758-4389,E,Public,24 hours daily,,,,1,30.79048,-81.652165,12/01/2023,167671,2023-01-12 23:20:36 UTC,22/10/2020,CHADEMO J1772COMBO,
ELEC,MOORES MILL MOORES MILL 2,2275 Marietta Blvd NW,,Atlanta,GA,30318,888-758-4389,E,Public,24 hours daily,,,2,0,33.819158,-84.448906,23/01/2023,167672,2023-01-23 23:06:50 UTC,22/10/2020,J1772,
ELEC,GEORGIA POWER ROME DC1,300 W 1st St,,Rome,GA,30161,888-758-4389,E,Public,24 hours daily,,,,1,34.254413,-85.173168,12/01/2023,167746,2023-01-12 23:20:38 UTC,24/10/2020,CHADEMO J1772COMBO,
ELEC,GEORGIA POWER ROME DC2,300 W 1st St,,Rome,GA,30161,888-758-4389,E,Public,24 hours daily,,,,1,34.254365,-85.173186,12/01/2023,167747,2023-01-12 23:20:38 UTC,24/10/2020,CHADEMO J1772COMBO,
ELEC,PVG CHARGE EV 2,5300 Winder Hwy,,Braselton,GA,30517,888-758-4389,E,Public,24 hours daily,,,2,0,34.152612,-83.814954,12/01/2023,167748,2023-01-12 23:20:38 UTC,24/10/2020,J1772,
ELEC,PVG CHARGE EV 3,2500 W Park Dr,,Gainesville,GA,30504,888-758-4389,E,Public,24 hours daily,,,2,0,34.244731,-83.851761,12/01/2023,167856,2023-01-12 23:20:12 UTC,27/10/2020,J1772,
ELEC,PVG CHARGE EV 1,2315 W Park Dr,,Gainesville,GA,30504,888-758-4389,E,Public,24 hours daily,,,2,0,34.245317,-83.851911,12/01/2023,167857,2023-01-12 23:20:12 UTC,27/10/2020,J1772,
ELEC,7SPC CFEC SPENCER,430 Spring St,,Spencer,TN,38585,888-758-4389,E,Public,24 hours daily,,,2,0,35.746964,-85.45841,12/01/2023,167886,2023-01-12 23:20:39 UTC,28/10/2020,J1772,
ELEC,"Walmart 899 - Valdosta, GA",340 Norman Dr.,,Valdosta,GA,31601,833-632-2778,E,Public,24 hours daily,,,,4,30.82641,-83.31805,23/01/2023,167893,2023-01-23 23:14:41 UTC,28/10/2020,CHADEMO J1772COMBO,
ELEC,GEORGIA POWER ENVISION L21,1560 Metropolitan Pkwy SW,,Atlanta,GA,30310,888-758-4389,E,Public,24 hours daily,,,2,0,33.71127,-84.403834,12/01/2023,168074,2023-01-12 23:20:29 UTC,31/10/2020,J1772,
ELEC,CLASSIC VW OUTDOOR STATION,4417 Wilkinson Blvd,,Gastonia,NC,28056,888-758-4389,E,Public,24 hours daily,,,2,0,35.256256,-81.102747,12/01/2023,168076,2023-01-12 23:19:57 UTC,31/10/2020,J1772,
ELEC,Walmart 2860 Pooler,160 Pooler Parkway,,Pooler,GA,31322,833-632-2778,E,Public,24 hours daily,,,,6,32.14257,-81.24328,23/01/2023,168080,2023-01-23 23:14:42 UTC,31/10/2020,CHADEMO J1772COMBO,
ELEC,7SPC SMITHVILLE,201 E Church Street,,Smithville,TN,37166,888-758-4389,E,Public,24 hours daily,,,2,0,35.962,-85.812775,12/01/2023,168108,2023-01-12 23:20:50 UTC,03/11/2020,J1772,
ELEC,CARTA GEORGIA AVE,817 Georgia Ave,,Chattanooga,TN,37402,888-758-4389,E,Public,24 hours daily,,,2,0,35.046127,-85.306948,23/01/2023,168148,2023-01-23 23:04:57 UTC,05/11/2020,J1772,
ELEC,"SHEETZ 647- Hillsborough, NC",1990 NC 86 S,,Hillsborough,NC,27278,833-632-2778,E,Public,24 hours daily,,,,4,36.05707,-79.08008,23/01/2023,168151,2023-01-23 23:13:55 UTC,05/11/2020,CHADEMO J1772COMBO,
ELEC,GEORGIA POWER TIFTON DC1,1215 US-82 West,,Tifton,GA,31794,888-758-4389,E,Public,24 hours daily,,,,1,31.450714,-83.533943,12/01/2023,168172,2023-01-12 23:20:53 UTC,06/11/2020,CHADEMO J1772COMBO,
ELEC,APSU LOT 6,451 Marion St,,Clarksville,TN,37040,888-758-4389,E,Public,24 hours daily,,,2,0,36.536112,-87.353728,12/01/2023,168179,2023-01-12 23:16:03 UTC,06/11/2020,J1772,
ELEC,"CHARLOTTE, NC 247 EV ARC",4411 Northpointe Industrial Blvd,,Charlotte,NC,28216,888-758-4389,T,TEMPORARILY UNAVAILABLE (Public),24 hours daily,,,2,0,35.280866,-80.872726,12/01/2023,168263,2023-01-12 23:17:51 UTC,11/11/2020,J1772,
ELEC,"Walmart 2134 - Charlotte, NC",7735 North Tryon Street,,Charlotte,NC,28262,833-632-2778,E,Public,24 hours daily,,,,1,35.29555,-80.75655,23/01/2023,168271,2023-01-23 23:14:05 UTC,11/11/2020,CHADEMO J1772COMBO,
ELEC,FAYETTEVILLE NC TRANS MUSEUM,302 W Russell St,,Fayetteville,NC,28301,888-758-4389,E,Public,24 hours daily,,,2,0,35.051862,-78.88186,12/01/2023,168475,2023-01-12 23:20:59 UTC,14/11/2020,J1772,
ELEC,Smyrna/Rutherford County Airport Authority,278 Doug Warpoole Rd,,Smyrna,TN,37167,888-998-2546,E,Public,MON: 24 hours | TUE: 24 hours | WED: 24 hours | THU: 24 hours | FRI: 24 hours | SAT: 24 hours | SUN: 24 hours,,,2,0,36.0045665,-86.5258659,23/01/2023,168513,2023-01-23 22:57:18 UTC,17/11/2020,J1772,
ELEC,CITY OF WILM RIVER PLACE 1,220 N Water St,,Wilmington,NC,28401,888-758-4389,E,Public,24 hours daily,,,2,0,34.238329,-77.950044,12/01/2023,168526,2023-01-12 23:18:31 UTC,17/11/2020,J1772,
ELEC,CITY OF WILM RIVER PLACE 2,243 N Front St,,Wilmington,NC,28401,888-758-4389,E,Public,24 hours daily,,,2,0,34.238197,-77.94942,12/01/2023,168527,2023-01-12 23:18:31 UTC,17/11/2020,J1772,
ELEC,7SPC SPARTA TN,5 W Maple St,,Sparta,TN,38583,888-758-4389,E,Public,24 hours daily,,,2,0,35.924793,-85.4652,12/01/2023,168530,2023-01-12 23:21:00 UTC,17/11/2020,J1772,
ELEC,Ann Street Parking Garage - Tesla Destination,140 Ann St,,Savannah,GA,31401,n/a  877-798-3752,E,Public,,,,3,0,32.079327,-81.098268,06/10/2022,168581,2023-01-18 15:15:20 UTC,27/02/2017,J1772 TESLA,
ELEC,Beach House Vacation Rental - Tesla Destination,131 Spindrift Lane,,Duck,NC,27949,  877-798-3752,E,Public,,,,1,0,36.187212,-75.753785,06/10/2022,168609,2023-01-18 15:15:20 UTC,10/05/2017,TESLA,
ELEC,Comfort inn and Suites Savannah Airport - Tesla Destination,15 Jay R Turner Dr,,Savannah,GA,31408,912-629-1500  877-798-3752,E,Public,,,,4,0,32.140741,-81.233936,06/10/2022,168697,2023-01-18 15:15:20 UTC,29/11/2017,J1772 TESLA,
ELEC,Comfort Inn and Suites Tifton - Tesla Destination,320 South Virginia Avenue,,Tifton,GA,31794,229-382-8250  877-798-3752,E,Public,,,,7,0,31.4512937,-83.5298017,06/10/2022,168698,2023-01-18 15:15:20 UTC,20/06/2018,J1772 TESLA,
ELEC,Country Inn & Suites By Radisson Tifton - Tesla Destination,310 S Virginia Ave,,Tifton,GA,31794,229-382-8100  877-798-3752,E,Public,,,,9,0,31.451419,-83.5287917,06/10/2022,168710,2023-01-18 15:15:20 UTC,20/06/2018,J1772 TESLA,
ELEC,Doubletree by Hilton Asheville-Biltmore - Tesla Destination,115 Hendersonville Rd,,Asheville,NC,28803,  877-798-3752,E,Public,,,,2,0,35.5625934,-82.542149,06/10/2022,168739,2023-01-18 15:15:20 UTC,25/05/2018,TESLA,
ELEC,Fairfield Inn & Suites Dublin - Tesla Destination,620 Pinehill Rd,,Dublin,GA,31021,478-277-0333  877-798-3752,E,Public,,,,3,0,32.486462,-82.939994,06/10/2022,168769,2023-01-18 15:15:20 UTC,19/10/2017,J1772 TESLA,
ELEC,Hampton Inn & Suites Snellville Atlanta NE - Tesla Destination,1905 Pharrs Rd,,Snellville,GA,30078,800-760-7718  877-798-3752,E,Public,,,,2,0,33.879837,-84.008176,06/10/2022,168820,2023-01-18 15:15:20 UTC,25/06/2019,TESLA,
ELEC,Hilton Charlotte University Place - Tesla Destination,8629 JM Keynes Dr,,Charlotte,NC,28262,704-547-7444  877-798-3752,E,Public,,,,6,0,35.3083,-80.750663,06/10/2022,168836,2023-01-18 15:15:20 UTC,23/09/2019,TESLA,
ELEC,Hilton Garden Inn Chattanooga Downtown - Tesla Destination,311 Chestnut St,,Chattanooga,TN,37402,  877-798-3752,E,Public,,,,3,0,35.0532539,-85.3121614,06/10/2022,168837,2023-01-18 15:15:20 UTC,25/05/2018,J1772 TESLA,
ELEC,Holiday Inn Conference Center - Tesla Destination,1805 West Hill Avenue,,Valdosta,GA,31601,229-244-1111  877-798-3752,E,Public,,,,6,0,30.8193207,-83.3104891,06/10/2022,168845,2023-01-18 15:15:20 UTC,30/04/2018,J1772 TESLA,
ELEC,Holiday Inn Express & Suites Cordele North - Tesla Destination,1102 Arc Way Dr,,Cordele,GA,31015,229-273-8775  877-798-3752,E,Public,,,,7,0,31.958024,-83.7497991,06/10/2022,168846,2023-01-18 15:15:20 UTC,25/05/2018,J1772 TESLA,
ELEC,Homewood Suites by Hilton Raleigh Cary I-40 - Tesla Destination,555 Crossroads Blvd,,Cary,NC,27518,  877-798-3752,E,Public,,,,3,0,35.758438,-78.732543,06/10/2022,168857,2023-01-18 15:15:20 UTC,14/05/2018,J1772 TESLA,
ELEC,Kilmarlic Golf Club - Tesla Destination,215 West Side Ln,,Powells Point,NC,27966,  877-798-3752,E,Public,,,,2,0,36.11618,-75.842797,06/10/2022,168909,2023-01-18 15:15:20 UTC,10/05/2017,TESLA,
ELEC,Shadow Springs Vineyard - Tesla Destination,55432 Crater Rd,,Hamptonville,NC,27020,336-468-5000  877-798-3752,E,Public,,,,2,0,36.096502,-80.85126,06/10/2022,169098,2023-01-18 15:15:20 UTC,29/10/2019,TESLA,
ELEC,SpringHill Suites Charlotte Southwest - Tesla Destination,3950 Arco Corporate Dr,,Charlotte,NC,28273,704-702-0500  877-798-3752,E,Public,,,,2,0,35.151587,-80.95232,06/10/2022,169124,2023-01-18 15:15:20 UTC,31/10/2019,TESLA,
ELEC,StayBridge Suites Mt. Juliet - Nashville - Tesla Destination,69 Belinda Pkwy,,Mount Juliet,TN,37122,615-754-2111  877-798-3752,E,Public,,,,1,0,36.168935,-86.506731,06/10/2022,169134,2023-01-18 15:15:20 UTC,11/06/2019,TESLA,
ELEC,Stonehurst Place - Atlanta - Tesla Destination,923 Piedmont Ave NE,,Atlanta,GA,30309,404-881-0722  877-798-3752,E,Public,,,,2,0,33.779853,-84.380573,06/10/2022,169140,2023-01-18 15:15:20 UTC,28/11/2016,J1772 TESLA,
ELEC,The Factory - Franklin - Tesla Destination,1024 Georgia Road,,Franklin,NC,28734,  877-798-3752,E,Public,,,,4,0,35.1597936,-83.3892163,06/10/2022,169175,2023-01-18 15:15:20 UTC,21/06/2018,TESLA,
ELEC,The Park on Main - Tesla Destination,205 Main St,,Highlands,NC,28741,800-221-5078  877-798-3752,E,Public,,,,2,0,35.053664,-83.200657,06/10/2022,169187,2023-01-18 15:15:20 UTC,16/10/2019,TESLA,
ELEC,Tower Place 100 - Tesla Destination,3340 Peachtree Rd Ste 2140,,Atlanta,GA,30326,  877-798-3752,E,Public,,,,1,0,33.8493203,-84.3632083,06/10/2022,169214,2023-01-18 15:15:20 UTC,13/11/2018,TESLA,
ELEC,"Target T1390 (Tucker, GA)",4241 Lavista Rd,,Tucker,GA,30084,833-632-2778,E,Public,24 hours daily,,,,4,33.84567,-84.24504,23/01/2023,169294,2023-01-23 23:14:25 UTC,18/11/2020,CHADEMO J1772COMBO,
ELEC,Piedmont Triad International Airport,1000 A Ted Johnson Pkwy,,Greensboro,NC,27409,336-665-5631,E,Private,Drivers must bring their own J1772 cordset for Level 1 charging,,4,,0,36.105313,-79.938316,10/01/2022,169357,2022-02-10 21:00:18 UTC,19/11/2020,NEMA1450,AIRPORT
ELEC,64 CHARGER EV 1,60 Mills Gap Rd,,Asheville,NC,28803,888-758-4389,E,Public,24 hours daily,,,2,0,35.498718,-82.515316,12/01/2023,169403,2023-01-12 23:20:01 UTC,21/11/2020,J1772,
ELEC,FOOD CITY FOOD CITY #629,920 N State of Franklin Rd,,Johnson City,TN,37604,888-758-4389,E,Public,24 hours daily,,,2,0,36.32396,-82.393432,12/01/2023,169433,2023-01-12 23:21:02 UTC,24/11/2020,J1772,
ELEC,North Hills,4351 The Cir at N Hills St,"Located near Exxon in the parking lot, right off of Six Forks road",Raleigh,NC,27609,919-881-1146,E,Public,24 hours daily,,,1,0,35.83788,-78.642,03/12/2020,169442,2023-01-05 02:13:28 UTC,01/01/2013,J1772,SHOPPING_CENTER
ELEC,Midtown Plaza,305 Church at North Hills St,Located in the Associated Parking Deck of Midtown Plaza: Deck #1,Raleigh,NC,27609,919-881-1146,E,Public,24 hours daily,,,3,0,35.834809,-78.635398,13/12/2022,169443,2022-12-13 14:36:26 UTC,01/01/2015,J1772,SHOPPING_CENTER
ELEC,"Walmart 1006 - Cordele, GA",1215 E 16th Ave,,Cordele,GA,31015,833-632-2778,E,Public,24 hours daily,,,,4,31.96344,-83.76263,23/01/2023,169462,2023-01-23 23:14:41 UTC,25/11/2020,CHADEMO J1772COMBO,
ELEC,Legacy at Firetower,611 Legacy Ct,,Winterville,NC,28590,800-663-5633,E,Public,,,,2,0,35.5521,-77.370754,21/12/2022,169939,2022-12-21 22:59:33 UTC,09/06/2020,J1772,
ELEC,Kuck Baxter Immigration station location,365 Northridge Road,,Atlanta,GA,30350,800-663-5633,T,TEMPORARILY UNAVAILABLE (Public),,,,2,0,33.980801,-84.347841,21/12/2022,169940,2022-12-21 22:59:33 UTC,26/08/2020,J1772,
ELEC,GEORGIA POWER COLUMBUS DC2,3103 Gentian Blvd,,Columbus,GA,31907,888-758-4389,E,Public,24 hours daily,,,,1,32.506032,-84.94138,12/01/2023,169954,2023-01-12 23:20:36 UTC,06/12/2020,CHADEMO J1772COMBO,
ELEC,Wendover Axcess Apartments,1501 CH Brandonshire Court,,Greensboro,NC,27409,888-998-2546,E,Public,MON: 24 hours | TUE: 24 hours | WED: 24 hours | THU: 24 hours | FRI: 24 hours | SAT: 24 hours | SUN: 24 hours,,,2,0,36.051395,-79.909511,23/01/2023,169991,2023-01-23 22:58:09 UTC,08/12/2020,J1772,
ELEC,GEORGIA POWER UNION CITY DC2,6781 Londonderry Way,,Union City,GA,30291,888-758-4389,T,TEMPORARILY UNAVAILABLE (Public),24 hours daily,,,,1,33.570117,-84.5383,12/01/2023,169997,2023-01-12 23:21:24 UTC,09/12/2020,CHADEMO J1772COMBO,
ELEC,Town Center Parking Deck - Tesla Supercharger,5220 Town Center Boulevard,,Peachtree Corners,GA,30092,877-798-3752,E,Public,24 hours daily; for Tesla use only,,,,12,33.97887457,-84.21511655,03/10/2022,170077,2022-12-01 17:40:26 UTC,07/12/2020,TESLA,PARKING_GARAGE
ELEC,Sheetz - Tesla Supercharger,2350 S Main St,,Lexington,NC,27292,877-798-3752,E,Public,24 hours daily; for Tesla use only,,,,8,35.800165,-80.288557,03/10/2022,170080,2022-12-01 17:40:26 UTC,07/12/2020,TESLA,CONVENIENCE_STORE
ELEC,Bethany Village,13800 GA-9,,Alpharetta,GA,30004,888-264-2208,E,Public,6am-12am daily,,,2,0,34.117442,-84.271389,08/04/2021,170097,2022-10-17 15:38:16 UTC,07/12/2020,J1772,SHOPPING_MALL
ELEC,FORT BENNING BLD2931 STA1,2832 1st Infantry Bde Loop,,Fort Benning,GA,31905,888-758-4389,E,Public,24 hours daily,,,2,0,32.344024,-84.978313,12/01/2023,170139,2023-01-12 23:12:40 UTC,15/12/2020,J1772,
ELEC,FORT BENNING BL218 STATION10,Marchant St,,Fort Benning,GA,31905,888-758-4389,E,Public,24 hours daily,,,2,0,32.359875,-84.970934,23/01/2023,170140,2023-01-23 23:08:03 UTC,15/12/2020,J1772,
ELEC,FORT BENNING BLDG 6 WEST #2,Riordan St,,Fort Benning,GA,31905,888-758-4389,E,Public,24 hours daily,,,2,0,32.353407,-84.97203,23/01/2023,170141,2023-01-23 23:04:24 UTC,15/12/2020,J1772,
ELEC,FORT BENNING BLDG 4 WEST,Chesney St,,Cusseta,GA,31905,888-758-4389,E,Public,24 hours daily,,,2,0,32.35267,-84.970256,23/01/2023,170142,2023-01-23 23:04:23 UTC,15/12/2020,J1772,
ELEC,FORT BENNING BLDG 6 WEST,Riordan St,,Cusseta,GA,31905,888-758-4389,E,Public,24 hours daily,,,2,0,32.353625,-84.972892,23/01/2023,170143,2023-01-23 23:04:22 UTC,15/12/2020,J1772,
ELEC,FORT BENNING BLDG 35 EAST,101-175 Baltzell Ave,,Cusseta,GA,31905,888-758-4389,E,Public,24 hours daily,,,2,0,32.365154,-84.959038,23/01/2023,170144,2023-01-23 23:03:40 UTC,15/12/2020,J1772,
ELEC,ENDEAVOR REG DEMONBREUN 1,1216 Demonbreun St,,Nashville,TN,37203,888-758-4389,E,Public,24 hours daily,,,2,0,36.154393,-86.78763,12/01/2023,170149,2023-01-12 23:20:58 UTC,15/12/2020,J1772,
ELEC,ENDEAVOR REG MCGAVOCK 1,1213 McGavock St,,Nashville,TN,37203,888-758-4389,E,Public,24 hours daily,,,2,0,36.154798,-86.787408,12/01/2023,170150,2023-01-12 23:20:58 UTC,15/12/2020,J1772,
ELEC,GEORGIA POWER STATESBORO DC2,17874 GA-67,,Statesboro,GA,30458,888-758-4389,E,Public,24 hours daily,,,,1,32.406712,-81.761786,12/01/2023,170189,2023-01-12 23:21:31 UTC,16/12/2020,CHADEMO J1772COMBO,
ELEC,Caswell Park,1404 Woodbine Ave,,Knoxville,TN,37917,865-215-4311,E,Public,Dawn to dusk,,,4,0,35.982143,-83.912201,10/01/2023,170218,2023-01-10 16:44:47 UTC,01/12/2020,J1772,PARK
ELEC,Civic Auditorium & Coliseum Garage,545 Howard Baker Jr. Ave,Located on 3rd floor,Knoxville,TN,37915,865-215-4311,E,Public,24 hours daily; pay lot,,,3,0,35.965185,-83.911493,10/01/2023,170219,2023-01-10 16:44:47 UTC,01/12/2020,J1772,PARKING_GARAGE
ELEC,Ijams Nature Center,2915 Island Home Ave,,Knoxville,TN,37920,865-215-4311,E,Public,9am-5pm M-Sat; 1-5pm Sun,,,2,0,35.95635022,-83.86753656,10/01/2023,170220,2023-01-10 16:44:47 UTC,01/12/2020,J1772,PARK
ELEC,Public Works Building,3131 Morris Ave,,Knoxville,TN,37909,865-215-4311,E,Public,24 hours daily,,,3,0,35.961025,-83.962255,10/01/2023,170221,2023-01-10 16:44:47 UTC,01/12/2020,J1772,MUNI_GOV
ELEC,Market Square Parking Garage,406 Walnut St,Located on 2nd floor,Knoxville,TN,37902,865-215-4311,E,Public,Garage business hours,,,4,0,35.965213,-83.920608,10/01/2023,170222,2023-01-10 16:44:47 UTC,01/12/2020,J1772,PARKING_GARAGE
ELEC,Sequoyah Park,1400 Cherokee Blvd,,Knoxville,TN,37919,865-215-4311,E,Public,Dawn to dusk,,,1,0,35.92923952,-83.97377415,10/01/2023,170223,2023-01-10 16:44:47 UTC,01/12/2020,J1772,PARK
ELEC,State Street Garage,500 State St,Located on 2nd floor,Knoxville,TN,37903,865-215-4311,E,Public,24 hours daily,,,4,0,35.965035,-83.917487,10/01/2023,170224,2023-01-10 16:44:47 UTC,01/12/2020,J1772,PARKING_GARAGE
ELEC,West Hills Park,410 N Winston Rd,,Knoxville,TN,37909,865-215-4311,E,Public,24 hours daily,,,2,0,35.92905,-84.04609,10/01/2023,170225,2023-01-10 16:44:47 UTC,01/12/2020,J1772,PARK
ELEC,7SPC SCES LECONTE 1,2925 Teaster Ln,,Pigeon Forge,TN,37863,888-758-4389,E,Public,24 hours daily,,,2,0,35.799548,-83.561381,12/01/2023,170294,2023-01-12 23:21:33 UTC,18/12/2020,J1772,
ELEC,Walmart 2256 Henderson,200 N Cooper Drive,,Henderson,NC,27536,833-632-2778,E,Public,24 hours daily,,,,4,36.33467,-78.44216,23/01/2023,170324,2023-01-23 23:14:22 UTC,18/12/2020,CHADEMO J1772COMBO,
ELEC,Walmart 907 Forsyth,180 N Lee Street,,Forsyth,GA,31029,833-632-2778,E,Public,24 hours daily,,,,4,33.04105,-83.94197,23/01/2023,170327,2023-01-23 23:13:50 UTC,18/12/2020,CHADEMO J1772COMBO,
ELEC,Walmart 3 Commerce,30983 US Highway 441,,Commerce,GA,30529,833-632-2778,E,Public,24 hours daily,,,,4,34.24706,-83.45774,23/01/2023,170344,2023-01-23 23:14:38 UTC,18/12/2020,CHADEMO J1772COMBO,
ELEC,Farrar Place,920 Hillsboro Blvd,,Manchester,TN,37355,833-632-2778,E,Public,24 hours daily,,,,4,35.47422,-86.07977,23/01/2023,170349,2023-01-23 23:14:12 UTC,18/12/2020,CHADEMO J1772COMBO,
ELEC,GWCC GWCC MB NGW 12,300 Andrew Young International Blvd NW,,Atlanta,GA,30303,888-758-4389,E,Public,24 hours daily,,,2,0,33.757171,-84.399827,12/01/2023,170446,2023-01-12 23:21:34 UTC,22/12/2020,J1772,
ELEC,PGFTL EV STATION 2,2905 Parkway,,Pigeon Forge,TN,37863,888-758-4389,E,Public,24 hours daily,,,2,0,35.797453,-83.565737,12/01/2023,170662,2023-01-12 23:19:00 UTC,30/12/2020,J1772,
ELEC,AB Tech - Cash Point Lot,340 Victoria Road,,Asheville,NC,28801,855-900-7584,E,Public,24 hours daily,,,4,1,35.570074,-82.553755,23/01/2023,170903,2023-01-23 23:12:11 UTC,05/01/2021,CHADEMO J1772 J1772COMBO,
ELEC,GEORGIA POWER TRENTON DC1,255 Crabtree St,,Trenton,GA,30752,888-758-4389,E,Public,24 hours daily,,,,1,34.871316,-85.511045,12/01/2023,171278,2023-01-12 23:21:54 UTC,14/01/2021,CHADEMO J1772COMBO,
ELEC,CDC PD01,Michael St NE,,Atlanta,GA,30322,888-758-4389,E,Public,24 hours daily,,,2,0,33.797006,-84.32596,12/01/2023,171279,2023-01-12 23:21:24 UTC,14/01/2021,J1772,
ELEC,GRANDFATHER MTN ENTRANCE GATE,2050 Blowing Rock Hwy,,Linville,NC,28646,888-758-4389,E,Public,24 hours daily,,,2,0,36.084764,-81.845793,12/01/2023,171283,2023-01-12 23:21:53 UTC,14/01/2021,J1772,
ELEC,GRANDFATHER MTN NATURE MUSEUM,1104 Grandfather Mountain Entrance Rd,,Linville,NC,28646,888-758-4389,E,Public,24 hours daily,,,2,0,36.090218,-81.834969,12/01/2023,171284,2023-01-12 23:21:48 UTC,14/01/2021,J1772,
ELEC,PP 5TH&BROAD 5+B_RETAIL_B1_1,550 Broadway,,Nashville,TN,37203,888-758-4389,T,TEMPORARILY UNAVAILABLE (Public),24 hours daily,,,2,0,36.16067,-86.77889,12/01/2023,171286,2023-01-12 23:20:03 UTC,14/01/2021,J1772,
ELEC,TVHS STATION3,112-186 TN-268,,Murfreesboro,TN,37129,888-758-4389,E,Public,24 hours daily,,,1,0,35.910308,-86.384071,23/01/2023,171287,2023-01-23 23:01:02 UTC,14/01/2021,J1772,
ELEC,PP 5TH&BROAD 5+B_OFFICE_05_1,134 5th Ave N,,Nashville,TN,37219,888-758-4389,E,Public,24 hours daily,,,2,0,36.16119,-86.77919,12/01/2023,171310,2023-01-12 23:20:36 UTC,15/01/2021,J1772,
ELEC,PP 5TH&BROAD 5+B_RESI02_9,612 Broadway,,Nashville,TN,37203,888-758-4389,E,Public,24 hours daily,,,2,0,36.160225,-86.78049,12/01/2023,171311,2023-01-12 23:21:34 UTC,15/01/2021,J1772,
ELEC,PP 5TH&BROAD 5+B_RESI02_8,118 7th Ave N,,Nashville,TN,37203,888-758-4389,E,Public,24 hours daily,,,2,0,36.160645,-86.78044,12/01/2023,171312,2023-01-12 23:19:04 UTC,15/01/2021,J1772,
ELEC,PP 5TH&BROAD 5+B_RESI02_3,620 Commerce St,,Nashville,TN,37203,888-758-4389,E,Public,24 hours daily,,,1,0,36.160923,-86.78056,12/01/2023,171313,2023-01-12 23:19:04 UTC,15/01/2021,J1772,
ELEC,7SPC VEC BYRDSTOWN,300 W Main St,,Byrdstown,TN,38549,888-758-4389,E,Public,24 hours daily,,,2,0,36.57109,-85.13344,12/01/2023,171388,2023-01-12 23:21:57 UTC,20/01/2021,J1772,
ELEC,Peachtree Corners Town Center (Atlanta GA),5220 Town Center Blvd,,Peachtree Corners,GA,30092,833-632-2778,E,Public,24 hours daily,,,,4,33.97871,-84.21455,23/01/2023,171397,2023-01-23 23:13:48 UTC,20/01/2021,CHADEMO J1772COMBO,
ELEC,ENDEAVOR REG BROADWAY 1,1501 Broadway,,Nashville,TN,37203,888-758-4389,E,Public,24 hours daily,,,2,0,36.154701,-86.789639,12/01/2023,171421,2023-01-12 23:20:58 UTC,22/01/2021,J1772,
ELEC,Lakeside Centre Way,2035 Lakeside Centre Way,,Knoxville,TN,37922,888-998-2546,E,Public,MON: 24 hours | TUE: 24 hours | WED: 24 hours | THU: 24 hours | FRI: 24 hours | SAT: 24 hours | SUN: 24 hours,,,2,0,35.861637,-84.062759,23/01/2023,171460,2023-01-23 22:58:18 UTC,26/01/2021,J1772,
ELEC,Sheetz - Tesla Supercharger,1001 North Spence Avenue,,Goldsboro,NC,27534,877-798-3752,E,Public,24 hours daily; for Tesla use only,,,,8,35.386459,-77.948452,03/10/2022,171466,2022-12-01 17:40:26 UTC,04/01/2021,TESLA,CONVENIENCE_STORE
ELEC,"Bank of America GA7-634 (Woodstock, GA)",12170 Highway 92,,Woodstock,GA,30188,833-632-2778,E,Public,24 hours daily,,,,4,34.08662,-84.48222,23/01/2023,171479,2023-01-23 23:13:54 UTC,27/01/2021,CHADEMO J1772COMBO,
ELEC,BSMG NORTH DECK 2,305 Jackson St,,Durham,NC,27701,888-758-4389,E,Public,24 hours daily,,,2,0,35.994797,-78.90499,23/01/2023,171531,2023-01-23 23:01:20 UTC,27/01/2021,J1772,
ELEC,TAPESTRY EV 2,300 Centerview Dr,,Brentwood,TN,37027,888-758-4389,T,TEMPORARILY UNAVAILABLE (Public),24 hours daily,,,1,0,36.026051,-86.789158,23/01/2023,171571,2023-01-23 23:00:24 UTC,27/01/2021,J1772,
ELEC,GEORGIA POWER CLAYTON DC,19 Duncan St,,Clayton,GA,30525,888-758-4389,E,Public,24 hours daily,,,,1,34.879996,-83.401815,23/01/2023,171572,2023-01-23 23:03:54 UTC,27/01/2021,CHADEMO J1772COMBO,
ELEC,FAYETTEVILLE NC FRANKLIN 3,208 Franklin St,,Fayetteville,NC,28301,888-758-4389,E,Public,24 hours daily,,,2,0,35.052518,-78.880276,12/01/2023,171672,2023-01-12 23:20:59 UTC,27/01/2021,J1772,
ELEC,FAYETTEVILLE NC FRANKLIN 1,208 Franklin St,,Fayetteville,NC,28301,888-758-4389,E,Public,24 hours daily,,,2,0,35.052294,-78.880344,12/01/2023,171673,2023-01-12 23:20:59 UTC,27/01/2021,J1772,
ELEC,FAYETTEVILLE NC FRANKLIN GAR. 2,208 Franklin St,,Fayetteville,NC,28301,888-758-4389,T,TEMPORARILY UNAVAILABLE (Public),24 hours daily; Drivers must bring their own J1772 cordset for Level 1 charging,,1,1,0,35.052639,-78.880249,23/01/2023,171674,2023-01-23 23:00:26 UTC,27/01/2021,J1772 NEMA515,
ELEC,FAYETTEVILLE NC FRANKLIN GAR. 1,208 Franklin St,,Fayetteville,NC,28301,888-758-4389,T,TEMPORARILY UNAVAILABLE (Public),24 hours daily; Drivers must bring their own J1772 cordset for Level 1 charging,,1,1,0,35.052647,-78.880264,23/01/2023,171675,2023-01-23 23:00:26 UTC,27/01/2021,J1772 NEMA515,
ELEC,FAYETTEVILLE NC FRANKLIN GAR. 3,208 Franklin St,,Fayetteville,NC,28301,888-758-4389,T,TEMPORARILY UNAVAILABLE (Public),24 hours daily; Drivers must bring their own J1772 cordset for Level 1 charging,,1,1,0,35.052341,-78.880379,23/01/2023,171676,2023-01-23 23:00:26 UTC,27/01/2021,J1772 NEMA515,
ELEC,METRO NASHVILLE FULTON GARAGE 2,800 2nd Avenue South,,Nashville,TN,37210,888-758-4389,E,Public,24 hours daily,,,1,0,36.153755,-86.767851,12/01/2023,171710,2023-01-12 23:12:04 UTC,27/01/2021,J1772,
ELEC,METRO NASHVILLE FULTON GARAGE 6,800 2nd Ave S,,Nashville,TN,37210,888-758-4389,E,Public,24 hours daily,,,2,0,36.153968,-86.767386,23/01/2023,171712,2023-01-23 23:01:28 UTC,27/01/2021,J1772,
ELEC,NORTHSIDE EV NORTHSIDE EV3,450 Northside Cherokee Blvd,,Canton,GA,30114,888-758-4389,E,Public,24 hours daily,,,2,0,34.228589,-84.465117,23/01/2023,171716,2023-01-23 23:06:41 UTC,27/01/2021,J1772,
ELEC,NORTHSIDE EV NORTHSIDE EV1,450 Northside Cherokee Blvd,,Canton,GA,30114,888-758-4389,E,Public,24 hours daily,,,2,0,34.230116,-84.466187,23/01/2023,171717,2023-01-23 23:06:37 UTC,27/01/2021,J1772,
ELEC,M3 FAST CHARGER,1715 N Brown Rd,,Lawrenceville,GA,30043,888-758-4389,E,Public,24 hours daily,,,,1,33.994891,-84.074553,23/01/2023,171737,2023-01-23 23:04:37 UTC,27/01/2021,CHADEMO,
ELEC,ASSURANT - ATL STATION 1,260 Interstate N Cir SE,,Atlanta,GA,30339,888-758-4389,E,Public,24 hours daily,,,2,0,33.899443,-84.463314,23/01/2023,171747,2023-01-23 23:04:29 UTC,27/01/2021,J1772,
ELEC,HIGHWOODS 2400 GW1,2400 Century Center Dr,,Atlanta,GA,30345,888-758-4389,E,Public,24 hours daily,,,2,0,33.846554,-84.306228,23/01/2023,171752,2023-01-23 23:03:38 UTC,27/01/2021,J1772,
ELEC,OVERLOOK II SURFACE PARK 2,2839 Paces Ferry Rd SE,,Atlanta,GA,30339,888-758-4389,E,Public,24 hours daily,,,2,0,33.86698,-84.472271,23/01/2023,171759,2023-01-23 23:04:54 UTC,27/01/2021,J1772,
ELEC,GERMANTOWN1 IMT GERMANTOWN1,1100 3rd Ave N,,Nashville,TN,37208,888-758-4389,T,TEMPORARILY UNAVAILABLE (Public),24 hours daily,,,2,0,36.175775,-86.784728,23/01/2023,171761,2023-01-23 23:04:18 UTC,27/01/2021,J1772,
ELEC,GEORGIA POWER LIBERTY VILL L2,1075 Hwy 155 S,,McDonough,GA,30253,888-758-4389,E,Public,24 hours daily,,,2,0,33.407251,-84.167596,23/01/2023,171775,2023-01-23 23:03:53 UTC,27/01/2021,J1772,
ELEC,GEORGIA POWER CAPTAIN D L2,1910 Eatonton Rd,,Madison,GA,30650,888-758-4389,E,Public,24 hours daily,,,2,0,33.561054,-83.476605,23/01/2023,171776,2023-01-23 23:03:53 UTC,27/01/2021,J1772,
ELEC,CARTA 548 VINE ST #1,548 Vine St,,Chattanooga,TN,37403,888-758-4389,E,Public,24 hours daily,,,2,0,35.048115,-85.300922,23/01/2023,171777,2023-01-23 23:06:06 UTC,27/01/2021,J1772,
ELEC,ALLIANCE CENTER TWO ALLIANCE #2,3560 Lenox Rd NE,,Atlanta,GA,30326,888-758-4389,E,Public,24 hours daily,,,2,0,33.851483,-84.365766,23/01/2023,171782,2023-01-23 23:03:15 UTC,27/01/2021,J1772,
ELEC,METRO NASHVILLE LENTZ 1,2500 Charlotte Ave,,Nashville,TN,37203,888-758-4389,E,Public,24 hours daily,,,1,0,36.155398,-86.813525,23/01/2023,171799,2023-01-23 23:01:13 UTC,27/01/2021,J1772,
ELEC,BSMG EAST DECK 2,250 South Mangum Street,,Durham,NC,27701,888-758-4389,T,TEMPORARILY UNAVAILABLE (Public),24 hours daily,,,2,0,35.992665,-78.902102,23/01/2023,171800,2023-01-23 23:01:29 UTC,27/01/2021,J1772,
ELEC,BSMG EAST DECK 1,250 South Mangum Street,,Durham,NC,27701,888-758-4389,E,Public,24 hours daily,,,2,0,35.992715,-78.902072,23/01/2023,171801,2023-01-23 23:01:20 UTC,27/01/2021,J1772,
ELEC,MEBANE TANGER EV 2,4000 Arrowhead Blvd,,Mebane,NC,27302,888-758-4389,E,Public,24 hours daily,,,2,0,36.074872,-79.267746,23/01/2023,171823,2023-01-23 23:02:45 UTC,27/01/2021,J1772,
ELEC,"CHARLOTTE, NC HUNTERSVILLE 02",10300 Compass St,,Huntersville,NC,28078,888-758-4389,E,Public,24 hours daily,,,2,0,35.413632,-80.857176,23/01/2023,171833,2023-01-23 23:04:51 UTC,27/01/2021,J1772,
ELEC,715 715 STATION 1,715 peachtree street,,Atlanta,GA,30308,888-758-4389,T,TEMPORARILY UNAVAILABLE (Public),24 hours daily,,,2,0,33.775982,-84.387613,23/01/2023,171854,2023-01-23 23:06:42 UTC,27/01/2021,J1772,
ELEC,BMW NASHVILLE STATION 3,1568 Mallory Ln,,Brentwood,TN,37027,888-758-4389,E,Public,24 hours daily,,,2,0,35.979509,-86.804146,23/01/2023,171874,2023-01-23 23:07:58 UTC,27/01/2021,J1772,
ELEC,BMW NASHVILLE STATION 2,1568 Mallory Ln,,Brentwood,TN,37027,888-758-4389,E,Public,24 hours daily,,,2,0,35.98036,-86.8045,23/01/2023,171875,2023-01-23 23:07:57 UTC,27/01/2021,J1772,
ELEC,BMW NASHVILLE STATION 1,1568 Mallory Ln,,Brentwood,TN,37027,888-758-4389,T,TEMPORARILY UNAVAILABLE (Public),24 hours daily,,,2,0,35.979891,-86.804221,23/01/2023,171876,2023-01-23 23:07:34 UTC,27/01/2021,J1772,
ELEC,BMW NASHVILLE STATION 4,1568 Mallory Ln,,Brentwood,TN,37027,888-758-4389,E,Public,24 hours daily,,,2,0,35.979353,-86.804628,23/01/2023,171877,2023-01-23 23:07:26 UTC,27/01/2021,J1772,
ELEC,CLT AIRPORT LEVEL6_ST1,5501 R C Josh Birmingham Pkwy,,Charlotte,NC,28208,888-758-4389,E,Public,24 hours daily,,,2,0,35.221642,-80.945506,23/01/2023,171915,2023-01-23 23:02:03 UTC,27/01/2021,J1772,
ELEC,CLT AIRPORT LEVEL6_ST3,5501 R C Josh Birmingham Pkwy,,Charlotte,NC,28208,888-758-4389,E,Public,24 hours daily,,,2,0,35.22165,-80.945388,23/01/2023,171916,2023-01-23 23:02:03 UTC,27/01/2021,J1772,
ELEC,CLT AIRPORT LEVEL5_ST3,5501 R C Josh Birmingham Pkwy,,Charlotte,NC,28208,888-758-4389,E,Public,24 hours daily,,,2,0,35.221817,-80.945334,23/01/2023,171917,2023-01-23 23:02:03 UTC,27/01/2021,J1772,
ELEC,CLT AIRPORT LEVEL6_ST2,5501 R C Josh Birmingham Pkwy,,Charlotte,NC,28208,888-758-4389,E,Public,24 hours daily,,,2,0,35.221624,-80.945442,23/01/2023,171918,2023-01-23 23:02:00 UTC,27/01/2021,J1772,
ELEC,CLT AIRPORT LEVEL5_ST2,5501 R C Josh Birmingham Pkwy,,Charlotte,NC,28208,888-758-4389,E,Public,24 hours daily,,,2,0,35.221782,-80.945409,23/01/2023,171919,2023-01-23 23:02:00 UTC,27/01/2021,J1772,
ELEC,CLT AIRPORT LEVEL4_ST2,5501 R C Josh Birmingham Pkwy,,Charlotte,NC,28208,888-758-4389,T,TEMPORARILY UNAVAILABLE (Public),24 hours daily,,,2,0,35.221668,-80.944873,23/01/2023,171920,2023-01-23 23:02:00 UTC,27/01/2021,J1772,
ELEC,CLT AIRPORT LEVEL4_ST3,5501 R C Josh Birmingham Pkwy,,Charlotte,NC,28208,888-758-4389,T,TEMPORARILY UNAVAILABLE (Public),24 hours daily,,,2,0,35.221694,-80.944798,23/01/2023,171921,2023-01-23 23:02:03 UTC,27/01/2021,J1772,
ELEC,CLT AIRPORT LEVEL5_ST1,5501 R C Josh Birmingham Pkwy,,Charlotte,NC,28208,888-758-4389,E,Public,24 hours daily,,,2,0,35.221791,-80.945474,23/01/2023,171922,2023-01-23 23:02:03 UTC,27/01/2021,J1772,
ELEC,NORTHWINDS NORTHWINDS3-1,2500 Northwinds Pkwy,,Alpharetta,GA,30009,888-758-4389,E,Public,24 hours daily,,,2,0,34.06067,-84.285852,23/01/2023,171931,2023-01-23 23:02:54 UTC,27/01/2021,J1772,
ELEC,GARAGE RAMP PINNACLE 2,150 3rd Ave S 150 3rd Ave South,,Nashville,TN,37201,888-758-4389,E,Public,24 hours daily,,,2,0,36.160422,-86.774678,23/01/2023,171949,2023-01-23 23:03:19 UTC,27/01/2021,J1772,
ELEC,"CHARLOTTE, NC MALLARD CK 01",1712 J N Pease Pl,,Charlotte,NC,28262,888-758-4389,T,TEMPORARILY UNAVAILABLE (Public),24 hours daily,,,2,0,35.32367,-80.773012,23/01/2023,171959,2023-01-23 23:04:29 UTC,27/01/2021,J1772,
ELEC,FAYETTE COUNTY STATION 1,140 Stonewall Ave W,,Fayetteville,GA,30214,888-758-4389,E,Public,24 hours daily,,,2,0,33.44762,-84.455767,23/01/2023,171963,2023-01-23 23:04:29 UTC,27/01/2021,J1772,
ELEC,754 MIDTOWN 2,759 West Peachtree St NW,,Atlanta,GA,30308,888-758-4389,E,Public,24 hours daily,,,2,0,33.775737,-84.386907,23/01/2023,171977,2023-01-23 23:04:06 UTC,27/01/2021,J1772,
ELEC,CARTA THEATRECENTRE 3,200 River St,,Chattanooga,TN,37405,888-758-4389,E,Public,24 hours daily,,,2,0,35.061236,-85.306042,23/01/2023,171981,2023-01-23 23:04:55 UTC,27/01/2021,J1772,
ELEC,CARTA THEATRECENTRE 2,200 River St,,Chattanooga,TN,37405,888-758-4389,E,Public,24 hours daily,,,2,0,35.061217,-85.30602,23/01/2023,171982,2023-01-23 23:04:55 UTC,27/01/2021,J1772,
ELEC,GEORGIA STATE G DECK EV1,52 Courtland St SE,,Atlanta,GA,30303,888-758-4389,E,Public,24 hours daily,,,2,0,33.751969,-84.387289,23/01/2023,171983,2023-01-23 23:04:43 UTC,27/01/2021,J1772,
ELEC,GEORGIA STATE GSU-G DECK EV1,52 Courtland St SE,,Atlanta,GA,30303,888-758-4389,E,Public,24 hours daily,,,2,0,33.752152,-84.387547,23/01/2023,171984,2023-01-23 23:01:21 UTC,27/01/2021,J1772,
ELEC,DUKEPTS SDG 5,302 Science Drive Science Drive Garage,,Durham,NC,27708,888-758-4389,E,Public,24 hours daily,,,2,0,35.9961,-78.9474,23/01/2023,171995,2023-01-23 23:05:03 UTC,27/01/2021,J1772,
ELEC,DUKEPTS SDG 6,302 Science Drive Science Drive Garage,,Durham,NC,27708,888-758-4389,E,Public,24 hours daily,,,2,0,35.996125,-78.947466,23/01/2023,171996,2023-01-23 23:05:02 UTC,27/01/2021,J1772,
ELEC,DUKEPTS SDG 4,302 Science Drive Science Drive Garage,,Durham,NC,27708,888-758-4389,E,Public,24 hours daily,,,2,0,35.996186,-78.947271,23/01/2023,171997,2023-01-23 23:05:03 UTC,27/01/2021,J1772,
ELEC,DUKEPTS SDG 3,302 Science Drive Science Drive Garage,,Durham,NC,27708,888-758-4389,E,Public,24 hours daily,,,2,0,35.996222,-78.947248,23/01/2023,171998,2023-01-23 23:05:02 UTC,27/01/2021,J1772,
ELEC,DUKEPTS SDG 7,302 Science Drive Science Drive Garage,,Durham,NC,27708,888-758-4389,E,Public,24 hours daily,,,2,0,35.996042,-78.947512,23/01/2023,171999,2023-01-23 23:04:57 UTC,27/01/2021,J1772,
ELEC,GEORGIA POWER ATHENS L2,1001 Prince Ave,,Athens,GA,30606,888-758-4389,E,Public,24 hours daily,,,2,0,33.961243,-83.39387,23/01/2023,172009,2023-01-23 23:03:53 UTC,27/01/2021,J1772,
ELEC,GEORGIA POWER WILLS RD L2,11675 Wills Rd,,Alpharetta,GA,30009,888-758-4389,E,Public,24 hours daily,,,2,0,34.064521,-84.311732,23/01/2023,172010,2023-01-23 23:03:55 UTC,27/01/2021,J1772,
ELEC,GEORGIA POWER MINOLA L2,5215 Minola Dr,,Lithonia,GA,30038,888-758-4389,E,Public,24 hours daily,,,2,0,33.700982,-84.176688,23/01/2023,172011,2023-01-23 23:03:55 UTC,27/01/2021,J1772,
ELEC,GEORGIA POWER CONCORD L2,1088 Concord Rd SE,,Smyrna,GA,30080,888-758-4389,E,Public,24 hours daily,,,2,0,33.875698,-84.521933,23/01/2023,172012,2023-01-23 23:03:55 UTC,27/01/2021,J1772,
ELEC,GEORGIA POWER DUBLIN L2,2175 US-441,,Dublin,GA,31021,888-758-4389,E,Public,24 hours daily,,,2,0,32.490959,-82.93298,23/01/2023,172015,2023-01-23 23:03:53 UTC,27/01/2021,J1772,
ELEC,GEORGIA POWER EPICENTER L2,135 Riverside Pkwy,,Austell,GA,30168,888-758-4389,E,Public,24 hours daily,,,2,0,33.771317,-84.558442,23/01/2023,172016,2023-01-23 23:03:53 UTC,27/01/2021,J1772,
ELEC,GEORGIA POWER STAYBRIDGE L2,3420 Norman Berry Dr,,Hapeville,GA,30354,888-758-4389,E,Public,24 hours daily,,,2,0,33.662897,-84.428088,23/01/2023,172018,2023-01-23 23:04:10 UTC,27/01/2021,J1772,
ELEC,CARTA ST ELMO #2,3001-3099 St Elmo Ave,,Chattanooga,TN,37408,888-758-4389,E,Public,24 hours daily,,,2,0,35.021531,-85.321354,23/01/2023,172021,2023-01-23 23:06:32 UTC,27/01/2021,J1772,
ELEC,RIVERWOOD 200 STATION 2,3300 Riverwood Parkway,,Atlanta,GA,30339,888-758-4389,T,TEMPORARILY UNAVAILABLE (Public),24 hours daily,,,2,0,33.876877,-84.459206,23/01/2023,172058,2023-01-23 23:06:07 UTC,27/01/2021,J1772,
ELEC,RIVERWOOD 200 STATION 4,3300 Riverwood Parkway,,Atlanta,GA,30339,888-758-4389,T,TEMPORARILY UNAVAILABLE (Public),24 hours daily,,,2,0,33.87683,-84.45916,23/01/2023,172059,2023-01-23 23:06:07 UTC,27/01/2021,J1772,
ELEC,SEVIERVILLE TANGER OUTLET 2,1641 Parkway,,Sevierville,TN,37862,888-758-4389,E,Public,24 hours daily,,,2,0,35.832928,-83.570396,23/01/2023,172106,2023-01-23 23:03:17 UTC,27/01/2021,J1772,
ELEC,HIGHWOODS 2800 GW1,2800 Century Center Dr,,Atlanta,GA,30345,888-758-4389,E,Public,24 hours daily,,,2,0,33.84864,-84.304877,23/01/2023,172146,2023-01-23 23:03:46 UTC,27/01/2021,J1772,
ELEC,FASTPARK ATLANTA 7,211 Charles W Grant Pkwy,,Atlanta,GA,30354,888-758-4389,E,Public,24 hours daily,,,2,0,33.640299,-84.39806,23/01/2023,172173,2023-01-23 23:04:05 UTC,27/01/2021,J1772,
ELEC,FASTPARK ATLANTA 4,211 Charles W Grant Pkwy,,Atlanta,GA,30354,888-758-4389,E,Public,24 hours daily,,,2,0,33.640254,-84.397953,23/01/2023,172174,2023-01-23 23:04:05 UTC,27/01/2021,J1772,
ELEC,FASTPARK ATLANTA 2,211 Charles W Grant Pkwy,,Atlanta,GA,30354,888-758-4389,E,Public,24 hours daily,,,2,0,33.640272,-84.398103,23/01/2023,172175,2023-01-23 23:04:04 UTC,27/01/2021,J1772,
ELEC,FASTPARK ATLANTA 6,211 Charles W Grant Pkwy,,Atlanta,GA,30354,888-758-4389,E,Public,24 hours daily,,,2,0,33.640237,-84.398017,23/01/2023,172176,2023-01-23 23:04:04 UTC,27/01/2021,J1772,
ELEC,FASTPARK ATLANTA 5,211 Charles W Grant Pkwy,,Atlanta,GA,30354,888-758-4389,E,Public,24 hours daily,,,2,0,33.640272,-84.398189,23/01/2023,172177,2023-01-23 23:04:04 UTC,27/01/2021,J1772,
ELEC,FASTPARK ATLANTA 8,211 Charles W Grant Pkwy,,Atlanta,GA,30354,888-758-4389,E,Public,24 hours daily,,,2,0,33.640246,-84.398114,23/01/2023,172178,2023-01-23 23:04:05 UTC,27/01/2021,J1772,
ELEC,FASTPARK ATLANTA 3,211 Charles W Grant Pkwy,,Atlanta,GA,30354,888-758-4389,E,Public,24 hours daily,,,2,0,33.640263,-84.397985,23/01/2023,172179,2023-01-23 23:04:04 UTC,27/01/2021,J1772,
ELEC,DELTA AIR LINES TOC EV CHARGER1,1775 M H Jackson Service Rd,,Atlanta,GA,30354,888-758-4389,E,Public,24 hours daily,,,2,0,33.641652,-84.415299,23/01/2023,172213,2023-01-23 23:05:29 UTC,27/01/2021,J1772,
ELEC,DELTA AIR LINES TOC EV CHARGER3,1775 M H Jackson Service Rd,,Atlanta,GA,30354,888-758-4389,E,Public,24 hours daily,,,2,0,33.641605,-84.415283,23/01/2023,172214,2023-01-23 23:05:29 UTC,27/01/2021,J1772,
ELEC,DELTA AIR LINES TOC EV CHARGER2,1775 M H Jackson Service Rd,,Atlanta,GA,30354,888-758-4389,E,Public,24 hours daily,,,2,0,33.64169,-84.415267,23/01/2023,172215,2023-01-23 23:05:29 UTC,27/01/2021,J1772,
ELEC,DELTA AIR LINES TOC EV CHARGER4,1775 M H Jackson Service Rd,,Atlanta,GA,30354,888-758-4389,E,Public,24 hours daily,,,2,0,33.641533,-84.415275,23/01/2023,172216,2023-01-23 23:05:29 UTC,27/01/2021,J1772,
ELEC,GA. AQUARIUM WHALE SHARK,225 Baker Street NW,,Atlanta,GA,30313,888-758-4389,T,TEMPORARILY UNAVAILABLE (Public),24 hours daily,,,2,0,33.763976,-84.395483,23/01/2023,172217,2023-01-23 23:05:23 UTC,27/01/2021,J1772,
ELEC,GA. AQUARIUM MANTA RAY,225 Baker St NW,,Atlanta,GA,30313,888-758-4389,T,TEMPORARILY UNAVAILABLE (Public),24 hours daily,,,2,0,33.763485,-84.395518,23/01/2023,172218,2023-01-23 23:05:22 UTC,27/01/2021,J1772,
ELEC,GA. AQUARIUM BELUGA WHALE,225 Baker St NW,,Atlanta,GA,30313,888-758-4389,T,TEMPORARILY UNAVAILABLE (Public),24 hours daily,,,2,0,33.763473,-84.395283,23/01/2023,172219,2023-01-23 23:05:17 UTC,27/01/2021,J1772,
ELEC,GA. AQUARIUM PENGUIN,225 Baker St NW,,Atlanta,GA,30313,888-758-4389,T,TEMPORARILY UNAVAILABLE (Public),24 hours daily,,,2,0,33.763497,-84.395414,23/01/2023,172220,2023-01-23 23:05:15 UTC,27/01/2021,J1772,
ELEC,GEORGIA POWER GPC CORP HQ1 L2,241 Ralph McGill Blvd NE,,Atlanta,GA,30308,888-758-4389,E,Public,24 hours daily,,,2,0,33.763953,-84.38002,23/01/2023,172223,2023-01-23 23:01:37 UTC,27/01/2021,J1772,
ELEC,DELTA AIR LINES GO CHARGER 14,Hartsfield Dr SW,,Atlanta,GA,30354,888-758-4389,E,Public,24 hours daily,,,2,0,33.653845,-84.423648,12/01/2023,172236,2023-01-12 23:10:42 UTC,27/01/2021,J1772,
ELEC,DELTA AIR LINES GO CHARGER 11,Hartsfield Dr SW,,Atlanta,GA,30354,888-758-4389,E,Public,24 hours daily,,,2,0,33.653822,-84.423798,23/01/2023,172237,2023-01-23 23:09:14 UTC,27/01/2021,J1772,
ELEC,DELTA AIR LINES GO CHARGER 5,Hartsfield Dr SW,,Atlanta,GA,30354,888-758-4389,E,Public,24 hours daily,,,2,0,33.653822,-84.424038,23/01/2023,172239,2023-01-23 23:05:35 UTC,27/01/2021,J1772,
ELEC,DELTA AIR LINES GO CHARGER 10,Hartsfield Dr SW,,Atlanta,GA,30354,888-758-4389,E,Public,24 hours daily,,,2,0,33.653831,-84.424175,23/01/2023,172240,2023-01-23 23:05:35 UTC,27/01/2021,J1772,
ELEC,DELTA AIR LINES GO CHARGER 3,Hartsfield Dr SW,,Atlanta,GA,30354,888-758-4389,E,Public,24 hours daily,,,2,0,33.65382,-84.423958,23/01/2023,172241,2023-01-23 23:05:29 UTC,27/01/2021,J1772,
ELEC,DELTA AIR LINES GO CHARGER 1,Hartsfield Dr SW,,Atlanta,GA,30354,888-758-4389,E,Public,24 hours daily,,,2,0,33.6538,-84.423757,23/01/2023,172242,2023-01-23 23:05:29 UTC,27/01/2021,J1772,
ELEC,DELTA AIR LINES GO CHARGER 9,Hartsfield Dr SW,,Atlanta,GA,30354,888-758-4389,E,Public,24 hours daily,,,2,0,33.65384,-84.424202,23/01/2023,172243,2023-01-23 23:05:29 UTC,27/01/2021,J1772,
ELEC,DELTA AIR LINES GO CHARGER 4,Hartsfield Dr SW,,Atlanta,GA,30354,888-758-4389,E,Public,24 hours daily,,,2,0,33.653824,-84.424014,23/01/2023,172244,2023-01-23 23:05:29 UTC,27/01/2021,J1772,
ELEC,DELTA AIR LINES GO CHARGER 8,Hartsfield Dr SW,,Atlanta,GA,30354,888-758-4389,E,Public,24 hours daily,,,2,0,33.653829,-84.424175,23/01/2023,172245,2023-01-23 23:05:29 UTC,27/01/2021,J1772,
ELEC,DELTA AIR LINES GO CHARGER 6,Hartsfield Dr SW,,Atlanta,GA,30354,888-758-4389,E,Public,24 hours daily,,,2,0,33.653826,-84.424105,23/01/2023,172246,2023-01-23 23:05:29 UTC,27/01/2021,J1772,
ELEC,DELTA AIR LINES GO CHARGER 7,Hartsfield Dr SW,,Atlanta,GA,30354,888-758-4389,E,Public,24 hours daily,,,2,0,33.653831,-84.424127,23/01/2023,172247,2023-01-23 23:05:29 UTC,27/01/2021,J1772,
ELEC,DELTA AIR LINES GO CHARGER 2,Hartsfield Dr SW,,Atlanta,GA,30354,888-758-4389,E,Public,24 hours daily,,,2,0,33.653813,-84.423891,23/01/2023,172248,2023-01-23 23:05:29 UTC,27/01/2021,J1772,
ELEC,BNA EXPRESS STATION 02,115 Knapp Blvd,,Nashville,TN,37217,888-758-4389,E,Public,24 hours daily,,,2,0,36.110741,-86.671986,23/01/2023,172250,2023-01-23 23:04:54 UTC,27/01/2021,J1772,
ELEC,SALESFORCE TOWE STATION 1,950 East Paces Ferry Rd,,Atlanta,GA,30326,888-758-4389,E,Public,24 hours daily,,,2,0,33.847693,-84.357465,23/01/2023,172276,2023-01-23 23:06:40 UTC,27/01/2021,J1772,
ELEC,N DRUID HILLS STATION 2,7 Executive Park Dr NE,,Atlanta,GA,30329,888-758-4389,E,Public,24 hours daily,,,2,0,33.829936,-84.338579,23/01/2023,172326,2023-01-23 23:07:46 UTC,27/01/2021,J1772,
ELEC,GEORGIA POWER BREMEN L2,125 US-27,,Bremen,GA,30110,888-758-4389,E,Public,24 hours daily,,,2,0,33.692566,-85.15111,23/01/2023,172354,2023-01-23 23:03:53 UTC,27/01/2021,J1772,
ELEC,GEORGIA POWER BEST WESTERN L2,301 N Central Ave,,Hapeville,GA,30354,888-758-4389,E,Public,24 hours daily,,,2,0,33.653992,-84.397638,23/01/2023,172355,2023-01-23 23:04:10 UTC,27/01/2021,J1772,
ELEC,METRO DC GAINESVILLE DC,450 Jesse Jewell Pkwy,,Gainesville,GA,30501,888-758-4389,T,TEMPORARILY UNAVAILABLE (Public),24 hours daily,,,,1,34.295886,-83.82931,23/01/2023,172365,2023-01-23 23:03:54 UTC,27/01/2021,CHADEMO J1772COMBO,
ELEC,GO BRAVES EAST EV LEVEL 4,75 Circle Pkwy,,Atlanta,GA,30339,888-758-4389,T,TEMPORARILY UNAVAILABLE (Public),24 hours daily,,,2,0,33.891731,-84.46646,23/01/2023,172378,2023-01-23 23:06:21 UTC,27/01/2021,J1772,
ELEC,GO BRAVES EAST EV LEVEL 5,75 Circle Pkwy,,Atlanta,GA,30339,888-758-4389,T,TEMPORARILY UNAVAILABLE (Public),24 hours daily,,,2,0,33.891824,-84.466658,23/01/2023,172379,2023-01-23 23:06:21 UTC,27/01/2021,J1772,
ELEC,GO BRAVES EAST EV LEVEL 2,75 Circle Pkwy,,Atlanta,GA,30339,888-758-4389,T,TEMPORARILY UNAVAILABLE (Public),24 hours daily,,,2,0,33.891456,-84.466162,23/01/2023,172380,2023-01-23 23:06:21 UTC,27/01/2021,J1772,
ELEC,GO BRAVES EAST EV LEVEL 3,75 Circle Pkwy,,Atlanta,GA,30339,888-758-4389,T,TEMPORARILY UNAVAILABLE (Public),24 hours daily,,,2,0,33.891619,-84.466358,23/01/2023,172381,2023-01-23 23:06:21 UTC,27/01/2021,J1772,
ELEC,GO BRAVES PLAZA EV LEV 2,75 Circle Pkwy,,Atlanta,GA,30339,888-758-4389,T,TEMPORARILY UNAVAILABLE (Public),24 hours daily,,,2,0,33.889493,-84.467835,23/01/2023,172382,2023-01-23 23:05:53 UTC,27/01/2021,J1772,
ELEC,GO BRAVES PLAZA EV LEV 1,75 Circle Pkwy,,Atlanta,GA,30339,888-758-4389,T,TEMPORARILY UNAVAILABLE (Public),24 hours daily,,,2,0,33.889402,-84.4678,23/01/2023,172383,2023-01-23 23:05:53 UTC,27/01/2021,J1772,
ELEC,GA GWINNETT COL STUDENT HOUSING,1000 University Center Ln,,Lawrenceville,GA,30043,888-758-4389,T,TEMPORARILY UNAVAILABLE (Public),24 hours daily,,,2,0,33.979813,-84.007298,23/01/2023,172392,2023-01-23 23:03:33 UTC,27/01/2021,J1772,
ELEC,GA GWINNETT COL BUILDING B LOT,1000 University Center Lane,,Lawrenceville,GA,30043,888-758-4389,T,TEMPORARILY UNAVAILABLE (Public),24 hours daily,,,2,0,33.981345,-84.004111,23/01/2023,172393,2023-01-23 23:03:33 UTC,27/01/2021,J1772,
ELEC,GA GWINNETT COL MAIN DECK1,1000 University Center Ln,,Lawrenceville,GA,30043,888-758-4389,E,Public,24 hours daily,,,2,0,33.981231,-84.000121,23/01/2023,172394,2023-01-23 23:03:33 UTC,27/01/2021,J1772,
ELEC,MONARCH TOWER G MONARCH TOWER,3424 Peachtree Rd NE,,Atlanta,GA,30326,888-758-4389,E,Public,24 hours daily,,,2,0,33.851898,-84.364905,23/01/2023,172395,2023-01-23 23:03:35 UTC,27/01/2021,J1772,
ELEC,SAT PLACE 300 BANYAN 1 GW,3237 Satellite Blvd,,Duluth,GA,30096,888-758-4389,E,Public,24 hours daily,,,2,0,33.963711,-84.120437,23/01/2023,172398,2023-01-23 23:04:23 UTC,27/01/2021,J1772,
ELEC,GEORGIA POWER N SHALLOW L2,4404 N Shallowford Rd,,Atlanta,GA,30338,888-758-4389,E,Public,24 hours daily,,,2,0,33.92105,-84.305822,23/01/2023,172465,2023-01-23 23:03:53 UTC,27/01/2021,J1772,
ELEC,BMW ALPHARETTA STATION SA01,1501 Alpharetta Hwy,,Roswell,GA,30076,888-758-4389,T,TEMPORARILY UNAVAILABLE (Public),24 hours daily,,,1,0,34.067167,-84.317752,23/01/2023,172477,2023-01-23 23:01:59 UTC,27/01/2021,J1772,
ELEC,BMW ALPHARETTA FAST CHARGER 01,1501 Alpharetta Hwy,,Roswell,GA,30076,888-758-4389,T,TEMPORARILY UNAVAILABLE (Public),24 hours daily,,,,1,34.0669,-84.31818,23/01/2023,172478,2023-01-23 23:01:59 UTC,27/01/2021,J1772COMBO,
ELEC,"CHARLOTTE, NC CATS I-485 1",9512 South Blvd,,Charlotte,NC,28273,888-758-4389,E,Public,24 hours daily,,,2,0,35.10683,-80.883225,23/01/2023,172490,2023-01-23 23:05:23 UTC,27/01/2021,J1772,
ELEC,"CHARLOTTE, NC CATS I-485 2",9512 South Blvd,,Charlotte,NC,28273,888-758-4389,E,Public,24 hours daily,,,2,0,35.107013,-80.883413,23/01/2023,172491,2023-01-23 23:05:18 UTC,27/01/2021,J1772,
ELEC,DELTA AIR LINES CAMP CREEK #1,3939 North West Drive,,College Park,GA,30337,888-758-4389,T,TEMPORARILY UNAVAILABLE (Public),24 hours daily,,,2,0,33.645984,-84.462065,23/01/2023,172520,2023-01-23 23:06:02 UTC,27/01/2021,J1772,
ELEC,DELTA AIR LINES CAMP CREEK #2,3939 North West Drive,,College Park,GA,30337,888-758-4389,T,TEMPORARILY UNAVAILABLE (Public),24 hours daily,,,2,0,33.645977,-84.461843,23/01/2023,172521,2023-01-23 23:06:02 UTC,27/01/2021,J1772,
ELEC,DELTA AIR LINES CAMP CREEK #4,3939 North West Drive,,College Park,GA,30337,888-758-4389,T,TEMPORARILY UNAVAILABLE (Public),24 hours daily,,,2,0,33.645984,-84.461596,23/01/2023,172522,2023-01-23 23:06:02 UTC,27/01/2021,J1772,
ELEC,DELTA AIR LINES CAMP CREEK #3,3939 North West Drive,,College Park,GA,30337,888-758-4389,T,TEMPORARILY UNAVAILABLE (Public),24 hours daily,,,2,0,33.645959,-84.461757,23/01/2023,172523,2023-01-23 23:05:56 UTC,27/01/2021,J1772,
ELEC,DUKEPTS PG2 LEVEL 3,2300-2314 Erwin Rd,,Durham,NC,27705,888-758-4389,E,Public,24 hours daily,,,2,0,36.008353,-78.937789,23/01/2023,172558,2023-01-23 23:07:47 UTC,27/01/2021,J1772,
ELEC,GWCC GWCC MBS NGW4,Mangum St SW,,Atlanta,GA,30303,888-758-4389,T,TEMPORARILY UNAVAILABLE (Public),24 hours daily,,,2,0,33.755643,-84.398666,23/01/2023,172598,2023-01-23 23:03:58 UTC,27/01/2021,J1772,
ELEC,GWCC GWCC MB NGW 7,Mangum St SW,,Atlanta,GA,30303,888-758-4389,E,Public,24 hours daily,,,2,0,33.755623,-84.398661,23/01/2023,172599,2023-01-23 23:03:58 UTC,27/01/2021,J1772,
ELEC,GWCC GWCC MB NGW 5,Mangum St SW,,Atlanta,GA,30303,888-758-4389,E,Public,24 hours daily,,,2,0,33.755575,-84.39861,23/01/2023,172600,2023-01-23 23:03:55 UTC,27/01/2021,J1772,
ELEC,GWCC GWCC MBS NGW2,Mangum St SW,,Atlanta,GA,30303,888-758-4389,T,TEMPORARILY UNAVAILABLE (Public),24 hours daily,,,2,0,33.755595,-84.398616,23/01/2023,172601,2023-01-23 23:03:55 UTC,27/01/2021,J1772,
ELEC,GWCC DCFC1,Mangum St SW,,Atlanta,GA,30303,888-758-4389,T,TEMPORARILY UNAVAILABLE (Public),24 hours daily,,,,1,33.755564,-84.398581,23/01/2023,172602,2023-01-23 23:03:50 UTC,27/01/2021,CHADEMO J1772COMBO,
ELEC,GWCC DCFC2,Mangum St SW,,Atlanta,GA,30303,888-758-4389,E,Public,24 hours daily,,,,1,33.755561,-84.398595,23/01/2023,172603,2023-01-23 23:03:50 UTC,27/01/2021,CHADEMO J1772COMBO,
ELEC,GWCC GWCC MBS GW,Mangum St SW,,Atlanta,GA,30303,888-758-4389,T,TEMPORARILY UNAVAILABLE (Public),24 hours daily,,,2,0,33.755612,-84.398635,23/01/2023,172604,2023-01-23 23:03:49 UTC,27/01/2021,J1772,
ELEC,GWCC GWCC MB GW 2,Mangum St SW,,Atlanta,GA,30303,888-758-4389,E,Public,24 hours daily,,,2,0,33.755608,-84.398648,23/01/2023,172605,2023-01-23 23:03:49 UTC,27/01/2021,J1772,
ELEC,GWCC GWCC MB NGW 6,Mangum St SW,,Atlanta,GA,30303,888-758-4389,E,Public,24 hours daily,,,2,0,33.755594,-84.398629,23/01/2023,172606,2023-01-23 23:03:38 UTC,27/01/2021,J1772,
ELEC,GWCC GWCC MBS NGW3,Mangum St SW,,Atlanta,GA,30303,888-758-4389,T,TEMPORARILY UNAVAILABLE (Public),24 hours daily,,,2,0,33.755626,-84.39865,23/01/2023,172607,2023-01-23 23:03:37 UTC,27/01/2021,J1772,
ELEC,GWCC GWCC MBS NGW1,Mangum St SW,,Atlanta,GA,30303,888-758-4389,T,TEMPORARILY UNAVAILABLE (Public),24 hours daily,,,2,0,33.755579,-84.398597,23/01/2023,172608,2023-01-23 23:03:41 UTC,27/01/2021,J1772,
ELEC,CARTA AIRPORT LOT2 #1,1001 Airport Rd,,Chattanooga,TN,37421,888-758-4389,E,Public,24 hours daily,,,2,0,35.038071,-85.195733,23/01/2023,172629,2023-01-23 23:04:59 UTC,27/01/2021,J1772,
ELEC,CARTA AIRPORT LOT2 #2,1001 Airport Rd,,Chattanooga,TN,37421,888-758-4389,E,Public,24 hours daily,,,2,0,35.038053,-85.195756,23/01/2023,172630,2023-01-23 23:04:55 UTC,27/01/2021,J1772,
ELEC,SEVENSPRINGS 7SPRINGS_LL2,320 Seven Springs Way,,Brentwood,TN,37027,888-758-4389,E,Public,24 hours daily,,,2,0,36.041636,-86.770464,23/01/2023,172637,2023-01-23 23:05:23 UTC,27/01/2021,J1772,
ELEC,SEVENSPRINGS 7SPRINGS_2,320 Seven Springs Way,,Brentwood,TN,37027,888-758-4389,E,Public,24 hours daily,,,2,0,36.041707,-86.770481,23/01/2023,172638,2023-01-23 23:05:21 UTC,27/01/2021,J1772,
ELEC,SEVENSPRINGS 7SPRINGS_LL1,320 Seven Springs Way,,Brentwood,TN,37027,888-758-4389,E,Public,24 hours daily,,,2,0,36.041803,-86.770483,23/01/2023,172639,2023-01-23 23:05:21 UTC,27/01/2021,J1772,
ELEC,"CHARLOTTE, NC CMGC PRKG L1-3",232 S Davidson St,,Charlotte,NC,28202,888-758-4389,E,Public,24 hours daily,,,1,0,35.222173,-80.839739,23/01/2023,172640,2023-01-23 23:05:43 UTC,27/01/2021,J1772,
ELEC,GEORGIA POWER GLENWOOD L2,800 Glenwood Ave SE,,Atlanta,GA,30316,888-758-4389,E,Public,24 hours daily,,,2,0,33.741872,-84.3595,23/01/2023,172747,2023-01-23 23:04:10 UTC,27/01/2021,J1772,
ELEC,THREE ALLIANCE 3 ALLIANCE EV5,Alliance Center Dr NE,,Atlanta,GA,30326,888-758-4389,E,Public,24 hours daily,,,2,0,33.85171,-84.36676,23/01/2023,172763,2023-01-23 23:05:32 UTC,27/01/2021,J1772,
ELEC,THREE ALLIANCE 3 ALLIANCE EV3,Alliance Center Dr NE,,Atlanta,GA,30326,888-758-4389,E,Public,24 hours daily,,,2,0,33.851301,-84.366785,23/01/2023,172764,2023-01-23 23:05:32 UTC,27/01/2021,J1772,
ELEC,THREE ALLIANCE 3 ALLIANCE EV6,Alliance Center Dr NE,,Atlanta,GA,30326,888-758-4389,E,Public,24 hours daily,,,2,0,33.851738,-84.367026,23/01/2023,172765,2023-01-23 23:05:28 UTC,27/01/2021,J1772,
ELEC,GEORGIA POWER SUNTRUST L2 7,655 Battery Ave SE Delta Deck Surface Lot,,Atlanta,GA,30339,888-758-4389,E,Public,24 hours daily,,,2,0,33.892091,-84.466122,23/01/2023,172768,2023-01-23 23:06:32 UTC,27/01/2021,J1772,
ELEC,GEORGIA POWER SUNTRUST L2 5,655 Battery Ave SE Delta Deck Surface Lot,,Atlanta,GA,30339,888-758-4389,E,Public,24 hours daily,,,2,0,33.892019,-84.466026,23/01/2023,172769,2023-01-23 23:06:32 UTC,27/01/2021,J1772,
ELEC,GEORGIA POWER SUNTRUST L2 6,655 Battery Ave SE Delta Deck Surface Lot,,Atlanta,GA,30339,888-758-4389,E,Public,24 hours daily,,,2,0,33.892046,-84.466058,23/01/2023,172770,2023-01-23 23:06:32 UTC,27/01/2021,J1772,
ELEC,GEORGIA POWER SUNTRUST L2 4,655 Battery Ave SE Delta Deck Surface Lot,,Atlanta,GA,30339,888-758-4389,E,Public,24 hours daily,,,2,0,33.891965,-84.465963,23/01/2023,172771,2023-01-23 23:06:31 UTC,27/01/2021,J1772,
ELEC,GEORGIA POWER SUNTRUST L2 3,655 BATTERY AVE SE Delta Deck Surface Lot,,Atlanta,GA,30339,888-758-4389,E,Public,24 hours daily,,,2,0,33.89193,-84.465933,23/01/2023,172772,2023-01-23 23:06:22 UTC,27/01/2021,J1772,
ELEC,GEORGIA POWER SUNTRUST L2 2,655 BATTERY AVE SE Delta Deck Surface Lot,,Atlanta,GA,30339,888-758-4389,E,Public,24 hours daily,,,2,0,33.891895,-84.465865,23/01/2023,172773,2023-01-23 23:06:21 UTC,27/01/2021,J1772,
ELEC,GEORGIA POWER SUNTRUST L2 1,655 BATTERY AVE SE Delta Deck Surface Lot,,Atlanta,GA,30339,888-758-4389,E,Public,24 hours daily,,,2,0,33.891825,-84.465797,23/01/2023,172774,2023-01-23 23:06:21 UTC,27/01/2021,J1772,
ELEC,METRO DC SUNTRUST DC,655 BATTERY AVE SE Delta Deck Surface Lot,,Atlanta,GA,30339,888-758-4389,E,Public,24 hours daily,,,,1,33.89177,-84.465715,23/01/2023,172775,2023-01-23 23:05:39 UTC,27/01/2021,CHADEMO J1772COMBO,
ELEC,CHARGER 1 LVR LVR 1,1270 Lifes Way,,Marietta,GA,30062,888-758-4389,E,Public,24 hours daily,,,2,0,33.935021,-84.51563,23/01/2023,172779,2023-01-23 23:06:37 UTC,27/01/2021,J1772,
ELEC,ATLANTA FALCONS ATL UNITED EV2,861 Franklin Gateway SE,,Marietta,GA,30067,888-758-4389,E,Public,24 hours daily,,,2,0,33.934363,-84.498526,23/01/2023,172782,2023-01-23 23:06:18 UTC,27/01/2021,J1772,
ELEC,COBB COUNTY 100 CHEROKEE 01,100 Cherokee St NE,,Marietta,GA,30060,888-758-4389,E,Public,24 hours daily,,,2,0,33.954289,-84.548408,23/01/2023,172788,2023-01-23 23:04:18 UTC,27/01/2021,J1772,
ELEC,COBB COUNTY 191 LAWRENCE 01,191 Lawrence St NE,,Marietta,GA,30060,888-758-4389,E,Public,24 hours daily,,,2,0,33.953553,-84.547503,23/01/2023,172790,2023-01-23 23:04:18 UTC,27/01/2021,J1772,
ELEC,PONCE CITY MKT GARAGE LEVEL 4B,675 Ponce De Leon Ave NE,,Atlanta,GA,30308,888-758-4389,E,Public,24 hours daily,,,2,0,33.772219,-84.365045,23/01/2023,172805,2023-01-23 23:04:06 UTC,27/01/2021,J1772,
ELEC,PONCE CITY MKT LOWER LEVEL A,675 Ponce De Leon Ave NE,,ATLANTA,GA,30308,888-758-4389,E,Public,24 hours daily,,,2,0,33.773022,-84.366601,23/01/2023,172806,2023-01-23 23:04:06 UTC,27/01/2021,J1772,
ELEC,PIEDMONT TRIAD MEBANE NORTH,3940 Arrowhead Blvd,,Mebane,NC,27302,888-758-4389,T,TEMPORARILY UNAVAILABLE (Public),24 hours daily,,,2,0,36.074817,-79.270022,23/01/2023,172854,2023-01-23 23:07:04 UTC,27/01/2021,J1772,
ELEC,SPECTRUM BLDG B1,300 S Tryon St,,Charlotte,NC,28202,888-758-4389,E,Public,24 hours daily,,,2,0,35.225683,-80.84576,23/01/2023,172905,2023-01-23 23:06:14 UTC,27/01/2021,J1772,
ELEC,SPECTRUM BLDG B2 5,300 S Tryon St,,Charlotte,NC,28202,888-758-4389,E,Public,24 hours daily,,,2,0,35.225686,-80.845775,23/01/2023,172906,2023-01-23 23:06:14 UTC,27/01/2021,J1772,
ELEC,SPECTRUM BLDG B2 3,300 S Tryon St,,Charlotte,NC,28202,888-758-4389,E,Public,24 hours daily,,,2,0,35.225675,-80.845784,23/01/2023,172907,2023-01-23 23:06:14 UTC,27/01/2021,J1772,
ELEC,SPECTRUM BLDG B2 6,300 S Tryon St,,Charlotte,NC,28202,888-758-4389,E,Public,24 hours daily,,,2,0,35.225674,-80.845771,23/01/2023,172908,2023-01-23 23:06:13 UTC,27/01/2021,J1772,
ELEC,SPECTRUM BLDG B2 4,300 S Tryon St,,Charlotte,NC,28202,888-758-4389,E,Public,24 hours daily,,,2,0,35.225671,-80.84576,23/01/2023,172909,2023-01-23 23:06:13 UTC,27/01/2021,J1772,
ELEC,SPECTRUM BLDG B2 2,300 S Tryon St,,Charlotte,NC,28202,888-758-4389,E,Public,24 hours daily,,,2,0,35.225662,-80.845792,23/01/2023,172910,2023-01-23 23:06:13 UTC,27/01/2021,J1772,
ELEC,CLT AIRPORT BUS VALET 01,5601 Wilkinson Blvd,,Charlotte,NC,28208,888-758-4389,E,Public,24 hours daily,,,2,0,35.233524,-80.934585,23/01/2023,173008,2023-01-23 23:08:24 UTC,27/01/2021,J1772,
ELEC,CLT AIRPORT BUS VALET 02,5601 Wilkinson Blvd,,Charlotte,NC,28208,888-758-4389,E,Public,24 hours daily,,,2,0,35.233223,-80.934266,23/01/2023,173009,2023-01-23 23:08:24 UTC,27/01/2021,J1772,
ELEC,CLT AIRPORT BUS. VALET 03,5601 Wilkinson Blvd,,Charlotte,NC,28208,888-758-4389,T,TEMPORARILY UNAVAILABLE (Public),24 hours daily,,,2,0,35.233024,-80.935744,23/01/2023,173010,2023-01-23 23:00:27 UTC,27/01/2021,J1772,
ELEC,CLT AIRPORT BUS. VALET 04,5601 Wilkinson Blvd,,Charlotte,NC,28208,888-758-4389,T,TEMPORARILY UNAVAILABLE (Public),24 hours daily,,,2,0,35.233052,-80.935729,23/01/2023,173011,2023-01-23 23:00:27 UTC,27/01/2021,J1772,
ELEC,CLT AIRPORT BUS. VALET 01,5601 Wilkinson Blvd,,Charlotte,NC,28208,888-758-4389,T,TEMPORARILY UNAVAILABLE (Public),24 hours daily; Drivers must bring their own J1772 cordset for Level 1 charging,,1,1,0,35.232876,-80.935783,23/01/2023,173012,2023-01-23 23:00:24 UTC,27/01/2021,J1772 NEMA515,
ELEC,CLT AIRPORT BUS. VALET 02,5601 Wilkinson Blvd,,Charlotte,NC,28208,888-758-4389,T,TEMPORARILY UNAVAILABLE (Public),24 hours daily; Drivers must bring their own J1772 cordset for Level 1 charging,,1,1,0,35.232903,-80.935783,23/01/2023,173013,2023-01-23 23:00:23 UTC,27/01/2021,J1772 NEMA515,
ELEC,CARTA SAU 1,Hickman Drive,,Collegedale,TN,37363,888-758-4389,T,TEMPORARILY UNAVAILABLE (Public),24 hours daily,,,2,0,35.050429,-85.050782,23/01/2023,173022,2023-01-23 23:04:59 UTC,27/01/2021,J1772,
ELEC,CARTA SAU 3,Hickman Drive,,Collegedale,TN,37363,888-758-4389,E,Public,24 hours daily,,,2,0,35.050278,-85.050435,23/01/2023,173023,2023-01-23 23:04:55 UTC,27/01/2021,J1772,
ELEC,CARTA SAU 2,Hickman Drive,,Collegedale,TN,37363,888-758-4389,T,TEMPORARILY UNAVAILABLE (Public),24 hours daily,,,2,0,35.050722,-85.050665,23/01/2023,173024,2023-01-23 23:04:53 UTC,27/01/2021,J1772,
ELEC,NCR HQ  MIDTOW NCR EV9,864 Spring St NW,,Atlanta,GA,30309,888-758-4389,E,Public,24 hours daily,,,2,0,33.778995,-84.389857,23/01/2023,173073,2023-01-23 23:08:03 UTC,27/01/2021,J1772,
ELEC,NCR HQ  MIDTOW NCR EV1,864 Spring St NW,,Atlanta,GA,30309,888-758-4389,E,Public,24 hours daily,,,2,0,33.778984,-84.389968,23/01/2023,173074,2023-01-23 23:08:02 UTC,27/01/2021,J1772,
ELEC,NCR HQ  MIDTOW NCR EV4,864 Spring St NW,,Atlanta,GA,30309,888-758-4389,E,Public,24 hours daily,,,2,0,33.778986,-84.389926,23/01/2023,173075,2023-01-23 23:08:02 UTC,27/01/2021,J1772,
ELEC,NCR HQ  MIDTOW NCR EV10,864 Spring St NW,,Atlanta,GA,30309,888-758-4389,E,Public,24 hours daily,,,2,0,33.778994,-84.389849,23/01/2023,173076,2023-01-23 23:08:01 UTC,27/01/2021,J1772,
ELEC,NCR HQ  MIDTOW NCR EV2,864 Spring St NW,,Atlanta,GA,30309,888-758-4389,E,Public,24 hours daily,,,2,0,33.778988,-84.38995,23/01/2023,173077,2023-01-23 23:08:01 UTC,27/01/2021,J1772,
ELEC,NCR HQ  MIDTOW NCR EV3,864 Spring St NW,,Atlanta,GA,30309,888-758-4389,E,Public,24 hours daily,,,2,0,33.778987,-84.389935,23/01/2023,173078,2023-01-23 23:08:00 UTC,27/01/2021,J1772,
ELEC,NCR HQ  MIDTOW NCR EV7,864 Spring St NW,,Atlanta,GA,30309,888-758-4389,E,Public,24 hours daily,,,2,0,33.778986,-84.3899,23/01/2023,173079,2023-01-23 23:08:00 UTC,27/01/2021,J1772,
ELEC,NCR HQ  MIDTOW NCR EV8,864 Spring St NW,,Atlanta,GA,30309,888-758-4389,E,Public,24 hours daily,,,2,0,33.778992,-84.389884,23/01/2023,173080,2023-01-23 23:08:00 UTC,27/01/2021,J1772,
ELEC,NCR HQ  MIDTOW NCR EV6,864 Spring St NW,,Atlanta,GA,30309,888-758-4389,E,Public,24 hours daily,,,2,0,33.778985,-84.389909,23/01/2023,173081,2023-01-23 23:08:00 UTC,27/01/2021,J1772,
ELEC,NCR HQ  MIDTOW NCR EV11,864 Spring St NW,,Atlanta,GA,30309,888-758-4389,E,Public,24 hours daily,,,2,0,33.778567,-84.389555,12/01/2023,173082,2023-01-12 23:11:02 UTC,27/01/2021,J1772,
ELEC,NCR HQ  MIDTOW NCR EV5 GW,864 Spring St NW,,Atlanta,GA,30309,888-758-4389,E,Public,24 hours daily,,,2,0,33.778985,-84.389917,23/01/2023,173083,2023-01-23 23:08:15 UTC,27/01/2021,J1772,
ELEC,PTREE MARKETPLC PCM STATION 1,6141 Peachtree Pkwy,,Norcross,GA,30092,888-758-4389,E,Public,24 hours daily,,,2,0,33.951757,-84.235241,23/01/2023,173088,2023-01-23 23:07:32 UTC,27/01/2021,J1772,
ELEC,REVUP1 SOLAR POINT 2,Zoo Pkwy,,Asheboro,NC,27205,888-758-4389,E,Public,24 hours daily,,,2,0,35.627194,-79.766719,23/01/2023,173148,2023-01-23 23:09:20 UTC,27/01/2021,J1772,
ELEC,INN INN 1,597 Barnsley Gardens Rd NW,,Adairsville,GA,30103,888-758-4389,E,Public,24 hours daily,,,2,0,34.302219,-84.983746,23/01/2023,173193,2023-01-23 23:08:55 UTC,27/01/2021,J1772,
ELEC,RIVERWOOD 200 STATION 1,3300 Riverwood Pkwy,,Atlanta,GA,30339,888-758-4389,T,TEMPORARILY UNAVAILABLE (Public),24 hours daily,,,2,0,33.877638,-84.459598,23/01/2023,173229,2023-01-23 23:06:00 UTC,27/01/2021,J1772,
ELEC,DELTA AIR LINES RESERVATIONS #2,700 South Central Ave,,Atlanta,GA,30354,888-758-4389,E,Public,24 hours daily,,,2,0,33.659613,-84.413669,23/01/2023,173255,2023-01-23 23:09:04 UTC,27/01/2021,J1772,
ELEC,DILLON STATION STATION2,223 S West St,,Raleigh,NC,27603,888-758-4389,E,Public,24 hours daily,,,2,0,35.777964,-78.645676,23/01/2023,173315,2023-01-23 23:09:02 UTC,27/01/2021,J1772,
ELEC,PROSCENIUM STATION 2,1170 Crescent Ave NE,,Atlanta,GA,30309,888-758-4389,E,Public,24 hours daily,,,2,0,33.786314,-84.384468,23/01/2023,173320,2023-01-23 23:08:06 UTC,27/01/2021,J1772,
ELEC,CHOA CHOA EV6,1400 Tullie Rd NE,,Atlanta,GA,30329,888-758-4389,E,Public,24 hours daily,,,2,0,33.831271,-84.332533,23/01/2023,173341,2023-01-23 23:09:19 UTC,27/01/2021,J1772,
ELEC,CHOA CHOA EV P3,1400 Tullie Rd NE,,Atlanta,GA,30329,888-758-4389,E,Public,24 hours daily,,,2,0,33.831236,-84.332586,23/01/2023,173342,2023-01-23 23:09:19 UTC,27/01/2021,J1772,
ELEC,DELTA AIR LINES TRAINING CNTR 3,1021 n outer loop rd,,Atlanta,GA,30320,888-758-4389,E,Public,24 hours daily,,,2,0,33.658779,-84.425338,12/01/2023,173371,2023-01-12 23:10:46 UTC,27/01/2021,J1772,
ELEC,DELTA AIR LINES TRAINING CNTR 2,1021 N Outer Loop Rd,,Atlanta,GA,30320,888-758-4389,E,Public,24 hours daily,,,2,0,33.658774,-84.42532,12/01/2023,173372,2023-01-12 23:10:46 UTC,27/01/2021,J1772,
ELEC,DELTA AIR LINES TRAINING CNTR 1,1021 N Outer Loop Rd,,Atlanta,GA,30320,888-758-4389,E,Public,24 hours daily,,,2,0,33.658701,-84.425333,12/01/2023,173373,2023-01-12 23:10:46 UTC,27/01/2021,J1772,
ELEC,DELTA AIR LINES OC3 CHARGER 1,980 Virginia ave,,Hapeville,GA,30354,888-758-4389,E,Public,24 hours daily,,,2,0,33.658024,-84.421291,12/01/2023,173375,2023-01-12 23:10:48 UTC,27/01/2021,J1772,
ELEC,DELTA AIR LINES OC3 CHARGER 3,980 Virginia Ave,,Hapeville,GA,30354,888-758-4389,E,Public,24 hours daily,,,2,0,33.658031,-84.421083,12/01/2023,173376,2023-01-12 23:10:48 UTC,27/01/2021,J1772,
ELEC,BUILDINGB1 EV STATION 02,800 Beaty St,,Davidson,NC,28036,888-758-4389,E,Public,24 hours daily,,,2,0,35.510877,-80.850078,23/01/2023,173377,2023-01-23 23:09:01 UTC,27/01/2021,J1772,
ELEC,BUILDINGB1 EV STATION 01,800 Beaty St,,Davidson,NC,28036,888-758-4389,T,TEMPORARILY UNAVAILABLE (Public),24 hours daily,,,2,0,35.510886,-80.850027,23/01/2023,173378,2023-01-23 23:09:01 UTC,27/01/2021,J1772,
ELEC,BEACON STATION 1,1035 Grant St SE,,Atlanta,GA,30315,888-758-4389,E,Public,24 hours daily,,,2,0,33.72602,-84.377529,12/01/2023,173389,2023-01-12 23:10:44 UTC,27/01/2021,J1772,
ELEC,DELTA AIR LINES INTERNATIONAL 1,1600 M H Jackson Service Rd,,Atlanta,GA,30320,888-758-4389,E,Public,24 hours daily,,,2,0,33.640373,-84.409604,12/01/2023,173397,2023-01-12 23:10:46 UTC,27/01/2021,J1772,
ELEC,SANDY SPRINGSEV CITY SPRINGS 2,1 Galambos Way,,Sandy Springs,GA,30328,888-758-4389,E,Public,24 hours daily,,,2,0,33.924714,-84.380431,23/01/2023,173423,2023-01-23 23:09:14 UTC,27/01/2021,J1772,
ELEC,JLR NASHVILLE DC FAST 01,3 Cadillac Dr,,Brentwood,TN,37027,888-758-4389,E,Public,24 hours daily,,,,1,36.036629,-86.797047,23/01/2023,173438,2023-01-23 23:08:43 UTC,27/01/2021,J1772COMBO,
ELEC,JLR NASHVILLE DC FAST 02,3 Cadillac Dr,,Brentwood,TN,37027,888-758-4389,E,Public,24 hours daily,,,,1,36.036425,-86.797454,23/01/2023,173439,2023-01-23 23:08:43 UTC,27/01/2021,J1772COMBO,
ELEC,NCR HQ  MIDTOW NCR EV 18,858 Spring St NW,,Atlanta,GA,30308,888-758-4389,E,Public,24 hours daily,,,2,0,33.778533,-84.38949,12/01/2023,173454,2023-01-12 23:11:02 UTC,27/01/2021,J1772,
ELEC,NCR HQ  MIDTOW NCR EV 17,858 Spring St NW,,Atlanta,GA,30308,888-758-4389,E,Public,24 hours daily,,,2,0,33.778573,-84.389292,12/01/2023,173455,2023-01-12 23:11:02 UTC,27/01/2021,J1772,
ELEC,NCR HQ  MIDTOW NCR EV 16,858 Spring St NW,,Atlanta,GA,30308,888-758-4389,E,Public,24 hours daily,,,2,0,33.778609,-84.389374,12/01/2023,173456,2023-01-12 23:11:02 UTC,27/01/2021,J1772,
ELEC,NCR HQ  MIDTOW NCR EV 15,858 Spring St NW,,Atlanta,GA,30308,888-758-4389,E,Public,24 hours daily,,,2,0,33.778538,-84.389464,12/01/2023,173457,2023-01-12 23:11:02 UTC,27/01/2021,J1772,
ELEC,NCR HQ  MIDTOW NCR EV 14,858 Spring St NW,,Atlanta,GA,30308,888-758-4389,E,Public,24 hours daily,,,2,0,33.77853,-84.389331,12/01/2023,173458,2023-01-12 23:11:02 UTC,27/01/2021,J1772,
ELEC,NCR HQ  MIDTOW NCR EV 12,858 Spring St NW,,Atlanta,GA,30308,888-758-4389,E,Public,24 hours daily,,,2,0,33.77857,-84.389489,12/01/2023,173459,2023-01-12 23:11:02 UTC,27/01/2021,J1772,
ELEC,NCR HQ  MIDTOW NCR EV 20,858 Spring St NW,,Atlanta,GA,30308,888-758-4389,E,Public,24 hours daily,,,2,0,33.778552,-84.389264,12/01/2023,173460,2023-01-12 23:11:02 UTC,27/01/2021,J1772,
ELEC,HIGHWOODS RTP 751 CORP EV 2,751 Corporate Center Drive,,Raleigh,NC,27607,888-758-4389,E,Public,24 hours daily,,,2,0,35.793383,-78.742278,23/01/2023,173468,2023-01-23 23:08:07 UTC,27/01/2021,J1772,
ELEC,FLOWJLR SERVICE 1,1205 Bridford Pkwy,,Greensboro,NC,27407,888-758-4389,E,Public,24 hours daily,,,2,0,36.058998,-79.90228,12/01/2023,173529,2023-01-12 23:10:29 UTC,27/01/2021,J1772,
ELEC,FLOWJLR DC FAST 02,1205 Bridford Pkwy,,Greensboro,NC,27407,888-758-4389,E,Public,24 hours daily,,,,1,36.059876,-79.902581,23/01/2023,173530,2023-01-23 23:08:54 UTC,27/01/2021,J1772COMBO,
ELEC,FLOWJLR DC FAST 01,1205 Bridford Pkwy,,Greensboro,NC,27407,888-758-4389,T,TEMPORARILY UNAVAILABLE (Public),24 hours daily,,,,1,36.059912,-79.902591,23/01/2023,173531,2023-01-23 23:08:46 UTC,27/01/2021,J1772COMBO,
ELEC,FLOWJLR SHOP 03,1205 Bridford Pkwy,,Greensboro,NC,27407,888-758-4389,T,TEMPORARILY UNAVAILABLE (Public),24 hours daily,,,1,0,36.059798,-79.902506,12/01/2023,173532,2023-01-12 23:10:44 UTC,27/01/2021,J1772,
ELEC,FLOWJLR SHOP 02,1205 Bridford Pkwy,,Greensboro,NC,27407,888-758-4389,T,TEMPORARILY UNAVAILABLE (Public),24 hours daily,,,1,0,36.05985,-79.902603,12/01/2023,173533,2023-01-12 23:10:44 UTC,27/01/2021,J1772,
ELEC,GEORGIA POWER CANTON L2,4045 Marietta Hwy,,Canton,GA,30114,888-758-4389,E,Public,24 hours daily,,,2,0,34.192986,-84.506653,23/01/2023,173538,2023-01-23 23:03:55 UTC,27/01/2021,J1772,
ELEC,PARK CENTRAL PC STATION 1,200 Park at N Hills St,,Raleigh,NC,27609,888-758-4389,T,TEMPORARILY UNAVAILABLE (Public),24 hours daily,,,2,0,35.835779,-78.637277,23/01/2023,173582,2023-01-23 23:09:19 UTC,27/01/2021,J1772,
ELEC,CDC ROEV01,1600 Clifton Rd,,Atlanta,GA,30329,888-758-4389,E,Public,24 hours daily,,,1,0,33.798834,-84.327526,23/01/2023,173583,2023-01-23 23:01:06 UTC,27/01/2021,J1772,
ELEC,CDC ROEV02,1600 Clifton Rd,,Atlanta,GA,30329,888-758-4389,E,Public,Mon 7:00am - 3:00pm; Tue 7:00am - 3:00pm; Wed 7:00am - 3:00pm; Thu 7:00am - 3:00pm; Fri 7:00am - 3:00pm,,,1,0,33.798829,-84.327453,23/01/2023,173584,2023-01-23 23:01:06 UTC,27/01/2021,J1772,
ELEC,DELTA AIR LINES MIDFIELD #2,1000 Toffie Terrace,,Atlanta,GA,30354,888-758-4389,T,TEMPORARILY UNAVAILABLE (Public),24 hours daily,,,2,0,33.653077,-84.430127,12/01/2023,173615,2023-01-12 23:11:35 UTC,27/01/2021,J1772,
ELEC,DELTA AIR LINES MIDFIELD #3,1000 Toffie Terrace,,Atlanta,GA,30354,888-758-4389,T,TEMPORARILY UNAVAILABLE (Public),24 hours daily,,,2,0,33.653128,-84.430123,12/01/2023,173616,2023-01-12 23:11:35 UTC,27/01/2021,J1772,
ELEC,CHOA SCOTTISH RITE 2,5455 Meridian Mark Rd,,Sandy Springs,GA,30342,888-758-4389,E,Public,24 hours daily,,,2,0,33.904699,-84.354465,12/01/2023,173633,2023-01-12 23:11:38 UTC,27/01/2021,J1772,
ELEC,CHOA EGLESTON 2,2015 Uppergate Dr,,Atlanta,GA,30322,888-758-4389,E,Public,24 hours daily,,,2,0,33.793587,-84.318856,12/01/2023,173634,2023-01-12 23:11:38 UTC,27/01/2021,J1772,
ELEC,TERM GARAGE 2 MNAA PARK GAR 1,Nashville,,Nashville,TN,37214,888-758-4389,E,Public,24 hours daily,,,2,0,36.130546,-86.667234,12/01/2023,173640,2023-01-12 23:11:26 UTC,27/01/2021,J1772,
ELEC,TERM GARAGE 2 MNAA PARK GAR 4,Nashville,,Nashville,TN,37214,888-758-4389,E,Public,24 hours daily,,,2,0,36.130508,-86.667146,12/01/2023,173641,2023-01-12 23:11:26 UTC,27/01/2021,J1772,
ELEC,METRO NASHVILLE 1-2,610 Murfreesboro Pike,,Nashville,TN,37210,888-758-4389,E,Public,24 hours daily,,,2,0,36.142237,-86.739507,12/01/2023,173676,2023-01-12 23:10:38 UTC,27/01/2021,J1772,
ELEC,METRO NASHVILLE 2-2,610 Murfreesboro Pike,,Nashville,TN,37210,888-758-4389,E,Public,24 hours daily,,,2,0,36.1422,-86.739328,12/01/2023,173677,2023-01-12 23:10:38 UTC,27/01/2021,J1772,
ELEC,METRO NASHVILLE 1-3,610 Murfreesboro Pike,,Nashville,TN,37210,888-758-4389,E,Public,24 hours daily,,,2,0,36.142266,-86.739534,12/01/2023,173678,2023-01-12 23:10:38 UTC,27/01/2021,J1772,
ELEC,ORANGE STATIONS NORTHSIDE EV1P1,1110 West Peachtree Street Northwest,,Atlanta,GA,30309,888-758-4389,T,TEMPORARILY UNAVAILABLE (Public),24 hours daily,,,2,0,33.785096,-84.388232,23/01/2023,173699,2023-01-23 23:09:39 UTC,27/01/2021,J1772,
ELEC,ORANGE STATIONS NORTHSIDE EV1P2,1110 West Peachtree Street Northwest,,Atlanta,GA,30309,888-758-4389,E,Public,24 hours daily,,,2,0,33.785085,-84.388215,23/01/2023,173700,2023-01-23 23:09:29 UTC,27/01/2021,J1772,
ELEC,HONDASOUTHPOINT SHOP01,1001 Southpoint Autopark Blvd,,Durham,NC,27713,888-758-4389,T,TEMPORARILY UNAVAILABLE (Public),24 hours daily,,,1,0,35.90736,-78.954091,12/01/2023,173706,2023-01-12 23:11:34 UTC,27/01/2021,J1772,
ELEC,GPH SHOP01,3325 Satellite Blvd,,Duluth,GA,30096,888-758-4389,E,Public,24 hours daily,,,1,0,33.96507,-84.12461,12/01/2023,173711,2023-01-12 23:12:01 UTC,27/01/2021,J1772,
ELEC,WHOLE FOODS MKT CHARLOTTE 02,6610 Fairview Rd,,Charlotte,NC,28210,888-758-4389,E,Public,24 hours daily,,,2,0,35.147649,-80.82956,12/01/2023,173716,2023-01-12 23:12:02 UTC,27/01/2021,J1772,
ELEC,8K PARKING DECK STATION 2,8000 Avalon Boulevard,,Alpharetta,GA,30009,888-758-4389,E,Public,24 hours daily,,,2,0,34.070498,-84.274215,12/01/2023,173718,2023-01-12 23:12:00 UTC,27/01/2021,J1772,
ELEC,8K PARKING DECK STATION 1,8000 Avalon Boulevard,,Alpharetta,GA,30009,888-758-4389,E,Public,24 hours daily,,,2,0,34.070416,-84.274215,12/01/2023,173719,2023-01-12 23:12:00 UTC,27/01/2021,J1772,
ELEC,WHOLE FOODS MKT RALEIGH NRL 2,8710 Six Forks Rd,,Raleigh,NC,27615,888-758-4389,E,Public,24 hours daily,,,2,0,35.8994,-78.64995,12/01/2023,173720,2023-01-12 23:12:03 UTC,27/01/2021,J1772,
ELEC,HIGHWOODS RTP CENTREGREEN 3,5000 Centregreen Way,,Cary,NC,27513,888-758-4389,T,TEMPORARILY UNAVAILABLE (Public),24 hours daily,,,2,0,35.826449,-78.794705,12/01/2023,173723,2023-01-12 23:11:43 UTC,27/01/2021,J1772,
ELEC,HIGHWOODS RTP CENTREGREEN 2,5000 Centregreen Way,,Cary,NC,27513,888-758-4389,T,TEMPORARILY UNAVAILABLE (Public),24 hours daily,,,2,0,35.826509,-78.794769,12/01/2023,173724,2023-01-12 23:11:43 UTC,27/01/2021,J1772,
ELEC,HENDRICK SBLVD SERVICE 1,8901 South Blvd,,Charlotte,NC,28273,888-758-4389,E,Public,24 hours daily,,,1,0,35.116214,-80.881659,12/01/2023,173741,2023-01-12 23:11:57 UTC,27/01/2021,J1772,
ELEC,SIMON LENOX SQUARE 4,3399 Peachtree Rd NE,,Atlanta,GA,30326,888-758-4389,E,Public,24 hours daily,,,1,0,33.845021,-84.361464,12/01/2023,173745,2023-01-12 23:12:07 UTC,27/01/2021,J1772,
ELEC,SIMON LENOX SQUARE 5,3399 Peachtree Rd NE,,Atlanta,GA,30326,888-758-4389,E,Public,24 hours daily,,,1,0,33.844985,-84.361448,12/01/2023,173746,2023-01-12 23:12:07 UTC,27/01/2021,J1772,
ELEC,SIMON LENOX SQUARE 1,3399 Peachtree Rd NE,,Atlanta,GA,30326,888-758-4389,E,Public,24 hours daily,,,1,0,33.845067,-84.361498,12/01/2023,173747,2023-01-12 23:12:07 UTC,27/01/2021,J1772,
ELEC,SIMON LENOX SQUARE 2,3399 Peachtree Rd NE,,Atlanta,GA,30326,888-758-4389,E,Public,24 hours daily,,,1,0,33.845071,-84.361497,12/01/2023,173748,2023-01-12 23:12:07 UTC,27/01/2021,J1772,
ELEC,OLD FOURTH WARD SINGLE PORT,608 Ralph McGill Blvd NE,,Atlanta,GA,30312,888-758-4389,T,TEMPORARILY UNAVAILABLE (Public),24 hours daily,,,1,0,33.764451,-84.367074,23/01/2023,173767,2023-01-23 23:06:21 UTC,27/01/2021,J1772,
ELEC,AUTONATIONHONDA SHOP01,1979 Thornton Rd,,Lithia Springs,GA,30122,888-758-4389,E,Public,24 hours daily,,,1,0,33.785996,-84.61182,12/01/2023,173768,2023-01-12 23:12:11 UTC,27/01/2021,J1772,
ELEC,METRO NASHVILLE SE LIBRARY 1,5264 Hickory Hollow Pl,,Nashville,TN,37013,888-758-4389,E,Public,24 hours daily,,,1,0,36.052518,-86.65697,12/01/2023,173779,2023-01-12 23:12:11 UTC,27/01/2021,J1772,
ELEC,METRO NASHVILLE HCH GARAGE 1,101 James Robertson Pkwy,,Nashville,TN,37201,888-758-4389,E,Public,24 hours daily,,,2,0,36.16733,-86.777483,12/01/2023,173786,2023-01-12 23:12:32 UTC,27/01/2021,J1772,
ELEC,RALEIGH STATION SHOP 02,4005 Capital Hills Dr,,Raleigh,NC,27616,888-758-4389,T,TEMPORARILY UNAVAILABLE (Public),24 hours daily,,,1,0,35.887772,-78.568741,12/01/2023,173848,2023-01-12 23:12:28 UTC,27/01/2021,J1772,
ELEC,RALEIGH STATION SHOP 01,4005 Capital Hills Dr,,Raleigh,NC,27616,888-758-4389,T,TEMPORARILY UNAVAILABLE (Public),24 hours daily,,,1,0,35.887789,-78.568955,12/01/2023,173849,2023-01-12 23:12:28 UTC,27/01/2021,J1772,
ELEC,RALEIGH STATION STATION 01,4005 Capital Hills Dr,,Raleigh,NC,27616,888-758-4389,T,TEMPORARILY UNAVAILABLE (Public),24 hours daily,,,2,0,35.887893,-78.568977,12/01/2023,173852,2023-01-12 23:12:12 UTC,27/01/2021,J1772,
ELEC,HENDRICKCONCORD SHOP01,7650 Bruton Smith Blvd,,Concord,NC,28027,888-758-4389,E,Public,24 hours daily,,,1,0,35.364568,-80.704816,12/01/2023,173868,2023-01-12 23:12:12 UTC,27/01/2021,J1772,
ELEC,DEWBERRY GROUP PEACHTREE 01,1555 Peachtree St NW,,Atlanta,GA,30309,888-758-4389,E,Public,24 hours daily,,,2,0,33.797832,-84.387945,12/01/2023,173909,2023-01-12 23:12:33 UTC,27/01/2021,J1772,
ELEC,WHOLE FOODS MKT ATLANTA 3,22 14th St NW,,Atlanta,GA,30309,888-758-4389,T,TEMPORARILY UNAVAILABLE (Public),24 hours daily,,,1,0,33.785992,-84.388722,12/01/2023,173934,2023-01-12 23:12:41 UTC,27/01/2021,J1772,
ELEC,WHOLE FOODS MKT ATLANTA 2,22 14th St NW,,Atlanta,GA,30309,888-758-4389,E,Public,24 hours daily,,,1,0,33.785936,-84.388633,12/01/2023,173935,2023-01-12 23:12:41 UTC,27/01/2021,J1772,
ELEC,WHOLE FOODS MKT ATLANTA 1,22 14th St NW,,Atlanta,GA,30309,888-758-4389,T,TEMPORARILY UNAVAILABLE (Public),24 hours daily,,,2,0,33.786068,-84.388647,12/01/2023,173936,2023-01-12 23:12:41 UTC,27/01/2021,J1772,
ELEC,PORTMAN CODA CODA TECH NGW 3,771 Spring St NW,,Atlanta,GA,30308,888-758-4389,E,Public,24 hours daily,,,2,0,33.775618,-84.388415,23/01/2023,173987,2023-01-23 23:07:28 UTC,27/01/2021,J1772,
ELEC,PORTMAN CODA CODA TECH NGW 2,756 W. Peachtree Street,,Atlanta,GA,30308,888-758-4389,E,Public,24 hours daily,,,2,0,33.775687,-84.38837,23/01/2023,173988,2023-01-23 23:07:26 UTC,27/01/2021,J1772,
ELEC,DELTA AIR LINES A2 CHARGER #9,3450 Main St,,Atlanta,GA,30337,888-758-4389,E,Public,24 hours daily,,,2,0,33.657654,-84.42171,12/01/2023,174000,2023-01-12 23:13:05 UTC,27/01/2021,J1772,
ELEC,DELTA AIR LINES A2 CHARGER #5,N Inner Loop Rd,,Hapeville,GA,30354,888-758-4389,T,TEMPORARILY UNAVAILABLE (Public),24 hours daily,,,2,0,33.657721,-84.42103,12/01/2023,174002,2023-01-12 23:13:05 UTC,27/01/2021,J1772,
ELEC,DELTA AIR LINES A2 CHARGER #4,N Inner Loop Rd,,Hapeville,GA,30354,888-758-4389,E,Public,24 hours daily,,,2,0,33.657681,-84.421077,12/01/2023,174003,2023-01-12 23:13:04 UTC,27/01/2021,J1772,
ELEC,DELTA AIR LINES A2 CHARGER #1,N Inner Loop Rd,,Hapeville,GA,30354,888-758-4389,E,Public,24 hours daily,,,2,0,33.657645,-84.420498,12/01/2023,174004,2023-01-12 23:13:04 UTC,27/01/2021,J1772,
ELEC,DELTA AIR LINES A2 CHARGER #2,N Inner Loop Rd,,Hapeville,GA,30354,888-758-4389,E,Public,24 hours daily,,,2,0,33.657735,-84.420794,12/01/2023,174005,2023-01-12 23:13:04 UTC,27/01/2021,J1772,
ELEC,DELTA AIR LINES A2 CHARGER #3,N Inner Loop Rd,,Hapeville,GA,30354,888-758-4389,E,Public,24 hours daily,,,2,0,33.657762,-84.420826,12/01/2023,174006,2023-01-12 23:13:04 UTC,27/01/2021,J1772,
ELEC,DELTA AIR LINES A2 CHARGER #8,N Inner Loop Rd,,Hapeville,GA,30354,888-758-4389,E,Public,24 hours daily,,,2,0,33.657731,-84.421346,12/01/2023,174007,2023-01-12 23:13:04 UTC,27/01/2021,J1772,
ELEC,DELTA AIR LINES DELTA FP 1,3980 Tradeport Blvd,,Atlanta,GA,30354,888-758-4389,E,Public,24 hours daily,,,2,0,33.645842,-84.392846,12/01/2023,174017,2023-01-12 23:13:07 UTC,27/01/2021,J1772,
ELEC,CITY-BROOKHAVEN CITY HALL 2,4362 Peachtree Rd,,Brookhaven,GA,30319,888-758-4389,T,TEMPORARILY UNAVAILABLE (Public),24 hours daily,,,2,0,33.870761,-84.333946,12/01/2023,174122,2023-01-12 23:13:28 UTC,27/01/2021,J1772,
ELEC,CROWN HONDA SHOP 01,3633 W Wendover Ave,,Greensboro,NC,27407,888-758-4389,E,Public,24 hours daily,,,1,0,36.05918,-79.869536,12/01/2023,174133,2023-01-12 23:13:31 UTC,27/01/2021,J1772,
ELEC,WHOLE FOODS MKT HUNTERSVILLE 1,9129 Sam Furr Rd,,Huntersville,NC,28078,888-758-4389,E,Public,24 hours daily,,,1,0,35.443649,-80.871523,12/01/2023,174222,2023-01-12 23:13:58 UTC,27/01/2021,J1772,
ELEC,TERM GARAGE 2 MNAA FAST DC 3,1 Terminal Dr,,Nashville,TN,37214,888-758-4389,T,TEMPORARILY UNAVAILABLE (Public),24 hours daily,,,,1,36.131546,-86.669254,12/01/2023,174248,2023-01-12 23:13:52 UTC,27/01/2021,CHADEMO,
ELEC,TERM GARAGE 2 MNAA DC FAST 2,1 Terminal Dr,,Nashville,TN,37214,888-758-4389,E,Public,24 hours daily,,,,1,36.131455,-86.669214,12/01/2023,174249,2023-01-12 23:13:52 UTC,27/01/2021,J1772COMBO,
ELEC,TERM GARAGE 2 MNAA DC FAST 1,1 Terminal Dr,,Nashville,TN,37214,888-758-4389,E,Public,24 hours daily,,,,1,36.13149,-86.669235,12/01/2023,174250,2023-01-12 23:13:52 UTC,27/01/2021,J1772COMBO,
ELEC,AT THE HILL STATION 2,1160 Johnson Ferry Rd NE,,Sandy Springs,GA,30342,888-758-4389,T,TEMPORARILY UNAVAILABLE (Public),24 hours daily,,,2,0,33.9051,-84.34905,12/01/2023,174325,2023-01-12 23:11:57 UTC,27/01/2021,J1772,
ELEC,AT THE HILL STATION 1,1160 Johnson Ferry Rd NE,,Sandy Springs,GA,30342,888-758-4389,E,Public,24 hours daily,,,2,0,33.90511,-84.34905,12/01/2023,174326,2023-01-12 23:12:14 UTC,27/01/2021,J1772,
ELEC,MODERN TOYOTA STATION 1,3178 Peters Creek Pkwy,,Winston-Salem,NC,27127,888-758-4389,E,Public,24 hours daily,,,1,0,36.045764,-80.261733,12/01/2023,174335,2023-01-12 23:12:34 UTC,27/01/2021,J1772,
ELEC,GOOGLE ATL-LCD1000-03,1000 Logistics Center Dr,,Fairburn,GA,30213,888-758-4389,E,Public,24 hours daily,,,2,0,33.542018,-84.598032,12/01/2023,174357,2023-01-12 23:14:01 UTC,27/01/2021,J1772,
ELEC,BLOWING ROCK BROCKOUTLET1,278 Shoppes on the Parkway Rd,,Blowing Rock,NC,28605,888-758-4389,E,Public,24 hours daily,,,2,0,36.140019,-81.670725,12/01/2023,174407,2023-01-12 23:14:21 UTC,27/01/2021,J1772,
ELEC,RIVERWALK APTS STATION 3,140 E Blount Ave,,Knoxville,TN,37920,888-758-4389,T,TEMPORARILY UNAVAILABLE (Public),24 hours daily,,,2,0,35.955338,-83.914653,23/01/2023,174420,2023-01-23 23:08:15 UTC,27/01/2021,J1772,
ELEC,RIVERWALK APTS STATION 2,211 E Blount Ave,,Knoxville,TN,37920,888-758-4389,T,TEMPORARILY UNAVAILABLE (Public),24 hours daily,,,2,0,35.955175,-83.916048,23/01/2023,174421,2023-01-23 23:08:15 UTC,27/01/2021,J1772,
ELEC,720 GARAGE STATION 04,621 S Poplar St,,Charlotte,NC,28202,888-758-4389,E,Public,24 hours daily,,,1,0,35.223935,-80.850547,12/01/2023,174435,2023-01-12 23:14:06 UTC,27/01/2021,J1772,
ELEC,720 GARAGE STATION 02,720 S Church St,,Charlotte,NC,28202,888-758-4389,E,Public,24 hours daily,,,2,0,35.223813,-80.850877,12/01/2023,174436,2023-01-12 23:14:06 UTC,27/01/2021,J1772,
ELEC,COC CORNING OPT 3,4200 Corning Pl,,Charlotte,NC,28216,888-758-4389,E,Public,24 hours daily,,,2,0,35.330548,-80.93871,12/01/2023,174539,2023-01-12 23:15:07 UTC,27/01/2021,J1772,
ELEC,COC CORNING OPT 2,4200 Corning Pl,,Charlotte,NC,28216,888-758-4389,E,Public,24 hours daily,,,2,0,35.330545,-80.938684,12/01/2023,174540,2023-01-12 23:15:07 UTC,27/01/2021,J1772,
ELEC,COC CORNING OPT 1,4200 Corning Pl,,Charlotte,NC,28216,888-758-4389,E,Public,24 hours daily,,,2,0,35.330536,-80.93863,12/01/2023,174541,2023-01-12 23:15:07 UTC,27/01/2021,J1772,
ELEC,METRO NASHVILLE BELLEVUE ICE 1,7638 US-70S,,Nashville,TN,37221,888-758-4389,E,Public,24 hours daily,,,2,0,36.080823,-86.95075,12/01/2023,174555,2023-01-12 23:15:01 UTC,27/01/2021,J1772,
ELEC,METRO NASHVILLE BELLEVUE ICE 2,7638 US-70S,,Nashville,TN,37221,888-758-4389,E,Public,24 hours daily,,,2,0,36.080902,-86.950746,12/01/2023,174556,2023-01-12 23:15:01 UTC,27/01/2021,J1772,
ELEC,TOWN OF CARY DT DECK P3 WEST,113 Walnut St,,Cary,NC,27511,888-758-4389,E,Public,24 hours daily,,,2,0,35.785283,-78.779283,12/01/2023,174577,2023-01-12 23:15:09 UTC,27/01/2021,J1772,
ELEC,TOWN OF CARY DT DECK P2 (1),113 Walnut St,,Cary,NC,27511,888-758-4389,T,TEMPORARILY UNAVAILABLE (Public),24 hours daily,,,2,0,35.785448,-78.779412,12/01/2023,174578,2023-01-12 23:15:09 UTC,27/01/2021,J1772,
ELEC,TOWN OF CARY DT DECK P6,113 Walnut St,,Cary,NC,27511,888-758-4389,E,Public,24 hours daily,,,2,0,35.785228,-78.779495,12/01/2023,174579,2023-01-12 23:14:38 UTC,27/01/2021,J1772,
ELEC,TOWN OF CARY DT DECK P4,113 Walnut St,,Cary,NC,27511,888-758-4389,T,TEMPORARILY UNAVAILABLE (Public),24 hours daily,,,2,0,35.783205,-78.779366,12/01/2023,174580,2023-01-12 23:14:38 UTC,27/01/2021,J1772,
ELEC,TOWN OF CARY DT DECK P3 EAST,113 Walnut St,,Cary,NC,27511,888-758-4389,E,Public,24 hours daily,,,2,0,35.783205,-78.77927,12/01/2023,174581,2023-01-12 23:14:37 UTC,27/01/2021,J1772,
ELEC,TOWN OF CARY DT DECK P2 (2),113 Walnut St,,Cary,NC,27511,888-758-4389,E,Public,24 hours daily,,,2,0,35.785387,-78.779701,12/01/2023,174582,2023-01-12 23:14:37 UTC,27/01/2021,J1772,
ELEC,GA TECH W22 #2,925 Dalney Street NW,,Atlanta,GA,30318,888-758-4389,E,Public,24 hours daily,,,2,0,33.779885,-84.400666,12/01/2023,174592,2023-01-12 23:14:25 UTC,27/01/2021,J1772,
ELEC,GA TECH W22 #4,925 Dalney Street NW,,Atlanta,GA,30318,888-758-4389,E,Public,24 hours daily,,,2,0,33.779886,-84.400791,12/01/2023,174593,2023-01-12 23:14:25 UTC,27/01/2021,J1772,
ELEC,GA TECH W22 #8,925 Dalney Street NW,,Atlanta,GA,30318,888-758-4389,E,Public,24 hours daily,,,2,0,33.779887,-84.400812,12/01/2023,174594,2023-01-12 23:14:25 UTC,27/01/2021,J1772,
ELEC,GA TECH W22 #7,925 Dalney Street NW,,Atlanta,GA,30318,888-758-4389,E,Public,24 hours daily,,,2,0,33.779887,-84.400778,12/01/2023,174595,2023-01-12 23:14:25 UTC,27/01/2021,J1772,
ELEC,GA TECH W22 #5,925 Dalney Street NW,,Atlanta,GA,30318,888-758-4389,E,Public,24 hours daily,,,2,0,33.779871,-84.400726,12/01/2023,174596,2023-01-12 23:14:25 UTC,27/01/2021,J1772,
ELEC,GA TECH W22 #9,925 Dalney Street NW,,Atlanta,GA,30318,888-758-4389,E,Public,24 hours daily,,,2,0,33.779882,-84.400617,12/01/2023,174597,2023-01-12 23:14:25 UTC,27/01/2021,J1772,
ELEC,GA TECH W22 #3,925 Dalney Street NW,,Atlanta,GA,30318,888-758-4389,E,Public,24 hours daily,,,2,0,33.779885,-84.400727,12/01/2023,174598,2023-01-12 23:13:59 UTC,27/01/2021,J1772,
ELEC,GA TECH W22 #6,925 Dalney Street NW,,Atlanta,GA,30318,888-758-4389,E,Public,24 hours daily,,,2,0,33.779884,-84.400699,12/01/2023,174599,2023-01-12 23:13:59 UTC,27/01/2021,J1772,
ELEC,GA TECH W22 #10,925 Dalney Street NW,,Atlanta,GA,30318,888-758-4389,E,Public,24 hours daily,,,2,0,33.779885,-84.400731,12/01/2023,174600,2023-01-12 23:13:59 UTC,27/01/2021,J1772,
ELEC,GSD STATION 3,Unnamed Road,,Duluth,GA,30097,888-758-4389,E,Public,24 hours daily,,,2,0,33.989132,-84.091549,12/01/2023,174821,2023-01-12 23:14:30 UTC,27/01/2021,J1772,
ELEC,GSD STATION 5,Unnamed Road,,Duluth,GA,30097,888-758-4389,E,Public,24 hours daily,,,2,0,33.989079,-84.092257,12/01/2023,174822,2023-01-12 23:14:29 UTC,27/01/2021,J1772,
ELEC,GSD STATION 6,Unnamed Road,,Duluth,GA,30097,888-758-4389,E,Public,24 hours daily,,,2,0,33.989079,-84.092075,12/01/2023,174823,2023-01-12 23:14:29 UTC,27/01/2021,J1772,
ELEC,GSD STATION 2,Unnamed Road,,Duluth,GA,30097,888-758-4389,E,Public,24 hours daily,,,2,0,33.98897,-84.091789,12/01/2023,174824,2023-01-12 23:14:29 UTC,27/01/2021,J1772,
ELEC,CHOA SUP CHARGER 06,1911 Cliff Valley Way NE,,Atlanta,GA,30329,888-758-4389,E,Public,24 hours daily,,,2,0,33.835736,-84.32525,12/01/2023,174894,2023-01-12 23:16:22 UTC,27/01/2021,J1772,
ELEC,CHOA SUP CHARGER 03,1911 Cliff Valley Way NE,,Atlanta,GA,30329,888-758-4389,E,Public,24 hours daily,,,2,0,33.835655,-84.325215,12/01/2023,174895,2023-01-12 23:16:22 UTC,27/01/2021,J1772,
ELEC,CHOA SUP CHARGER 02,1911 Cliff Valley Way NE,,Atlanta,GA,30329,888-758-4389,E,Public,24 hours daily,,,2,0,33.835711,-84.325228,12/01/2023,174896,2023-01-12 23:16:22 UTC,27/01/2021,J1772,
ELEC,CHOA SUP CHARGER 04,1911 Cliff Valley Way NE,,Atlanta,GA,30329,888-758-4389,E,Public,24 hours daily,,,2,0,33.835745,-84.325255,12/01/2023,174897,2023-01-12 23:16:22 UTC,27/01/2021,J1772,
ELEC,CHOA SUP CHARGER 05,1911 Cliff Valley Way NE,,Atlanta,GA,30329,888-758-4389,E,Public,24 hours daily,,,2,0,33.835629,-84.325306,12/01/2023,174898,2023-01-12 23:16:22 UTC,27/01/2021,J1772,
ELEC,MARTA KENSINGTON L2 2,3350 Kensington Rd,,Decatur,GA,30032,888-758-4389,E,Public,24 hours daily,,,2,0,33.771882,-84.252859,12/01/2023,174903,2023-01-12 23:16:26 UTC,27/01/2021,J1772,
ELEC,MARTA KENSINGTON L2 1,3350 Kensington Rd,,Decatur,GA,30032,888-758-4389,E,Public,24 hours daily,,,2,0,33.77187,-84.252721,12/01/2023,174904,2023-01-12 23:16:26 UTC,27/01/2021,J1772,
ELEC,PEMBROKE HQ CP1,8344 Fayetteville Rd,,Raeford,NC,28376,888-758-4389,E,Public,24 hours daily,,,2,0,35.031242,-79.11927,12/01/2023,174909,2023-01-12 23:16:28 UTC,27/01/2021,J1772,
ELEC,LEGACY AFC STATION 2,3353 Peachtree Rd NE,,Atlanta,GA,30326,888-758-4389,E,Public,24 hours daily,,,2,0,33.847361,-84.366858,12/01/2023,174916,2023-01-12 23:16:23 UTC,27/01/2021,J1772,
ELEC,LEGACY AFC STATION 1,3353 Peachtree Rd NE,,Atlanta,GA,30326,888-758-4389,E,Public,24 hours daily,,,2,0,33.847512,-84.366836,12/01/2023,174917,2023-01-12 23:16:23 UTC,27/01/2021,J1772,
ELEC,MARTA HE HOLMES L2 3,Hamilton E. Holmes Station Bus Bay,,Atlanta,GA,30311,888-758-4389,E,Public,24 hours daily,,,2,0,33.753636,-84.469482,12/01/2023,174945,2023-01-12 23:16:33 UTC,27/01/2021,J1772,
ELEC,MARTA HE HOLMES L2 2,Hamilton E. Holmes Station Bus Bay,,Atlanta,GA,30311,888-758-4389,E,Public,24 hours daily,,,2,0,33.753721,-84.469455,12/01/2023,174946,2023-01-12 23:16:33 UTC,27/01/2021,J1772,
ELEC,NC STATE PARTNERS WY DCK,Partners Way,,Raleigh,NC,27606,888-758-4389,E,Public,24 hours daily,,,2,0,35.773777,-78.674447,23/01/2023,174951,2023-01-23 23:05:12 UTC,27/01/2021,J1772,
ELEC,MARTA LINDBERGH L2 1,Sidney Marcus Blvd NE,,Atlanta,GA,30324,888-758-4389,E,Public,24 hours daily,,,2,0,33.825883,-84.369126,12/01/2023,174972,2023-01-12 23:16:38 UTC,27/01/2021,J1772,
ELEC,MARTA LINDBERGH L2 2,Sidney Marcus Blvd NE,,Atlanta,GA,30324,888-758-4389,E,Public,24 hours daily,,,2,0,33.825922,-84.369192,12/01/2023,174973,2023-01-12 23:16:38 UTC,27/01/2021,J1772,
ELEC,MARTA DORAVILLE L2 3,5932 New Peachtree Rd,,Atlanta,GA,30340,888-758-4389,E,Public,24 hours daily,,,2,0,33.901377,-84.281995,12/01/2023,174994,2023-01-12 23:16:40 UTC,27/01/2021,J1772,
ELEC,MARTA DORAVILLE L2 2,5932 New Peachtree Rd,,Atlanta,GA,30340,888-758-4389,E,Public,24 hours daily,,,2,0,33.901322,-84.282074,12/01/2023,174995,2023-01-12 23:16:40 UTC,27/01/2021,J1772,
ELEC,GALLERIA IMTGALLERIA NGW,427 Nichol Mill Ln,,Brentwood,TN,37027,888-758-4389,E,Public,24 hours daily,,,2,0,35.956664,-86.818974,23/01/2023,175056,2023-01-23 23:08:00 UTC,27/01/2021,J1772,
ELEC,LRC-GB LRC-GB,807 E Main St,,Durham,NC,27701,888-758-4389,E,Public,24 hours daily,,,2,0,35.990683,-78.890352,12/01/2023,175128,2023-01-12 23:16:28 UTC,27/01/2021,J1772,
ELEC,WFM - SOUTH GW1,2800 Old Milton Pkwy,,Alpharetta,GA,30004,888-758-4389,T,TEMPORARILY UNAVAILABLE (Public),24 hours daily,,,2,0,34.069496,-84.277771,12/01/2023,175161,2023-01-12 23:17:04 UTC,27/01/2021,J1772,
ELEC,CAMERONATFP CAMERON AT FP 1,6300 Tower Cir,,Franklin,TN,37067,888-758-4389,E,Public,24 hours daily,,,2,0,35.93748,-86.81119,12/01/2023,175162,2023-01-12 23:17:02 UTC,27/01/2021,J1772,
ELEC,TCMC B GARAGE CENTENNIAL B4,311 23rd Ave N,,Nashville,TN,37203,888-758-4389,E,Public,24 hours daily,,,2,0,36.152193,-86.807851,12/01/2023,175251,2023-01-12 23:16:02 UTC,27/01/2021,J1772,
ELEC,TCMC B GARAGE CENTENNIAL B8,311 23rd Ave N,,Nashville,TN,37203,888-758-4389,E,Public,24 hours daily,,,2,0,36.152202,-86.807787,12/01/2023,175252,2023-01-12 23:16:00 UTC,27/01/2021,J1772,
ELEC,TCMC B GARAGE CENTENNIAL B7,311 23rd Ave N,,Nashville,TN,37203,888-758-4389,E,Public,24 hours daily,,,2,0,36.152323,-86.807819,12/01/2023,175253,2023-01-12 23:16:00 UTC,27/01/2021,J1772,
ELEC,TCMC B GARAGE CENTENNIAL B5,311 23rd Ave N,,Nashville,TN,37203,888-758-4389,E,Public,24 hours daily,,,2,0,36.152263,-86.807723,12/01/2023,175254,2023-01-12 23:15:59 UTC,27/01/2021,J1772,
ELEC,TCMC B GARAGE CENTENNIAL B6,311 23rd Ave N,,Nashville,TN,37203,888-758-4389,E,Public,24 hours daily,,,2,0,36.152271,-86.807755,12/01/2023,175255,2023-01-12 23:15:59 UTC,27/01/2021,J1772,
ELEC,TCMC B GARAGE CENTENNIAL B1,311 23rd Ave N,,Nashville,TN,37203,888-758-4389,E,Public,24 hours daily,,,2,0,36.152245,-86.807905,12/01/2023,175256,2023-01-12 23:15:59 UTC,27/01/2021,J1772,
ELEC,TCMC B GARAGE CENTENNIAL B2,311 23rd Ave N,,Nashville,TN,37203,888-758-4389,E,Public,24 hours daily,,,2,0,36.15228,-86.80783,12/01/2023,175257,2023-01-12 23:15:59 UTC,27/01/2021,J1772,
ELEC,NASHVILLE VAMC NASH 3,1310 24th Ave S,,Nashville,TN,37212,888-758-4389,E,Public,24 hours daily,,,1,0,36.141586,-86.804474,23/01/2023,175273,2023-01-23 23:05:43 UTC,27/01/2021,J1772,
ELEC,NASHVILLE VAMC NASH 2,1310 24th Ave S,,Nashville,TN,37212,888-758-4389,E,Public,24 hours daily,,,1,0,36.141581,-86.804513,23/01/2023,175274,2023-01-23 23:05:39 UTC,27/01/2021,J1772,
ELEC,NASHVILLE VAMC NASH 4,1310 24th Ave S,,Nashville,TN,37212,888-758-4389,T,TEMPORARILY UNAVAILABLE (Public),24 hours daily,,,1,0,36.141524,-86.804512,23/01/2023,175275,2023-01-23 23:05:39 UTC,27/01/2021,J1772,
ELEC,THE ALASTAIR STATION 3,6500 Aria Blvd,,Sandy Springs,GA,30328,888-758-4389,E,Public,24 hours daily,,,2,0,33.934419,-84.365176,12/01/2023,175282,2023-01-12 23:17:34 UTC,27/01/2021,J1772,
ELEC,THE ALASTAIR STATION 1,6500 Aria Blvd,,Sandy Springs,GA,30328,888-758-4389,E,Public,24 hours daily,,,2,0,33.93441,-84.365155,12/01/2023,175283,2023-01-12 23:15:59 UTC,27/01/2021,J1772,
ELEC,MARTA COLLEGEPARK L24,"3800 E Main St,",,College Park,GA,30337,888-758-4389,E,Public,24 hours daily,,,2,0,33.650629,-84.447905,12/01/2023,175289,2023-01-12 23:17:21 UTC,27/01/2021,J1772,
ELEC,MARTA COLLEGEPARK L25,"3800 E Main St,",,College Park,GA,30337,888-758-4389,E,Public,24 hours daily,,,2,0,33.650603,-84.44786,12/01/2023,175290,2023-01-12 23:17:21 UTC,27/01/2021,J1772,
ELEC,MARTA COLLEGEPARK L22,"3800 E Main St,",,College Park,GA,30337,888-758-4389,E,Public,24 hours daily,,,2,0,33.650685,-84.447986,12/01/2023,175291,2023-01-12 23:17:21 UTC,27/01/2021,J1772,
ELEC,MARTA NORTHSPRING L24,7010 Peachtree Dunwoody Rd,,Sandy Springs,GA,30328,888-758-4389,E,Public,24 hours daily,,,2,0,33.944248,-84.356829,12/01/2023,175305,2023-01-12 23:17:28 UTC,27/01/2021,J1772,
ELEC,MARTA NORTHSPRING L23,7010 Peachtree Dunwoody Rd,,Sandy Springs,GA,30328,888-758-4389,E,Public,24 hours daily,,,2,0,33.944204,-84.356829,12/01/2023,175306,2023-01-12 23:17:28 UTC,27/01/2021,J1772,
ELEC,MARTA NORTHSPRING L22,7010 Peachtree Dunwoody Rd,,Sandy Springs,GA,30328,888-758-4389,T,TEMPORARILY UNAVAILABLE (Public),24 hours daily,,,2,0,33.944167,-84.356826,12/01/2023,175307,2023-01-12 23:17:28 UTC,27/01/2021,J1772,
ELEC,MARTA NORTHSPRING L21,7010 Peachtree Dunwoody Rd,,Sandy Springs,GA,30328,888-758-4389,E,Public,24 hours daily,,,2,0,33.944127,-84.356826,12/01/2023,175308,2023-01-12 23:17:28 UTC,27/01/2021,J1772,
ELEC,AC HOTEL ATL AC HOTEL 1,2079 Hospitality Way,,College Park,GA,30337,888-758-4389,E,Public,24 hours daily,,,2,0,33.64185,-84.45689,12/01/2023,175340,2023-01-12 23:16:32 UTC,27/01/2021,J1772,
ELEC,AC HOTEL ATL AC HOTEL 2,2079 Hospitality Way,,College Park,GA,30337,888-758-4389,E,Public,24 hours daily,,,2,0,33.64149,-84.45686,12/01/2023,175341,2023-01-12 23:16:32 UTC,27/01/2021,J1772,
ELEC,GO BRAVES RED PARKING EV5,553 Circle 75 Pkwy Level 5,,Atlanta,GA,30339,888-758-4389,E,Public,24 hours daily,,,2,0,33.888734,-84.468622,23/01/2023,175363,2023-01-23 23:05:54 UTC,27/01/2021,J1772,
ELEC,GO BRAVES RED PARKING EV3,553 Circle 75 Pkwy Level 3,,Atlanta,GA,30339,888-758-4389,E,Public,24 hours daily,,,2,0,33.888741,-84.468576,23/01/2023,175364,2023-01-23 23:05:54 UTC,27/01/2021,J1772,
ELEC,GO BRAVES RED PARKING EV2,553 Circle 75 Pkwy Level 2,,Atlanta,GA,30339,888-758-4389,T,TEMPORARILY UNAVAILABLE (Public),24 hours daily,,,2,0,33.888758,-84.468615,23/01/2023,175365,2023-01-23 23:05:54 UTC,27/01/2021,J1772,
ELEC,GO BRAVES RED PARKING EV7,553 Circle 75 Pkwy Level 7,,Atlanta,GA,30339,888-758-4389,T,TEMPORARILY UNAVAILABLE (Public),24 hours daily,,,2,0,33.888745,-84.468608,23/01/2023,175366,2023-01-23 23:05:54 UTC,27/01/2021,J1772,
ELEC,GO BRAVES RED PARKING EV4,553 Circle 75 Pkwy Level 4,,Atlanta,GA,30339,888-758-4389,T,TEMPORARILY UNAVAILABLE (Public),24 hours daily,,,2,0,33.888743,-84.468589,23/01/2023,175367,2023-01-23 23:05:53 UTC,27/01/2021,J1772,
ELEC,GO BRAVES RED PARKING EV1,553 Circle 75 Pkwy Level 1,,Atlanta,GA,30339,888-758-4389,E,Public,24 hours daily,,,2,0,33.888749,-84.468592,23/01/2023,175368,2023-01-23 23:05:54 UTC,27/01/2021,J1772,
ELEC,CITY OF ROSWELL NO.PARKING LOT,38 Hill St,,Roswell,GA,30075,888-758-4389,E,Public,24 hours daily,,,2,0,34.022952,-84.35958,12/01/2023,175406,2023-01-12 23:17:39 UTC,27/01/2021,J1772,
ELEC,"CHARLOTTE, NC 249 EV ARC",1776 Statesville Ave,,Charlotte,NC,28206,888-758-4389,T,TEMPORARILY UNAVAILABLE (Public),24 hours daily,,,2,0,35.248044,-80.833352,12/01/2023,175419,2023-01-12 23:17:51 UTC,27/01/2021,J1772,
ELEC,"CHARLOTTE, NC 250 EV ARC",932 Seigle Ave,,Charlotte,NC,28205,888-758-4389,E,Public,24 hours daily,,,2,0,35.226344,-80.823656,12/01/2023,175420,2023-01-12 23:16:57 UTC,27/01/2021,J1772,
ELEC,"CHARLOTTE, NC 248 EV ARC",500 Dalton Ave,,Charlotte,NC,28206,888-758-4389,T,TEMPORARILY UNAVAILABLE (Public),24 hours daily,,,2,0,35.240246,-80.835945,12/01/2023,175421,2023-01-12 23:16:29 UTC,27/01/2021,J1772,
ELEC,WFM - SOUTH WHOLEFOODS NAS2,1210 Broadway,,Nashville,TN,37203,888-758-4389,T,TEMPORARILY UNAVAILABLE (Public),24 hours daily,,,2,0,36.156693,-86.788379,12/01/2023,175423,2023-01-12 23:17:21 UTC,27/01/2021,J1772,
ELEC,THE WORKS CHATTAHOOCHEE 2,1235 Chattahoochee Ave NW,,Atlanta,GA,30318,888-758-4389,E,Public,24 hours daily,,,2,0,33.80337,-84.42866,12/01/2023,175488,2023-01-12 23:17:56 UTC,27/01/2021,J1772,
ELEC,8K PARKING DECK 10K PARKING #4,10000 Avalon Blvd,,Alpharetta,GA,30009,888-758-4389,E,Public,24 hours daily,,,2,0,34.069841,-84.274472,12/01/2023,175503,2023-01-12 23:18:04 UTC,27/01/2021,J1772,
ELEC,8K PARKING DECK 10K PARKING #3,10000 Avalon Blvd,,Alpharetta,GA,30009,888-758-4389,E,Public,24 hours daily,,,2,0,34.069814,-84.274235,12/01/2023,175504,2023-01-12 23:17:59 UTC,27/01/2021,J1772,
ELEC,8K PARKING DECK 10K PARKING #1,10000 Avalon Blvd,,Alpharetta,GA,30009,888-758-4389,E,Public,24 hours daily,,,2,0,34.069814,-84.274396,12/01/2023,175505,2023-01-12 23:19:12 UTC,27/01/2021,J1772,
ELEC,UPC EMP. PARKING,1525 N Rocky River Rd,,Monroe,NC,28110,888-758-4389,E,Public,24 hours daily,,,2,0,35.015476,-80.60731,12/01/2023,175508,2023-01-12 23:17:37 UTC,27/01/2021,J1772,
ELEC,GO BRAVES ORANGE EV LV2 2,1800 Windy Ridge Pkwy SE,,Atlanta,GA,30339,888-758-4389,T,TEMPORARILY UNAVAILABLE (Public),24 hours daily,,,2,0,33.891295,-84.469203,23/01/2023,175566,2023-01-23 23:06:31 UTC,27/01/2021,J1772,
ELEC,GO BRAVES ORANGE EV LEV3,1800 Windy Ridge Pkwy SE,,Atlanta,GA,30339,888-758-4389,T,TEMPORARILY UNAVAILABLE (Public),24 hours daily,,,2,0,33.891304,-84.469149,23/01/2023,175567,2023-01-23 23:06:22 UTC,27/01/2021,J1772,
ELEC,GO BRAVES ORANGE EV LEV2,1800 Windy Ridge Pkwy SE,,Atlanta,GA,30339,888-758-4389,T,TEMPORARILY UNAVAILABLE (Public),24 hours daily,,,2,0,33.891304,-84.469192,23/01/2023,175568,2023-01-23 23:05:54 UTC,27/01/2021,J1772,
ELEC,MARTA EDGEWOOD L2,1414 DeKalb Ave NE,,Atlanta,GA,30307,888-758-4389,E,Public,24 hours daily,,,2,0,33.76215,-84.341405,12/01/2023,175653,2023-01-12 23:18:25 UTC,27/01/2021,J1772,
ELEC,MARTA EDGEWOOD L3,1414 DeKalb Ave NE,,Atlanta,GA,30307,888-758-4389,E,Public,24 hours daily,,,2,0,33.762147,-84.341449,12/01/2023,175654,2023-01-12 23:18:25 UTC,27/01/2021,J1772,
ELEC,DURHAM COUNTY JUSTICE 1RIGHT,510 S Dillard St,,Durham,NC,27701,888-758-4389,E,Public,24 hours daily,,,2,0,35.992141,-78.901309,12/01/2023,175667,2023-01-12 23:18:30 UTC,27/01/2021,J1772,
ELEC,DURHAM COUNTY JUSTICE 3LEFT,510 S Dillard St,,Durham,NC,27701,888-758-4389,E,Public,24 hours daily,,,2,0,35.992175,-78.901393,12/01/2023,175668,2023-01-12 23:18:30 UTC,27/01/2021,J1772,
ELEC,DURHAM COUNTY JUSTICE 3RIGHT,510 S Dillard St,,Durham,NC,27701,888-758-4389,E,Public,24 hours daily,,,2,0,35.992184,-78.901329,12/01/2023,175669,2023-01-12 23:18:30 UTC,27/01/2021,J1772,
ELEC,DURHAM COUNTY NLIB LEFT,221 Milton Rd,,Durham,NC,27712,888-758-4389,E,Public,24 hours daily,,,2,0,36.088806,-78.914461,12/01/2023,175681,2023-01-12 23:18:31 UTC,27/01/2021,J1772,
ELEC,BROADSTONE DRM LEVEL 2 ADA,600 Willard St,,Durham,NC,27701,888-758-4389,E,Public,24 hours daily,,,1,0,35.993779,-78.908236,12/01/2023,175791,2023-01-12 23:15:27 UTC,27/01/2021,J1772,
ELEC,BROADSTONE DRM GUEST 1 ADA,600 Willard St,,Durham,NC,27701,888-758-4389,E,Public,24 hours daily,,,1,0,35.993798,-78.908226,12/01/2023,175792,2023-01-12 23:15:28 UTC,27/01/2021,J1772,
ELEC,PIVET PUBLIC DC1,2244 Metropolitan Pkwy SW,,Atlanta,GA,30315,888-758-4389,E,Public,24 hours daily,,,,1,33.692389,-84.40676,12/01/2023,175802,2023-01-12 23:18:35 UTC,27/01/2021,CHADEMO J1772COMBO,
ELEC,PIVET PUBLIC DC3,2244 Metropolitan Pkwy SW,,Atlanta,GA,30315,888-758-4389,E,Public,24 hours daily,,,,1,33.692351,-84.40676,12/01/2023,175804,2023-01-12 23:16:09 UTC,27/01/2021,CHADEMO J1772COMBO,
ELEC,PIVET PUBLIC DC2,2244 Metropolitan Pkwy SW,,Atlanta,GA,30315,888-758-4389,E,Public,24 hours daily,,,,1,33.69237,-84.406757,12/01/2023,175805,2023-01-12 23:16:09 UTC,27/01/2021,CHADEMO J1772COMBO,
ELEC,PIVET PUBLIC DC5,2244 Metropolitan Pkwy SW,,Atlanta,GA,30315,888-758-4389,E,Public,24 hours daily,,,,1,33.692306,-84.406761,12/01/2023,175806,2023-01-12 23:16:08 UTC,27/01/2021,CHADEMO J1772COMBO,
ELEC,GEORGIA POWER BRASELTON L2,5159 Golf Club Dr,,Braselton,GA,30517,888-758-4389,E,Public,24 hours daily,,,2,0,34.097794,-83.815374,23/01/2023,179861,2023-01-23 23:03:34 UTC,27/01/2021,J1772,
ELEC,GEORGIA POWER MERCER L2,1501 Mercer University Dr,,Macon,GA,31204,888-758-4389,E,Public,24 hours daily,,,2,0,32.825982,-83.654688,23/01/2023,179862,2023-01-23 23:03:34 UTC,27/01/2021,J1772,
ELEC,GEORGIA POWER LAKEPOINT L2,171 LakePoint Pkwy,,Cartersville,GA,30121,888-758-4389,E,Public,24 hours daily,,,2,0,34.119244,-84.746025,23/01/2023,179863,2023-01-23 23:03:53 UTC,27/01/2021,J1772,
ELEC,METRO DC VININGS DC,4300 Paces Ferry Rd,,Atlanta,GA,30339,888-758-4389,E,Public,24 hours daily,,,,1,33.864395,-84.46671,23/01/2023,179865,2023-01-23 23:03:54 UTC,27/01/2021,CHADEMO J1772COMBO,
ELEC,GEORGIA POWER HOLCOMB BR L2,8465 Holcomb Bridge Rd,,JOHNS CREEK,GA,30022,888-758-4389,E,Public,24 hours daily,,,2,0,33.986531,-84.27015,23/01/2023,179866,2023-01-23 23:03:53 UTC,27/01/2021,J1772,
ELEC,161 PEACHTREE STATION 3,161 Peachtree Center Ave NE,,Atlanta,GA,30303,888-758-4389,T,TEMPORARILY UNAVAILABLE (Public),24 hours daily,,,2,0,33.759394,-84.385494,23/01/2023,179867,2023-01-23 23:03:47 UTC,27/01/2021,J1772,
ELEC,161 PEACHTREE STATION 2,161 Peachtree Center Ave NE,,Atlanta,GA,30303,888-758-4389,T,TEMPORARILY UNAVAILABLE (Public),24 hours daily,,,2,0,33.75953,-84.385717,23/01/2023,179868,2023-01-23 23:03:47 UTC,27/01/2021,J1772,
ELEC,HIGHWOODS 2500 GW1,2500 Century Pkwy NE,,Atlanta,GA,30345,888-758-4389,E,Public,24 hours daily,,,2,0,33.848428,-84.30663,23/01/2023,179869,2023-01-23 23:03:38 UTC,27/01/2021,J1772,
ELEC,CORT WINDWARD LAKES EV2,905 Lake Union Hill Way,,Alpharetta,GA,30004,888-758-4389,E,Public,24 hours daily,,,2,0,34.08235,-84.279366,23/01/2023,179870,2023-01-23 23:03:41 UTC,27/01/2021,J1772,
ELEC,NORTHPARK 500 STATION 3,1100 Abernathy Rd NE,,Atlanta,GA,30328,888-758-4389,E,Public,24 hours daily,,,2,0,33.934551,-84.352488,23/01/2023,179871,2023-01-23 23:03:46 UTC,27/01/2021,J1772,
ELEC,NORTHPARK 500 STATION 1,1100 Abernathy Rd NE,,Atlanta,GA,30328,888-758-4389,E,Public,24 hours daily,,,2,0,33.934648,-84.352469,23/01/2023,179872,2023-01-23 23:03:45 UTC,27/01/2021,J1772,
ELEC,NORTHPARK 500 STATION 2,1100 Abernathy Rd NE,,Atlanta,GA,30328,888-758-4389,E,Public,24 hours daily,,,2,0,33.934641,-84.352367,23/01/2023,179873,2023-01-23 23:02:33 UTC,27/01/2021,J1772,
ELEC,CAMDEN BUCKHEAD THE PEACHTREE,3097 Maple Dr NE,,Atlanta,GA,30305,888-758-4389,T,TEMPORARILY UNAVAILABLE (Public),24 hours daily,,,2,0,33.839983,-84.371405,23/01/2023,179874,2023-01-23 23:03:11 UTC,27/01/2021,J1772,
ELEC,GWCC GWCC,285 Andrew Young International Blvd,,Atlanta,GA,30313,888-758-4389,E,Public,24 hours daily,,,2,0,33.756935,-84.397675,23/01/2023,179875,2023-01-23 23:01:13 UTC,27/01/2021,J1772,
ELEC,NORTHPARK 400 STATION 2,1000 Abernathy Rd NE,,Atlanta,GA,30328,888-758-4389,E,Public,24 hours daily,,,2,0,33.934863,-84.354609,23/01/2023,179876,2023-01-23 23:03:18 UTC,27/01/2021,J1772,
ELEC,ALLIANCE CENTER ONE ALLIANCE #4,3500 Lenox Rd,,Atlanta,GA,30326,888-758-4389,E,Public,24 hours daily,,,2,0,33.852127,-84.366118,23/01/2023,179877,2023-01-23 23:03:17 UTC,27/01/2021,J1772,
ELEC,SAVANNAH TANGER 2,200 Tanger Blvd.,,Pooler,GA,31322,888-758-4389,E,Public,24 hours daily,,,2,0,32.133999,-81.24155,23/01/2023,179879,2023-01-23 23:03:05 UTC,27/01/2021,J1772,
ELEC,CROCKER PARTNER CP PROMINENCE 2,3475 Piedmont Rd NE,,Atlanta,GA,30305,888-758-4389,E,Public,24 hours daily,,,2,0,33.849952,-84.375084,23/01/2023,179880,2023-01-23 23:02:15 UTC,27/01/2021,J1772,
ELEC,CROCKER PARTNER CP PROMINENCE 3,3475 Piedmont Rd NE,,Atlanta,GA,30305,888-758-4389,E,Public,24 hours daily,,,2,0,33.849872,-84.375122,23/01/2023,179881,2023-01-23 23:03:01 UTC,27/01/2021,J1772,
ELEC,7000 PARKWAY 1,7000 Central Pkwy,,Atlanta,GA,30328,888-758-4389,E,Public,24 hours daily,,,2,0,33.92723,-84.34871,23/01/2023,179882,2023-01-23 23:02:45 UTC,27/01/2021,J1772,
ELEC,COUSINS 3348 P6 #2,3348 Peachtree Rd NE,,Atlanta,GA,30326,888-758-4389,T,TEMPORARILY UNAVAILABLE (Public),24 hours daily,,,2,0,33.847902,-84.36966,23/01/2023,179883,2023-01-23 23:02:33 UTC,27/01/2021,J1772,
ELEC,LOCUST GROVE TANGER EV 2,1000 Tanger Dr,,Locust Grove,GA,30248,888-758-4389,T,TEMPORARILY UNAVAILABLE (Public),24 hours daily,,,2,0,33.348845,-84.122709,23/01/2023,179884,2023-01-23 23:02:38 UTC,27/01/2021,J1772,
ELEC,COUSINS 3344 P6 #2,3344 Peachtree Rd NE,,Atlanta,GA,30305,888-758-4389,E,Public,24 hours daily,,,2,0,33.847383,-84.368527,23/01/2023,179886,2023-01-23 23:02:33 UTC,27/01/2021,J1772,
ELEC,GA TECH AREA 4 #3,837 State St NW,,Atlanta,GA,30313,888-758-4389,E,Public,24 hours daily,,,2,0,33.777545,-84.399306,23/01/2023,179891,2023-01-23 23:02:03 UTC,27/01/2021,J1772,
ELEC,GA TECH AREA 4 #1,837 State St NW,,Atlanta,GA,30313,888-758-4389,E,Public,24 hours daily,,,2,0,33.777458,-84.399305,23/01/2023,179892,2023-01-23 23:02:00 UTC,27/01/2021,J1772,
ELEC,GA TECH W23 #1,352 Peachtree Pl NW,,Atlanta,GA,30318,888-758-4389,E,Public,24 hours daily,,,2,0,33.780038,-84.398571,23/01/2023,179893,2023-01-23 23:02:00 UTC,27/01/2021,J1772,
ELEC,GA TECH CURRAN 2,875 Curran St NW,,Atlanta,GA,30318,888-758-4389,E,Public,24 hours daily,,,2,0,33.779341,-84.405184,23/01/2023,179894,2023-01-23 23:02:00 UTC,27/01/2021,J1772,
ELEC,ATLANTIC STN 1684LF 1685RT,261 19th St NW,,Atlanta,GA,30363,888-758-4389,E,Public,24 hours daily,,,2,0,33.793777,-84.395913,23/01/2023,179895,2023-01-23 23:01:07 UTC,27/01/2021,J1772,
ELEC,ATLANTIC STN 1686LF 1687RT,261 19th St NW,,Atlanta,GA,30363,888-758-4389,E,Public,24 hours daily,,,2,0,33.793799,-84.395914,23/01/2023,179896,2023-01-23 23:01:08 UTC,27/01/2021,J1772,
ELEC,AVALON CHARGE AVALON STATION3,1400 Alpha Ct,,Alpharetta,GA,30009,888-758-4389,T,TEMPORARILY UNAVAILABLE (Public),24 hours daily,,,2,0,34.071235,-84.2774,23/01/2023,179897,2023-01-23 23:01:54 UTC,27/01/2021,J1772,
ELEC,AVALON CHARGE AVALON STATION6,2200 Avalon Boulevard,,Alpharetta,GA,30009,888-758-4389,E,Public,24 hours daily,,,2,0,34.070399,-84.278422,23/01/2023,179898,2023-01-23 23:01:42 UTC,27/01/2021,J1772,
ELEC,BMW OF ROSWELL STATION 06,11458 Alpharetta Hwy,,Roswell,GA,30076,888-758-4389,T,TEMPORARILY UNAVAILABLE (Public),24 hours daily,,,1,0,34.058375,-84.328097,23/01/2023,179899,2023-01-23 23:01:32 UTC,27/01/2021,J1772,
ELEC,BMW OF ROSWELL STATION 03,11458 Alpharetta Hwy,,Roswell,GA,30076,888-758-4389,T,TEMPORARILY UNAVAILABLE (Public),24 hours daily,,,1,0,34.058508,-84.328081,23/01/2023,179900,2023-01-23 23:01:31 UTC,27/01/2021,J1772,
ELEC,BMW OF ROSWELL STATION 09,11458 Alpharetta Hwy,,Roswell,GA,30076,888-758-4389,T,TEMPORARILY UNAVAILABLE (Public),24 hours daily,,,1,0,34.05868,-84.328261,23/01/2023,179901,2023-01-23 23:01:31 UTC,27/01/2021,J1772,
ELEC,BMW OF ROSWELL STATION 02,11458 Alpharetta Hwy,,Roswell,GA,30076,888-758-4389,T,TEMPORARILY UNAVAILABLE (Public),24 hours daily,,,1,0,34.058551,-84.328073,23/01/2023,179902,2023-01-23 23:01:31 UTC,27/01/2021,J1772,
ELEC,BMW OF ROSWELL STATION 11,11458 Alpharetta Hwy,,Roswell,GA,30076,888-758-4389,T,TEMPORARILY UNAVAILABLE (Public),24 hours daily,,,1,0,34.058622,-84.32828,23/01/2023,179903,2023-01-23 23:01:31 UTC,27/01/2021,J1772,
ELEC,BMW OF ROSWELL STATION 07,11458 Alpharetta Hwy,,Roswell,GA,30076,888-758-4389,T,TEMPORARILY UNAVAILABLE (Public),24 hours daily,,,1,0,34.05877,-84.328252,23/01/2023,179904,2023-01-23 23:01:31 UTC,27/01/2021,J1772,
ELEC,BMW OF ROSWELL STATION 04,11458 Alpharetta Hwy,,Roswell,GA,30076,888-758-4389,T,TEMPORARILY UNAVAILABLE (Public),24 hours daily,,,1,0,34.058473,-84.328087,23/01/2023,179905,2023-01-23 23:01:30 UTC,27/01/2021,J1772,
ELEC,BMW OF ROSWELL STATION 12,11458 Alpharetta Hwy,,Roswell,GA,30076,888-758-4389,T,TEMPORARILY UNAVAILABLE (Public),24 hours daily,,,1,0,34.058569,-84.328288,23/01/2023,179906,2023-01-23 23:01:30 UTC,27/01/2021,J1772,
ELEC,BMW OF ROSWELL STATION 10,11458 Alpharetta Hwy,,Roswell,GA,30076,888-758-4389,T,TEMPORARILY UNAVAILABLE (Public),24 hours daily,,,1,0,34.058654,-84.328272,23/01/2023,179907,2023-01-23 23:01:30 UTC,27/01/2021,J1772,
ELEC,BMW OF ROSWELL STATION 05,11458 Alpharetta Hwy,,Roswell,GA,30076,888-758-4389,T,TEMPORARILY UNAVAILABLE (Public),24 hours daily,,,1,0,34.058426,-84.328093,23/01/2023,179908,2023-01-23 23:01:30 UTC,27/01/2021,J1772,
ELEC,BMW OF ROSWELL STATION 08,11458 Alpharetta Hwy,,Roswell,GA,30076,888-758-4389,T,TEMPORARILY UNAVAILABLE (Public),24 hours daily,,,1,0,34.058718,-84.328258,23/01/2023,179909,2023-01-23 23:01:32 UTC,27/01/2021,J1772,
ELEC,ATLANTA FALCONS AF EXEC LOT 2,4400 Falcon Pkwy,,Flowery Branch,GA,30542,888-758-4389,E,Public,24 hours daily,,,2,0,34.192023,-83.898189,23/01/2023,179910,2023-01-23 23:01:30 UTC,27/01/2021,J1772,
ELEC,TANGER COMMERCE TANGER EV 2,800 Steven B Tanger Blvd,,Commerce,GA,30529,888-758-4389,E,Public,24 hours daily,,,2,0,34.250937,-83.473024,23/01/2023,179911,2023-01-23 23:00:56 UTC,27/01/2021,J1772,
ELEC,TURNER TECHWOOD TECH 1000 01,1000 Techwood Dr NW,,Atlanta,GA,30318,888-758-4389,E,Public,24 hours daily,,,2,0,33.781832,-84.393529,23/01/2023,179914,2023-01-23 23:00:46 UTC,27/01/2021,J1772,
ELEC,GA TECH E81 #1,81 4th St NW,,Atlanta,GA,30308,888-758-4389,E,Public,24 hours daily,,,2,0,33.775203,-84.38941,23/01/2023,179915,2023-01-23 23:00:43 UTC,27/01/2021,J1772,
ELEC,TURNER PROPERTI CNN CENTER U2,Centennial Olympic Park Dr NW,,Atlanta,GA,30303,888-758-4389,E,Public,24 hours daily,,,2,0,33.75615,-84.395293,23/01/2023,179916,2023-01-23 23:00:49 UTC,27/01/2021,J1772,
ELEC,TURNER PROPERTI CNN CENTER L1,Centennial Olympic Park Dr NW,,Atlanta,GA,30303,888-758-4389,E,Public,24 hours daily,,,2,0,33.756149,-84.395371,23/01/2023,179917,2023-01-23 23:00:49 UTC,27/01/2021,J1772,
ELEC,TURNER PROPERTI CNN CENTER U3,Centennial Olympic Park Dr NW,,Atlanta,GA,30303,888-758-4389,E,Public,24 hours daily,,,2,0,33.75618,-84.39524,23/01/2023,179918,2023-01-23 23:00:49 UTC,27/01/2021,J1772,
ELEC,TURNER PROPERTI CNN CENTER L2,Centennial Olympic Park Dr NW,,Atlanta,GA,30303,888-758-4389,E,Public,24 hours daily,,,2,0,33.75618,-84.395315,23/01/2023,179919,2023-01-23 23:00:46 UTC,27/01/2021,J1772,
ELEC,TURNER TECHWOOD TECH 1030 01,1030 Techwood Dr NW,,Atlanta,GA,30318,888-758-4389,E,Public,24 hours daily,,,2,0,33.783136,-84.395024,23/01/2023,179920,2023-01-23 23:00:46 UTC,27/01/2021,J1772,
ELEC,MARTA WINDWARD L2 3,12585 Dryden RD,,Alpharetta,GA,30005,888-758-4389,E,Public,24 hours daily,,,2,0,34.086117,-84.260654,12/01/2023,180582,2023-01-12 23:18:53 UTC,27/01/2021,J1772,
ELEC,MARTA WINDWARD L2 1,12585 Dryden RD,,Alpharetta,GA,30005,888-758-4389,E,Public,24 hours daily,,,2,0,34.085981,-84.26076,12/01/2023,180583,2023-01-12 23:18:53 UTC,27/01/2021,J1772,
ELEC,3800 GLENWOOD STATION 3,3701 National Dr PARKING DECK,,Raleigh,NC,27612,888-758-4389,E,Public,24 hours daily,,,2,0,35.831995,-78.66662,12/01/2023,180722,2023-01-12 23:16:34 UTC,27/01/2021,J1772,
ELEC,3800 GLENWOOD STATION 2,3701 National Dr PARKING DECK,,Raleigh,NC,27612,888-758-4389,E,Public,24 hours daily,,,2,0,35.83196,-78.666666,12/01/2023,180723,2023-01-12 23:16:34 UTC,27/01/2021,J1772,
ELEC,3800 GLENWOOD STATION 4,3701 National Dr PARKING DECK,,Raleigh,NC,27612,888-758-4389,E,Public,24 hours daily,,,2,0,35.83197,-78.666625,12/01/2023,180724,2023-01-12 23:16:34 UTC,27/01/2021,J1772,
ELEC,AAA - PIEDMONT PIEDMONT EV3,1968 Peachtree Rd NW,,Atlanta,GA,30309,888-758-4389,E,Public,24 hours daily,,,2,0,33.808811,-84.394386,23/01/2023,180733,2023-01-23 23:04:38 UTC,27/01/2021,J1772,
ELEC,PF PARKING LOT BARLEY GARDEN R,500 Heatherden Ave,,Fayetteville,GA,30214,888-758-4389,E,Public,24 hours daily,,,2,0,33.4703,-84.506836,12/01/2023,180833,2023-01-12 23:19:20 UTC,27/01/2021,J1772,
ELEC,M3 STATION 1 - M3,1600 N Brown Rd,,Lawrenceville,GA,30043,888-758-4389,E,Public,24 hours daily,,,2,0,33.995456,-84.072914,12/01/2023,180925,2023-01-12 23:19:30 UTC,27/01/2021,J1772,
ELEC,PF PARKING LOT TOGWOTEE #3,1240 GA-54,,Fayetteville,GA,30214,888-758-4389,E,Public,24 hours daily,,,2,0,33.45035,-84.50735,12/01/2023,180931,2023-01-12 23:19:31 UTC,27/01/2021,J1772,
ELEC,PF PARKING LOT TOGWOTEE #2,1240 GA-54,,Fayetteville,GA,30214,888-758-4389,E,Public,24 hours daily,,,2,0,33.45023,-84.507416,12/01/2023,180932,2023-01-12 23:19:31 UTC,27/01/2021,J1772,
ELEC,RAMADA WYNDHAM STATION 2,1 Gateway Blvd E,,Savannah,GA,31419,888-758-4389,E,Public,24 hours daily,,,2,0,32.006693,-81.279549,12/01/2023,180969,2023-01-12 23:19:29 UTC,27/01/2021,J1772,
ELEC,RAMADA WYNDHAM STATION 1,1 Gateway Blvd E,,Savannah,GA,31419,888-758-4389,E,Public,24 hours daily,,,2,0,32.006647,-81.279581,12/01/2023,180970,2023-01-12 23:19:29 UTC,27/01/2021,J1772,
ELEC,TERMINAL 1 P2 STATION 1,Terminal Garage 1 140 BNA Park Dr,,Nashville,TN,37214,888-758-4389,E,Public,24 hours daily,,,2,0,36.133298,-86.666467,12/01/2023,181008,2023-01-12 23:18:56 UTC,27/01/2021,J1772,
ELEC,TERMINAL 1 P2 STATION 2,Terminal Garage 1 140 BNA Park Dr,,Nashville,TN,37214,888-758-4389,E,Public,24 hours daily,,,2,0,36.133275,-86.666722,12/01/2023,181009,2023-01-12 23:18:56 UTC,27/01/2021,J1772,
ELEC,TERMINAL 1 P4 STATION 1,Terminal Garage 1 140 BNA Park Dr,,Nashville,TN,37214,888-758-4389,E,Public,24 hours daily,,,2,0,36.134,-86.666465,12/01/2023,181010,2023-01-12 23:18:56 UTC,27/01/2021,J1772,
ELEC,TERMINAL 1 P4 STATION 2,Terminal Garage 1 140 BNA Park Dr,,Nashville,TN,37214,888-758-4389,E,Public,24 hours daily,,,2,0,36.133976,-86.666691,12/01/2023,181011,2023-01-12 23:18:56 UTC,27/01/2021,J1772,
ELEC,TERMINAL 1 P3 STATION 2,Terminal Garage 1 140 BNA Park Dr,,Nashville,TN,37214,888-758-4389,E,Public,24 hours daily,,,2,0,36.133628,-86.666701,12/01/2023,181012,2023-01-12 23:18:42 UTC,27/01/2021,J1772,
ELEC,TERMINAL 1 P3 STATION 3,Terminal Garage 1 140 BNA Park Dr,,Nashville,TN,37214,888-758-4389,E,Public,24 hours daily,,,2,0,36.133584,-86.666926,12/01/2023,181013,2023-01-12 23:18:42 UTC,27/01/2021,J1772,
ELEC,TERMINAL 1 P3 STATION 1,Terminal Garage 1 140 BNA Park Dr,,Nashville,TN,37214,888-758-4389,E,Public,24 hours daily,,,2,0,36.133662,-86.666489,12/01/2023,181014,2023-01-12 23:18:42 UTC,27/01/2021,J1772,
ELEC,TERMINAL 1 P4 STATION 3,Terminal Garage 1 140 BNA Park Dr,,Nashville,TN,37214,888-758-4389,E,Public,24 hours daily,,,2,0,36.13394,-86.666937,12/01/2023,181015,2023-01-12 23:18:56 UTC,27/01/2021,J1772,
ELEC,GEORGIA POWER M'VILLE DC1,2478 N Columbia St,,Milledgeville,GA,31061,888-758-4389,E,Public,24 hours daily,,,,1,33.112225,-83.258282,12/01/2023,181113,2023-01-12 23:18:07 UTC,27/01/2021,CHADEMO J1772COMBO,
ELEC,ATL WEST LEVEL1 STATION1,4199 Skytrain Way,,College Park,GA,30337,888-758-4389,E,Public,24 hours daily,,,1,0,33.641149,-84.459234,12/01/2023,181159,2023-01-12 23:18:54 UTC,27/01/2021,J1772,
ELEC,ATL WEST LEVEL1 STATION3,4199 Skytrain Way,,College Park,GA,30337,888-758-4389,E,Public,24 hours daily,,,2,0,33.641122,-84.459181,12/01/2023,181160,2023-01-12 23:18:54 UTC,27/01/2021,J1772,
ELEC,ATL WEST LEVEL1 STATION2,4199 Skytrain Way,,College Park,GA,30337,888-758-4389,E,Public,24 hours daily,,,2,0,33.641077,-84.459288,12/01/2023,181161,2023-01-12 23:18:54 UTC,27/01/2021,J1772,
ELEC,ATL WEST LEVEL3 STATION2,4199 Skytrain Way,,College Park,GA,30337,888-758-4389,E,Public,24 hours daily,,,2,0,33.64105,-84.459449,12/01/2023,181162,2023-01-12 23:18:54 UTC,27/01/2021,J1772,
ELEC,ATL WEST LEVEL5 STATION2,4199 Skytrain Way,,College Park,GA,30337,888-758-4389,E,Public,24 hours daily,,,2,0,33.640782,-84.459374,12/01/2023,181164,2023-01-12 23:18:54 UTC,27/01/2021,J1772,
ELEC,ATL WEST LEVEL7 STATION1,4199 Skytrain Way,,College Park,GA,30337,888-758-4389,E,Public,24 hours daily,,,2,0,33.640925,-84.45917,12/01/2023,181166,2023-01-12 23:18:54 UTC,27/01/2021,J1772,
ELEC,ATL WEST LEVEL2 STATION1,4199 Skytrain Way,,College Park,GA,30337,888-758-4389,E,Public,24 hours daily,,,2,0,33.641131,-84.459309,12/01/2023,181170,2023-01-12 23:18:54 UTC,27/01/2021,J1772,
ELEC,ATL WEST LEVEL3 STATION1,4199 Skytrain Way,,College Park,GA,30337,888-758-4389,E,Public,24 hours daily,,,2,0,33.640872,-84.459481,12/01/2023,181171,2023-01-12 23:18:54 UTC,27/01/2021,J1772,
ELEC,ATL WEST LEVEL2 STATION2,4199 Skytrain Way,,College Park,GA,30337,888-758-4389,E,Public,24 hours daily,,,2,0,33.64089,-84.459535,12/01/2023,181172,2023-01-12 23:18:54 UTC,27/01/2021,J1772,
ELEC,ATL WEST LEVEL5 STATION1,4199 Skytrain Way,,College Park,GA,30337,888-758-4389,E,Public,24 hours daily,,,2,0,33.640809,-84.459374,12/01/2023,181173,2023-01-12 23:18:54 UTC,27/01/2021,J1772,
ELEC,GEORGIA POWER BRADLEYPARK DC1,1514 Bradley Park Dr,,Columbus,GA,31904,888-758-4389,E,Public,24 hours daily,,,,1,32.531652,-84.970408,12/01/2023,181239,2023-01-12 23:18:23 UTC,27/01/2021,CHADEMO J1772COMBO,
ELEC,HUNTERSVILLE MARK OIL L2,101 Statesville Rd,,Huntersville,NC,28078,888-758-4389,E,Public,24 hours daily,,,2,0,35.409603,-80.854126,12/01/2023,181247,2023-01-12 23:20:04 UTC,27/01/2021,J1772,
ELEC,GEORGIA POWER MACON DC1,6255 Zebulon Rd,,Macon,GA,31210,888-758-4389,E,Public,24 hours daily,,,,1,32.882043,-83.766682,12/01/2023,181470,2023-01-12 23:19:51 UTC,27/01/2021,CHADEMO J1772COMBO,
ELEC,GEORGIA POWER MACON DC2,6255 Zebulon Rd,,Macon,GA,31210,888-758-4389,E,Public,24 hours daily,,,,1,32.88202,-83.766693,12/01/2023,181471,2023-01-12 23:20:25 UTC,27/01/2021,CHADEMO J1772COMBO,
ELEC,JASBER PLAZA JASBER EV 1,1105 Main St,,Forest Park,GA,30297,888-758-4389,E,Public,24 hours daily,,,2,0,33.6184,-84.35359,12/01/2023,181497,2023-01-12 23:20:27 UTC,27/01/2021,J1772,
ELEC,GEORGIA POWER LAVONIA DC1,14177 Jones St,,Lavonia,GA,30553,888-758-4389,E,Public,24 hours daily,,,,1,34.447877,-83.125993,12/01/2023,181498,2023-01-12 23:19:33 UTC,27/01/2021,CHADEMO J1772COMBO,
ELEC,GEORGIA POWER KINGSLAND DC2,1375 Hospitality Ave,,Kingsland,GA,31548,888-758-4389,E,Public,24 hours daily,,,,1,30.790453,-81.65213,12/01/2023,181585,2023-01-12 23:19:41 UTC,27/01/2021,CHADEMO J1772COMBO,
ELEC,MOORES MILL MOORES MILL 1,2275 Marietta Blvd NW,,Atlanta,GA,30318,888-758-4389,E,Public,24 hours daily,,,2,0,33.819122,-84.448884,23/01/2023,181586,2023-01-23 23:06:40 UTC,27/01/2021,J1772,
ELEC,PVG CHARGE EV 5,5300 Winder Hwy,,Braselton,GA,30517,888-758-4389,E,Public,24 hours daily,,,2,0,34.152541,-83.814887,12/01/2023,181607,2023-01-12 23:20:34 UTC,27/01/2021,J1772,
ELEC,PVG CHARGE EV 4,5300 Winder Hwy,,Braselton,GA,30517,888-758-4389,E,Public,24 hours daily,,,2,0,34.152446,-83.814719,12/01/2023,181608,2023-01-12 23:20:38 UTC,27/01/2021,J1772,
ELEC,GEORGIA POWER TIFTON L2,1215 US-82 West,,Tifton,GA,31794,888-758-4389,E,Public,24 hours daily,,,2,0,31.450719,-83.533903,12/01/2023,181667,2023-01-12 23:20:53 UTC,27/01/2021,J1772,
ELEC,GEORGIA POWER TIFTON DC2,1215 US-82 West,,Tifton,GA,31794,888-758-4389,E,Public,24 hours daily,,,,1,31.450723,-83.534005,12/01/2023,181668,2023-01-12 23:20:07 UTC,27/01/2021,CHADEMO J1772COMBO,
ELEC,GEORGIA POWER COLUMBUS DC1,3103 Gentian Blvd,,Columbus,GA,31907,888-758-4389,E,Public,24 hours daily,,,,1,32.506065,-84.941364,12/01/2023,181870,2023-01-12 23:19:59 UTC,27/01/2021,CHADEMO J1772COMBO,
ELEC,GEORGIA POWER UNION CITY DC1,6781 Londonderry Way,,Union City,GA,30291,888-758-4389,E,Public,24 hours daily,,,,1,33.570121,-84.53827,12/01/2023,181896,2023-01-12 23:20:02 UTC,27/01/2021,CHADEMO J1772COMBO,
ELEC,FORT BENNING BLD218 STATION8,Marchant St,,Fort Benning,GA,31905,888-758-4389,E,Public,24 hours daily,,,2,0,32.359874,-84.97085,23/01/2023,181936,2023-01-23 23:08:03 UTC,27/01/2021,J1772,
ELEC,FORT BENNING BLD218 STATION2,Marchant St,,Fort Benning,GA,31905,888-758-4389,E,Public,24 hours daily,,,2,0,32.360115,-84.970019,23/01/2023,181937,2023-01-23 23:07:21 UTC,27/01/2021,J1772,
ELEC,FORT BENNING BLD218 STATION5,Marchant St,,Fort Benning,GA,31905,888-758-4389,T,TEMPORARILY UNAVAILABLE (Public),24 hours daily,,,2,0,32.36006,-84.970047,23/01/2023,181938,2023-01-23 23:07:21 UTC,27/01/2021,J1772,
ELEC,FORT BENNING BLD218 STATION9,Marchant St,,Fort Benning,GA,31905,888-758-4389,E,Public,24 hours daily,,,2,0,32.359838,-84.970951,23/01/2023,181939,2023-01-23 23:07:20 UTC,27/01/2021,J1772,
ELEC,FORT BENNING BLD218 STATION1,Marchant St,,Fort Benning,GA,31905,888-758-4389,E,Public,24 hours daily,,,2,0,32.360126,-84.969962,23/01/2023,181940,2023-01-23 23:07:20 UTC,27/01/2021,J1772,
ELEC,FORT BENNING BLD321 STATION3,Marchant St,,Fort Benning,GA,31905,888-758-4389,T,TEMPORARILY UNAVAILABLE (Public),24 hours daily,,,2,0,32.360054,-84.970148,23/01/2023,181941,2023-01-23 23:07:20 UTC,27/01/2021,J1772,
ELEC,FORT BENNING BLD218 STATION6,Marchant St,,Fort Benning,GA,31905,888-758-4389,T,TEMPORARILY UNAVAILABLE (Public),24 hours daily,,,2,0,32.359994,-84.970455,23/01/2023,181942,2023-01-23 23:07:20 UTC,27/01/2021,J1772,
ELEC,FORT BENNING BLD218 STATION4,Marchant St,,Fort Benning,GA,31905,888-758-4389,E,Public,24 hours daily,,,2,0,32.360028,-84.970312,23/01/2023,181943,2023-01-23 23:07:20 UTC,27/01/2021,J1772,
ELEC,FORT BENNING BLD218 STATION7,Marchant St,,Fort Benning,GA,31905,888-758-4389,E,Public,24 hours daily,,,2,0,32.359929,-84.970621,23/01/2023,181944,2023-01-23 23:07:21 UTC,27/01/2021,J1772,
ELEC,ENDEAVOR REG DEMONBREUN 2,1216 Demonbreun St,,Nashville,TN,37203,888-758-4389,E,Public,24 hours daily,,,2,0,36.154311,-86.787417,12/01/2023,181946,2023-01-12 23:20:58 UTC,27/01/2021,J1772,
ELEC,GEORGIA POWER STATESBORO DC1,17874 GA-67,,Statesboro,GA,30458,888-758-4389,E,Public,24 hours daily,,,,1,32.406693,-81.761841,12/01/2023,181952,2023-01-12 23:21:31 UTC,27/01/2021,CHADEMO J1772COMBO,
ELEC,7SPC SCES LECONTE 3,2925 Teaster Ln,,Pigeon Forge,TN,37863,888-758-4389,E,Public,24 hours daily,,,2,0,35.799495,-83.561535,12/01/2023,181990,2023-01-12 23:21:33 UTC,27/01/2021,J1772,
ELEC,7SPC SCES LECONTE 4,2925 Teaster Ln,,Pigeon Forge,TN,37863,888-758-4389,E,Public,24 hours daily,,,2,0,35.799476,-83.561592,12/01/2023,181991,2023-01-12 23:21:33 UTC,27/01/2021,J1772,
ELEC,7SPC SCES LECONTE 2,2925 Teaster Ln,,Pigeon Forge,TN,37863,888-758-4389,E,Public,24 hours daily,,,2,0,35.79953,-83.56142,12/01/2023,181992,2023-01-12 23:21:33 UTC,27/01/2021,J1772,
ELEC,7SPC DOLLYWOOD EMPL,1022 Dollywood Ln,,Pigeon Forge,TN,37863,888-758-4389,E,Public,24 hours daily,,,2,0,35.795962,-83.537932,12/01/2023,181993,2023-01-12 23:21:33 UTC,27/01/2021,J1772,
ELEC,GWCC GWCC MB NGW 10,300 Andrew Young International Blvd NW,,Atlanta,GA,30303,888-758-4389,E,Public,24 hours daily,,,2,0,33.757167,-84.39981,12/01/2023,182047,2023-01-12 23:21:33 UTC,27/01/2021,J1772,
ELEC,PGFTL EV STATION 1,2905 Parkway,,Pigeon Forge,TN,37863,888-758-4389,E,Public,24 hours daily,,,2,0,35.797472,-83.565772,12/01/2023,182151,2023-01-12 23:19:00 UTC,27/01/2021,J1772,
ELEC,GEORGIA POWER TRENTON DC2,255 Crabtree St,,Trenton,GA,30752,888-758-4389,E,Public,24 hours daily,,,,1,34.871299,-85.511032,12/01/2023,182214,2023-01-12 23:21:54 UTC,27/01/2021,CHADEMO J1772COMBO,
ELEC,CDC PD02,Michael St NE,,Atlanta,GA,30322,888-758-4389,E,Public,24 hours daily,,,2,0,33.797013,-84.326099,12/01/2023,182215,2023-01-12 23:21:24 UTC,27/01/2021,J1772,
ELEC,CDC PD03,Michael St NE,,Atlanta,GA,30322,888-758-4389,E,Public,24 hours daily,,,2,0,33.79708,-84.326037,12/01/2023,182216,2023-01-12 23:21:24 UTC,27/01/2021,J1772,
ELEC,CDC PD04,Michael St NE,,Atlanta,GA,30322,888-758-4389,E,Public,24 hours daily,,,2,0,33.796966,-84.326265,12/01/2023,182217,2023-01-12 23:21:24 UTC,27/01/2021,J1772,
ELEC,CDC PD05,Michael St NE,,Atlanta,GA,30322,888-758-4389,E,Public,24 hours daily,,,2,0,33.797012,-84.326464,12/01/2023,182218,2023-01-12 23:21:24 UTC,27/01/2021,J1772,
ELEC,CDC PD06,Michael St NE,,Atlanta,GA,30322,888-758-4389,E,Public,24 hours daily,,,2,0,33.797096,-84.326394,12/01/2023,182219,2023-01-12 23:21:24 UTC,27/01/2021,J1772,
ELEC,CDC PD07,Michael St NE,,Atlanta,GA,30322,888-758-4389,E,Public,24 hours daily,,,2,0,33.796954,-84.326336,12/01/2023,182220,2023-01-12 23:21:24 UTC,27/01/2021,J1772,
ELEC,CDC PD08,Michael St NE,,Atlanta,GA,30322,888-758-4389,E,Public,24 hours daily,,,2,0,33.796944,-84.326193,12/01/2023,182221,2023-01-12 23:21:24 UTC,27/01/2021,J1772,
ELEC,PP 5TH&BROAD 5+B_RETAIL_B1_3,550 Broadway,,Nashville,TN,37203,888-758-4389,E,Public,24 hours daily,,,2,0,36.160652,-86.779015,12/01/2023,182230,2023-01-12 23:19:28 UTC,27/01/2021,J1772,
ELEC,PP 5TH&BROAD 5+B_RETAIL_B2_2,550 Broadway,,Nashville,TN,37203,888-758-4389,E,Public,24 hours daily,,,2,0,36.1606,-86.778915,12/01/2023,182231,2023-01-12 23:19:28 UTC,27/01/2021,J1772,
ELEC,PP 5TH&BROAD 5+B_RETAIL_B2_3,550 Broadway,,Nashville,TN,37203,888-758-4389,E,Public,24 hours daily,,,2,0,36.16055,-86.778854,12/01/2023,182232,2023-01-12 23:19:27 UTC,27/01/2021,J1772,
ELEC,PP 5TH&BROAD 5+B_RETAIL_B2_4,550 Broadway,,Nashville,TN,37203,888-758-4389,E,Public,24 hours daily,,,2,0,36.1606,-86.77885,12/01/2023,182233,2023-01-12 23:19:27 UTC,27/01/2021,J1772,
ELEC,PP 5TH&BROAD 5+B_RETAIL_B1_4,550 Broadway,,Nashville,TN,37203,888-758-4389,E,Public,24 hours daily,,,2,0,36.160835,-86.779076,12/01/2023,182234,2023-01-12 23:19:27 UTC,27/01/2021,J1772,
ELEC,PP 5TH&BROAD 5+B_RETAIL_B2_1,550 Broadway,,Nashville,TN,37203,888-758-4389,E,Public,24 hours daily,,,2,0,36.160587,-86.77883,12/01/2023,182235,2023-01-12 23:19:27 UTC,27/01/2021,J1772,
ELEC,PP 5TH&BROAD 5+B_RETAIL_B1_2,550 Broadway,,Nashville,TN,37203,888-758-4389,E,Public,24 hours daily,,,2,0,36.16066,-86.778854,12/01/2023,182236,2023-01-12 23:19:27 UTC,27/01/2021,J1772,
ELEC,TVHS STATION1,112-186 TN-268,,Murfreesboro,TN,37129,888-758-4389,E,Public,24 hours daily,,,1,0,35.910673,-86.384039,23/01/2023,182237,2023-01-23 23:01:02 UTC,27/01/2021,J1772,
ELEC,PP 5TH&BROAD 5+B_OFFICE_04_2,134 5th Ave N,,Nashville,TN,37219,888-758-4389,E,Public,24 hours daily,,,2,0,36.161053,-86.77924,12/01/2023,182246,2023-01-12 23:20:36 UTC,27/01/2021,J1772,
ELEC,PP 5TH&BROAD 5+B_OFFICE_04_3,134 5th Ave N,,Nashville,TN,37219,888-758-4389,E,Public,24 hours daily,,,2,0,36.16119,-86.77928,12/01/2023,182247,2023-01-12 23:20:36 UTC,27/01/2021,J1772,
ELEC,PP 5TH&BROAD 5+B_OFFICE_04_1,134 5th Ave N,,Nashville,TN,37219,888-758-4389,E,Public,24 hours daily,,,2,0,36.16103,-86.77917,12/01/2023,182248,2023-01-12 23:20:36 UTC,27/01/2021,J1772,
ELEC,PP 5TH&BROAD 5+B_OFFICE_05_4,134 5th Ave N,,Nashville,TN,37219,888-758-4389,E,Public,24 hours daily,,,2,0,36.16122,-86.77928,12/01/2023,182249,2023-01-12 23:20:36 UTC,27/01/2021,J1772,
ELEC,PP 5TH&BROAD 5+B_OFFICE_05_3,134 5th Ave N,,Nashville,TN,37219,888-758-4389,E,Public,24 hours daily,,,2,0,36.16127,-86.77925,12/01/2023,182250,2023-01-12 23:20:36 UTC,27/01/2021,J1772,
ELEC,PP 5TH&BROAD 5+B_OFFICE_05_2,134 5th Ave N,,Nashville,TN,37219,888-758-4389,E,Public,24 hours daily,,,2,0,36.161175,-86.77925,12/01/2023,182251,2023-01-12 23:20:36 UTC,27/01/2021,J1772,
ELEC,PP 5TH&BROAD 5+B_RESI02_7,612 Broadway,,Nashville,TN,37203,888-758-4389,E,Public,24 hours daily,,,2,0,36.16023,-86.78032,12/01/2023,182252,2023-01-12 23:19:12 UTC,27/01/2021,J1772,
ELEC,PP 5TH&BROAD 5+B_RESI02_4,612 Broadway,,Nashville,TN,37203,888-758-4389,E,Public,24 hours daily,,,2,0,36.160217,-86.780426,12/01/2023,182253,2023-01-12 23:19:04 UTC,27/01/2021,J1772,
ELEC,PP 5TH&BROAD 5+B_RESI02_6,612 Broadway,,Nashville,TN,37203,888-758-4389,E,Public,24 hours daily,,,2,0,36.160057,-86.7804,12/01/2023,182254,2023-01-12 23:19:04 UTC,27/01/2021,J1772,
ELEC,PP 5TH&BROAD 5+B_RESI02_5,612 Broadway,,Nashville,TN,37203,888-758-4389,T,TEMPORARILY UNAVAILABLE (Public),24 hours daily,,,1,0,36.1601,-86.7801,12/01/2023,182255,2023-01-12 23:19:04 UTC,27/01/2021,J1772,
ELEC,PP 5TH&BROAD 5+B_RESI02_1,612 Broadway,,Nashville,TN,37203,888-758-4389,E,Public,24 hours daily,,,2,0,36.159996,-86.78047,12/01/2023,182256,2023-01-12 23:19:04 UTC,27/01/2021,J1772,
ELEC,PP 5TH&BROAD 5+B_RESI02_2,118 7th Ave N,,Nashville,TN,37203,888-758-4389,E,Public,24 hours daily,,,1,0,36.160748,-86.78034,12/01/2023,182257,2023-01-12 23:19:04 UTC,27/01/2021,J1772,
ELEC,JACKSON EMC LAWRENCEVILLE,825 Buford Dr NE,,Lawrenceville,GA,30043,888-758-4389,E,Public,Mon 7:30am - 5:30pm; Tue 7:30am - 5:30pm; Wed 7:30am - 5:30pm; Thu 7:30am - 5:30pm; Fri 7:30am - 5:30pm; Sat 7:30am - 5:30pm; Sun 7:30am - 5:30pm,,,2,0,33.983586,-83.984697,23/01/2023,182458,2023-01-23 23:05:13 UTC,27/01/2021,J1772,
ELEC,PUBLIC STATIONS WEST,100 Sierra Nevada Way,,Fletcher,NC,28732,888-758-4389,E,Public,Mon 8:00am - 11:00pm; Tue 8:00am - 11:00pm; Wed 8:00am - 11:00pm; Thu 8:00am - 11:00pm; Fri 8:00am - 11:00pm; Sat 8:00am - 11:00pm; Sun 8:00am - 11:00pm,,,1,0,35.430402,-82.548957,23/01/2023,182644,2023-01-23 23:07:37 UTC,27/01/2021,J1772,
ELEC,MILL HOUSE LOT HISTORIC REVOL,2005 Yanceyville St,,Greensboro,NC,27405,888-758-4389,T,TEMPORARILY UNAVAILABLE (Public),24 hours daily,,,2,0,36.099001,-79.776144,23/01/2023,182672,2023-01-23 23:08:03 UTC,27/01/2021,J1772,
ELEC,MILL HOUSE LOT MILL HOUSE EAST,2005 Yanceyville St,,Greensboro,NC,27405,888-758-4389,T,TEMPORARILY UNAVAILABLE (Public),24 hours daily,,,2,0,36.098984,-79.77608,23/01/2023,182674,2023-01-23 23:08:04 UTC,27/01/2021,J1772,
ELEC,JLR CARY LEITH 3 - BAY1,1000 Autopark Blvd,,Cary,NC,27511,888-758-4389,E,Public,Mon 7:00am - 8:00pm; Tue 7:00am - 8:00pm; Wed 7:00am - 8:00pm; Thu 7:00am - 8:00pm; Fri 7:00am - 8:00pm; Sat 7:00am - 8:00pm; Sun 7:00am - 8:00pm,,,,1,35.739528,-78.815519,23/01/2023,182692,2023-01-23 23:08:32 UTC,27/01/2021,J1772COMBO,
ELEC,BCBST CH5 P5 01 NEW STATION 1,1 Cameron Hill Circle,,Chattanooga,TN,37402,888-758-4389,E,Public,Mon 12:00am - 12:00am; Tue 12:00am - 12:00am; Wed 12:00am - 12:00am; Thu 12:00am - 12:00am; Fri 12:00am - 12:00am; Sat 12:00am - 12:00am; Sun 12:00am - 12:00am,,,2,0,35.050555,-85.31839,23/01/2023,182712,2023-01-23 23:08:57 UTC,27/01/2021,J1772,
ELEC,HIGHWOODS RTP VA SPRINGS 1 S2,5501 Virginia Way,,Brentwood,TN,37027,888-758-4389,T,TEMPORARILY UNAVAILABLE (Public),24 hours daily,,,2,0,36.033329,-86.815457,23/01/2023,182715,2023-01-23 23:08:58 UTC,27/01/2021,J1772,
ELEC,JLR CHATTANOOGA DC FAST 01,7648 Lee Hwy,,Chattanooga,TN,37421,888-758-4389,E,Public,Mon 8:30am - 6:00pm; Tue 8:30am - 6:00pm; Wed 8:30am - 6:00pm; Thu 8:30am - 6:00pm; Fri 8:30am - 6:00pm; Sat 9:00am - 5:00pm,,,,1,35.059025,-85.133696,23/01/2023,182716,2023-01-23 23:09:00 UTC,27/01/2021,J1772COMBO,
ELEC,7SPC TVPPA OFFICE,1210 Broad Street,,Chattanooga,TN,37402,888-758-4389,E,Public,24 hours daily,,,2,0,35.040118,-85.309134,12/01/2023,182815,2023-01-12 23:11:11 UTC,27/01/2021,J1772,
ELEC,KOHL'S - CHPT MILTON 2,13097 Hwy 9 N,,Milton,GA,30004,888-758-4389,E,Public,Mon 7:00am - 10:00pm; Tue 7:00am - 10:00pm; Wed 7:00am - 10:00pm; Thu 7:00am - 10:00pm; Fri 7:00am - 10:00pm; Sat 7:00am - 10:00pm; Sun 7:00am - 10:00pm,,,1,0,34.104725,-84.268274,12/01/2023,182848,2023-01-12 23:11:17 UTC,27/01/2021,J1772,
ELEC,KOHL'S - CHPT MILTON 1,13097 Hwy 9 N,,Milton,GA,30004,888-758-4389,E,Public,Mon 7:00am - 10:00pm; Tue 7:00am - 10:00pm; Wed 7:00am - 10:00pm; Thu 7:00am - 10:00pm; Fri 7:00am - 10:00pm; Sat 7:00am - 10:00pm; Sun 7:00am - 10:00pm,,,1,0,34.10469,-84.268268,12/01/2023,182849,2023-01-12 23:11:17 UTC,27/01/2021,J1772,
ELEC,KOHL'S - CHPT 0444 MARIETTA 2,1317 Johnson Ferry Rd,,Marietta,GA,30068,888-758-4389,E,Public,Mon 7:00am - 10:00pm; Tue 7:00am - 10:00pm; Wed 7:00am - 10:00pm; Thu 7:00am - 10:00pm; Fri 7:00am - 10:00pm; Sat 7:00am - 10:00pm; Sun 7:00am - 10:00pm,,,1,0,33.980878,-84.427195,12/01/2023,182872,2023-01-12 23:11:18 UTC,27/01/2021,J1772,
ELEC,KOHL'S - CHPT 0444 MARIETTA 1,1317 Johnson Ferry Rd,,Marietta,GA,30068,888-758-4389,E,Public,Mon 7:00am - 10:00pm; Tue 7:00am - 10:00pm; Wed 7:00am - 10:00pm; Thu 7:00am - 10:00pm; Fri 7:00am - 10:00pm; Sat 7:00am - 10:00pm; Sun 7:00am - 10:00pm,,,1,0,33.981078,-84.42727,12/01/2023,182873,2023-01-12 23:11:18 UTC,27/01/2021,J1772,
ELEC,KOHL'S - CHPT 1123 MCDONOUG 1,1570 GA-20,,McDonough,GA,30253,888-758-4389,T,TEMPORARILY UNAVAILABLE (Public),Mon 7:00am - 10:00pm; Tue 7:00am - 10:00pm; Wed 7:00am - 10:00pm; Thu 7:00am - 10:00pm; Fri 7:00am - 10:00pm; Sat 7:00am - 10:00pm; Sun 7:00am - 10:00pm,,,1,0,33.42107,-84.190494,12/01/2023,182889,2023-01-12 23:11:25 UTC,27/01/2021,J1772,
ELEC,KOHL'S - CHPT 1123 MCDONOUG 2,1570 GA-20,,McDonough,GA,30253,888-758-4389,E,Public,Mon 7:00am - 10:00pm; Tue 7:00am - 10:00pm; Wed 7:00am - 10:00pm; Thu 7:00am - 10:00pm; Fri 7:00am - 10:00pm; Sat 7:00am - 10:00pm; Sun 7:00am - 10:00pm,,,1,0,33.421035,-84.190525,12/01/2023,182890,2023-01-12 23:11:25 UTC,27/01/2021,J1772,
ELEC,KOHL'S - CHPT 0523 NASHVILL 2,2330 Jackson Downs Blvd,,Nashville,TN,37214,888-758-4389,E,Public,Mon 7:00am - 10:00pm; Tue 7:00am - 10:00pm; Wed 7:00am - 10:00pm; Thu 7:00am - 10:00pm; Fri 7:00am - 10:00pm; Sat 7:00am - 10:00pm; Sun 7:00am - 10:00pm,,,1,0,36.184011,-86.634005,12/01/2023,182895,2023-01-12 23:11:25 UTC,27/01/2021,J1772,
ELEC,KOHL'S - CHPT 0523 NASHVILL 4,2330 Jackson Downs Blvd,,Nashville,TN,37214,888-758-4389,E,Public,Mon 7:00am - 10:00pm; Tue 7:00am - 10:00pm; Wed 7:00am - 10:00pm; Thu 7:00am - 10:00pm; Fri 7:00am - 10:00pm; Sat 7:00am - 10:00pm; Sun 7:00am - 10:00pm,,,1,0,36.184013,-86.634012,12/01/2023,182896,2023-01-12 23:11:25 UTC,27/01/2021,J1772,
ELEC,KOHL'S - CHPT 0523 NASHVILL 1,2330 Jackson Downs Blvd,,Nashville,TN,37214,888-758-4389,E,Public,Mon 7:00am - 10:00pm; Tue 7:00am - 10:00pm; Wed 7:00am - 10:00pm; Thu 7:00am - 10:00pm; Fri 7:00am - 10:00pm; Sat 7:00am - 10:00pm; Sun 7:00am - 10:00pm,,,1,0,36.184079,-86.634031,12/01/2023,182899,2023-01-12 23:11:26 UTC,27/01/2021,J1772,
ELEC,KOHL'S - CHPT 0523 NASHVILL 3,2330 Jackson Downs Blvd,,Nashville,TN,37214,888-758-4389,E,Public,Mon 7:00am - 10:00pm; Tue 7:00am - 10:00pm; Wed 7:00am - 10:00pm; Thu 7:00am - 10:00pm; Fri 7:00am - 10:00pm; Sat 7:00am - 10:00pm; Sun 7:00am - 10:00pm,,,1,0,36.184065,-86.634039,12/01/2023,182900,2023-01-12 23:11:26 UTC,27/01/2021,J1772,
ELEC,KOHL'S - CHPT 0525 MURFREES 3,2535 Old Fort Pkwy,,Murfreesboro,TN,37128,888-758-4389,E,Public,Mon 7:00am - 10:00pm; Tue 7:00am - 10:00pm; Wed 7:00am - 10:00pm; Thu 7:00am - 10:00pm; Fri 7:00am - 10:00pm; Sat 7:00am - 10:00pm; Sun 7:00am - 10:00pm,,,1,0,35.843489,-86.442813,12/01/2023,182917,2023-01-12 23:11:28 UTC,27/01/2021,J1772,
ELEC,KOHL'S - CHPT 1056 SPRING H 4,1001 Crossings Blvd,,Spring Hill,TN,37174,888-758-4389,E,Public,Mon 7:00am - 10:00pm; Tue 7:00am - 10:00pm; Wed 7:00am - 10:00pm; Thu 7:00am - 10:00pm; Fri 7:00am - 10:00pm; Sat 7:00am - 10:00pm; Sun 7:00am - 10:00pm,,,1,0,35.739499,-86.941084,12/01/2023,182925,2023-01-12 23:11:29 UTC,27/01/2021,J1772,
ELEC,KOHL'S - CHPT 1056 SPRING H 3,1001 Crossings Blvd,,Spring Hill,TN,37174,888-758-4389,E,Public,Mon 7:00am - 10:00pm; Tue 7:00am - 10:00pm; Wed 7:00am - 10:00pm; Thu 7:00am - 10:00pm; Fri 7:00am - 10:00pm; Sat 7:00am - 10:00pm; Sun 7:00am - 10:00pm,,,1,0,35.739492,-86.9411,12/01/2023,182927,2023-01-12 23:11:29 UTC,27/01/2021,J1772,
ELEC,KOHL'S - CHPT 1056 SPRING H 1,1001 Crossings Blvd,,Spring Hill,TN,37174,888-758-4389,E,Public,Mon 7:00am - 10:00pm; Tue 7:00am - 10:00pm; Wed 7:00am - 10:00pm; Thu 7:00am - 10:00pm; Fri 7:00am - 10:00pm; Sat 7:00am - 10:00pm; Sun 7:00am - 10:00pm,,,1,0,35.739517,-86.941099,12/01/2023,182928,2023-01-12 23:11:29 UTC,27/01/2021,J1772,
ELEC,KOHL'S - CHPT 1056 SPRING H 2,1001 Crossings Blvd,,Spring Hill,TN,37174,888-758-4389,E,Public,Mon 7:00am - 10:00pm; Tue 7:00am - 10:00pm; Wed 7:00am - 10:00pm; Thu 7:00am - 10:00pm; Fri 7:00am - 10:00pm; Sat 7:00am - 10:00pm; Sun 7:00am - 10:00pm,,,1,0,35.739517,-86.941112,12/01/2023,182929,2023-01-12 23:11:29 UTC,27/01/2021,J1772,
ELEC,KOHL'S - CHPT 0522 FRANKLIN 3,300 Spring Creek Drive,,Franklin,TN,37067,888-758-4389,E,Public,Mon 7:00am - 10:00pm; Tue 7:00am - 10:00pm; Wed 7:00am - 10:00pm; Thu 7:00am - 10:00pm; Fri 7:00am - 10:00pm; Sat 7:00am - 10:00pm; Sun 7:00am - 10:00pm,,,1,0,35.936914,-86.820273,12/01/2023,182931,2023-01-12 23:11:30 UTC,27/01/2021,J1772,
ELEC,KOHL'S - CHPT 0522 FRANKLIN 4,300 Spring Creek Drive,,Franklin,TN,37067,888-758-4389,E,Public,Mon 7:00am - 10:00pm; Tue 7:00am - 10:00pm; Wed 7:00am - 10:00pm; Thu 7:00am - 10:00pm; Fri 7:00am - 10:00pm; Sat 7:00am - 10:00pm; Sun 7:00am - 10:00pm,,,1,0,35.936927,-86.820304,12/01/2023,182932,2023-01-12 23:11:30 UTC,27/01/2021,J1772,
ELEC,KOHL'S - CHPT 0522 FRANKLIN 1,300 Spring Creek Drive,,Franklin,TN,37067,888-758-4389,E,Public,Mon 7:00am - 10:00pm; Tue 7:00am - 10:00pm; Wed 7:00am - 10:00pm; Thu 7:00am - 10:00pm; Fri 7:00am - 10:00pm; Sat 7:00am - 10:00pm; Sun 7:00am - 10:00pm,,,1,0,35.936926,-86.820299,12/01/2023,182933,2023-01-12 23:11:30 UTC,27/01/2021,J1772,
ELEC,KOHL'S - CHPT 0522 FRANKLIN 2,300 Spring Creek Drive,,Franklin,TN,37067,888-758-4389,E,Public,Mon 7:00am - 10:00pm; Tue 7:00am - 10:00pm; Wed 7:00am - 10:00pm; Thu 7:00am - 10:00pm; Fri 7:00am - 10:00pm; Sat 7:00am - 10:00pm; Sun 7:00am - 10:00pm,,,1,0,35.936923,-86.820322,12/01/2023,182934,2023-01-12 23:11:30 UTC,27/01/2021,J1772,
ELEC,KOHL'S - CHPT 0525 MURFREES 1,2535 Old Fort Pkwy,,Murfreesboro,TN,37128,888-758-4389,E,Public,Mon 7:00am - 10:00pm; Tue 7:00am - 10:00pm; Wed 7:00am - 10:00pm; Thu 7:00am - 10:00pm; Fri 7:00am - 10:00pm; Sat 7:00am - 10:00pm; Sun 7:00am - 10:00pm,,,1,0,35.843437,-86.442816,12/01/2023,182935,2023-01-12 23:11:30 UTC,27/01/2021,J1772,
ELEC,KOHL'S - CHPT 0525 MURFREES 2,2535 Old Fort Pkwy,,Murfreesboro,TN,37128,888-758-4389,E,Public,Mon 7:00am - 10:00pm; Tue 7:00am - 10:00pm; Wed 7:00am - 10:00pm; Thu 7:00am - 10:00pm; Fri 7:00am - 10:00pm; Sat 7:00am - 10:00pm; Sun 7:00am - 10:00pm,,,1,0,35.84341,-86.442821,12/01/2023,182936,2023-01-12 23:11:30 UTC,27/01/2021,J1772,
ELEC,KOHL'S - CHPT 0525 MURFREES 4,2535 Old Fort Pkwy,,Murfreesboro,TN,37128,888-758-4389,E,Public,Mon 7:00am - 10:00pm; Tue 7:00am - 10:00pm; Wed 7:00am - 10:00pm; Thu 7:00am - 10:00pm; Fri 7:00am - 10:00pm; Sat 7:00am - 10:00pm; Sun 7:00am - 10:00pm,,,1,0,35.843462,-86.442824,12/01/2023,182937,2023-01-12 23:11:30 UTC,27/01/2021,J1772,
ELEC,SKYHOUSE SOUTH SKYHOUSE 2,100 6th St NE,,Atlanta,GA,30308,888-758-4389,E,Public,24 hours daily,,,2,0,33.777483,-84.383207,12/01/2023,182968,2023-01-12 23:12:04 UTC,27/01/2021,J1772,
ELEC,SKYHOUSE SOUTH SKYHOUSE 1,100 6th St NE,,Atlanta,GA,30308,888-758-4389,E,Public,24 hours daily,,,2,0,33.777468,-84.383217,12/01/2023,182969,2023-01-12 23:12:04 UTC,27/01/2021,J1772,
ELEC,SENTRYONE LAB,4001 Yancey Rd,,Charlotte,NC,28217,888-758-4389,E,Public,Mon 5:00pm - 12:00am; Tue 5:00pm - 12:00am; Wed 5:00pm - 12:00am; Thu 5:00pm - 12:00am; Fri 5:00pm - 12:00am; Sat 7:00am - 12:00am; Sun 7:00am - 12:00am,,,2,0,35.186248,-80.878874,12/01/2023,182989,2023-01-12 23:12:27 UTC,27/01/2021,J1772,
ELEC,HIGHWOODS RTP VA SPRINGS 1 S1,5501 Virginia Way,,Brentwood,TN,37027,888-758-4389,T,TEMPORARILY UNAVAILABLE (Public),24 hours daily,,,2,0,36.033381,-86.815361,12/01/2023,183010,2023-01-12 23:13:07 UTC,27/01/2021,J1772,
ELEC,"PNC ARENA PNC VIP 36,37",1400 Edwards Mill Rd,,Raleigh,NC,27607,888-758-4389,E,Public,24 hours daily,,,2,0,35.802486,-78.72239,12/01/2023,183170,2023-01-12 23:15:00 UTC,27/01/2021,J1772,
ELEC,"PNC ARENA PNC VIP 34,35",1400 Edwards Mill Rd,,Raleigh,NC,27607,888-758-4389,E,Public,24 hours daily,,,2,0,35.802444,-78.72236,12/01/2023,183171,2023-01-12 23:15:00 UTC,27/01/2021,J1772,
ELEC,"PNC ARENA PNC VIP 32,33",1400 Edwards Mill Rd,,Raleigh,NC,27607,888-758-4389,E,Public,24 hours daily,,,2,0,35.802406,-78.72232,12/01/2023,183172,2023-01-12 23:15:00 UTC,27/01/2021,J1772,
ELEC,MOONSHINE H-D DCFAST HOG,7128 S Springs Dr,,Franklin,TN,37067,888-758-4389,E,Public,24 hours daily,,,,1,35.953728,-86.81553,12/01/2023,183182,2023-01-12 23:15:08 UTC,27/01/2021,J1772COMBO,
ELEC,Taylor Place,1411 Rep. John Lewis Way N,,Nashville,TN,37208,615-242-4747,E,Public - Credit card at all times,ISM only: 6:30am-6:00pm / Restaurant Valet only: 6:00pm-6:00am,A D Debit M V,,2,0,36.178294,-86.790855,15/02/2021,183265,2021-08-04 00:01:52 UTC,11/01/2021,J1772,OFFICE_BLDG
ELEC,SOUTHWIRE NORTH CAMPUS 2,5152 Columbia Dr,,Carrollton,GA,30117,888-758-4389,E,Public,24 hours daily,,,2,0,33.605665,-85.106732,12/01/2023,183364,2023-01-12 23:18:40 UTC,27/01/2021,J1772,
ELEC,SOUTHWIRE NORTH CAMPUS 1,5152 Columbia Dr,,Carrollton,GA,30117,888-758-4389,E,Public,24 hours daily,,,2,0,33.605665,-85.106786,12/01/2023,183365,2023-01-12 23:18:40 UTC,27/01/2021,J1772,
ELEC,"CHARLOTTE, NC FIRE HQ 4",500 Dalton Ave,,Charlotte,NC,28206,888-758-4389,E,Public,24 hours daily,,,2,0,35.240489,-80.836201,12/01/2023,183464,2023-01-12 23:21:37 UTC,27/01/2021,J1772,
ELEC,"CHARLOTTE, NC FIRE HQ 3",500 Dalton Ave,,Charlotte,NC,28206,888-758-4389,E,Public,24 hours daily,,,2,0,35.240491,-80.836265,12/01/2023,183465,2023-01-12 23:21:37 UTC,27/01/2021,J1772,
ELEC,"CHARLOTTE, NC FIRE HQ 1",500 Dalton Ave,,Charlotte,NC,28206,888-758-4389,E,Public,24 hours daily,,,2,0,35.240351,-80.835981,12/01/2023,183466,2023-01-12 23:21:37 UTC,27/01/2021,J1772,
ELEC,"CHARLOTTE, NC FIRE HQ 2",1210 Statesville Ave,,Charlotte,NC,28206,888-758-4389,E,Public,24 hours daily,,,2,0,35.240493,-80.836324,12/01/2023,183467,2023-01-12 23:21:37 UTC,27/01/2021,J1772,
ELEC,Sheetz - Tesla Supercharger,1237 Mebane Oaks Road,,Mebane,NC,27302,877-798-3752,E,Public,24 hours daily; for Tesla use only,,,,8,36.069862,-79.270016,03/10/2022,183563,2022-12-01 17:40:26 UTC,25/01/2021,TESLA,CONVENIENCE_STORE
ELEC,GEORGIA POWER MARTINEZDC1,221 Bobby Jones Expy,,Martinez,GA,30907,888-758-4389,E,Public,24 hours daily,,,,1,33.506913,-82.093164,12/01/2023,183722,2023-01-12 23:22:05 UTC,02/02/2021,CHADEMO J1772COMBO,
ELEC,GEORGIA POWER MARTINEZDC2,221 Bobby Jones Expy,,Martinez,GA,30907,888-758-4389,E,Public,24 hours daily,,,,1,33.506932,-82.093193,12/01/2023,183723,2023-01-12 23:22:05 UTC,02/02/2021,CHADEMO J1772COMBO,
ELEC,Ruby Falls,1720 S Scenic Highway,,Chattanooga,TN,37409,888-998-2546,E,Public,MON: 24 hours | TUE: 24 hours | WED: 24 hours | THU: 24 hours | FRI: 24 hours | SAT: 24 hours | SUN: 24 hours,,,2,0,35.018887,-85.339767,23/01/2023,183732,2023-01-23 22:58:19 UTC,02/02/2021,J1772,
ELEC,Town of Apex - Fleet,323 N Salem St,,Apex,NC,27502,,E,Private,Fleet use only,,,4,0,35.734544,-78.847516,13/12/2022,183787,2022-12-13 14:36:26 UTC,23/04/2020,J1772,MUNI_GOV
ELEC,Parkaire Landing,4880 Lower Roswell Rd,,Marietta,GA,30068,888-264-2208,E,Public,6am-12am daily,,,2,0,33.964587,-84.40965,08/04/2021,183825,2022-10-17 15:38:16 UTC,01/02/2021,J1772,SHOPPING_CENTER
ELEC,7SPC VEC JAMESTOWN,196 Gaudin Ave,,Jamestown,TN,38556,888-758-4389,E,Public,24 hours daily,,,2,0,36.42418,-84.93206,12/01/2023,183856,2023-01-12 23:22:08 UTC,06/02/2021,J1772,
ELEC,Van Alen Office LLC,555 South Mangum Street,,Durham,NC,27701,866-816-7584,E,Public,,,,6,0,35.990454,-78.901642,23/01/2023,184035,2023-01-23 23:37:29 UTC,01/01/2020,J1772,
ELEC,Publix #1689,"3460 Sandy Plains Rd, NE Suite 400",,Marietta,GA,30066,770-321-6208,E,Public,Store business hours; customer use only while shopping at Publix,,,2,0,34.034782,-84.46257,06/04/2022,184082,2022-04-06 14:08:04 UTC,17/06/2020,J1772,GROCERY
ELEC,Publix #1665,2223 8th Ave S,,Nashville,TN,37204,615-279-9470,E,Public,Store business hours; customer use only while shopping at Publix,,,2,0,36.128822,-86.77856,06/04/2022,184083,2022-04-06 14:08:04 UTC,27/01/2021,J1772,GROCERY
